,Unnamed: 0.17,Unnamed: 0.16,Unnamed: 0.15,Unnamed: 0.14,Unnamed: 0.13,Unnamed: 0.12,Unnamed: 0.11,Unnamed: 0.10,Unnamed: 0.9,Unnamed: 0.8,Unnamed: 0.7,Unnamed: 0.6,Unnamed: 0.5,Unnamed: 0.4,Unnamed: 0.3,Unnamed: 0.2,Unnamed: 0.1,Unnamed: 0,Brand,Name,ID,sku,comments
141,141,141,141,141,141,141,141,141,141,141,141,141,141,141,141,141,141,141,jane iredale,beyond matte liquid foundation,pimprod2008017,2552811," * I love this foundation, its like your own skin but better. * At this price I'm pretty disappointed. Color match was great and does not oxidize, but that's where the pros ended for me. Definitely not full coverage, didn't blend well and shifts/splotchy. If you're an oilslick like me… this is a total waste. Maybe good for dryer skin? Going back to Dior at this price point and won't be purchasing this one again. * This foundation brought out texture and wrinkles I have never seen before. It is not very blend-able, as it takes a lot of manipulation to look somewhat acceptable. This product is very drying and I have oily skin. Not to mention it does not adhere to the skin, it slips and sides off your face throughout the day leaving you patchy. * I finally found my holy grail foundation, I didn't even buy it at Ulta but that's how much I loved it to write a review. It feels like I'm wearing nothing, it matches my skin perfectly which has been a nightmare for years trying to find a good match. * This coverage is a lot more sheer and dewy than I had anticipated. This would be a beautiful foundation for someone with dry, mature skin since it does not crease. The colors are not accurate either. I suggest ordering one to two shades darker. * I need to keep looking. I have a full bottle that I hope to find someone that it works for. * I was so disappointed in this product because I had been saving to buy it for such a long time and when I used it, it melted off and had to use a lot of setting powder to keep it in place somewhat!! I wish I could return it but I threw away the box!"
142,142,142,142,142,142,142,142,142,142,142,142,142,142,142,142,142,142,142,burt's bees,mattifying powder foundation,xlsimpprod16781002,2518238,
143,143,143,143,143,143,143,143,143,143,143,143,143,143,143,143,143,143,143,maybelline,instant age rewind eraser treatment foundation,pimprod2043641,2620458," * As a pale girl I NEVER can find foundation that's fair enough.  Not only is this a shade match, but the wear is smooth and pretty- and it's hard to mess up the application.  Sponge/Brush/Fingers.  Also primer/no primer the product goes on well. * Very very easy for applying on skin  love this product * overall, this product is pretty terrible for me at least. very greasy & oily, transfers easily, little to no coverage on my acne & stuck to dry patches. did no justice for me whatsoever. * I use it on my whole face starting around my eyes nose an spread it my cheeks and chin.before I use blush. * I had to mix it with another foundation to color match it but it looks cakey and not full coverage * I bought this for my mom hoping it would give her enough coverage but it's almost sheer in spots. * But I don't. I know it's like a holy grail for a lot of people... but for me. It's terrible. It creases and I don't get the greatest coverage. Sorry, I'm sticking with my shape tape"
144,144,144,144,144,144,144,144,144,144,144,144,144,144,144,144,144,144,144,l'orÃ©al,age perfect 4-in-1 tinted face balm foundation,pimprod2034423,2601959," * I cant say enough good about this product! My 55 yr old skin looks great with it! I recommend using a primer and a brush for application. A little of it goes a long way. I hope Loreal never discontines this foundation! Try it! You wont be disappointed! * I am 61 and was so shocked when I began to apply this foundation/balm. It feels so nourishing and applies so evenly. It's light yet gives a good medium coverage. A great summertime weight. Not heavy but yet just enough color. Love it. Buy it. Give it a try. I think you'll like it. * This foundation is so perfect for me. It blends perfectly into my skin. It's so easy to apply. I just dab it on with a beauty sponge and I'm done in minutes! 
I love it ❤️ * I'm not sure why my skin reacts to foundation so terribly, but even the luxury brands make me look a little off. I know my undertone and have been able to pinpoint my exact color profile, so it's not that. Foundation usually sits on top of my face, amplifies my fine lines, and makes me look like a hot mess. Age Perfect Tinted Balm is the only foundation that makes me look better, and I wish I knew about it sooner. It's my favorite! * I have what the skincare industry refers to as ""mature ""skin. I am a make junkie and I had many foundations from drugstores and major department stores but as I got older they all made me look cake and settled into lines. I stumbled on this product and I love it. It's my skin only better. It lasts almost all day on my  combination oily dry skin. It is a wonderful product with light medium coverage for mature skin. Will definitely buy again * I've used 3 pots of this now and I'm still somehow surprised by how nice it is. The formula feels like it won't cover much, but it softens the appearance of/seems to fill and even out pores, scars, wrinkles, or any textures--I often get compliments on how smooth my skin looks when I use this. I've gone back and forth between two colors because, as other reviewers have mentioned, the color match is a little difficult. All in all, I keep trying new foundations just to come back to this one and be impressed by it. * I'm a light-medium skin tone that leans towards cool. I got started on this because an influencer raved about it a few yrs. ago. I decided to try it and couldn't had been more thrilled. I use shade fair 20 for reference. In the pot it looks more like a peach shade. It glides on effortlessly and melts into my skin. My dry/mature skin looks healthy. I'm sure I will get tired of this foundation, but for the last 3 yrs. I've been pleased. Only time will tell."
145,145,145,145,145,145,145,145,145,145,145,145,145,145,145,145,145,145,145,hourglass,illusion hyaluronic skin tint,pimprod2020463,2575960," * I expected to love this based on reviews I'd seen, but for me, it applied very thick, sat noticeably in pores (an issue I've never had with any other product) and fine lines and didn't do anything it claims to do. I actually found it quite drying. I love HG products and am so glad Ulta is carrying them. I hope they'll carry the newer HG skin tint so I can try that one. * Im 55 and my skin is very dry, this product is moisturizing and never settles in my pores , an excellent alternative to foundation which just sat on my skin, this tinted moisturizer does not do that. I would highly recommend this product- * I have never had so many compliments about my skin since using this tinted moisturizer! It may not be for anyone needing full coverage makeup but someone looking for a glow and slight coverage! * It was very hard to find something for my aging skin that is full coverage, but doesn't settle into lines and look caked on. this was recommended in store and I absolutely love it! I apply with a beauty blender and use shape tape concealer with a tiny bit of setting powder. Really makes a difference being hyaluronic and any pictures while wearing come out great. A must in my drawer. * I wanted to like this. I have dry skin and some creepiness at 52. This made all of that worse.

It's very thick and kinda hard to blend out even with moisturizer and primer. 
I had to return this and buy the Too Faced brand hydrating liquid foundation. * Several comments said this was medium to full coverage which made me want to try it and it is not. There is absolutely no coverage at all. If anything it's just a glorified moisturizer so I'm thinking those other comments were for a different product. * Absolutely one of my favorite foundation. I love how it leaves my skin glowing and hydrated!"
146,146,146,146,146,146,146,146,146,146,146,146,146,146,146,146,146,146,146,jane iredale,refillable compact,pimprod2031651,2595249," * The discontinued gold compact was perfectly thin and light weight, making it easy to carry everyday. Also great for touch-ups when mineral foundation SPF is needed out in the sun! The closing latch wasn't super secure but I never had a problem with it opening in my purse. The new design is thick and super heavy. It's beautiful to sit on a counter, but useless weight for travel or carried in a shoulder bag. So sad I never odered backs up of the slim gold-tone compact! * I was surprised how expensive this compact is. But I have had so many contacts break and then I get crumbled pressed powder. This one looks like it will hold up well. I will let you know the first time I drop it-Yikes! * Very happy with this new compact. My JI mineral foundation stores securely,  the compact opens easily and now has a mirror. Yay! * I am a loyal Jane Iredale brand user. In fact, I have been using their products for over 20 years. The Jane Iredale line was recommended to me by the surgeon who did facial reconstruction after skin cancer surgery. 

Although I love their products, I have always been ""ehh"" about their packaging....until now! Thanks for finally giving up the gaudy gold (sorry, Jane Iredale) and going with this new, modern and aesthetically pleasing line of packaging. Since I have several of the old gold compacts, including the gold metals ones, I ordered one of the new compacts to see how I would like it. After receiving the new compact, I cannot wait to replace ALL my older versions! 

One more suggestion... in your future development, please consider making your eye shadows available in refills. I love the idea of being kinder to our planet and saving on the excess packaging. I do not mind paying separately for the cases if I know if is making a smaller, greener impact for future generations. =)

One final note of thanks to Ulta...I have been begging my local store to start carrying Jane Iredale. I am glad to see that you are at least finally carrying this amazing, clean line of makeup online! * I bought this on sale and I'm glad I did. It just makes it nice to put your foundation in. For the price of the foundation, it's a shame you have to purchase compact separately. * This packaging is overpriced and by default should be included with the powder. Waste of money."
147,147,147,147,147,147,147,147,147,147,147,147,147,147,147,147,147,147,147,nudestix,tinted cover foundation,pimprod2008837,2552723," * Of course it doesn't fully cover blemishes, its not full coverage. I buy this again & again & pair it with concealer for under eyes / blemishes , & blush. Its so smooth, never breaks out my acne prone skin. I love it so much!! * Honestly I hate foundation, I have super sensitive skin and anything can break me out easily. This foundation is SO NICE!! It is more like a skin tint than a foundation, which I prefer if I do ever wear it, the smell is relaxing (if you're not an essential oil person I wouldn't recommend, the lavender is pretty strong), and it doesn't feel like anything is on. For my Florida girls this stuff is a great quick fix for the hot and humid days!! * I have super sensitive, rosacea-prone skin & my eyes are really easily irritated by makeup (ocular rosace) that started a few years ago - suddenly I couldn't wear my favorite makeup without breaking out, & my eyes burning, bright red. I searched & finally found a brand specifically for rosacea-prone skin! So happy to be able to wear makeup again! Over the last year or so the formula clearly changed - I couldn't find a color match & then my eyes started to  burn again. Back to the search - finally found this - I love this foundation & the whole product line! It's light & looks great - as others have said, I look like myself, only better! It doesn't settle in my lines or pores, doesn't irritate my skin or eyes. It does feel a bit oily / has a bit of shine. Also, Nude 3 is a perfect color match for me when it goes on, but it does darken a bit across the day so I'm going to try 2.5 & save 3 for the summer. Otherwise, highly recommend!! * I bought this foundation and love it.  I'm 47 years old with dry and pigmented skin from aging and I like light coverage products due to aging skin look more natural than full coverage foundation.  Very moisturizing.  I still set with loose powder and yes would buy this as long as nudestix still made this. * I got this product in shades light3 it a good tinted moisturizer with light to medium at most.  Great for dry skin.  Love this product. * Flawless and lightweight. I'm in love. * im telling you right now GET THIS. the PERFECT natural foundation that isnt too sheer or too high coverage. also the single foundation i have that is my true shade!!!! i can blend this out so well even w my hands which i cant typically w other foundations and it blends out BEAUTIFULLY. funny thing is i bought this on mistake,, was trying out concealer and wanted to buy it but accidentally picked this up instead. BEST MISTAKE EVER!!!! WALK DONT RUN TO UR ULTA 4 THIS IM SO FR"
148,148,148,148,148,148,148,148,148,148,148,148,148,148,148,148,148,148,148,ulta beauty collection,adjustable coverage foundation,xlsimpprod5721072,2260079,
149,149,149,149,149,149,149,149,149,149,149,149,149,149,149,149,149,149,149,uoma beauty,say what?! foundation,pimprod2033346,2593663," * I've been doing makeup for over an decade and I've never found a foundation that doesn't make me look cakey. I've tried every popular brand in the world (under $50) and just couldnt find a product my skin liked until this one. 

I have both very oily and very dry skin and zero skin care routine so a lot of that is likely due to me being a bit terrible. But I was randomly recommended this over a year ago by a guy at the mall of America morphe store and it genuinely felt like second skin. He paired it with morphe primer and it's the best my skin ever has or will look. It looks so natural and yet makes my skin look amazing. You can't even tell I'm wearing foundation. 

I sadly ran out and tossed the bottle before ordering more like an idiot and I've spent the last 5 months trying to track this foundation down. I just ordered more so unless the formula has changed drastically I'll add pictures once I have it. But I was genuinely mourning the loss of this foundation and thought I was doomed to have cakey looking skin again forever. 

If you can't find a foundation no matter how many you try I highly highly recommend this one. Maybe my skin is just weird so it might not work for you but I will never ever allow myself to run out of this foundation again. It's been a terrible few months for my makeup without it. * I really love this foundation. I used to use MAC and like this much better after trying a bunch of different brands. I have very sensitive skin and no problems. I have been using this for years now and I am very happy with it. It goes on smooth and it buildable to a good medium coverage. * This was my first time trying this make up brand and I a now a fan! Makeup is lightweight and comfortable to the skin. Is  100% true to skin match and buildable coverage, and also holds well in heat! * Run run RUN to get this foundation!!! I cant say enough good things about it! It gives such a radiant, skin like finish and doesnt feel heavy or greasy. Plus, the shades come in differnt formulas, depending on the shade range!!! * This is my 4th time buying this foundation and they changed the formula! It has a watery, runny consistency, whereas before it was a thicker consistency. The new formula still works just as well as the old one! Coverage is buildable without looking cakey (just make sure to blend with a damp sponge). I have rosacea and red acne marks & it covers flawlessly and still looks like my skin. 

I also have combo skin. I find this foundation to hydrate and also not accentuate my oils that i produce throughout the day. It's a perfect soft matte finish. * I get compliments whenever I wear this. it's a really good, light on the skin, natural finish foundation, but somehow still manages to have good coverage. It's very easy to blend into the skin, and wears great across the day. My absolute favorite thing about it though is that it has the best shade range and undertone range I've experienced. I'm a pale olive which is very hard to find foundation for, but this looks amazing on me. * This foundation of the game changer, so long wearing I work 10 to 12 hour days and it does not budge crack or flake. This is a Serum foundation so it is very watery but the coverage is absolutely amazing. I have never seen a Foundation blur the way this does. I have been mixing this foundation with the Youthforia primer for light days this combo makes it into a radiant tinted moisturizer."
150,150,150,150,150,150,150,150,150,150,150,150,150,150,150,150,150,150,150,j.cat beauty,aquasurance compact foundation,pimprod2000221,2550026," * so I do a full face every day. every once in a while I'll ""cheat"" and use this product to save time. it works sooo well. I use a light shade which I chose by pretty much matching my neck/highlight areas and use it mainly in my T zone. highlighting under eyes, forehead between brows chin and then I also add it along my jawline. then I go about my routine as normal but without the need for foundation highlight and baking. saves so much time! it builds well and has amazing coverage. it lasts all day. I have mature skin and hate when things settle into fine lines and wrinkles and I do not have that problem with this. it actually makes my skin appear younger compared to my full face routine with baking etc. I know I hav to find a new foundation to help avoid it but who has the time lol anyway... YES. this product is one I want to hoard in case it ever goes away. it's amazing. I use it with a compact dense brush. 

only downside is that I broke 2... but it's because I throw it in my purse and I know that's not ideal and on me for being careless. but if it's getting tossed around, be aware the powder may break. * This is a must have in my kit! I use it to lightly set my foundation and it transforms my face! I have also used it as a powder foundation for summer days and it is flawless! * This is the best powder foundation i have ever tried, i reach for this one over my high end one. Its my go to during the summer months. * Medium to full coverage. I like to carry it in my bag for touch ups because it covers the redness around the nose, i can cover up some my blemishes that peak out after wearing makeup all day etc * I use the shade Natural and I absolutely love this powder. i've used mine all the way to the pan and just restocked a new one. Literally the most beautiful blurring coverage, doesn't feel cakey or drying and my skin looks flawless. Great for on the go and quick touch ups. I usually hate the feeling of wearing heavy foundations and powders so once I found this it was over. Super breathable and comfortable and evens out my skin tone in a couple quick pass overs. I love this product. * Medium to high coverage, smoothing, non-comedogenic. Its a bit hard to shade match. I use Soft Tan in this powder and Nars Valencia, Lisa Eldridge 19, Estee Lauder 4w1. * This was my favorite foundation for everyday wear until recently. It is the best color match I've found and so easy to use. However, as others have stated, my last two orders have fallen apart into unusable powder within a few uses. Super bummed."
151,151,151,151,151,151,151,151,151,151,151,151,151,151,151,151,151,151,151,revlon,illuminance skin-caring foundation,pimprod2036478,2605534," * I have been using this since it was introduced to the Revlon line and my hope is that this never gets discontinued.🙌🏻 I love the ingredients in this foundation and the coverage is amazing. It does not settle in my lines; it actually plumps my skin (hyaluronic acid 🙌🏻🩵👏🏻🤩) and gives a flawless finish. I also have extremely sensitive skin and my face does not react to this at all. It seems a lot of brands are now incorporating good skincare ingredients in foundations and this one is a winner! 🥇🙌🏻👏🏻 * Went tried on my arm but ,when I put on face was way to dark for it.
But this is my first time ever using anything on my face so I'm  learning baby steps. * I'm over 50, have fair, neutral, combination skin with especially dry cheeks, redness, and texture. This foundation seemed to cover the redness fine but it faded within about 2 hours of wear. It settled in my fine lines and looked, for lack of a better word, gritty. No fragrance but does have an unpleasant chemical smell. It's a no for me. (Not Revlon's fault but the color-finding function led me to 117 Light Beige, which was the right depth level but pulled warm on me.) * the most skinlike finish of any drugstore product I've ever found. it has good coverage, wears comfortably on the skin, and doesn't crease or transfer if you set and prep correctly. it feels like the $50-$70 foundations i used to wear and the price is unbeatable. 10/10 * What an incredible skin loving foundation. After 2 weeks of using I'm noticing a more even skin tone, my fine lines are disappearing, and my skin feels nourished. I love this for spring/ summer! I prefer it without primer as I notice I get the most benefit that way. I do set with a non-talc powder and Milani setting spray. It truly looks like skin if you get the right shade! * When set properly, this foundation lasts all day, looks like skin, and never cakes or clings to dry patches. It looks and feels expensive on the skin, and I'd pick this over my Lancome for coverage anyway. It can be a bit too dewy if you don't do proper skin prep, but with the right primer and setting powder, it's perfect 👌 * This is an AMAZING foundation. The coverage is perfection. It's dewy, has great ingredients, and I absolutely love it on my very sensitive skin. I have been using this since it was introduced to the Revlon line and my hope is that this will never discontinue. 🤞 I have used only high-end foundations in the past before trying this foundation and this one is a clear winner. 🙌🏻🩷😻"
152,152,152,152,152,152,152,152,152,152,152,152,152,152,152,152,152,152,152,dior,forever natural matte velvet compact foundation,pimprod2045605,2625554,
153,153,153,153,153,153,153,153,153,153,153,153,153,153,153,153,153,153,153,pacifica,kind tint tinted serum,pimprod2030679,2591360," * I have sensitive, oily, and redness-prone skin, so moisturizers usually dont work on me. Im plesently suprised on how well this works with my skin chemistry. The coverage is very much buildable, some days i put just a tiny bit on to moisturize and even out my skin-tone, othertimes i build it up for more coverage. Only downside is the occasional pilling that others here mentioned, but its subtle enough. * I love this.  I apply after i ise a moisturizer.  Provides supermligbt coverage to even out skin tone. I use the shade 15 which has a yellow indertone rather than red. * It has great ingredients but it jusy peels right off the face. It doesnt stick at all it immediatly pills its unwearable which sucks cuz i love the ingredients * i love this skin tint. i've repurchased already and plan to again (and again!). it's nice and lightweight. does nit upset my dry/acne-prone skin at all. it evens the complexion nicely. i don't find it difficult to apply at all - i use a damp sponge. very happy with this. * Honestly super oily. It's very sheer which is nice but it really oxidizes in the skin so badly and clogs your pores. * Wanted to give this a try, one of the girls in the store recommended it for me saying its a great product. I tried it it was horrible, barely any coverage, dried very weird, and when i touched or wiped my hand over my face it was like pieces of it were coming off. I didnt even put alot on. Disappointed and would not recommend. * I have been on the hunt for a tinted moisturizer. Saw this tinted serum & based on the reviews wanted to try it out. Came in today and it was such a let down! Super watery and hss no coverage at all. I tried applying it with a beuty blender did not work, a brush was worse, ended up apllying it with my hands like i would a serum but its super patchy and hard to blend. Just a no jn my opinion, save your money snd try the purlesse tinted moisturizer with spf instead. Inwas trying to love this product in reolacement of my purlesse thats now $40, since this is more affordable but you def get what you pay for."
