,Unnamed: 0.29,Unnamed: 0.28,Unnamed: 0.27,Unnamed: 0.26,Unnamed: 0.25,Unnamed: 0.24,Unnamed: 0.23,Unnamed: 0.22,Unnamed: 0.21,Unnamed: 0.20,Unnamed: 0.19,Unnamed: 0.18,Unnamed: 0.17,Unnamed: 0.16,Unnamed: 0.15,Unnamed: 0.14,Unnamed: 0.13,Unnamed: 0.12,Unnamed: 0.11,Unnamed: 0.10,Unnamed: 0.9,Unnamed: 0.8,Unnamed: 0.7,Unnamed: 0.6,Unnamed: 0.5,Unnamed: 0.4,Unnamed: 0.3,Unnamed: 0.2,Unnamed: 0.1,Unnamed: 0,Brand,Name,ID,sku,comments
91,91,91,91,91,91,91,91,91,91,91,91,91,91,91,91,91,91,91,91,91,91,91,91,91,91,91,91,91,91,91,estee lauder,futurist hydra rescue moisturizing foundation spf 45,pimprod2013152,2577966," * My favorite foundation . Love the formula for my skin . Doesnt leave my skin oily like NARS or other liquid foundations do . Has good hydration and lasts all day * This product has a strong fragrance. It did not blend well, and had a very dry pasty effect. I'm a less is more type girl, so maybe it would work for someone who does a bit more layering of products? I would say primer is a must under this product. It literally reminds me of liquid face paint. * I typically wear Lancome Skin Feels Good but wanted something with more coverage and more dewy finish, which this has on both counts. It feels nice on dry winter skin, looks decent for most of my work day. The colors are a litle darker than they appear in the example photos. I purchased Ecru 1n2, and it would really be more appropriate for a summer shade for me. The photos just made the lighter colors look basically white. However, I found the corresponding concealer in this line to be too light!!! I would have gotten a better match in person, but most of my local Ultas dont carry EL in store. * First off, I'm 42, a skincare enthusiast, and my dry/combo skin requires a moisturizing foundation. I've tried most high end foundations, and the EL Futurist Hydra foundation is it, folks. I'm on my fourth tube, and I'll keep buying it along with the Futurist primer. Not only is this foundation non drying, long lasting & great at covering redness -- the added SPF 45 is a total bonus. The high SPF is what made me purchase initially. Granted, I apply an SPF before my makeup routine, but hey, the more the merrier. Highly recommend. * I purchased this foundation about five years ago, back when there was only a few shades. I guess they were testing the market at the time. I ended up with the lightest shade (Porcelain C0). I used it until the tube expired, and now I bought my normal shade from EL which is 1C1 Cool Bone. I'm so happy they offer this shade now! Truthfully, both shades suit me fine. I have pale skin with a pink undertone. I am 40 years old and have combo skin that leans dry in the winter and more oily in the summer. I love this foundation in the winter months to keep my skin plump and hydrated! It goes on like butter with a high medium coverage. I tried this in the summer, and it didn't last very long. It's totally fine since I switch up foundations between colder and warmer months.  This is an awesome foundation if you have dry skin! * Moisturizing, silky smooth to apply, and the color is just right. * LOVE this foundation - best product ever!  Great coverage, hydration - feels like silk on my face.  You hardly need any product.  Make sure you always shake and move it to keep it mixed.  Only downside is the container - if you take too much product - you have no way of putting it back…….For this price - PLEASE redesign to be able to unscrew lid."
92,92,92,92,92,92,92,92,92,92,92,92,92,92,92,92,92,92,92,92,92,92,92,92,92,92,92,92,92,92,92,maybelline,super stay full coverage foundation,xlsimpprod17161541,2519481,
93,93,93,93,93,93,93,93,93,93,93,93,93,93,93,93,93,93,93,93,93,93,93,93,93,93,93,93,93,93,93,chanel,nÂ°1 de chanel revitalizing foundation,pimprod2029950,2605425," * This is a nice foundation but I don't find this foundation particularly luminous. To me it's almost a soft matte. I have to add oil to it to achieve any luminosity. coverage is a solid medium and I would consider it buildable. I don't find it great for dry mature skin.  It can look a little cakey if not applied in thin layers. I will finish it but won't repurchase. For my skin type I much prefer the Healthy Glow foundation as an all purpose foundation. This foundation is more full glam for me. * This is my new favorite foundation. I can apply it with my hands, brush, sponge and it always looks so beautiful and natural. The color match is perfect and it lasts throughout my entire 8 hour work day and beyond. I cannot recommend this enough. I also do have oily/combo skin. * The price of this foundation is ridiculous, but I keep buying it because for my skin it is the best foundation out there. I just love it. I apply with a sponge and it looks beautiful all day long. * The foundation has great coverage with a very light feeling. * I don't wear makeup often but this foundation is the best that I have seen on me.  I receive compliments every time I wear it.  I have BR42 and it makes my face look bright - I love the color. * I've really tried to like this makeup but after continually trying it still burns and by the afternoon my face has flaky peeling patches. * The only time I get compliments on my skin is when I'm wearing this. It's expensive but lasts a long time and a little goes a long way. Its the perfect weight for me—light to medium coverage."
94,94,94,94,94,94,94,94,94,94,94,94,94,94,94,94,94,94,94,94,94,94,94,94,94,94,94,94,94,94,94,smashbox,always on skin-balancing foundation with hyaluronic acid + adaptogens,pimprod2040206,2610447," * I havd tried pretty much every foundation out there from drugstore to high end and thus is in my top three favorites. It just looks so beautiful on the skin, covers what you need covered, and is lightweight and looks like skin. I love this foundation and i hope they never get rid of it. * This foundation is ok. I just don't like that I have use a setting powder in certain areas on my face because it settles in my fine lines. But my biggest issue is that I've bought this foundation 3 times now at Ulta and every single time the shade is different. It's like 1 to 2 shades lighter so now every time I go, I have to bring an old one that matches me to make sure I get one that's the correct shade. * I dont know what they did with the original formula they had…but this one is not good. I used smashbox for years then switched to NARS.. didnt buy smashbox foundation for a while until recently and this new formula is just so bad!!! Like WHY SMASHBOX?! Why did you guys ruin my fav ever foundation! It exaggerates my pores so bad that im embarrassed to be seen wearing it.. after the first time i thoufht i could just ignore it but after the 3rd time wearing it i cant. Im putting it away and will be Sticking to my Nars foundation from now on! * I've been a loyal Smashbox fan for years. Their Studio Skin has been my HG, but of course they've had to discontinue it. Hearing about this new line- I gave it a shot but it's a no-go. Disappointing is an understatement. If you're a pale girly, with neutral undertone, and have any skin issues- you're out of luck. Now I have to find a completely new brand and everything.

I wore .3 in studio skin and asked help from a smashbox rep, they recommended f20c. Omg what an absolute joke. Extremely dark and orange on my skin. I got a few other shades to try out (because of course online only)- and the closest one is F10N- but it's too pale and yellow for me. 

Besides that- the formula isn't great. It has no staying power, ie, it will start to run/smudge immediately if you get any moisture on your skin and it does not apply well at all. I agree with the strangely chalky appearance others have commented- which highlights any/every imperfection. I'm early 30s and combo/dry rosacea prone skin and its a no go for me.

When you find a great trustworthy foundation, it feels priceless. This one is a total miss. Smashbox- bring back the studio skin! You had a customer for life. * I was very excited to try this but it was a major letdown. 

I have sensitive combination skin that has been on the dry side lately due to retinol. I explained this to the Ulta employee and she recommended this foundation for me. 

I put it on today and it makes my face look like chalk. I moisturize and prep appropriately, but no matter. It looks dry, flat, and has poor coverage. 

Definitely returning. * This foundation makes the skin look flawless and the coverage is buildable. Will melt into your skin. I use a foundation brush to put on and use MAC prep and prime before and after the application. I love this stuff! * This foundation probably works good on clear oily skin but on acne prone, textured skin it looks dry and really exaggerates the pores. Looks like chalk on your face"
95,95,95,95,95,95,95,95,95,95,95,95,95,95,95,95,95,95,95,95,95,95,95,95,95,95,95,95,95,95,95,maybelline,super stay 24h skin tint + vitamin c,pimprod2039657,2610817," * This Maybelline Skin Tint is beautiful on the skin and it does last.  I really like it!  It is difficult to find my exact shade.  At this point, I have purchased three shades before I found one that really matches.  I wish there was a way to have small samples we could try prior to purchase.  However, the effort was worth it!! * I loved this foundation it feels light weight and it's very liquidy so I don't have to use any sponges or brushes I can just apply with my fingers, however I do use a sponge to even it out. 
It makes my skin look and feel good. * This product is really glowy and light but it is more medium to full coverage and is turns orange the longer you have it on. * Best one I have tried! Does not clog my pores nor does it affect my existing acne in a negative way. Smooths my skin out and looks natural which I love. Will definitely repurchase and recommend to friends and family especially those who struggle with finding an acne friendly skin tint. * I really wanted to love this skin tint, but it totally broke me out. Apart from that, on the first layer of application it looks god awful on my acne prone skin. A second layer however, looks good. When I wear this skin tint, i always have a problem with having little streak marks on my nose from where i apply blush at the end of my routine. I don't have this problem with  ther foundations. The packaging also makes this product super messy. * There's a reason why everyone hypes this skin tint. It has been the best foundation I've ever bought. Will definitely keep repurchasing this. It covers my hyperpigmentation without that heavy foundation feel and it last so long. I love this product. * If you're looking for light coverage this is for you! I use this as an everyday foundation just to have some color! You are able to build on it. It does have a slight orange hue but with some blush and translucent powder, you're good to go!"
96,96,96,96,96,96,96,96,96,96,96,96,96,96,96,96,96,96,96,96,96,96,96,96,96,96,96,96,96,96,96,l'orÃ©al,true match super-blendable foundation,pimprod2034733,2602421," * I wear tinted sunscreen but felt I needed something more when I wear a full face of makeup. This has great coverage, not tacky, good color match and long wearing. Great price point since I don't wear it every day. * I think it just depends in what typ on skin you have. * This is my nee favkrite foundation. I stopped wearing makeup because foundation always felt too heavy and settled on my face. This did not. Makeup looked great all night. * Color matches beautifully to whats shown online, lightweight. Light coverage but also buildable. I use one pump amd than do a powder foundation by maybelline and lasts all day. This may not cover acne prone skin, but it definitely helped a little with redness on my cheeks. A good product all around, it doesnt feel heavy. * I love this foundation and have used it for years! The shade I use matches me perfectly and the liquid is very blendable and feels light on my skin. I only have one complaint and its about the pump. I miss the old screw-on caps! The pump wastes so much product because you can't really control how much is coming out and can't get all of the liquid out especially if you're getting close to the bottom and shake it up. With the old screw-on cap, you had control of how much you want to get out and you could get all of the product out. The only downfall of that was possibly dropping the bottom, but I waste so much product and have to buy more often which is just messed up L'Oreal. I love this product though and will stick with it so long as the formula and color stay the same. * It is a very much affordable foundation and feels smooth on the skin. I like it very much because it blends almost perfectly on my skin * Ive tried so many foundations, high end and cheap, and this is one of the best hands down! It stays on 13+ hours, no creases, doesn't ever look oily! Just so good!"
97,97,97,97,97,97,97,97,97,97,97,97,97,97,97,97,97,97,97,97,97,97,97,97,97,97,97,97,97,97,97,estÃ©e lauder,double wear stay in place matte powder foundation refill,pimprod2031253,2593713," * Love products * I wear 1c1 in winter but 2c1 in summer,I love how easy it is to change out shades with these refills. It's a wonderful, flexible formula that's never cakey. * I buy ivorynude (one if the lightest shades).The color mathecs perfects, at first. However, with a couple hours, my makeup looks a couple shades darker. I have worn this on my tropical vacations and it holds against water, still looking perfect. If you buy a couple shades lighter, it may work for you. * Love the smooth look 👌 * I am 47 with normal to dry skin. Full coverage long lasting! * Reason for 3 star, I didn't like the color on me * I really love this foundation - it goes on smooth and feels weightless. However, I don't believe that the color is true to the liquid foundation. Initially, yes, but it seems to oxidize within 30-60 minutes, making you look a slightly different shade/darker. I wear a combination of 2N1 and 2N2. The 2N1 powder went on great but now my skin looks  very pink compared to my neck. I never have this issue with the liquid version."
98,98,98,98,98,98,98,98,98,98,98,98,98,98,98,98,98,98,98,98,98,98,98,98,98,98,98,98,98,98,98,dior,forever natural nude foundation,pimprod2036826,2604394," * This foundation is amazing..it's as if the Forever Matte and Glow had a baby.  It gives such a beautiful satin finish that is not too matte and not too glowy just perfect. I will definitely buy this again and I've recommended it to quite a few of my friends and they love it as well! * I have been trying to decide why I am not reaching for this foundation and I have come to the conclusion I may have gotten an old bottle. The texture is thick and gel like; not what I would expect from a ""nude natural"" foundation. Looks cakey. and when I shake it I don't hear or feel any movement in the bottle. It doesn't really smell spoiled although it does have a fragrance as Dior does. I have tried thinning it out with oil or moisturizer but then it doesn't dry down as it should. I am disappointed but don't know if it's actually the product or that I received  an old bottle. Unfortunately I tossed the box. It's not impossible as I have received  expired products from the warehouse on a couple of other occasions. But I have definitely had better foundations that cost less. * I was not wowed by this foundation. maybe my color match wasn't the best. I am fair to light with a neutral leaning slightly warm complexion and I don't think there is a great match for me in this product. I did not find this product to look very natural or give me any sort of radiance. I felt it looked semi matte rather than a natural finish. Coverage was fine-light to medium as expected. I much prefer Chanel's Healthy Glow foundation. I have mature skin and think perhaps this foundation is better suited to a younger customer. I didn't dislike it but I would not repurchase it. For me it looked rather flat no matter how I prepped my skin. * This is a fantastic foundation! It's lightweight and  leaves me looking naturally flawless. I will say it doesn't completely cover dark spots/acne but I am personally fine with that- nothing a little concealer can't help with. I will definitely be repurchasing. * Wonderful product! * This is the best foundation that I have tried in at least the last 5 years of searching for ""the one"".  Not too heavy or too light. Not cakey and does not settle into my fine lines. This foundation lasts throughout the workday and well into the evening. Definitely worth the price. Finally!  I've found the one!! * Here's a quick review you can use for Dior foundation at Ulta:

""I absolutely love how smooth the Dior foundation applies to my skin! It blends effortlessly, giving me a flawless finish that feels lightweight yet provides great coverage. The formula feels luxurious, and it lasts all day without creasing or feeling heavy. Whether you're going for a natural look or building it up for full glam, this foundation is a game-changer. Highly recommend trying it out—you won't be disappointed!"""
99,99,99,99,99,99,99,99,99,99,99,99,99,99,99,99,99,99,99,99,99,99,99,99,99,99,99,99,99,99,99,mac,studio radiance serum powered foundation,pimprod2040797,2613967," * This product is too thick and heavy. I did not like it at all. * Very oily so easily come off the face makes kinda itchy, and I never had that with any products in my life by far the worst from MAC * The way this lays on my skin. I don't need to put anything else on my face. It's quick it's effortless. And makes my skin feel amazing once I take it off. 10 out of 10 * This foundation is one of two I go between. It is hydrating without being greasy with good coverage! I find the best results when I set with translucent powder and setting spray. It's a good value and last for a long time comes with the pump too! * Great cover.. moisture...
Goes on smoothly. * I have very dry skin so I was looking for a foundation that hydrated all day with lasting color and this fits the bill! I bought online as they had a coupon going so I took a gamble on my color match, but it was perfect and blends so easily. I have a lot of redness and freckles and this covers almost effortlessly without having to use a ton of product. Like I said, I have very dry skin but this lasts all day with zero flaking!

My only ""Con"" would be with the bottle itself as it does NOT travel well. The top easily moves out of the lock position so I just make sure to wrap it in a paper towel and put it in a seperate bag to prevent any spills. * So for context I'm a guy living in the South and despite how much things have progressed I still get looks and attitude from some of the sales people at department stores when I go in to get some makeup. However I have always been treated kindly by the people who work in the local Ulta. So when I decided I wanted to splurge a little on a new and better quality foundation I knew exactly where I needed to go to get some advice and shade matched. I have combination acne prone skin that tends to lean oily but has random dry patches occasionally and uneven red skin toneproblems. So I was thinking something full coverage with a matte finish to help with the oily zones and even out my skin tone. I went later at night when it wasn't busy and the really sweet girl that was working in makeup that night surprised me when she said that I should try this particular foundation. I don't like 2 in 1 cosmetic products typically because that usually means it doesn't do either thing it's supposed to do the best. And with this product I was concerned that the finish would end up being super shiny and the coverage would be just enough so that people noticed I'm wearing makeup but not enough to actually cover up my imperfections which is the opposite of what I wanted. I just want to look like I have healthy skin and to my surprise that's exactly how I looked after she applied it. Make sure you get shade matched because it took her 4 different attempts to find the perfect one but when she was finished she even said wow it  looks like you aren't wearing any thing and just have beautiful skin. Also it turns out with all the extra hydration my face is now less oily than before, my skin tone has improved and I feel more confident. I took away one star because it is a buildable coverage but it takes more makeup than any other product I've used to get the level of coverage I like. And at nearly $50 a bottle I wish it would last a little longer. Other than that I love it. Thanks Ulta 😘"
100,100,100,100,100,100,100,100,100,100,100,100,100,100,100,100,100,100,100,100,100,100,100,100,100,100,100,100,100,100,100,maybelline,super stay up to 24hr hybrid powder-foundation,pimprod2036593,2603936," * First off, Shade 112 is absolute perfection for me. This has such incredible coverage that only a small amount is required to help make your skin look so pretty! It can be built up to absolute full coverage but, in my opinion, that can look a bit cakey and too artificial. I use a flat top brush to apply this mostly to my nose and cheeks where I've got the most redness then pull it outward and I'm never not satisfied with the coverage. I've gotten a darker shade to wear as bronzer just because it covers so well! * Nice texture and goes on easy. Wish I had bought a slightly darker shade. * This powder foundation is quick and easy to apply. The only issue I have with it is that it tends to cake up under the eye area if you have wrinkles there. Otherwise it's perfect for smooth and young skin. * This is awesome alone or applied with big brush over Maybelline 30hr Super Stay foundation! * Looks very dry and cakes. will only use very lightly. I have dry skin and this looks very dry and cakey. * Ive used this product for years. This new formula is super loose messy red tones & transfers . Sad I have to find another powder. * Very nice I would definitely buy again"
101,101,101,101,101,101,101,101,101,101,101,101,101,101,101,101,101,101,101,101,101,101,101,101,101,101,101,101,101,101,101,dermablend,flawless creator liquid foundation drops,xlsimpprod16661005,2515171,
102,102,102,102,102,102,102,102,102,102,102,102,102,102,102,102,102,102,102,102,102,102,102,102,102,102,102,102,102,102,102,tarte,amazonian clay blurring powder foundation,pimprod2036934,2604704," * I was informed by a women at ulta that the powder concealer from tarte that I used was discontinued and that this was it's replacement. I mentioned to her I had sensitive skin and was told there would be no issue as it was a minor ingredient change. this was in fact not the case. I wasted my money on this product as I am not fully covered in hives and welts to the extend I had to take a benadryl. if you have sensitive skin please use with caution. this product differs greatly from their previous one. * I use the liquid Amazon Clay foundation for years. First time trying the powder. This is nice, light weight. Definitely an everyday wear. Leaves skin, soft and does not feel heavy or caky. * Creat coverage * Fine powder * I love how this powder foundation blurs lines! Beautiful easy to blend coverage. Leaves skin feeling soft like your not wearing anything at all. I also love the tarte Amazonian clay foundation this is the same except in powder form. I definitely recommend and i will definitely buy again. I was hesitant at first because of mu fine lines but this soft powder excels at blurring and leaving a beautiful soft matte look. Try it. * It's seems hard not easy to apply was disappointed. I love the foundation but not this powder * This product is great ! Iit is very light and blend able and does not cake or crease … I'm 50 years old and wear it all day and it's perfect !"
103,103,103,103,103,103,103,103,103,103,103,103,103,103,103,103,103,103,103,103,103,103,103,103,103,103,103,103,103,103,103,pat mcgrath labs,skin fetish: sublime perfection foundation,pimprod2040434,2613894," * I was looking for a new foundation. I get full coverage without the dryness and cracking that other products caused. This product produces a flawless look. * This foundation has many positive attributes. It has a lovely natural finish and a great shade range. It feels like a serum and blends beautifully. I so wanted to love this because the shade was perfect which is unusual for me. Unfortunately, it felt terrible on my face. Granted, I have dry, mature skin but I'm not particularly sensitive. I could not get past the tight feeling from the alcohol in this. It made my skin sting, feel tight and look dry as the day wore on. I felt it wore very well but it also caused some redness for me. I tried several moisturizers, oils and primers and nothing helped. so it's definitely a NO for me. It felt like a strange polymer on my face. However, for anyone not sensitive to a high alcohol content I would still recommend it. It truly is a beautiful foundation and if it was reformulated without so much alcohol I would try it again. * Goes on like a serum, covers like a light weight powder. I received so many compliments. I will purchase again. * I like this foundation if i know im not going to be wearing makeup all day it gets oily. I have oily/ dry skin. However It looks nice wilhen applied with makeup brush not sponge . * I like this foundation if i know im not going to be wearing makeup all day it gets oily. I have oily/ dry skin. However It looks nice wilhen applied with makeup brush not sponge . * I absolutely love this foundation. The color match was perfect and it feels like no other foundation I've ever used. 10/10 recommend * I purchased this foundation based on it being highly recommended for mature skin. But it is very thin and not easy to put on. Yes, it is biuldable but I don't like putting tons of foundation on just to make it look smooth.  I'm over 50 so i don't recommend it to anyone in my age group."
