,Brand,Name,ID,sku,comments
0,estÃ©e lauder,double wear stay-in-place foundation,xlsimpprod14641507,2309420,
1,urban decay,face bond self-setting waterproof foundation,pimprod2044818,2623593," * That is a very, very good product. Keep it on the shelf. * This is what replaced their old naked skin weightless foundation and it doesnt even compare. I love they kept the matte finish but this one definitely makes my skin not look as flawless. Almost splotchy in places. Bring back the old one! It was my absolute favorite!!! * I have realllyyy oily skin.  NOTHING lasts and always seems to crease or seperate around my nose, chin, and forehead.  I bought this when it was on sale because I figured it was worth a try for the price and after a month of use its safe to say that so far nothing has compared for me.  I currently have it on and after 11 hours + work for 7 it still looks BEAUTIFUL.  I'd recommend to anyone that has oily skin, it might not be the best for dry skin though but I've never noticed any clinging to dry patches with this one either * My fav skin tint! * I absolutely LOVE this foundation! Its buildable, and a little goes a long way! I love a natural/matte look, so i really enjoy how this looks on my skin. I have acne and scarring, as well as redness. It doesnt feel heavy, and it lasts me over 12 hours along with my skin prep. * Eh, it's alright. I have fair and neutral skin. But it's also dry, so I have to work quick with this foundation or it will start pulling apart as I work with it. It also settles into my pores after some time if the layer is too thick. And while it's a decent shade match, it tends to pull yellow on me * I had only used this a handful of times & its a complete waste of money, it exploded and there's practically nothing left."
2,it cosmetics,cc+ cream with spf 50+,xlsimpprod5770257,2264064,
3,dior,dior forever fluid skin glow foundation,pimprod2036824,2605019," * I wanted to try this a few times before giving my final thoughts. Im a healthcare worker who regularly works 12 hour shifts. That being said, I have tried & tested SO many foundations this year. My issue with other foundations is the fact that it doesnt last through a shift. I was always dealing with creasing, patching, flaking and just looking cakey. I tried different skin prep, primers, setting powders/ sprays and nothing changed. Ive been wanting to try this foundation now for a while and finally did.. and let me tell you- this is the best purchase ive ever made. It holds up beautifully, and it still looks just as amazing at the end of the day. Every issue ive had with other foundations, never happened with this. 
I have very sensitive & acne prone skin and this has not given me any sort of reaction or break out. My first shift wearing it, i received so many compliments. It gave me my confidence back! I will continue to repurchase this. * I dont have sensitive skin. I never broke out from a cosmetic product and this immediately caused the worst reaction on my face. My skin was dry itch and peeling. This foundation has a fragrance in it and it is not good for the skin. Sucks because i really liked the product. * I bought this for my mom. She loved it so much that I had to buy one for myself. The coverage is outstanding. We have been using it for a bit now, this is her 4th bottle and my 1st. Will definitely buy again! * This foundation leaves a beautiful dewy finish in my over 50 skin!! * Dior doesn't disappoint.  Even better layered. Do the coverage that works for you.  Lasts all day perfectly. * Too expensive. I wear it everyday. * Received my order today from Ulta, and it's already expired. Will buy directly from Dior from now on. Do better, Ulta."
4,bareminerals,original loose powder foundation spf 15,vp11362,2093947,
5,lancÃ´me,teint idole ultra wear 24h full coverage foundation,pimprod2039028,2608119," * Definitely would be buying it again * Good for my skin, non-comedogenic, non-acneogenic, and it looks natural on. It's also buildable if you need a little more. Thanks, Lancome. * Best foundation I can find to stay on my oily T-zone with a little help from hourglass mineral primer . Not happy that they reformulated and took away my 215-N which was a perfect match for my complexion. * I have neutral-y, extremely pale, olive undertone skin. I have struggled my whole life with foundations. Warm tones are always orange, cool tones are pink, and neutral tends to lean a bit coral-colored. 095w is the first shade match ive ever gotten that didnt need contour to make work. It doesnt feel heavy on my skin and it never looks cakey. * I loved how the foundation applied abd looked on my skin, it's probably the best I've seen on myself, ut they need to make better light - fair skin shades. Even the lightest shade (which is neutral) is yellow on me, and the lightest cool tone shade is too dark. * My previous color had too much red in it which made my face to dark Against my light colored neck. I'm looking forward to using it. And make up artist put the color on my face before I bought it and I loved it. I'm sure I will enjoy it compared to the previous color I had. * I had been wearing Dior Forever Matte for over 4 years now but started to notice it wasn't blending well on my skin no matter how I applied it.  Decided to try Lancolm Teint Idole Ultra Wear Matte and am loving it.  It is more liquidy than the Dior which makes it much easier to apply & blend.  I literally only need 1 pump worked into my brush using the palm of my hand (a Wayne Goss tip) for my whole face.  I set it with a little Morphe powder and a puff.  It looks grest ALL day and matches my fair yellow-gold undertone perfectly.   I usually blot twice a day and the excess oil is easily removed while the foundation looks newly applied again.  No extra powder needed.  So glad I decided to switch to Lancolm!   Would highly recommend!!!"
6,mac,studio fix powder plus foundation makeup,xlsimpprod15921242,2510813,
7,too faced,born this way natural finish longwear liquid foundation,xlsimpprod12621017,2290021,
8,nars,light reflecting advanced skincare foundation,pimprod2030141,2591117," * They were out of my normal foundation from nars. It has good coverage but it runny when you put it on and doesnt have the same luster as radiant wear foundation. Its ok for a change but wouldn't purchase again. * I used the foundation finder tool on NARS' website and it recommended the shade Patagonia.  It was a perfect match!  I apply it with a brush and use 2 tiny pumps of foundation and it covers everything - blemishes, dark circles, etc.  Does not look like I am wearing foundation which is the key. * I love this foundation so much, its goes on so smoothly, it blends well and its oily friendly. I have my summer and my winter shades. * I've been using NARS foundation for a few years and love everything about it. I had been using  Armani foundation and due to prices increases I tried NARS and never went back. NARS is comparable to Armani and more affordable. * It's pretty good but I don't think it's a product I would purchase again. There are other foundations that are equal to this one that aren't as expensive. I have dry skin and it works pretty well with it, however the overall feel of wearing it kinda bugs me. It feels like it sits on top of your skin rather than soaking into it. Also, please, for the love of everything, fix the pump and the cap. The pump shoots out the foundation, and the cap stopped connecting onto the bottle after some time. Gets quite messy. 

It does have a glowy, dewy finish and decent coverage, which is what I was looking for, so that's a plus. * I purchased this foundation because it had been recommended to me by multiple people as being ""safe for acne prone skin"". I am in my early 20s and have been on the hunt for a foundation that looks good and doesn't break me out. Unfortunately, it's not this one. Each time I used it my face flared up with more pimples. I wash my brushes after each use, and do thorough skin care prep to try to prevent a breakout as much as possible. I've worn this foundation many times because I wanted to give it the benefit of the doubt, but I've been left with horrific pimples that I am trying to get rid of months later. The makeup does look amazing on the skin and it does have that very light Dewey look to it and covers acne very well, but the after effects are not worth it. I have deep painful pimples on my face now. * This is the best liquid foundation i have ever used! Genuinely sooooo worth the price. My skin looks so fresh and clean when i use this foundation. I like how it is buildable yet light weight. Just a must!!!"
9,mac,studio fix fluid spf15 24hr matte foundation + oil control,pimprod2044825,2622206," * its good and does the job but I think its pricey in that case I would prefer estee lauder its better but still a good foundation * I bought this black Friday and the Sunday I went to a dance practice for a quince cause I'm a dama and it held up WONDERFULLY! this is my new everyday! * This is the worst foundation I've ever worn! It's greasy, cakey and settles in every line and pore on my face. It is so bad, it's nothing like the original formula. After about 3 hours of wearing it, I couldn't handle how bad it looked and how greasy and cakey it got. Never wearing this again! * I have super oily skin and sometimes my makeup just doesn't last. However, I wore this for my wedding in August and it wore so beautifully. Even by the end of the night I still had coverage! Got so many compliments on my makeup. It's my go-to now! * Omg so i dont really use matte foundations because unfortunately i have very dry skin but something cool I discovered playing with make up is use a tinted moisturizer foundation with this foundation and you girlies dont know how beautiful this looks 😍 * I tried to love it but I just dont. I used a primer, and have dry ish skin. Not terribly dry, no dry patches. This did not look good at all on my skin. It broke apart and made my skin look much much worse than it did without makeup. I used a brush to apply and it just looked like I threw it on but I took my time to do it. Looked terrible 😂 * I love my makeup"
10,bareminerals,complexion rescue tinted moisturizer mineral spf 30,xlsimpprod11771035,2283390,
11,bareminerals,barepro 16-hr skin-perfecting powder foundation,pimprod2030155,2589559,
12,fenty beauty by rihanna,pro filt'r soft matte longwear liquid foundation,pimprod2029862,2592558," * i absolutely used to love this, unfortunately, they reformulated 🫩 its no longer the same its a complete no for me now. doesnt mix well with any of my powders and looks extremely blotchy under the eyes. * The best foundation ever! * This is one of the worst liquid foundations I have ever used. I skin prepped and moisturized before using this and it looked awful. I ended up using some drug store bought foundation I had instead so I will be returning this item. * I wanted to love this foundatiin given all the great reviews but even after moisturizing masks and serums, this goes on so cakey. I don't have especially dry skin, but this doesnt work for me at all. At my cheekbones and beside my nose, it gets flaky unlike any foundation I've ever used. I do not recommend. * This foundation is amazing! It goes on smooth, looks natural. No cakey buildup, not flaking. Truly feels like a second skin!! From now in my go to!! * It has a really good coverage * It work great on my face covers dark spots.."
13,clinique,even better makeup broad spectrum spf 15 foundation,xlsimpprod10791919,2206255,
14,it cosmetics,cc+ nude glow lightweight foundation + glow serum with spf 40,pimprod2031824,2594106," * [I received this product in exchange for my honest review] 

Love love love this CC foundation! Not too heavy but great coverage with a nice natural glow to it! Also great that it has SPF to protect my fair skin! * [I received this product in exchange for my honest review] This was a great product, and not just because i received for free! I love the fact that is mostly a skincare foundation versus a regular foundation! The color matched me well, and it provided the right amount of coverage I like! It is lightweight and more of like a skintint to me! * [I received this product in exchange for my honest review] The first thing I like about this product is the combination of sunscreen, serum, and foundation , saving me time on my busy mornings. Next, the main function of this foundation is its smooth, creamy texture that blends easily to the skin. It provides moderate yet lightweight coverage, leaving the skin feeling smooth, radiant, and healthy-looking, perfectly suited to my natural makeup style. The color matches my skin tone; this depends on individual skin tone selection, but for me, the product has good color payoff and doesn't fade after a few hours. * [I received this product in exchange for my honest review] I've gotten to like my natural face, and this skin tint was sheer enough it didn't feel or look caked on. Love that it also gives SPF 40 protection for my face! The color match was pretty close, too! * I received this product in exchange for my honest review.
[I received this product in exchange for my honest review] I have been using IT Cosmetics CC+ Nude Glow in Fair and this one amazing product does 3 things amazingly well! It's a color correcting, medium-coverage skin tint that incudes a brightening skin serum and SPF 40. The CC+ Nude Glow has a 90% skincare base, made up of 2% niacinamide, hyaluronic acid and green tea extract, so my skin has literally been glowing! It provides medium coverage, yet feels so lightweight and comfortable, it's like  wearing nothing. As a person with a fair complexion, a lot of colors are too orange or dark, but this color just melted into my skin. And, it does all this while providing your SPF. I truly think this is a miracle product! * [I received this product in exchange for my honest review] A light lotion like foundation that blends in easily and hides fine lines. I tried it in Fall sunshine and the SPF provided good coverage. I'd buy it again. * [I received this product in exchange for my honest review] This looks amazing on my skin! I got just one shade too dark but this will be perfect for the summer for me!! It's super lightweight, it almost feels like a light cream!"
15,estee lauder,futurist hydra rescue moisturizing foundation spf 45,pimprod2013152,2577966," * Love this foundation. Very smooth and lightweight full coverage. * Was excited to get my hands on this since it was on sale. Tried it in store, and it was cakey. But I was crossing finger it was probably the tester so I still bought it. Next day, I prepped my skin, dried all the products applied and got a brush to put in on. Sadly, it was confirmed cakey on me. 🥲 * I was super hesitant to buy since its a moisturizing foundation nc most dont sit well on my oily t-zone! Ive used the double wear and LOVE the longevity of it, but needed something a little less coverage! This was PERFECT and everyrhing I was looking for. Medium coverage, sits flawlessly on my mature skin, and doesnt over hydrate my already oily skin. Finished with a setting powder and ny skin was flawless ALL day. New favorite and staple in my routine!!!! * This foundation is a life changer. When I wear it my skin looks flawless. People tell me how beautiful my skin is. * Very good product.  I am satisfied and staff very knowledgeable about this product. * This foundation is very moisturizing, which is what my skin needs now that I have more mature skin. I recommend this to anyone who needs moisture. * Was not hydrating in my opinion.  Left a dry look finish, had to shake tube well....returned"
16,bareminerals,matte foundation broad spectrum spf 15,xlsimpprod1480002,2209455,
17,pur,4-in-1 love your selfie longwear foundation & concealer,pimprod2005671,2544533," * PUR foundation is one of the best product used on my face! My photos are clear when used and makes me smile when I look at myself. Thank you! * I'll always love this foundation. I really hope Ulta doesn't discontinue it entirely. It provides good coverage, it's lightweight, it lasts all day, and it's great for problems skin! * Best foundation I've ever used, I will never buy anything else!!! * I use it to cover my mild melasma and I love it doesn't cake like other products, it feels light and not greasy. * How can you send me used and durty product , i paid my money to receive good quality service but now i will return everything and close my credit card * Color was too dark. * Was recommended this and loved it!"
18,it cosmetics,cc+ cream natural matte foundation with spf 40,pimprod2044261,2621797," * For context, I have dry, sensitive skin with occasional breakouts. For years, it was the best foundation I used, until learning it permanently stained my towels and clothes. Initially, I thought the marks were from bleach, but later saw it was this foundation. This was a deal breaker; I cannot apply a formula to my skin that bleaches fabric. Frankly, I would give it five stars but cannot due this con. Pros: buildable coverage, natural matte— ""skin like"" finish, and excellent shade range. * I LOVE IT makeup. I literally use just about every other product. I have always used the regular CC cream foundation with the 50spf which always looked flawless on my skin. My skin is really combination but because it's more on the oily side and blot oil throughout the day, I figured I'd try the matte. Big mistake. I wish I could return it because it's awful. I have big pores especially on my nose and this makeup just sits in the pores almost like reverse freckles! And when trying to blend it into my skin, it smears and is cakey and just no. I'm going back to the normal CC line because that one melts into my skin. I do not recommend this at all. * I really like this foundation it is light weight and long lasting throughout the day. It takes very little and the coverage is great. * Didn't get my free gift * Tried this on a whim during the big 50% off sale. it is my new favorite foundation!! I love the way it looks, blends, the coverage, etc. my new staple for daily wear. * This has been my go-to CC cream for years (maybe a decade?) but with my most recent purchase in August 2025, i was disappointed to discover the formulation has completely changed. It is no longer a mineral based (zinc, titanium) sunscreen. And the coverage is way thicker. Reminds me dermablend heaviness. So frustrated by the change because it was so incredible for so long. Back to the drawing board. * Good coverage, moisturizes your skin and you don't need much product."
19,it cosmetics,bye bye foundation full coverage moisturizer with spf 50+,xlsimpprod17611001,2523634,
20,fenty beauty by rihanna,eaze drop blurring skin tint,pimprod2031372,2592608," * I wanted to love this soo bad .. especially for how much i paid. made my pores very visible and CLUNGGG to dry spots real bad. on the parts that werent dry it didnt look bad so maybe if youre on the oily side it'll work for you !! * I received Blurring skin tint by @fentybeauty in exchange for my honest review 

As I age I find myself gravitating more towards a skin tint versus a medium/full coverage foundation. My skin needs a product that's less drying and more hydrating. Fenty Beauty blurring skin tint made it to my top two! This skin tint plays well with all my skincare products and all my other makeup products. The wear time is great and it doesn't cake after hours of wearing it. I mean, what else could you ask for? This is around $40 which is step but I'm willing to spend that for a product that's works so well for my routine! 

#fentybeauty #fentybeautybyrihanna #fentybeautyfoundation #influenster #skintint #sarahinfluencesyou #makeup #beauty 

@influenster @fentybeauty * Maybe not for my skin cause i have dry and oily. It creases badly with powder and spray after 2 hours * [I received this product in exchange for my honest review] I received the Fenty Skin Tint for free, and I was actually surprised by how much I ended up liking it. The texture is lightweight and blends really easily without looking streaky or cakey. It evens out my skin tone while still letting my natural skin show through, so it doesn't look like I'm wearing a full foundation.

The finish is natural with a slight blurring effect, and it feels comfortable throughout the day—no heaviness, no chalky dryness, and it didn't cling to dry patches. I also noticed it doesn't oxidize as much as other tints I've tried.

It's not full coverage, so if you have blemishes or dark spots you'll still need a concealer, and it can get a little dewy after a few hours if you have oilier skin. But overall, it's a great everyday product for a smooth, quick, effortless look. * It's the oddest thing, but this skin tint was truthfully the worst thing I've put on my face in a loooooong time. I don't know what it is. It just does NOT like my skin. I've tried applying with my fingers and massaging into my skin. I've tried applying with my fingers and blending out with a sponge. I've tried no primer underneath. I've tried primer underneath. I've tried my usual skincare underneath. I've tried without any skincare at all. I can NOT get this skin tint to stop collecting in ever single pore on my face to the point where it looks like little tiny dots all over and a sheer wash of nothing in between. I've even tried building it up thinking I needed more. Conversely, I've tried using the least amount possible thinking I was using too much. It also seems to find and desperately cling to the slightest whisper of dryness that I swear I didn't have before I put it on and make me look like a crusty sandwich. I ended up returning it because I couldn't salvage this disaster. It also broke up crazily in every crease I own within an hour… with setting powder, without setting powder, with concealer (Fenty btw), without concealer. Didn't matter. * I love this product and would buy it again. * I wanted to love this so bad but after 4/5 hours it either fades or slides around. You're better off wearing concealer or the elf cc cream."
21,it cosmetics,cc+ cream illumination spf 50+,xlsimpprod12251079,2287681,
22,nars,natural radiant longwear foundation,xlsimpprod17421227,2523136,
23,morphe,lightform extended hydration foundation,pimprod2043869,2621355," * I really love this foundation is super light on the skin but performs well . Medium to buildable coverage . Definitely would by again and possibly add a few shades to my kit. Please keep around * The old formula was so much better.  This one is fine.  The packaging is horrible.  The bottle leaks all the time and pumping it out is terrible.  It's like there is no spring in the pump.  Its a hard press and you cant really manage how much comes out. Then a drip leaks out after you press it, which is wasteful.  I like the foundation ok, but they desperately need to fix the bottle and pump. * Love the color & goes on so smooth. * Even though its light coverage, it makes your skin look amazing, with glow and sooo natural. * Very easy to use! I literally just used a foundation brush and applied it and it was seamless with no oxidation or cracking. This is coming from someone who has never used foundation before because of how i worried id look a mess later lol. Morphe has yet to let me down * I got this product as a free gift with purchase. I hadn't even considered trying it until I received it as the free gift. I absolutely love the coverage. This is not something I would have tried before as I have not used Morphe foundations. However, the drawback is foundation comes out of the pump and gets on the finger after pushing down. This  creates a mess and then foundation gets everywhere or you have to have something to wipe off the excess that gets on your finger from the pump leaking. * Love it"
24,tarte,face tape full coverage foundation,pimprod2003933,2540290," * This is the HOLY GRAIL of all foundations; it's true. I'm shocked. I had to change my skincare routine, especially my foundation, after 40yo, due to creasing. This DOES NOT CREASE. Amazing!! It is waterproof, lasts more than 24 hours, & it's as smooth as it gets. I am in love, & this is now my go to foundation for full glam days. I did have trouble with color matching, as the new 20B was far too white/caspery, but the 22B was nearly spot on. 27B was far too orange for me. The whiter colors run especially light ladies; up yourself to a shade darker than you think you'll need & you should be good. :-) * I like the way it looks on me, does not cake and looks natural * I wanted a full coverage foundation & an Ulta beauty rep. recommend this foundation. On a spot check at the store, it looked good. However, when I put it on my whole face at home, I saw wrinkles I had never seen before! This foundation is so think it settled into my fine lines and pores making them look bigger. * Flawless finish. * Foundation in neutral is very orange
Love the coverage but color choices are hard to match my complexion * This is my go to foundation. I love the coverage, the range of shades and my skin is happy with it on. Pair it with a great primer and top it with a good setting spray and you're golden from morning until night. * Everytime I wear this foundation, I get so many compliments on it."
25,lancÃ´me,dual finish multi-tasking lightweight pressed powder foundation,xlsimpprod3650148,2235364,
26,pÃ¼r,4-in-1 pressed mineral makeup broad spectrum spf 15,xlsimpprod3790037,2236106,
