,Unnamed: 0.17,Unnamed: 0.16,Unnamed: 0.15,Unnamed: 0.14,Unnamed: 0.13,Unnamed: 0.12,Unnamed: 0.11,Unnamed: 0.10,Unnamed: 0.9,Unnamed: 0.8,Unnamed: 0.7,Unnamed: 0.6,Unnamed: 0.5,Unnamed: 0.4,Unnamed: 0.3,Unnamed: 0.2,Unnamed: 0.1,Unnamed: 0,Brand,Name,ID,sku,comments
0,0,0,0,0,0,0,0,0,0,0,0,0,0,0,0,0,0,0,estÃ©e lauder,double wear stay-in-place foundation,xlsimpprod14641507,2309420,
1,1,1,1,1,1,1,1,1,1,1,1,1,1,1,1,1,1,1,urban decay,face bond self-setting waterproof foundation,pimprod2044818,2623593," * This blends well and the shade match was perfect but does not last long in the kentucky humidity. It seperates after a few hours on me and it also smudges wuite a bit even with a powder on. * This foundation is not like the previous ones it replaced. It is cakey. Bring back the old ones. * As soon as I applied it on my face, my face turned red and started itching, rashes * I have an olive undertone that has historically made shade matching a nightmare, and my skin is also really oily so foundation almost always ends up breaking apart or slipping off. The UD Face Bond is one of very few that holds up against my oiliness and the ONLY one that both holds up AND matches my skin undertone that I've tried. I have worn this multiple times for 12+ hour days at work, and once for 17 hours as a bridesmaid running around at a wedding in the rain. I did blot my face for the wedding at around the 14 hour mark but I honestly could've gotten away without it. 

This foundation probably would not work on those without oily skin - I can imagine that it would feel really drying if you're not endowed with an oil slick face like I am, especially since it has alcohol pretty prominently in the ingredients. But for the very oily, this is definitely worth a try. * I've been an Urban Decay foundation believer for over 10 years. Although it can be frustrating when a formula is discontinued (I started with the original Naked foundation, which changed to Stay Naked, which is now seemingly being phased out.) I will say that Urban Decay delivers in helping customers find a suitable shade match with their new formulas. 
This formula is lightweight, not heavy or greasy, and blends seamlessly. I continue to be an Urban Decay believer. I have tried other brands and they simply don't compare to the quality * This product  is my first time l buy that brand they  were out of the product  l buy . * I love this. It is waterproof the only thing is it startsn ""cracking"" by end of day. I don't set it with anything which could be the problem I also have dry skin and it does settle there. The coverage is perfect and I just use more moustierizer in the morning. 💖"
2,2,2,2,2,2,2,2,2,2,2,2,2,2,2,2,2,2,2,it cosmetics,cc+ cream with spf 50+,xlsimpprod5770257,2264064,
3,3,3,3,3,3,3,3,3,3,3,3,3,3,3,3,3,3,3,dior,dior forever fluid skin glow foundation,pimprod2036824,2605019," * I don't understand what justifies the high price of this foundation. The color match was beautiful, but the TRANSFER! I have tried every primer, powder  and setting spray but this transfers on everything. And the smell is odd. * I wanted to love this foundation because I heard so many great things about it but I had to wash it off after 10 minutes because I had an allergic reaction to the fragrance in it. * Product is definitely very hydrating but it oxidizes after a while. * Matches my skin tone perfect feels and looks great my favorite foundation * Ive used pretty much every foundation out there and I have to say this one is # 1 !!!!! Best coverage, color match and longevity. Love everything about it. * its not a full coverage foundation * I have tried many foundations and this will always be my go to. I have acne scars and this covers them and leaves such a glow natural finish. I'm obsessed."
4,4,4,4,4,4,4,4,4,4,4,4,4,4,4,4,4,4,4,bareminerals,original loose powder foundation spf 15,vp11362,2093947,
5,5,5,5,5,5,5,5,5,5,5,5,5,5,5,5,5,5,5,lancÃ´me,teint idole ultra wear 24h full coverage foundation,pimprod2039028,2608119," * There are pros to this foundation. The shade is perfect, and it has good wear time. I also appreciate there is no added perfume. 

The cons, which is why I am going to stop using it, is that Alcohol Denatured (pure alcohol form) is the third ingredient. It has sensitized my skin. It causes noticeable redness and irritation. It is so disappointing.    I cannot use this and do not recommend it. 

I hope they reformulate again and remove this harsh ingredient. * I love this foundation!  It has great coverage and the sunscreen is a major plus! * Long lasting. Premium quality. It's a little matte/flat, so I add a little of my it Cosmetics foundation to give it a little glow and dimension. J'adore! * Long lasting, great coverage, good undertone, could not ask more from a foundation! * I wanted to love this, but I'm having a hard time. It seems to get cakey with a full day wear. I've tried it with different primers, no primer, different setting mists and no mists--same effect. I like the coverage it gives, and the color match is pretty good, I'm just not in love with the all day wear on this one. * Really appreciate that Lancôme offers shades for olives undertones. I finally found my perfect match. The foundation is full coverage but doesn't feel heavy on the skin. It lasts all day. I don't even have to powder through out the day. * This is my go-to foundation. It never disappoints!"
6,6,6,6,6,6,6,6,6,6,6,6,6,6,6,6,6,6,6,mac,studio fix powder plus foundation makeup,xlsimpprod15921242,2510813,
7,7,7,7,7,7,7,7,7,7,7,7,7,7,7,7,7,7,7,too faced,born this way natural finish longwear liquid foundation,xlsimpprod12621017,2290021,
8,8,8,8,8,8,8,8,8,8,8,8,8,8,8,8,8,8,8,nars,light reflecting advanced skincare foundation,pimprod2030141,2591117," * Not worth the price * I absolutely love this foundation!  The color matches my light olive complexion (Figi), it goes on smoothly (I use a brush), my skin looks flawless.  After a few minutes I don't even feel like I have foundation on, my skin feels velvety.  This foundation is long lasting with great buildable coverage. * I am 53 and have been looking for a foundation that helps take a fee years off my face..I found it finally!! Blends beautifully with my brush, doesn't settle into fine lines and reduces pores. The color match is perfect! I have never bought a Nars product till now, but I am now a repeat customer! * Ive been using Nars for years. I have tried other foundations but i always end up coming back to Nars. I always get complements on my skin when i use this foundation. It sets very naturally. * I'm not gonna lie, this foundation is really, really bad. I'm using the shade Oslo which is a perfect match but this foundation somehow just smears all over my face while highlighting my pores/texture and breaks down after an hour or two. It just does not want to sit properly no matter what I do. I've tried using a brush, beauty blender, my hands, puffs and it doesn't make a difference. Even with prepping my skin (dry skin with sometimes oily tzone) - I've done my full skincare routine, minimal routine and no routine and this foundation somehow behaves the same. Setting spray and a translucent powder also do not help. It's just not good no matter what I do, which is extremely disappointing. * I tried this foundation because Loreal Infallable did not last long on my oily skin, and Tarte Amazonian Clay was cakey and made my pores and lines very visible. I applied Smashbox Mattying Primer on my face, then blended the NARS foundation with a sponge. I finished with Maybelline finishing powder. My makeup lasted all night and I looked younger because of the great coverage. I highly recommend this foundation if you have combo or oily skin, but definitely use a good matte primer! * My new favorite foundation! It matches my skin perfectly and blends so well with high coverage as well. It feels great on my skin!"
9,9,9,9,9,9,9,9,9,9,9,9,9,9,9,9,9,9,9,mac,studio fix fluid spf15 24hr matte foundation + oil control,pimprod2044825,2622206," * Covers where I need it, stays on longer * Love the coverage. It feels so silky going on. It blends really easy. * Does anyone have dupe recommendations for the original formula in other brands? I'll be switching after trying this reformulation. It's really awful, listen to all the bad reviews! 

The new formula is no comparison to the original. Very greasy, even on dry skin. Separated within an hour of wear, accentuated poors & fine lines, and left dry patches looking flakey. Does NOT provide full coverage, even after a few passes of attempting to build the coverage (in vain). Transfers very easily, even after setting with powder. This formula never set on my skin and just felt gross. * Ive been using Mac for years. And this new stuff is horrile. My face looks cakey doesnt stay on, just rubs off. The old stuff used ti be sweat proof. But not anymore. * I gave this 5 stars several months ago when I first bought it, because the first time I used it it really did seem to look nice and last. I don't know what changed but I don't like wearing it anymore, it definitely oxidizes & my face looks greasy after just a couple hours. I keep having to powder it. It also separates a lot, especially on my forehead and it's kind of drying. I'm now searching for a new foundation. Double Wear lasts better but dries me out and ends up looking chalky. * NONE, I LOVE THIS PRODUCT, USING IT FOR YEARS. * Sinc they changed the formula it's terrible unfortunately. I have been using this since I was 15 and it has never failed me, until I bought this 3 weeks ago in the new pump bottle, also the new formula. Slightly devastated, it sits nothing like it did before on the skin, it does not matter whether you use the most expensive quality primer, setting powder, spray, all of it can't fix the awful quality of the new formula, and trust me, I tried it all in the 3 weeks hoping maybe...but it's just awful. So bad I literally called Mac and left them a phone review because please give us back what we loved. Until then they've lost a literal lifetime customer, I'm sorry comrades, tight the good fight, try it yourself side by side your old formula if you have some still, then spam Mac with your reviews until they change it back, please, can't we just have this one thing in this timeline?"
10,10,10,10,10,10,10,10,10,10,10,10,10,10,10,10,10,10,10,bareminerals,complexion rescue tinted moisturizer mineral spf 30,xlsimpprod11771035,2283390,
11,11,11,11,11,11,11,11,11,11,11,11,11,11,11,11,11,11,11,bareminerals,barepro 16-hr skin-perfecting powder foundation,pimprod2030155,2589559," * It was so amazing * I've been a loyal bareminerals user for some time and I usually am not disappointed. That's why I decided to give this item a try. I usually use their loose powder as a matte coverage when I want to look more natural and I also frequently use their bb cream with SPF. But I wanted to get a product to help with full coverage on top of my cream foundation, and THIS IS IT! This barepro powder almost erases the different imperfects you don't want to show up when sporting a full coverage look, while looking like your actual skin! And the matte aspect is great for someone like me who is naturally oily skin. I highly recommend * I've always worn Bare Minerals brush on loose powder. This one was on sale at Ulta so I decided to try it. I love the ease that it goes on snd the coverage it gives. My new favorite foundation. * So far, I am really liking the powder foundation. I had used the bare pro liquid for years, but they recently changed the formula and it looks really bad on late-30s dry skin. 

The reason for taking off one star is because I feel like the make up only lasts until lunch, even with a primer and expensive finishing spray. However, it comes off ""evenly"" if that makes sense. No patchiness or weird peeling. * I've been using this foundation for many years, and I love the coverage, and it's clean ingredients.  It never makes my skin look dry either. * BEST FOUNDATION POWDER EVER. * For me, Barepro 16HR is perfect. I suffer Rosacea and I can give myself the coverage I want, although less is    better than more."
12,12,12,12,12,12,12,12,12,12,12,12,12,12,12,12,12,12,12,fenty beauty by rihanna,pro filt'r soft matte longwear liquid foundation,pimprod2029862,2592558," * The best foundation I ever used * I've tried many liquid foundations and this fell short of my expectations.It didn't provide lasting coverage & has a dry texture. * Wow, what I have been looking for in a foundation. Has a slight glow and applies smoothly. Makes my face look younger and brighter. Definitely my new favorite! * Unfortunately this foundation was not my shade, so I was not able to give a review. I can not say how the foundation looked on the skin or how it wore through the day * Urban Decay is much better but since they're discontinuing the All Nighter, I decided to give this a try. Fenty splatters too much, leaving marks on clothes and all over my bathroom counter. I will not be purchasing again. Also, coverage doesn't last as long as Urban Decay. * This product is amazing! It blends very well with my complexion and is a very buildable foundation. I like the packaging for this product and will add this to my makeup routine. * I just bought a new bottle and the color seems to be separating inside the bottke…. No happy"
13,13,13,13,13,13,13,13,13,13,13,13,13,13,13,13,13,13,13,clinique,even better makeup broad spectrum spf 15 foundation,xlsimpprod10791919,2206255,
14,14,14,14,14,14,14,14,14,14,14,14,14,14,14,14,14,14,14,it cosmetics,cc+ nude glow lightweight foundation + glow serum with spf 40,pimprod2031824,2594106," * I love this product! I am 70 years old and have never used any kind of foundation or makeup. I don't like the look, like someone is wearing a mask. You can tell that every pore is filled. Well, I'm at the stage where spots are just brought on by age. I was hoping to find something that would cover the spots and not look obvious. This product looks great! It evens out my complexion and doesn't look heavy. I purchased 2 different shades because there is a season when I love to tan. I would recommend this to anyone looking for a lightweight coverage that looks very natural. * I was using a full coverage foundation and was recommended I use the lightweight foundation and I have to say that it gives me a more natural look. It's light weight and fresh feeling on my face even at 3pm. * This product really works well for me.  It gives a nice glow and evens out my skin tone.  I think it is very flattering.  I have received several compliments. * I can see it sitting on my skin.  It doesn't seem to blend in nicely. * The original formula is too heavy. I like the coverage on this formula best. Better shades too. * Great coverage without being too heavy. Beautiful shine. * Easy to apply and just what I need"
15,15,15,15,15,15,15,15,15,15,15,15,15,15,15,15,15,15,15,estee lauder,futurist hydra rescue moisturizing foundation spf 45,pimprod2013152,2577966," * I'm in the sun almost constantly so I need a product like this that combines spf with skin loving moisturizers and a perfect amount of coverage. I do use a setting powder so everything stays put all day * I have dry skin quite often because acne medication. This is the best I've found that doesn't flake and stick to my dry patches. I use a wet sponge to apply it. * As of summer 2024, I've been using this foundation for over two years on my ""mature"" 47 yo skin. It looks great and preforms well with any skincare I've ever worn underneath, including different sunscreens. (PSA - this has SPF but shouldn't be relied upon as your only SPF in a day.) Looks great. The color range seems completely constant across the brand. So if you started with the Doublewear Stay in Place and were looking for something lighter and more natural finish, you can choose your ""usual"" shade. * I have worn the double wear sheer foundation in dessert beige for years. They changed it so much; it is hardly the same foundation now. The double wear in full coverage is too much for aging skin (I find). I looked at the serum tint and it was clearly too oily for me and too sheer. The hydra rescue, on the other hand, is the new deal. A lot of sun protection, just enough coverage. And most importantly I finally matched the color the right way and that is to my neck. Turns out I was never desert beige, I am exactly Ecru. Who knew! It can look flaky if you don't have a moisturized enough base. Also, start with a smaller amount, then build up coverage as needed to avoid caking. Other than that, it stays on and does not easily transfer. * I love the formula. It's highly pigmented so a thin layer is plenty, you don't feel like you're wearing anything. The only problem is the tube it's in is the worst foundation container I've ever had. I dismissed other reviews of people complaining bc I thought maybe it was user error, I was wrong. The pump leaks everywhere leaving a huge mess every time you use it. * This product is very runny, which I read in the reviews.  It doesn't take a lot of product to cover, and I really like the color (Fresco) and how it disappears after application.  My face feels hydrated most of the day after use.  I did detect a slight odor, but it was very faint, and it goes away quickly.  You just have to be careful, removing it from the tube.  Plan on it being a little messy.  I do like it so far, and it gives me a natural look. * Great product"
16,16,16,16,16,16,16,16,16,16,16,16,16,16,16,16,16,16,16,bareminerals,matte foundation broad spectrum spf 15,xlsimpprod1480002,2209455,
17,17,17,17,17,17,17,17,17,17,17,17,17,17,17,17,17,17,17,pur,4-in-1 love your selfie longwear foundation & concealer,pimprod2005671,2544533," * I use this foundation all over and it has excellent coverage! I can even add a little more in spots that need it and they just disappear! My only complaint is for them to change the bottle. I am almost out of product, but i can tell there is soooo much more leftover on the sides of the bottle. The problem is that it's impossible to scrape it due to the doe foot applicator fitting through such a narrow hole. * I actually had an ulta employee try this on me in the store and my daughter was stunned at how good it looked. I have malasma and it really evened me out , my daughter said she never has seen my skin look that good. I hate heavy makeup and I really only use this for under my eyes and over my cheeks where my malasma is. , more as a concealer. It works very well. I may try their spf tint too. I recommend this. * This is my everyday go to foundation! Gives me great coverage and I love that it has skincare built in it. The ingredients are clean and I've noticed my skin feels and looks so much better since I started using this. I'm on my second bottle and swear by this stuff. * Absolutely flawless. I can wear it sheer or full coverage! Not sticky, not cakey!!! I also love the primer it makes my skin super smooth and prolongs the make up even more ! Filter in a bottle ! (Use the pur brush as well) * holy grail foundation, i will never but another again 😍😍😍😍 * I've tried many foundations and have had incredible difficulty finding one that matched my skin tone (pale neutral) and didn't oxidize.  This foundation is perfection (shade LN2).  The color stays true and doesn't oxidize throughout the day as so many foundations have done on my skin.

It has a natural finish, sits very smoothly on and blends easily into my combination skin without emphasizing dry patches, lines, or pores.  My skin is fairly reactive, and I've had no negative reactions to this foundation.  The coverage is buildable and so good that I no longer have to wear concealer.  I've found that using a setting powder does help it wear throughout the day, but it's still nice even without.  I hope PUR continues to make this foundation forever! * also love it because shade TN3 is a perfect color match for my skin tone."
18,18,18,18,18,18,18,18,18,18,18,18,18,18,18,18,18,18,18,it cosmetics,cc+ cream natural matte foundation with spf 40,pimprod2044261,2621797," * Have combination skin did my usual skin care then applied the IT cosmetics primer before applying this CC Cream. Looked great for first hour or so then skin got very shiny and showed texture and enhanced fine lines. Returned product. * Too heavy for my skin. Needed to thin down with moisturizer * The shade match is so good. I'm a neutral tan olive. I got the shade neutral tan. This was one of the best shade matches I've had. Looks so good!! The only downside is that it transfers. * I had stopped using foundation due to the caked on feeling with full coverage and setting in the fine lines and I'm not, a stop what I'm doing to touch up girl..so this is a game changer! Love how light it feels last all day no touch ups! And no creasing. * Conceals and blurs my dark spots and redness! Doesnt make me break out. Makes my skin look natural and healthy. I wear a hydrating Lorac primer underneath. I apply with my hands. Takes about 45 seconds to apply. Doesnt sit in my fine lines. Can sometimes cling to extremely dry patches but it doesnt cling nearly as bad as 99% of othef products ive tried! * I've tried to like this foundation like 3 times now i keep returning it and then seeing a good review and then buying it again hoping it'll work but it clings to every dry spot even with skin prep and primer thats just me though. * Oily skin girls definitely buy it. Leaves the skin very pretty and mattified. With little product it covers a lot and lasts all day. I have oily skin and the makeup was perfect throughout the day."
19,19,19,19,19,19,19,19,19,19,19,19,19,19,19,19,19,19,19,it cosmetics,bye bye foundation full coverage moisturizer with spf 50+,xlsimpprod17611001,2523634,
20,20,20,20,20,20,20,20,20,20,20,20,20,20,20,20,20,20,20,fenty beauty by rihanna,eaze drop blurring skin tint,pimprod2031372,2592608," * I was looking for a tinted base product in order to avoid wearing a full coverage foundation every day for work which just ends up causing breakouts eventually. This product really gets the job done. It covers up any subtle imperfection and doesn't feel like I'm wearing any product. I do use it with some light concealer under my eyes since I have naturally darker under eyes, but overall I would definitely reccomend. * If you have oily skin it could be a really good option to try
I have the lightest shade of this tint and I am matching it with Fenty powder. Perfect combo as for me. I love it.
Very light coverage but it helps very good with the redness.

I probably wouldn't recommend it for dry skin 
It's helps my oily skin but it probably will dry out your skin. * This has got to be the best wearing skin tint I have ever tried! Worked an 8 hr shift and it still looked beautiful. Def could have powdered, but there was no transfer or separation in sight! Sooooo good! * I have tried more skin tints than I care to admit. Dozens and dozens. THIS IS THE ONE. God bless this skin tint. * this product is so good. make sure you prep with spf, i use the cetaphil non oily moisturizer sunscreen thing. when i went to ulta and tried the product, my face was dry and wasnt prepped. it definitely clings to dry spots so make sure you moisturize before applying. i rub into my skin after applying moisturizer then blend with a sponge. this product feels like skin and if youre looking for that evened skin tone and satin finish i would 100% get this. i have acne prone skin and oily combination skin and this product was so good and covered my blemishes. if youre thinking about getting this, GET IT. * I really wanted to love this, and i kinda did but this did not stay on at all, i set it with powder and used a good setting spray but it doesn't stay on like it claims to, literally melted off my face. * I really wanted to love this, and i kinda did but this did not stay on at all, i set it with powder and used a good setting spray but it doesn't stay on like it claims to, literally melted off my face."
21,21,21,21,21,21,21,21,21,21,21,21,21,21,21,21,21,21,21,it cosmetics,cc+ cream illumination spf 50+,xlsimpprod12251079,2287681,
22,22,22,22,22,22,22,22,22,22,22,22,22,22,22,22,22,22,22,nars,natural radiant longwear foundation,xlsimpprod17421227,2523136,
23,23,23,23,23,23,23,23,23,23,23,23,23,23,23,23,23,23,23,morphe,lightform extended hydration foundation,pimprod2043869,2621355," * Absolutely love it!  Just what I was looking for...Perfect coverage. * This is such an underated foundation. I have combination dry skin. I do not use cream blush or bronzer. Im a powder type of girl so I always set with powder then hydrating setting spray for the dew look without being grease if that makes sense. This foundation doesnt need a primer, it looks better without . Last all day and it is smooth . One of my favorite ones so far and you can not beat the price . * Very natural * This is my everyday foundation. this is magic in a bottle. I literally use half a pump to do my makeup and it lasts me all day. I love morphe products so much * So light weight and buildable coverage. Definitely get shade matched in the store because I tried a shade and it oxidized. Ended up getting a lighter and it matches perfected. I sweated in the foundation and it was still in tact! I just prepped befofe with moisturizer and primer and set with powder and it was perfect! Underrated product! * Excellent coverages * this product is perfect. its so hydrating and the coverage is amazing. its super light and feels like theres nothing on. i had it on for over 12 hours and its still fully in tact. even when you are sweating it will stay on. the areas where i didnt use setting powder or spray it only came off a tiny bit. 10/10"
