,Brand,Name,ID,sku,comments
0,estÃ©e lauder,double wear stay-in-place foundation,xlsimpprod14641507,2309420,
1,urban decay,face bond self-setting waterproof foundation,pimprod2044818,2623593," * With acne orobe skin, it is difficult to find a foundation. Howevr, face bibd has not caused any new breakouts. In fact, it is great with oil control, full coverage, and minimizing pores. It looks very natural without being cakey. The only warning is a hydrating lotion is needed uf uou have acne combo skin. * Color was way darker than the shade on the web, need a couple shades lighter but will consider purchasing again * I had been waiting a long time to try this and SO GLAD I did. Skin match is impeccable. Coverage is perfect for me. My only complaint is the size is so small. * This would be a nice product, just not for me.  Sits a little Cakey on my face, tried a couple different primers.  Just not meant for my skin type.  Lasts all day, and color match is pretty spot on….so I gave it three stars * After years of searching for a replacement for Hourglass Immaculate which was discontinued, I have finally found the one! Face Bond has beautiful coverage, is long lasting and does down nicely. Great for oily girls. Highly recommend! * This foundation is the beat foundation I've used in years!!!! I have extremely oily skin,with a lot of discoloration and texture from acne…This foundation is lightweight but,buildable…Even though its a self-setting foundation,I would recommend you still set with your loose powder..The coverage this foundation will give you is awesome!!! * Finally I found my perfect foundation, love it."
2,it cosmetics,cc+ cream with spf 50+,xlsimpprod5770257,2264064,
3,dior,dior forever fluid skin glow foundation,pimprod2036824,2605019," * Literally kicking myself for not trying skin glow sooner. Finish comparable to haus labs. Rivals the Dior skin perfect stick (my fav). Honestly puts Armani to shame. No cling to dry patches. Makes me want to cry how due to how pretty it is. lol * This foundation has a nice finish on my skin but it settles in every little line on my face, very disappointed. * 3rd time buying this. It blends perfectly, covers my fine lines, even my '11' line BUT BETTER THAN THAT- it covers my heavy rosacea on my cheeks. Love this product! * I love this product. It makes my face looks flawless and glowing,  I will recommend it to my friends * The foundation matches my skin tone perfectly. I was using another foundation before but found it very shear. This one covers but is not thick or caked on. It also has a nice scent to it. * The Dior Forever Foundation is absolutely amazing. It applies beautifully, evens out the skin tone, doesn't emphasize pores, and lasts all day without looking cakey. The skin looks fresh, smooth, and natural. It feels very comfortable on the skin and doesn't dry it out.
I'm very happy with the result — this is definitely a foundation I'll keep using and highly recommend. * Glowy, medium to full coverage, fancy."
4,bareminerals,original loose powder foundation spf 15,vp11362,2093947,
5,lancÃ´me,teint idole ultra wear 24h full coverage foundation,pimprod2039028,2608119," * After every time i wore this i would break out in painful pimples. I would not  recomend for sensitive skin. * Long wearing, full coverage without caking or settling into fine lines. Perfection in a bottle! * I have been using this product for a good while. I sure hope they never stop this product. I've recommended this to many ladies * I've used this for years and it DOES stay on all day very well without being thick or caking and washes off easily. * I like my other Lancôme foundation but I can only get it on line * As someone with extremely oily and sensitive acne-prone skin this foundation is my holy grail. It wears nicely thoughout the day and I appreciate the coverage. Def would reccomend to splurge on this. * I love the coverage i returned for a more matte foundation"
6,mac,studio fix powder plus foundation makeup,xlsimpprod15921242,2510813,
7,too faced,born this way natural finish longwear liquid foundation,xlsimpprod12621017,2290021,
8,nars,light reflecting advanced skincare foundation,pimprod2030141,2591117," * I bought this as a potential wedding foundation and unfortunately it does not work for my skin. My skin looks worse and this foundation emphasizes problems I didn't know I had. * I was in desperate need of a new foundation and Ive had my eye on this for a while so I finally pulled the trigger and wow. Talk about flawless. I have sensitive combo skin that has gotten much drier now that I'm using retinol and other actives. This applies like a dream and truly gives a light reflecting finish. It feels completely weightless too which I adore. I'm a decently fair girly with a bit of redness and Mont Blanc was a perfect match for me. I'm getting married this year and i do believe i will be wearing this on my wedding day 😍 * I've heard so much about this foundation for a long time. I had grabbed the Nars radiant concealer a few months ago after seeing rave reviews and personally didn't like it, so I wasn't super eager to try the foundation. I've been searching for my 'perfect' foundation formula for so long, and desperate to find something I liked I grabbed a bunch of different ones to try. this one is THE one! it's so beautiful on. I want radiance without looking greasy or emphasizing texture. I have acneic and scarred texture, and needed something matte but radiant if that makes sense. I also have some fine lines that foundations tend to exaggerate. this stuff is perfect for me! truly gives a ""glow from within"" glow rather than a shine. I recently tried PT's foundation and HATED it, so I've been hesitant on trying luminous formulas. the coverage of this is perfect and it obviously works perfectly with my Nars pot concealer. I will say- finding your perfect shade match may not be easy. I'm a pale, olive tone and struggled a bit with both the concealers and foundation. I usually have to get neutral undertone shades because warm/cool never work for me. Nars seems to have very yellow-toned shades in their formulas. I have to mix 2, but that's unfortunately pretty standard for me anyway. nonetheless, I absolutely LOVE this formula and will absolutely be re-purchasing! * I have always had difficulty finding my shade in foundation but this is the first time ive had a good match. I wear the shade Perth and it medium coverage but with color correction all my dark spots are cover and i get a smooth flawless base! It pairs well with the concealer and gives a more natural finish * This foundation gives you an effortless natural glow. It is like your skin but better. Buildable coverage and consistency is light and sets nicely without primer or setting powder. * I am 43 and had been using a pressed powder foundation. I felt like it was drawing attention to fine lines and wrinkles. I did some research on best foundations for lines/wrinkles and kept stumbling upon this foundation. I tried this and absolutely love it. I think it minimizes my fine lines and wrinkles. Will absolutely buy again. * This NARS foundation is truly one of the bast. It resists oxidizing and is buildable and looks natural. I highly recommend it for older skin types. It has light reflectors, but not shimmer. Very hydrating. Try it you'll love it and Never go back to anything else."
9,mac,studio fix fluid spf15 24hr matte foundation + oil control,pimprod2044825,2622206," * Im very satisfied with my products 
I brought a friend with me that day and the girls tried the foundation in each one of bus and we love it and buy it
In the future I will bring more friends with me and yes I will love to continue buying this product * This foundation is truly unmatched. The finish, coverage, oil control, and wear time are perfection. Even in humid Houston weather!! It looks flawless on the skin all day without caking, separating, or breaking down, even on oily skin. It photographs beautifully and somehow still looks natural in person. I've tried countless foundations at every price point and always come back to this one. PLEASE never change this formula, it is absolute gold and a staple that outperforms everything else on the market. * I love it. * I had such high hopes and was let down. This foundation immediately settled down into every pore and line. It lifted when applying any other product over it. I have never had this much trouble with a foundation. * This new formulation shows every tiny line in faces, settles patchy and wears off quickly, although it doesn't matter how long it stays on because the initial look is not usable for photos or life. It's a completely different foundation from the industry standard Studio Fix Fluid we've used for the last 30 years. Could Mac rerelease the original formula as a Retro line, or MA Standard pro line? * The old fomula was amazing, had perfect coverage, and didnt cause breakouts. This new formula is runny, doesn't blend as well, and contains salicylic acid which caused dry patches and made my skin flake. * I"
10,bareminerals,complexion rescue tinted moisturizer mineral spf 30,xlsimpprod11771035,2283390,
11,bareminerals,barepro 16-hr skin-perfecting powder foundation,pimprod2030155,2589559,
12,fenty beauty by rihanna,pro filt'r soft matte longwear liquid foundation,pimprod2029862,2592558," * I love this foundation! It provides the long lasting coverage I need and I get so many compliments! I have definitely spread the word that Fenty is it. My shade is 440. * Don't like really want my tarte back,been waiting for them to get restock in . * The color was too light * I am not too sure about the color match but the foundation itself is beautiful ❤️ * This has been my go to foundation for years! But i dont know what it is now. I haven't changed the process ive always used to apply my makeup, I now notice within the first few hours my face is oily and the make up starts to separate. I an honestly devastated that I now need to try something new. * Did not blend out well. Drys very quickly and made my skin look light years older. It's wild. I'm 38 and this is not the correct formula for my skin type. * 225 is a perfect match for me as an olive girly."
13,clinique,even better makeup broad spectrum spf 15 foundation,xlsimpprod10791919,2206255,
14,it cosmetics,cc+ nude glow lightweight foundation + glow serum with spf 40,pimprod2031824,2594106," * [I received this product in exchange for my honest review] I hate the feel of foundation on my face but this does not bother me. Just a small amount covers the redness that I don't care for without feeling heavy. I enjoy that it is buildable for more coverage should be needed. SPF is important to me as I live in a hot humid and sunny climate. * I received this product in exchange for my honest review. I'm absolutely loving this foundation! It feels so lightweight, leaves my skin looking flawless and shine-free, and it lasts all day. Plus, it has SPF! The shade is soft and natural, almost like a gentle sunscreen tint. I love the packaging, it's super cute and easy to use, and the creamy texture blends beautifully. The scent is really pleasant, too. I would definitely repurchase! * [I received this product in exchange for my honest review] Not my ideal product, super oily, didn't sit well on my skin. It was super thick, the scent was super off putting as well, it was very chemically based * [I received this product in exchange for my honest review] I am obsessed! I spend a ton of time outside at my boys' baseball games here in the desert, so I constantly am wearing sunscreen. This product makes my skin look flawless, while not looking too made-up, all while protecting it from the sun! It is lightweight and easy to apply/spread evenly. It doesn't pull like other tinted sunscreens do. The color initially appeared way too dark upon pumping it from the bottle, but it lightens up a tremendous amount once spread out. The coverage seemed to last all day, from an 8am baseball game start to a 9pm finish for the day. It withstood baseball dirt infused wind, a hooded sweatshirt tightened around my face as much as it it could be, and constant hand touches and wipes as I sweat out my kid on the pitcher's mound, haha. At the end of the day, it washed off easily and didn't leave any residue behind.  Check out how it covered my natural Irish cheek redness! * [I received this product in exchange for my honest review] I am very excited to share this feedback. I unfortunately have very noticeable veins, and it makes it hard achieved a natural look. But that has now ended. This product covers my very visible veins and any other blemish with a very settled look. I absolutely love that it protects from further sun damage with the sunscreen the formula has in it. I actually love how much it covers my facial veins. I will also use it on the top of my hands, too. High recommend this product for its lasting protection and beauty prepared formula. 10/10 * Would be good if they had better shades for cool undertones. The fair cool still makes me look too orange. * [I received this product in exchange for my honest review] I have sensitive skin so I'm always nervous about trying new products, but I am very happy with this! It went on smoothly, easy to build coverage, as well as covered up a bruise that I had on my hand. Did not transfer or create, was easy to remove."
15,estee lauder,futurist hydra rescue moisturizing foundation spf 45,pimprod2013152,2577966," * Thought I would splurge on this and wish I didn't. Within minutes this foundation settled into and accentuated every pore, line,  and wrinkle on my face. Trying yo get it to blend just makes it get mire blotchy. I am going to try to return it. I don't recommend this. * Crazy hydrating to the point it was an oil slick. I looked like a hormonal teen upon application. Also - what happened with the shades?? I'm a perfect match for 2C3 Fresco in EL's Double Wear foundation.  But this? Futurist Hydra in 2C3 Fresco is about 3-4 shades too light!! Completely different color/shade than Double Wear!! DEF SHADE UP (go WAY darker) with this!!  Not sure why shade matching had to be made so much more difficult that it already was, but dangit - $$ wasted. This stuff is also best for over 55yo skin imo, not those over 35yo that are just starting to get creasing & lines. Def best for VERY dry, post menopause, etc. I'm 45yo, & this was far too much ""hydration"" for me (didn't think that was possible - but it IS.) It just smeared all over my face like oil & transferred far too easily. It also didn't wear nearly as long as Double Wear, although I understand the difference, lol. BUT it was not at all creasey, nor dry & cakey, so for that, I gave it 3 stars. I can see this working great on me when I hit 55-60yo plus, but just not right now.  Pricey as all get-out too. Plz fix the shades to match your other foundation colors, it's ridiculously different! * This makeup has great coverage, matches skin tone better than most, lasts all day and just a very good makeup * Goes on smooth light weight great coverage.i will buy this product again .this is the first time I purchase this brand of foundation.
I rate it as a 10  ...,.............................................................................................. * Usually this is my go to. I don't know if there's something wrong with the one I purchased but it's definitely not the quality I expect from Estée Lauder. * Too shiny and irritating to my skin * I'm happy with this product. Highly recommended having a color match to get the right shade for you. Good coverage plus moisturizer is a win win!"
16,bareminerals,matte foundation broad spectrum spf 15,xlsimpprod1480002,2209455,
17,pur,4-in-1 love your selfie longwear foundation & concealer,pimprod2005671,2544533," * absolutely  great color match.  Great texture and natural looking coverage * It leaves the skin with a terrible texture. * I've been wearing this makeup for quite a while. My biggest complaint is that I have to buy two different colors and blend them to get a decent color match. Other than that it's got great coverage. * PUR foundation is one of the best product used on my face! My photos are clear when used and makes me smile when I look at myself. Thank you! * I'll always love this foundation. I really hope Ulta doesn't discontinue it entirely. It provides good coverage, it's lightweight, it lasts all day, and it's great for problems skin! * Best foundation I've ever used, I will never buy anything else!!! * I use it to cover my mild melasma and I love it doesn't cake like other products, it feels light and not greasy."
18,it cosmetics,cc+ cream natural matte foundation with spf 40,pimprod2044261,2621797," * For a while this wasnt being found in store or online the then it came back the packaging changed a bit and now the formula shcks :( you can see all your imperfections and it sinks into your pores making them appear larger * I love this foundation & use it regularly but am disappointed & frankly furious that the product I ordered on January 4th has a 3/2026 expiration date.. Guest services did not apologize and in fact indicated that since the product was not YET expired, my only recourse was to return it via mail or in a store within 30 days if I wanted a cash refund. Really? This product shouldn't even have been on a store or warehouse shelf this close to expiration. Check expiration dates, my fellow shoppers. And do better, MUCH BETTER, Ulta! * I have been using IT for years and years and decided to try the matte formula. For my skin, it is a no go! I'm 48 and have combo skin with dry patches. Even after my skincare routine and moisturizer this formula looked flat, cakey and uneven; it didn't go on smooth and emphasized all my dry spots. I'll stick with CC cream and glowy formulas. * I dislike the flat look of matte foundation. I love moisturizing look of it cosmetics foundations. I'll return and hoping ULTA will let me replace it. * This foundation takes  just a couple drops to get the entire face. I love it because it's not cakey and makes me look natural and like I'm not wearing any makeup. * Love that it's buildable coverage, a little goes a long way. I'm in my early 30s and it doesn't get cakey. By the end of the day I am a little shiny at times but it's nothing compared to other products. * For context, I have dry, sensitive skin with occasional breakouts. For years, it was the best foundation I used, until learning it permanently stained my towels and clothes. Initially, I thought the marks were from bleach, but later saw it was this foundation. This was a deal breaker; I cannot apply a formula to my skin that bleaches fabric. Frankly, I would give it five stars but cannot due this con. Pros: buildable coverage, natural matte— ""skin like"" finish, and excellent shade range."
19,it cosmetics,bye bye foundation full coverage moisturizer with spf 50+,xlsimpprod17611001,2523634,
20,fenty beauty by rihanna,eaze drop blurring skin tint,pimprod2031372,2592608," * Gives the look of refreshed and glowy without creasing * [I received this product in exchange for my honest review] Love this formula, I did get the wrong shade but with the use of my other products the base looks amazing. Very easy to use, blends beautifully definitely recommend for a everyday use base. * [I received this product in exchange for my honest review] Blends very good. I wasn't crazy about the way it dried down. Made my skin dry. The shade was not a good match for me either. I thought the packaging was nice. It lasted a long time too. * I have been loving this skin tint and it is the first I have ever purchased. I looked at a ton and tested many and this was the best one I could find for under $50! It feels very nice on the skin and I just blend it woth a brush. It dries quickly but feels very smooth and covera up my redness quite well. * [I received this product in exchange for my honest review] I'm very conflicted as I love Fenty brand, but this skin tint was not the greatest product I've tried as it oxidized very quickly and leaned orange on me. I got shade 2 (light with neutral undertones), which should have been light enough for my light skin, but it was unusable on its own due to the oxidization that would happen almost immediately. The formula of the tint is comfortable to use, but the coverage is absolutely minimal/negligible. When I put it on, it felt nice on the skin. But, again, due to thin coverage, it even looked like I put nothing on the skin until I built it up significantly. However, my skin did feel dry after I put this on. On the plus side, there's no fragrance in this product. Overall, I think it might maybe work for someone who has near-perfect skin where they just want to add a little something, but I wouldn't recommend it to anyone who's used to using one product for coverage. This skin tint is a good base for other products that might need color correction to the tone, but not a wow product on its own. * It broke me out and it's progressively gotten worse, ive now got acne scars all over my face. I loved this at first because it cancled out all of my redness and matched my skin perfectly. But turns out over time it was making it more red. * The coverage of this skin tint never disappoints.  I just wish there were more shade options for us neutral girlies."
21,it cosmetics,cc+ cream illumination spf 50+,xlsimpprod12251079,2287681,
22,nars,natural radiant longwear foundation,xlsimpprod17421227,2523136,
23,morphe,lightform extended hydration foundation,pimprod2043869,2621355," * I used to use Neutrogena serum foundation for sensitive skin. It was rhe beat foundation I've ever used but I am now making sure everything I use is cruelty free. Morphe foundation is awesome! I combine it with the cocokind gel cream moisturizer because I need the extra hydration. They combine nicely. And this foundation is a great deal. I tried some more expensive ""hydrating"" foundations from other companies and my skin looked awful. * I've only been using this for a few days, but I like it a lot. It's got excellent coverage and a nice glow to it, similar to NARS. 

I'm oily and acne prone and this works pretty well. The only issue I've had is that it really doesn't build well. It gets cakey if you apply too much, so i would just cover problem spots with concealer and keep to one (maybe two) light layers of this foundation.

Overall, I'm very impressed, especially for the price. It feels prestige to me. I also got a really good color match right off the bat, despite ordering online. Thanks Morphe!! * I love this foundation!! Not only does it stay on my face, but its also reasonably priced! I've been using this foundation for what seems like forever, but they recently sold out of my shade everyone- on the Morphe website too. I have tried 3 foundations since running out and have not found anything that even compares to the Morphe foundation. Hoping they restock because I am over using bad foundations! * I need to bring the Lightform Extended Hydration foundation back or a trade it for the correct shade. Please advise * I love the coverage and the natural look it gives worth it's money * I bought this foundation 2weeks ago. I love how it goes on with my Morphe brush! I also use the Sunrise powder & all the eye make. I have gotten compliments on my make up. So far I'm very happy with my Morphe products! * Was sold out before Christmas and I was bummed. Tried another day and it was not only back in stock, but on sale!! I'm 59 yo, and have super dry skin with rosacea as well. The formula is fairly thin/runny but it covers ssooo nicely. It's buildable without looking thick/heavy. Skin prep was; a rice toner, Neutrogena Hydro Boost serum and Hydro Boost water gel moisturizer and ELF power grip primer. Color is Light 06C"
