,Unnamed: 0.29,Unnamed: 0.28,Unnamed: 0.27,Unnamed: 0.26,Unnamed: 0.25,Unnamed: 0.24,Unnamed: 0.23,Unnamed: 0.22,Unnamed: 0.21,Unnamed: 0.20,Unnamed: 0.19,Unnamed: 0.18,Unnamed: 0.17,Unnamed: 0.16,Unnamed: 0.15,Unnamed: 0.14,Unnamed: 0.13,Unnamed: 0.12,Unnamed: 0.11,Unnamed: 0.10,Unnamed: 0.9,Unnamed: 0.8,Unnamed: 0.7,Unnamed: 0.6,Unnamed: 0.5,Unnamed: 0.4,Unnamed: 0.3,Unnamed: 0.2,Unnamed: 0.1,Unnamed: 0,Brand,Name,ID,sku,comments
149,149,149,149,149,149,149,149,149,149,149,149,149,149,149,149,149,149,149,149,149,149,149,149,149,149,149,149,149,149,149,uoma beauty,say what?! foundation,pimprod2033346,2593663," * I got shade TN1. The formula is great- relatively clean, with a soft matte finish. It also did not upset my very sensitive skin. This would be one of the BEST foundations if the color wasn't so wrong. If you can find a shade that works, go for it * Is so loose * if you want to struggle to blend your foundation and then have it reveal every line, bump and pore then this is for you. * Very textured and dry result. I have dry skin, so maybe if you're oily you won't mind. I wore the fairest shade. Doesn't perform or last, but packaging is pretty at least. * I have incredinly dry skin with pretty severe dermatitis flare ups. I am also a gymnastics coach, so I have a very active and sweaty job where my skin is exposed to a lot of chalk dust. I work vendor markets where I sell art, and those can get very sweaty, they last alllll day, and they are outside. When i use this foundation with the m!lk hydrogr!p primer and the cal!r@y setting spray, nothing moves. I should also mention i use the n@rs tube concealer and c@l!ray mascara. I just did a market where it was very hot and sweaty and had this same face of makeup on for 12+ hours. I looked in the mirror to do some major touch ups before going to an event, and realized i barely needed anything. I did spritz my face with fine water mist a few times throughout the day because i was a bit dehydrated, but that was it. It really does stayyyy put. 11/10 holy grail. * I have incredinly dry skin with pretty severe dermatitis flare ups. I am also a gymnastics coach, so I have a very active and sweaty job where my skin is exposed to a lot of chalk dust. I work vendor markets where I sell art, and those can get very sweaty, they last alllll day, and they are outside. When i use this foundation with the m!lk hydrogr!p primer and the cal!r@y setting spray, nothing moves. I should also mention i use the n@rs tube concealer and c@l!ray mascara. I just did a market where it was very hot and sweaty and had this same face of makeup on for 12+ hours. I looked in the mirror to do some major touch ups before going to an event, and realized i barely needed anything. I did spritz my face with fine water mist a few times throughout the day because i was a bit dehydrated, but that was it. It really does stayyyy put. 11/10 holy grail. * Ladies, you must shake the bottle well before pumping the product! I work at a cosmetic store and sell this foundation. I love it for the days I want more coverage. If you don't shake it really good you will find its a runny consistency. I felt the need to review the foundation after reading some of the reviews."
150,150,150,150,150,150,150,150,150,150,150,150,150,150,150,150,150,150,150,150,150,150,150,150,150,150,150,150,150,150,150,j.cat beauty,aquasurance compact foundation,pimprod2000221,2550026," * This is my favorite powder foundation formula and has been for years - goes on so smoothly and is buildable. The last few compacts I've bought have cracked from barely any use. I had to dump the powder into a different container and use it that way. * so I do a full face every day. every once in a while I'll ""cheat"" and use this product to save time. it works sooo well. I use a light shade which I chose by pretty much matching my neck/highlight areas and use it mainly in my T zone. highlighting under eyes, forehead between brows chin and then I also add it along my jawline. then I go about my routine as normal but without the need for foundation highlight and baking. saves so much time! it builds well and has amazing coverage. it lasts all day. I have mature skin and hate when things settle into fine lines and wrinkles and I do not have that problem with this. it actually makes my skin appear younger compared to my full face routine with baking etc. I know I hav to find a new foundation to help avoid it but who has the time lol anyway... YES. this product is one I want to hoard in case it ever goes away. it's amazing. I use it with a compact dense brush. 

only downside is that I broke 2... but it's because I throw it in my purse and I know that's not ideal and on me for being careless. but if it's getting tossed around, be aware the powder may break. * This is a must have in my kit! I use it to lightly set my foundation and it transforms my face! I have also used it as a powder foundation for summer days and it is flawless! * This is the best powder foundation i have ever tried, i reach for this one over my high end one. Its my go to during the summer months. * Medium to full coverage. I like to carry it in my bag for touch ups because it covers the redness around the nose, i can cover up some my blemishes that peak out after wearing makeup all day etc * I use the shade Natural and I absolutely love this powder. i've used mine all the way to the pan and just restocked a new one. Literally the most beautiful blurring coverage, doesn't feel cakey or drying and my skin looks flawless. Great for on the go and quick touch ups. I usually hate the feeling of wearing heavy foundations and powders so once I found this it was over. Super breathable and comfortable and evens out my skin tone in a couple quick pass overs. I love this product. * Medium to high coverage, smoothing, non-comedogenic. Its a bit hard to shade match. I use Soft Tan in this powder and Nars Valencia, Lisa Eldridge 19, Estee Lauder 4w1."
151,151,151,151,151,151,151,151,151,151,151,151,151,151,151,151,151,151,151,151,151,151,151,151,151,151,151,151,151,151,151,revlon,illuminance skin-caring foundation,pimprod2036478,2605534," * Got this foundation about 2 weeks ago… just don't even look into this product. Maybe l'm having bad luck but it smells like paint, it creases SO EASILY I have to powder my face immediately after just to avoid it and then it STILL creases. The foundation comes off way to 
easily, and doesn't last longer than a few hours. * Got this foundation about 2 weeks ago… just don't even look into this product. Maybe l'm having bad luck but it smells like paint, it creases SO EASILY I have to powder my face immediately after just to avoid it and then it STILL creases. The foundation comes off way to 
easily, and doesn't last longer than a few hours. * Glowy. Dewy. Perfect. * I bought this item from Ulta after the sales associate recommended it for my mature skin. It was a close match as far as color goes. However, this smells like paint and has caused my skin to break out horribly. I won't recommend this item. * I have been using this since it was introduced to the Revlon line and my hope is that this never gets discontinued.🙌🏻 I love the ingredients in this foundation and the coverage is amazing. It does not settle in my lines; it actually plumps my skin (hyaluronic acid 🙌🏻🩵👏🏻🤩) and gives a flawless finish. I also have extremely sensitive skin and my face does not react to this at all. It seems a lot of brands are now incorporating good skincare ingredients in foundations and this one is a winner! 🥇🙌🏻👏🏻 * Went tried on my arm but ,when I put on face was way to dark for it.
But this is my first time ever using anything on my face so I'm  learning baby steps. * I'm over 50, have fair, neutral, combination skin with especially dry cheeks, redness, and texture. This foundation seemed to cover the redness fine but it faded within about 2 hours of wear. It settled in my fine lines and looked, for lack of a better word, gritty. No fragrance but does have an unpleasant chemical smell. It's a no for me. (Not Revlon's fault but the color-finding function led me to 117 Light Beige, which was the right depth level but pulled warm on me.)"
152,152,152,152,152,152,152,152,152,152,152,152,152,152,152,152,152,152,152,152,152,152,152,152,152,152,152,152,152,152,152,dior,forever natural matte velvet compact foundation,pimprod2045605,2625554,
153,153,153,153,153,153,153,153,153,153,153,153,153,153,153,153,153,153,153,153,153,153,153,153,153,153,153,153,153,153,153,pacifica,kind tint tinted serum,pimprod2030679,2591360," * I tried to mkx this with so mant thingd and use it so many ways and it sucks. Its patchy and gross feeling. * I tried to mkx this with so mant thingd and use it so many ways and it sucks. Its patchy and gross feeling. * I wore this last night and actually liked how it applied (first time I tried it, it did pill) and wore. Woke up this morning with a forehead full of bumps :( I know there are benefits for some, but the niacinamide really messed with my skin * This would be my holy grail foundation IF it wasn't so frustrating to apply. I have extremely dry skin and this tint gives just enough coverage to make my skin look radiant and healthy. It does not transfer, does not stick to or accentuate dry spots, and the shade range goes light enough for me, which usually isn't the case for tints with limited shades. HOWEVER, this stuff is an absolute nightmare to apply. If you accidentally touch it with your brush or sponge after it dries down (which takes only a few seconds), it will pill and come off your face. The only way I've found to fix this is to remove it and start over. Maybe I'm applying it wrong, but I've tried different primers, applicators, etc., all with the same result. I really wish it wasn't so hard to apply because I love the finish, but I won't be repurchasing because of this. * I have sensitive, oily, and redness-prone skin, so moisturizers usually dont work on me. Im plesently suprised on how well this works with my skin chemistry. The coverage is very much buildable, some days i put just a tiny bit on to moisturize and even out my skin-tone, othertimes i build it up for more coverage. Only downside is the occasional pilling that others here mentioned, but its subtle enough. * I love this.  I apply after i ise a moisturizer.  Provides supermligbt coverage to even out skin tone. I use the shade 15 which has a yellow indertone rather than red. * It has great ingredients but it jusy peels right off the face. It doesnt stick at all it immediatly pills its unwearable which sucks cuz i love the ingredients"
154,154,154,154,154,154,154,154,154,154,154,154,154,154,154,154,154,154,154,154,154,154,154,154,154,154,154,154,154,154,154,revlon,illuminance serum tint,pimprod2042614,2618859," * I have gotten many compliments at work about my skin since using this product. My skin is plumper, softer, radiant and smoother. Hint when applying make sure your skin is moisturized and use a sponge to apply or it will pile if you rub it to much. * I love the no makeup only skin effect I get with this product.  Evens my skin tone and mixes well with my sunscreen * I'm usually a prestige foundation only girly but this worked great for me. Its great for a light foundation or light coverage days. It helped even out my skin tone. It is nice but it will get into wrinkles like the one I have in the middle of my brow. However, I just pat it down and call it a day. Nice product for the price range. * This serum tint has a nice smooth consistency, covers well, and goes on easily. Good color choices for most skin tones. I have combination skin, more dry than oily, and the serum in this tint is just right. For the price point, it's worth a try. * I bought this on a whim, and it exceeded my expectations.  It goes on so smoothly, the coverage is that of a foundation, but it's still light enough to feel like a tinted moisturizer.  Would definitely purchase this again * I've tried many foundations and serum tints from  drugstore to high end. I love this Serum Tint!!! Medium coverage with a soft glow effect to your complexion. Easy to apply with a good foundation brush or finger tips. I do use a primer but not really necessary. Big bang for your bucks.  Good skin benefits too. * I've been looking for a drug store dupe for my ilia serum skin tint and sadly this is not it. It was patchy on my dry skin and also made me look so washed out. I got this because with the serum title I thought it would help my skin look dewy etc."
155,155,155,155,155,155,155,155,155,155,155,155,155,155,155,155,155,155,155,155,155,155,155,155,155,155,155,155,155,155,155,covergirl,clean fresh skin milk foundation,pimprod2011577,2556836," * I absolutely love this tint for the summer. Apply with a brush for higher coverage, about two layers. I struggle with acne scars, in those areas I apply glossier concealer and feel satisfied. During the winter I see myself applying this for running errands or more lowkey events. I get a lot of compliments with this tint at this time of the year for its radiance. * I've been using this for a little over a month and was having postpartum breakouts prior to it, thsi helped soothe my skin and stopped mh breakouts. I work in a cooler all day so trust this helps my skin! * I will say that I have used this product in the past. Its not too bad for the price of the product. However, the coverage is very light and not really buildable. Although, I do like how it gives a somewhat dewy effect. I also like how it has clean ingredients! So if you like dewy foundation, light coverage, and clean ingredients then this product might be for you. * I rarely wear foundation, largely because I hate how heavy it feels on my face, and I also love my freckles and foundations tend to cover them. I bought this out of curiosity and I'm surprisingly happy with the result! It's a pretty watery consistency, but that means A) a little goes a long way, especially when applied with a foundation brush, and B) it feels so light on my face!! It evened out my skin tone (as someone with vitiligo, this is always a big win!!) without totally covering my freckles. It looks super natural, too. I appreciate the price for the amount of product and the fact that it has no scent. 

The one con for me is that my nose felt kind of greasy a few hours later—but the rest of my face felt pretty dry, so that could just be my overactive pores LOL.

For reference, I am very pale (and I have vitiligo). I'm using shade 520- Fair. * It smelt soooo bad bro, i put it on twice, once to try and another to actually go out and then when i did it to go out it started peeling and looked SOOOOO cakey, like cakier than cakey. It smells TERRIBLE, when i was applying it i had to hurry since it smelt sooo bad, i can even explain fbe scent, but its just plain terrible, dont recommend * As I enter my mid-twenties, I've transitioned from the thick, full-coverage foundations of my adolescence to more lightweight and natural finishes. I bought this with the hopes of it being a bit more full coverage than a regular tinted moisturizer.

The color match is great, no quarrels there. It is also a great base for makeup and blends very smoothly with a beauty blender. I am, however, disappointed in the coverage. It is a very sheer foundation - it mostly just does color correction and levels out skin color. It does not do much for acne scars or dark circles. Also make sure to exfoliate and moisturize, as this will cling to dry patches. It also seems to fade a bit throughout the day.

Overall, it's a decent tinted moisturizer. Look elsewhere for lightweight with coverage. * Both my teens use this and love it. Provides a good light coverage without to much of a makeup look."
156,156,156,156,156,156,156,156,156,156,156,156,156,156,156,156,156,156,156,156,156,156,156,156,156,156,156,156,156,156,156,covergirl,trublend matte made liquid foundation,pimprod2000386,2533518," * I use the foundation daily and I would definitely recommend to someone who's on a tight budget. only thing is it is easily transferable and doesn't stay on variable. It also looks a bit cakey but i highly recomend spraying do we setting spray onto your brush/sponge, and then blending out. * I normally wear Estee stay matte foundation but I was out and until it arrived I needed something in the meantime. I wore this out, was standing in the parking lot talking to my friends and some random lady walked up to us and said ""sorry to interupt but I just have to tell you, you are stunning"" ( she was talking to me) And then she walked off. I was never told that when I wore the Estee! What the heck, this stuff is GOLD. * I have been using this foundation for 5 years now. I will say it is not full coverage but it is buildable. This foundation feels so lightweight & it gives such a natural look. I've tried other foundations but always come back to this one cause its just so good! I tend to have an oily T-zone & everywhere else is pretty much dry but this foundation doesn't ever really cake or flake on me. I 100% recommend this foundation for an everyday natural look! * I love this foundation! it's affordable and stays on all throughout the work day * this foundation is surprisingly good for the price. it's buildable, smooth, and has a nice matte but natural finish. it flaked on my chin area after a few hours, but that could be my skin type. * Love this for my combo skin. I'm not extremely oily but I needed something that would actually last throughout the day without needing to powder by midday. I actually like it better than the Lancome Teint Idole Ultra Wear. I am shade 090 in Lancome but have not been able to find a good color match as 090 is too light and the next shades are too dark and orange. I have very fair neutral skin. I prefer how the covergirl looks, it is very smooth with slightly better coverage, and L20 is a great shade and a closer match than the Lancome (maybe L20 is a dash too light but it looks perfect after bronzer). It gives a natural matte finish that doesn't cling or look cakey. Works well on my middle-age skin with fine lines. Has great medium-full coverage. Highly recommend! * I really love this foundation and I will continue to purchase it! Affordable and covers well."
157,157,157,157,157,157,157,157,157,157,157,157,157,157,157,157,157,157,157,157,157,157,157,157,157,157,157,157,157,157,157,l.a. girl,pro coverage liquid foundation,xlsimpprod15711049,2505343,
158,158,158,158,158,158,158,158,158,158,158,158,158,158,158,158,158,158,158,158,158,158,158,158,158,158,158,158,158,158,158,flower beauty,light illusion liquid foundation,xlsimpprod17631333,2525008,
159,159,159,159,159,159,159,159,159,159,159,159,159,159,159,159,159,159,159,159,159,159,159,159,159,159,159,159,159,159,159,essence,keep me covered long-lasting foundation,pimprod2037417,2603112," * For the price that its sold at, this foundation is amazing! It stays on pretty well, and it doesn't separate on the face like other foundations did. And this was really important for me, because I get super oily skin during the day. It did get a bit shiny though. * My skin is more dry during the winter months! So far so good i love the coverage and the shade was perfect for me. I love how it doesnt dry right away i was able to dot my face with it and then pat it with my foundation brush. The price is also another plus! * Bought wrong shade gave to my daughter inlaw she loves it * I absolutely love this product. This is just my second time buying it and I have finally found the foundation for me. And the price is phenomenal. * I was pleasently surprised. I have oily skin and this make up stayed on all day.  It looks flawless, I really liked it. * I tried everything to keep this foundation from coming off and smearing everywhere. If you have fine lines, it sets in them and makes them very noticeable. Do not recommend. * Awesome and affordable! Very waterproof and looks great, liquid to powder type foundation. I enjoy that and it's full coverage when built up, not cake. Shade light medium is a perfect match! I'm sticking up, it's worth it!"
160,160,160,160,160,160,160,160,160,160,160,160,160,160,160,160,160,160,160,160,160,160,160,160,160,160,160,160,160,160,160,ulta beauty collection,moisturizing foundation stick,xlsimpprod18691125,2529950,
161,161,161,161,161,161,161,161,161,161,161,161,161,161,161,161,161,161,161,161,161,161,161,161,161,161,161,161,161,161,161,e.l.f. cosmetics,camo powder foundation,pimprod2030787,2597461," * This works so well for my skin when I want to beaty ""filter"" my face. But this is noy for dry skin. * It broke the second I tapped my brush on it. Then it was impossible to blend out on my face and ruined my makeup ): * I love this powder this is the best powder that I have discovered as of lately. Elf kills it with all the products they release but this is top tier. * I really wanted to like this product, but even though I moisturize my skin, it leaves randow streaks on my face, as if i applied it with a paint brush. And leaves weird marks on my nose that I cant blend out and have to literally use my nails to scratch off. I have oily skin and never experienced this with a powder foundation. * I have fair skin and got the recommended color. It's too yellow for me and honestly isn't as good as the dermablend camo. I only got it because I can't find the dermablend camo anywhere. This doesn't stay on my skin very well and rubs off so easily. * I am 39 years old, and I have struggled to find a powder foundation that would work for my combo skin, I have spent tons of money, looked high and low, and have never been happy with anything that I found in the past. I could not believe how well, this held up for me! I am 39 years old and I had a baby nine months ago and don't have much time to do my make up but I still wanna look half decent when I have to go out of the house and this is quick and easy and effortless, I highly recommend this to anybody who cannot seem to find a powder foundation that works for them, maybe you might meet your match with this one. I do use the little sponge that comes with the powder because it works for me and I don't want to try to mess withthe system lol. * If your ever going for a simple quick look thsi is the foundation powder to use, the shade match is incredible accurate,decent coverage for a sinple quick look. I definitely recommend!!"
162,162,162,162,162,162,162,162,162,162,162,162,162,162,162,162,162,162,162,162,162,162,162,162,162,162,162,162,162,162,162,ulta beauty collection,velvet matte longwear foundation,pimprod2020823,2560234," * I would look like one of those powdered face men from the 1800s if i wore this. * This foundation came and did exactly what it said it would and did not disappoint. Definitely pleased with the application and effect of coverage. Obviously anything works best if you have a daily skin prep-care routine like priming and moisturizing, especially since this is full coverage as opposed to a soft focus/medium coverage. 
**
-If you have dry skin and don't moisturize it's not going to have the desired velvety and blurred consistency, especially over pores and anywhere your skin creases. You won't have to worry about reapplying but if you need to blot or erase an oily area, it looks fantastic when paired with an adjustable coverage powder foundation!!
-No need to worry about concealer since it's basically built in. 
-Also, for anyone who is used to set-spraying each layer of face makeup just keep in mind it's a thicker liquid and sets in tight so just be sure to finish blending anything else before setting it. 
-Typically this product blends best with either fingers or a silicone sponge - anything it cant seep or dry into. * The texture of this was not good. I didn't "" use a primer, but I never do and there usually isn't a problem. * Picked this up on a whim. I thought it would be similar to MUFE Matte Velvet Skin because of the name, but it's more comparable to Huda Beauty Faux Filter foundation IMO. Very thick and not the easiest to blend, especially down your neck or in the creases of your nose. It starts drying basically the moment you put it on your face, which doesn't help with blending. Bought shade Fair Cool and it goes on practically white, but does dry down darker.

An okay foundation for the price you pay, but there are better ones out there. * This foundation is incredibly thick, making it hard to blend. My face looks overly dry, even with moisturizer and primer. * I have very oily acne prone skin and i live in humid florida, and travel often. If you need to cover blemishes and acne this is your stuff, a veey little goes a longggg way, full coverge not too heavy and it doesn't cake up, you need to use a moisturizer under as it can be drying, which is perfect if you have oily skin like me. I stopped buying high end dermablend and this is a very affordable replacement * Doesn't blend nice into my skin. Looks chalky and uneven"
