,Unnamed: 0.17,Unnamed: 0.16,Unnamed: 0.15,Unnamed: 0.14,Unnamed: 0.13,Unnamed: 0.12,Unnamed: 0.11,Unnamed: 0.10,Unnamed: 0.9,Unnamed: 0.8,Unnamed: 0.7,Unnamed: 0.6,Unnamed: 0.5,Unnamed: 0.4,Unnamed: 0.3,Unnamed: 0.2,Unnamed: 0.1,Unnamed: 0,Brand,Name,ID,sku,comments
58,58,58,58,58,58,58,58,58,58,58,58,58,58,58,58,58,58,58,dior,dior forever foundation fluid matte,pimprod2036825,2604875," * Words can describe how much love I have for this foundation. As an oily skin girly, i love the matte finish. Will definitely buy again and again. * My skin tends to be sensituve, and I used this foundation thinking this product and the ingredients were the best because it's ""Dior"". After using it for a few days (before realizing it was the problem), my face brone out in hives and cystic acne that unlike anything I have ever experienced. It was so bad, I didn't leave my house for a week! Now I am left with scars on my face that could take years to recover from. I dont know if it's the ethylhexyl salicylate, alcohol, or mystery frangance in this ish, but I wouldn't wish what happened to me on my worst enemy. Dont touch this stuff with a 10 ft pole!!!

I'm trying not to hold it against ""Dior"" or Ulta, but the fact that they're even letting this stuff stay on the market baffles me. Dont use this. * If you have tried the YSL matte foundation and you're looking for a less expensive version this is it! It smells amazing, has the SPF and stays on matte. I live in AZ where if is hot and this does not feel heavy or cakey. * I decided to try this foundation after seeing reviews on YouTube. But it does not live up to the reviews. It is not transfer proof, and it rubs off so easily. If you touch your face, it's smearing. I may have to go back to bare minerals. * The foundation itself is great. It goes on smooth and it last long it is not greasy or oily. The pump keeps clogging, every few days when I dispense it shoots out at angles, it gets on my clothes, and I have to change last minute. It gets on the wall… its very frustrating. It is good make up, but if I am spending this much money, the packaging should be good too. * This foundation seriously changed the game for me. I have a hormonal IUD and have been on meds to correct the skin issues it has given me, and this has done wonders for controlling oil! I use the Laura Mercier Blurring Primer and this stuff, and I will never use anything else. I manage a drive-thru coffee shop so I see quite a few people daily and I get at LEAST 5-10 compliments a day on my make-up! Its worth it to have to make sure my pump is clean so it doesn't rogue squirt * The best foundation perfect match and stays on all day."
59,59,59,59,59,59,59,59,59,59,59,59,59,59,59,59,59,59,59,clinique,stay-matte oil-free makeup foundation,xlsimpprod10791929,2247037,
60,60,60,60,60,60,60,60,60,60,60,60,60,60,60,60,60,60,60,clinique,acne solutions liquid makeup foundation,pimprod2043524,2619813," * This foundation makes me feel like I'm wearing nothing, but provides good coverage for my acne & scars. I have oily skin and after a full shift at work my face still looks matte with a slight glow at the end of day. I've found my holy grail foundation. * EXCELLENT PRODUCT. HELPS CONTROL MY BREAK OUTS * Like mentioned below the new formula does not go on smooth and is very drying. The shades have also changed. I have used this foundation for over ten years and now have to find a new brand. * I like this product…wish it had clean ingredients * I have been having a hard time the last few years finding a foundation I love. I picked this one up on a whim and WOW, I love it! I and in my 40s but have oily skin, large pores and redness. This foundation goes on beautifully, covers my redness, blurs my pores and wears nicely all day! Plus the shade I picked up (Alabaster) is perfect for my light cool toned skin. Love it! * I struggle with acne in my mid 30s and even before that I couldn't find a good foundation that truly lasted all day and looked so smooth. I got this for free when I became diamond so I figured if it sucked I wasnt out anything—- and it turned out to be lifechanging. The coverage is so perfect, it is so smoothing and looks so good! It doesn't melt in heat and helps not give me anymore acne. It also works great with all my other blushes, bronzer, etc. Ive already purchased another because i dont ever want to run out! * It is so light and not oily like other brands i have try."
61,61,61,61,61,61,61,61,61,61,61,61,61,61,61,61,61,61,61,fenty beauty by rihanna,eaze drop blur + smooth foundation stick,pimprod2041564,2614177," * Exactly what I was looking for.  Light but buildable coverage. No caking. Blends beautifully. Have tried over 2 products with no issues. * Does not go on well for a stick. It pulls at delicate skin & is not creamy. Also, it accentuates any dry skin on my face, even after exfoliating. Can't use it, waste of money. * I heard this tint stick had great reviews, so I tried it. It made me break out after a few days. It won't wear long, after a few hours it'll start to separate and look super splotchy. Won't be repurchasing. * I love this stick, I am quite pale with neutral to cool undertones and this looks quite natural on me. I personally prefer to blend with my fingers to help the product melt into my skin, I have drier skin and with a primer it doesn't settle into fine lines or cling to drier areas like around the nose * I love applying this product however it's not a good pick if you plan to wear it all day. I am a night nurse so I want my foundation to look nice 14+ hours. Even with Fenty's setting powder and spray I can't get this to wear long. I do enjoy this for running errands or short excursions. * Fenty  foundation stick convenient, goes on smooth * I love the finish but it turns orange :( 
Shade 16, my brightening concealer doesn't balance out the oxidation either but it's a good formula. Gonna try and use a blue concealer to cancel out the orange and hope it works. I do like the Anastasia Balm with the Fenty hydrating concealer and Fenty matte powder foundation together though."
62,62,62,62,62,62,62,62,62,62,62,62,62,62,62,62,62,62,62,fenty beauty by rihanna,soft'lit naturally luminous hydrating longwear foundation,pimprod2045514,2624152," * Literally obsessed with this foundation. It's lightweight and easily buildable for more coverage. * This is a great foundation for those who like a soft luminous look, there's no fragrance , no oxidation at all just a seamless look . I really enjoy the coverage on this and doesn't cake up . * I bought a darker shade for contouring and to mix with lighter shade and this finish is perfect. I love how the coverage is and definitely is very matte. * I bought a darker shade for contouring and to mix with lighter shade and this finish is perfect. I love how the coverage is and definitely is very matte. * This foundation is buildable, and did a pretty great job in covering my blemishes. It was very simple to blend out using a foundation brush, and I didn't have any issues of separation during my wear. I also didn't feel like I had any foundation on. * Pretty much flawless skin Looking really hydrated and healthy without a shiney glow really lays down so nicely I really love this foundation * Love how the foundation leaves my face leaves me with a nice glow natural look"
63,63,63,63,63,63,63,63,63,63,63,63,63,63,63,63,63,63,63,hourglass,veil hydrating skin tint,pimprod2040571,2611435," * I picked this up to try, as I don't wear foundation or makeup in general daily but I wanted something to balance my skin tone without being cakey looking. I am 39, with dry skin. This sits on your skin like a light moisturizer and gives you a smoother, glowy look. If you get this expecting full coverage, you will be disappointed. Its a tinted moisturizer, not a foundation. It does what it says. I would like it to have SPF as well though. * it looks really nice and set well with powder where it was needed. but you have to use quite a bit of product and it's such a small amount for the price. * Nice coverage which hydrates throughout the day. I like the glow this tint gives to my skin. Much better to use around the eye area when compared to my foundation- less creasing. * Based on all the reviewams it got from ""make up reviewers"" I thought this would be magical. It has good coverage, without being overwheling. But it never set, and it felt sticky without setting it down. 

The shades needed a little bit more range, and they are very different in person than online. 

I will use it up, because of how much I spent on it. 

I habe combo skin. * Goes on the skin beautifully, dewy dreamy buildable coverage, no makeup makeup look, evens texture and tone, gets you through days where you don't want a full beat and want the skin to breath. Just wow! Try it. * This truly is an amazing skin tint. When I first apply it, it looks like nothing, but as you blend it into the skin you can see a visible evening of skin tone and a glowy hydration. It is comfortable to wear. It does not feel cakey or heavy. I can wear it on my undereyes set with an undereye powder, and set everywhere else with a loose powder. I typically prep my skin with a toner (Glow Recipe) and my moisturizer  (Beekman 1802) and do not otherwise prime my skin, but I may change that routine as winter approaches. One of my favorite base products ever! * I am really liking this skin tint. It's a bit thicker than other skin tints I use but very hydrating & smoothing. I just buff it a bit with a brush so it feels a bit lighter. The shade finder quiz makes it easy to choose your match too!"
64,64,64,64,64,64,64,64,64,64,64,64,64,64,64,64,64,64,64,morphe,filter effect soft-focus foundation,pimprod2022516,2577758," * Great quality * A friend introduced me to this foundation about 2 years ago and I have been using it since! Easy to apply with my brush, and smooth! I love it! * First time I purschased Morphe foundation, it felt great on my skin and looked good. * I love this make up * I picked up the Morphe Filter Effect in the shade, ""Filter Light 4"".  It works perfect with my light olive skin and now I'm a true believer that im actually an olive with out doubt. Normally I have to buy a neutral leaning cool shade. I still will have to buy neutral leaning cool after this is gone because Ulta now only shows 32 shades out of the 33 shades that were there.  Filter Light 4 as of today is no longer listed on Ulta's website. It not even listed as out of stock just gone. The numbers go from Light 1,2,3, and 5 for example.  Such a bummer. Not sure if i can check the Morphe website but I only bought one botttel of this to test and see if it would work and it does perfectly. * My go-to foundation. I love the way it makes my skin look. * It goes on smoothly and has nice coverag"
65,65,65,65,65,65,65,65,65,65,65,65,65,65,65,65,65,65,65,urban decay,face bond self-setting waterproof foundation,pimprod2044818,2623593," * This blends well and the shade match was perfect but does not last long in the kentucky humidity. It seperates after a few hours on me and it also smudges wuite a bit even with a powder on. * This foundation is not like the previous ones it replaced. It is cakey. Bring back the old ones. * As soon as I applied it on my face, my face turned red and started itching, rashes * I have an olive undertone that has historically made shade matching a nightmare, and my skin is also really oily so foundation almost always ends up breaking apart or slipping off. The UD Face Bond is one of very few that holds up against my oiliness and the ONLY one that both holds up AND matches my skin undertone that I've tried. I have worn this multiple times for 12+ hour days at work, and once for 17 hours as a bridesmaid running around at a wedding in the rain. I did blot my face for the wedding at around the 14 hour mark but I honestly could've gotten away without it. 

This foundation probably would not work on those without oily skin - I can imagine that it would feel really drying if you're not endowed with an oil slick face like I am, especially since it has alcohol pretty prominently in the ingredients. But for the very oily, this is definitely worth a try. * I've been an Urban Decay foundation believer for over 10 years. Although it can be frustrating when a formula is discontinued (I started with the original Naked foundation, which changed to Stay Naked, which is now seemingly being phased out.) I will say that Urban Decay delivers in helping customers find a suitable shade match with their new formulas. 
This formula is lightweight, not heavy or greasy, and blends seamlessly. I continue to be an Urban Decay believer. I have tried other brands and they simply don't compare to the quality * This product  is my first time l buy that brand they  were out of the product  l buy . * I love this. It is waterproof the only thing is it startsn ""cracking"" by end of day. I don't set it with anything which could be the problem I also have dry skin and it does settle there. The coverage is perfect and I just use more moustierizer in the morning. 💖"
66,66,66,66,66,66,66,66,66,66,66,66,66,66,66,66,66,66,66,jane iredale,purepressed base mineral foundation refill,pimprod2033383,2595091," * Yall. Name a skin type…i have it. Lol. But serously this beautiful powder is by far the best powder foundation i have ever tried and i have tried nearly all of them. You can sheer it out for a set or finish or pack it on for a full coverage moment. All wirhout looking dry or cakey. It is the first powder i don't immediately reach for a setting spray to ""melt"" it. You can. But you dont have to. This conpany is also on my good list for being loudly and proudly prochoice. Love it. * I'm a powder foundation junky. I hate liquid foundation so much. So I always use powder foundation. The reason I LOVE this foundations are 1) long lasting wear 2) doesn't look cakey at all 3) but still has great coverage without looking heavy 4) color matches my skin tone very well. I have tried from cheap to high end ones and I say this is one of the best. I have one more favorite but I'm keeping it as my beauty secret! * I'm in my late 30s and was looking for a powder that wouldn't sink into my fine lines, and lasted. This was not it. The coverage is too transparent, so you have to use a lot of get better coverage, and then it doesn't have any staying power. Maybe it's my skin or my primer that doesn't work well with it, but for the price I wasn't impressed. * I have used PUR Cosmetics pressed powder foundation for 5+ years, but it has retinol in it and I'm pregnant. I tried several other brands of powder foundations (Bare Minerals, Lancome, Maybelline) and they all looked so patchy, cakey, and horrible. I tried this as a last-ditch effort, and I'm so glad I did! This is a fantastic pressed powder foundation. It applies easily, doesn't look patchy, doesn't look cakey, doesn't settle into my fine lines, and provides decent light/medium coverage. This has a very nice semi-matte finish, and looks very natural on the skin with a feather-light texture. I will say PUR's product offers a little more coverage in my opinion, but this product is still amazing. I love the ingredients, and I love the refillable compact concept. I highly recommend this! I have combination, acne prone skin and this did not cause breakouts for me. * I originally purchased the kit on the JE website, then came back to Ulta.com to get my refill. This is the only foundation I've ever actually used up!!! I have rosacea and wear glasses, so my tzone does get shiny and requires a small touchup at midday. Some tips:
-use a primer of some kind, either Jane's or another that you like.
-get a retractable travel brush (I use the one from Eco Tools) this is great for touchups and when I need more coverage, I twist the brush only halfway (making it denser) which gives more coverage for my cheeks because I have rosacea. If you need heavy coverage, you are going to want a dense brush to sort of pack it on in downward patting strokes. 
DO NOT swirl/buff...this is not the other mineral powder. different formulas work differently. 
  * This perfectly matches my skin tone. It's very difficult to see when I swab it on my face to see the color.  Nothing  else has ever matched like this. I have been using it for about 8 years. I have normal to dry skin and this gives a natural look. * Initially I didn't like this powder. Was accustomed to fuller coverage powder foundations and i think the shade i chose was a bit light. Decided to use it as a setting powder over a tinted moisturizer because i had a sample of a good tinted moisturizer i wanted to try. I really only wanted to use it up so my money wasn't wasted. This is where i fell in love. It's very good at blurring and I found that it was better than the 100 different setting powders I'd used. I'm a little surprised about the reviews that mentioned cracking because this is the ONLY powder I've ever had in 35 years (in my 50s) that i used completely. Even the little edges stayed in place until they were completely gone. Weird. I can only guess it's because i never bought the hard case to put it in because I initially didn't love it. It stayed in the plastic refill case until ENTIRELY gone."
67,67,67,67,67,67,67,67,67,67,67,67,67,67,67,67,67,67,67,dior,dior forever fluid skin glow foundation,pimprod2036824,2605019," * I don't understand what justifies the high price of this foundation. The color match was beautiful, but the TRANSFER! I have tried every primer, powder  and setting spray but this transfers on everything. And the smell is odd. * I wanted to love this foundation because I heard so many great things about it but I had to wash it off after 10 minutes because I had an allergic reaction to the fragrance in it. * Product is definitely very hydrating but it oxidizes after a while. * Matches my skin tone perfect feels and looks great my favorite foundation * Ive used pretty much every foundation out there and I have to say this one is # 1 !!!!! Best coverage, color match and longevity. Love everything about it. * its not a full coverage foundation * I have tried many foundations and this will always be my go to. I have acne scars and this covers them and leaves such a glow natural finish. I'm obsessed."
68,68,68,68,68,68,68,68,68,68,68,68,68,68,68,68,68,68,68,anastasia beverly hills,"medium coverage, natural finish luminous foundation",pimprod2008586,2551421," * Im so picky with foundations i went to ulta and tried this one on and loved it. I was suprised that the 230N matched my skin, cause im a medium skin tone. This is listed as being very light but it matched skin perfectly. I really love the coverage and would purchase again. * I loved this foundation it gave me this beautiful Glam and  it gave me this full confident look im so inlove * I really love this product. It's light and stays on. * I am very confused by the positive reviews for this, especially the ones by ladies with mature skin. This foundation is pretty bad. like another reviewer, I have tried using this in every way I can think of. With different primers, setting sprays, etc. It has so many issues. Makes my pores look huge even with blurring primers, settles into my smile and one forehead line so bad. It's super cakey and slides off the face. Like I was in shock the first time I wore it, it looked ok in my beauty room but once I stepped in the light, I looked insane. I will try it. Couple of more times but I'll have to give up after that. * I really enjoyed using this foundation. I found the coverage to be very buildable so I could get a full if I wanted to! It is a luminous finish so I powder the areas that I need to. I also didn't find it to be too heavy and I got a lot of compliments on my skin. * Im 46 so wrinkles and pores is a thing. This foundation works better than my maybelline skin tint, Lancôme ultra wear, elf satin & camo, misha bb cream. Its very skin like but w/ coverage, doesnt settle in lines, erases pores! Wears all day, i lightly set it w/ elf radiance setting powder & lovk it in w/ elfs glycerin setting spray, chefs kiss its so pretty on my skin. If it gets shiny throughout the day maybe 1/2 during a 12 hr shift i lightly pat it w/ hourglass new compact powder trust me you wont regret especially mature ladies. * I love this product. It is gorgeous on the skin. I'm oily and it still looks great. Good price on it."
69,69,69,69,69,69,69,69,69,69,69,69,69,69,69,69,69,69,69,tarte,babassu foundcealer dewy foundation spf 20,pimprod2006408,2542892," * Love this. Associate was knowledgeable and helpful. * I have been using this for years and it's the best foundation I've ever used! Great coverage, never looks cakey, and always get compliments on my skin.

I live in a dry state and have struggled with my skin drying out - the hydrating properties leave my skin glowing! I'm also at a higher elevation and credit the sun protection properties with protecting my skin in a way that it has slowed wrinkles, fine lines, and sun damage!

I've also suffered from comedonal acne in the past but this has never caused a reaction.

I will be absolutely devastated if this is ever discontinued. It is my favorite and I can't even fathom using anything else. * At first, I was happy to have found a foundation in a light enough tone, and was impressed by how well it matched and covered up my bit of acne. However, as I wore it, I noticed my acne getting worse day by day. It was doing a great job coverage-wise, but I kept breaking out more and more until I stopped using it. After I stopped, my acne calmed down, leaving me with the same issue as before.. * This foundation matches my skin perfectly. Hides all my imperfections and dark spots as well. * I love Tarte products, this foundation is the best! * I was unfamiliar with the rate brand until I went into the Ulta store to select a new foundation. I was looking for a lightweight foundation with a dewy finish, and was directed to the Tarte representative. She did a fantastic job helping me select the right shade (in the natural light by the window). I can't say enough good things about this foundation. The first day I wore it, my friends commented how glowing my skin looked! It's not too heavy, and I love how it feels on my skin. I'm now a Tarte foundation convert! * I think this is my new Holy grail. Great coverage and great application."
70,70,70,70,70,70,70,70,70,70,70,70,70,70,70,70,70,70,70,tula,radiant skin brightening serum skin tint spf 30,pimprod2032850,2598954," * All tinted moisturizers are so orange or pink on me. Tula's very light warm nails it. I use it on top of my daily SPF moisturizer and it's the right, light coverage i was looking for. It covers light imperfections, lessens my undereye circles, and reduces redness. Totally recommend! * Very happy I got a sample and didn't purchase this product. First off it doesn't cover any redness, or even out tone at all. It had a strong smell like zinc oxide and was very hard to apply, very pasty and sticky. And the worst part it darkened and turned orange after about 15 minutes. Yuck. * Caused the ""Great Outbreak"" of 2024. Ive never had pimples this size or in the places they poped up! * I started using this product a few months ago. My skin is sensitive to many products but this was one has not caused any unusal breakouts. This product is moisturizing without feeling heavy. It provides moderrate coverage and looks natural! I have definitely received positive skin comments wearing this stuff! I definitely intend on continuing to purchase this moisturizer! * Got this in a subscription box, but i will repurchase it. I love the finish on this on my dry, aging skin. It does need to be set with a powder or will remain a little tacky, but afterwards it looks gorgeous. * Light and covers good * Product feels light with some light tint coverage as well."
