,Brand,Name,ID,sku,comments
95,maybelline,super stay 24h skin tint + vitamin c,pimprod2039657,2610817," * 100000/10 recommend!! I would say I have combo skin more leaning to the dry side. This product is my holy grail. I used a $60 foundation months back and regret paying that money for horrible foundation. This one has never let me down! * The product goes on very easily and leaves an almost instant matt finish, yet still blend-able even after it starts to dry. I have dry skin and even though it dries down almosy instantly, it doesn't feel like it's making my skin feel even more dry and doesn't cling to any dry patches. It does however get into my smile creases, but i have pretty defined lines so that's expected. * My skin is combo mostly dry and this foundation looks gorgeous on my skin. It does not look cakey throught the day and the longevity is good. Highly recommended for people with dry or combo skin. * Goes on smoothly. Perfect balance for my combination skin. Just the right amount of coverage. Highly recommend! * They need more shades but I like the formula. It really sticks to my skin and lasts an 8 hour shift at work. Doesnt feel too heavy or cakey. * I had high expectations for this skin tint seeing all of its glowing reviews. After only using it twice, my skin HATED IT. I started getting little break outs allllll over my skin. Will be returning. ): * I love it, very flawless on the skin, lasts all day and its natural for a natural looking day"
96,l'orÃ©al,true match super-blendable foundation,pimprod2034733,2602421," * I usually exclusively use high end or luxury makeup products, but I've been hearing about this foundation for years now and finally decided to try it. Let me tell you what. I regret not buying it sooner. The coverage and finish is very comparable to my favorite Make Up For Ever HD foundation, and it photographs equally well. The buildable coverage also makes this foundation perfect for underpainting if you're into that. For reference, I am a very dry skin girl and I prep with lots of moisturizer.  It blends into the skin like a dream and works well with all of the other products I've used with it. * Purchased this brand for the first time and it did not disappoint. Decent quality for its price point and I like that you can increase coverage without it feeling caked on. I give this a 7/10 considering price and quality. * I love the product,  it blends in with my skin tone very well. * I was easily influenced by TikTok to buy this foundation and pleasantly surprised that I liked it. I am not much of a foundation wearer but love that this is buildable and it is moisturizing. Did not break me out and there was no unpleasant smell. * I wanted to try this because i saw Shelby Ann from Tiktok using it and thiught id try it out. I love Nars Radiant. I will say to get this foundation to last one and really look good on the skin, you have to prep. 
I use the same routine as Shelby. 
Milk toner
Elf glow drops
However i have used recently: milk toner,elf power grip primer, elf glow sunscreen, and then apply foundation, 
I really does look like a filter. Love it. * The color match was great and the texture was very light but it was very drying and after just one wear my skin broke out :( if you have sensitive/ combo or dry skin I would not recommend * This product gives good coverage without looking heavy"
97,estÃ©e lauder,double wear stay in place matte powder foundation refill,pimprod2031253,2593713," * I love this foundation. I first tried the stay wear liquid but I found that I like the stay wear powder foundation better. I have combination skin with hormonal acne and it doesn't aggravate my acne at all. I usually just get a under the skin bump or two on my chin a week before my cycle and this foundation doesn't make it worse or aggravate it in any way. I don't have any injections or fillers and I have some fine lines and it doesn't sit in those lines making me look older so I definitely like that. I take good care of my skin and  believe in aging gracefully. I know I am getting older and the wrinkles are coming but thats okay with me. My smile lines are from the wonderful smiles and laughs I've had and I wear them proudly. I eat a healthy diet, workout every morning and I only drink water and my skin reflects that and looks healthy. Just because we age doesn't mean we won't look good anymore. Healthy, glowing skin is beautiful at any age in my opinion. So, I use this powder foundation all year round and I definitely recommend using a good primer for your skin type before applying this foundation. It definitely keeps it looks good thru your work day. I use to solely use Clinique and I still use their eye shadow, mascara, blush and skincare but I had a good friend introduce me to this foundation and I literally ran out to get it lol. Just remember every day you wake up is a gift and a chance to shine :) * Once I apply Esstee's  Double wear foundation I use her compact powder to set the foundation.  It is a perfect complement to the foundation. * Love products * I wear 1c1 in winter but 2c1 in summer,I love how easy it is to change out shades with these refills. It's a wonderful, flexible formula that's never cakey. * I buy ivorynude (one if the lightest shades).The color mathecs perfects, at first. However, with a couple hours, my makeup looks a couple shades darker. I have worn this on my tropical vacations and it holds against water, still looking perfect. If you buy a couple shades lighter, it may work for you. * Love the smooth look 👌 * I am 47 with normal to dry skin. Full coverage long lasting!"
98,dior,forever natural nude foundation,pimprod2036826,2604394," * This foundation is amazing..it's as if the Forever Matte and Glow had a baby.  It gives such a beautiful satin finish that is not too matte and not too glowy just perfect. I will definitely buy this again and I've recommended it to quite a few of my friends and they love it as well! * I have been trying to decide why I am not reaching for this foundation and I have come to the conclusion I may have gotten an old bottle. The texture is thick and gel like; not what I would expect from a ""nude natural"" foundation. Looks cakey. and when I shake it I don't hear or feel any movement in the bottle. It doesn't really smell spoiled although it does have a fragrance as Dior does. I have tried thinning it out with oil or moisturizer but then it doesn't dry down as it should. I am disappointed but don't know if it's actually the product or that I received  an old bottle. Unfortunately I tossed the box. It's not impossible as I have received  expired products from the warehouse on a couple of other occasions. But I have definitely had better foundations that cost less. * I was not wowed by this foundation. maybe my color match wasn't the best. I am fair to light with a neutral leaning slightly warm complexion and I don't think there is a great match for me in this product. I did not find this product to look very natural or give me any sort of radiance. I felt it looked semi matte rather than a natural finish. Coverage was fine-light to medium as expected. I much prefer Chanel's Healthy Glow foundation. I have mature skin and think perhaps this foundation is better suited to a younger customer. I didn't dislike it but I would not repurchase it. For me it looked rather flat no matter how I prepped my skin. * This is a fantastic foundation! It's lightweight and  leaves me looking naturally flawless. I will say it doesn't completely cover dark spots/acne but I am personally fine with that- nothing a little concealer can't help with. I will definitely be repurchasing. * Wonderful product! * This is the best foundation that I have tried in at least the last 5 years of searching for ""the one"".  Not too heavy or too light. Not cakey and does not settle into my fine lines. This foundation lasts throughout the workday and well into the evening. Definitely worth the price. Finally!  I've found the one!! * Here's a quick review you can use for Dior foundation at Ulta:

""I absolutely love how smooth the Dior foundation applies to my skin! It blends effortlessly, giving me a flawless finish that feels lightweight yet provides great coverage. The formula feels luxurious, and it lasts all day without creasing or feeling heavy. Whether you're going for a natural look or building it up for full glam, this foundation is a game-changer. Highly recommend trying it out—you won't be disappointed!"""
99,mac,studio radiance serum powered foundation,pimprod2040797,2613967," * The product is great, but it was really Miguel, the Ulta consultant, who made the experience memorable and assured I would come back and purchase again. Even though it wasn't his primary product area, he spent the time to find just the right foundation color , talk about the benefits of other MAC products and how they work together and was very informative, but not high pressure. He is the reason I will return! * I love this foundation. It has just the right coverage, covers flaws without looking cakey. Gives me an all day glow that looks totally natural. * Love love love this foundation! It's light weight, not a true mat but doesnt make me look shiny. It's buildable, lasts all day and the perfect match. * I swear its been YEARS to find a good base. 

YES the colors aren't solid and theres mot much variation BUT with concealer you add dimension and you're good go! 

I work in a kitchen over steaming soup pots and SWEAR on this!

Its hard ti find something that will stay all day in steam and sweat . ALSO glsses! A life saviour! Cant believe it took me this long to get into MAC. * As an older woman. My skin has changed. This product gives a smooth,  clean result. Great color match. * I sat with the MAC rep and we re-did ALL the foundations and powders for the winter! * Love this foundation …especially in the fall & winter. When skin tends to be drier!!"
100,maybelline,super stay up to 24hr hybrid powder-foundation,pimprod2036593,2603936," * Perfect long lasting and it does not feel cakey * It's just OK. I didn't feel like the color was great at matching and I didn't feel like it really smooth my skin or covered my pores. It also made my skin feel very dry. * O like this product but still looking to see if there is anything else better for my aging oily skin. When I sweat at work and face starts to get oily a few hours before I go home * I have tried way too many cream, liquid, and powder foundations and keep going back to this one. I have been using for years. Even good for mature skin. * 12+ hours of coverage, that will hold up in humid summer Weather, this is my tried & true. Matte. Buildable formula, versatile, light handed with a fluffy brush or pack on with puff for more coverage. On  ""dry"" days, mist with a hydrating spray. * I was looking for something to replace my beloved elf camo powder foundation after they discontinued it but this one is not it. The coverage is nonexistent, and texture is just chalky. Wish i could return but sadly tried too long to make it work and missed the return window. * not a good product for those with large pores or any texture. also wears off so quick"
101,dermablend,flawless creator liquid foundation drops,xlsimpprod16661005,2515171,
102,tarte,amazonian clay blurring powder foundation,pimprod2036934,2604704," * I have oily skin and I used to use the MAC compact but they changed their formula so o switched to this and I couldn't be more happier that I did. 
I'm in my 40s and useless daily. Ladies in our 40s, please don't forget to use setting spray to set the powder so it does not look Cakey or dry. * I have been using this powder foundation for a few months now, and while sometimes it's tricky to find the right primer to put underneath it. I do like it overall. It has a good medium coverage and sits well on my skin. I have combination skin, oily in the t zone, dry on the cheeks. I feel that it blends in with my skin well and while I don't think it lasts 18 hours, I do feel like it lasts almost all day with very minimal touchup.. * Love it! * This was my first time using one of the Tarte foundations and this one did not work for me. I have combination normal/oily skin and this just made my skin very oily and break out. I did return it and switch back to my normal brand * Love Tarte products * Only powder I will ever use! Has a great matt finish and covers so well! * Creamy, yet light. Feels good on the skin."
103,pat mcgrath labs,skin fetish: sublime perfection foundation,pimprod2040434,2613894," * I have dry skin it works well to stop flakiness. Most foundations don't work well with moisturizers and cause separation but not this brand. It melts nicely and looks like skin! And no heaviness * This is a very natural looking foundation.  Although extremely lightweight, it covers amazingly well.  Be careful when applying because it is very watery, but once it sets it gives a nice natural coverage. * I got shade 2, and it pulls WAY too yellow; I looked like I was having kidney failure. I couldn't even focus on the finish or feel because it looked insane. I was really bummed because I've waited years to try this foundation. * This foundation is very ""watery"" which I was warned of but it doesn't bother me and it goes on nicely. The coverage is light but buildable. My skin is prone to oxidizing foundations terribly and this is the best foundation I have found that doesn't oxidize as bad as others on my skin. * this is an amazing foundation. the only con is the bottle. it WILL squirt all over you if you are running low so DO NOT apply in your going out outfit. it stains your clothes * This product has such a light consistency, ince it dries down its like wearing nothing. Lovely medium coverage that can be built upon. Makes skin look perfected and lasts all day * This is such a beautiful foundation. It give enough to cover redness and uneven tones but still looks natural and not heavy. You dont even know you have anything on. Beautiful for mature skin."
104,hourglass,vanish seamless finish foundation stick,pimprod2020481,2575932," * I tried so may expensive foundations brands because I could never find my shade but this one was the perfect one for me!!! I bought the Dior foundation and still try to use my hourglass one even though theres barely product left * I ordered this product twice and returned. Both times the foundation stick was found upside down.  The stick was no longer attached to the base but had detached and was in the cap. There was no way to use this product. * I used the foundation stick manay years ago and was obsessed with the seemless coverage; however, this is not the same foundation stick. They must have changed the formula bc it goes onto your skin terribly and looks cakey, cracked immediately upon application. Ive tried four different types of primer as well as none at all and I still am left with the same look. Do not waste your money. * She went on so nicely, that at first, I was obsessed. That quickly dissipated as I wore her throughout the day. She broke apart, leaving a weird finish on skin. It still looked ok from afar but the moment you got close it was a disaster. I tried and tried again. I thought maybe it's my sunscreen, my serum, my moisturizer. But no matter what I switched out, the same thing happened - goes on great and breaks apart in an hour or two. I returned her :( * I have oily/combo acne prone skin. This product is great on my oily sections and provides a full coverage. It has an insane amount of product, I have used a lot of it and ive had it for over a year yet still have half. It can cling to my pimples a little bit but as i wear it through the day it blends into it. * I have used Hourglass (which I prefer) as well as IT Cosmetics and both have changed the description for their products (from a name to a number and vice versa). I have a number on my Hourglass stick and unfortunately can't reorder online. So frustrating!
IT doesn't even have the description on the product so that sealed the deal for them. Makes no sense why they make it so hard for the consumer. * Good color match and formula. Problem packaging, amount of product, and price. The product was stuck to the cap. I was able to get the product out and place it in a tiny jar. Packaging needs redesign for the price. Can't recommend for this reason."
105,wyn beauty,featuring you hydrating skin enhancing tint spf 30,pimprod2044322,2622290," * Not buying at least 3 bottles in my shade. Now it's sold out. So far, I have enjoyed the coverage on the areas on my face that I'm self conscious about for almost a ""no makeup "" look. It does have a slight smell but nothing too major. The one I bought did have an exp date of 11/25/25, but I haven't had any adverse reactions * I feel this is a truly underrated product. It mixes so good with my foundation and enhances it. I use Estee Lauder Double Wear and il Makiage. I hope this stays on the market. It is a truly great product. You can use it alone and it gives you a natural no makeup finish with a slightly dewy glow. * This blends well with my foundation. It creates such a beautiful velvet finist. The foundation I use il makiage or Estee Lauder double wear. I truly feel this is an underrated product. I use it almost everyday and I love it. Cannot live without it. * Tried but the texture was horrible on my skin. Yea i tend to have dryer skin but i would prime my skin and still if would get sooo cake like . Awful * I love skin tint, this is the opposite of what good skin tint is. it's oily, separates, sticks to dry patches and feels heavy on the skin. I'm sorry I wanted to like it. the pro is nice packing * This is actually very nice. I have a pretty spot on shade match. Very lightweight, comfortable and moisturizing on the face. Pretty glowy so if you prefer a matte skin tint stay away (also if you have very sensitive skin, this may cause itching and breakouts cause the formula is expiring) but the finish is very natural/everyday friendly. I was shocked at the coverage. Can definitely be built up to a medium coverage. Love that theres spf in there and wears surprisingly well. Lasts through my workdays and under the sun while driving. I like the packaging, i think its fun. I take concealer too seriously to try the concealer but this is great for under $10. I enjoy this for basic mundane days where i dont want to use up my nicer product but want to look put together * This product doesn't blend well into skin no matter how well I prep my skin! Gives a very patchy and dry look."
106,hourglass,ambient soft glow foundation,pimprod2033509,2599657," * I wasnt all that jazzed about this foundation at first. I am 51 years old with combination skin and i have been on a years long mission to find a foundation that worked well with my skin. Most foundation looks great when you first put it on, but for me, it starts slipping around as the day goes on and ends up a mess by the end of the day. When I first tried this, it looked a bit cakey and clung to the dry patches on my face, but it didnt move…at all.  Then I tried applying less- like not even a quarter of a pump. That was the ticket! Perfect coverage, no cakiness, and it doesnt budge - all day long. It doesnt feel like anything on my skin. 

Not every product works for every skin type  but this is IT for me! * I really wanted to love this foundation. I love the color match and coverage, however three days in and I noticed acne ALL OVER MY FACE. So sad!!! * I have tried everything out there. Finally found this gem. Looks so natural complexion looks flawless. Light weight. I have mature skin and have lots of spots covers great with little color correction. Little expensive but a little goes a long way. Definitely worth a try * It clung to every dry patch no matter how much I prepped and it separated. * I don't usually write reviews, but I felt like I had to this time—just to give some insight before you spend your money on this foundation.

First off, I LOVE Hourglass. I've been obsessed with their concealers—they've been my go-to for so long—so I really thought I'd love their foundation too… but sadly, I was super disappointed. This foundation is not it.

For reference, I've used Estée Lauder and thought it was decent, but I was still curious to try this one. I always prep my skin well, but even with that, this foundation went on patchy and came off so easily. Ijust didn't sit right. I've never had this issue with my past foundations. Like… what?? 😩

Just wanted to share my experience in case it helps any of you. If you're looking for a reliable, everyday foundation, I honestly don't think this one is worth the price. :( * For context, I have combo to oily skin. I tried this foundation for two weeks. No matter what prep I did, no matter what I set it with, it highlighted every pore and line on my face. It looked cakey and greasy (I used less than 1 pump). It does provide good coverage, and it doesn't feel heavy on the skin. Just didn't work for me. * I had an appointment in the salon for formal makeup for a masquerade ball, and the artist doing my makeup pulled out this brand to use and it was the most perfect shade match Ive ever seen for my skin, I went and bought it immediately"
107,l'orÃ©al,infallible pro-matte liquid longwear foundation,xlsimpprod11861081,2283483,
108,fenty beauty by rihanna,pro filt'r soft matte powder foundation,pimprod2031422,2592359," * My powder foundation (I have used for 30 years) was discontinued so i was in search for something as similar as possible. My daughter found this for me and so far i absolutely love it. The color match is perfect.  It goes on so soft and smooth and there is not a weird or strong smell. * Good coverage. * The first time gave me a rash so I waited a couple of months to make sure it was this and I tried it again and gave a red bumps all over my face. I'm not the only one. There's a lot of bad reviews w the same effect. * Excellent powder foundation for older women.  I don't know why my color doesn't seem to be available anymore though.  What's going on with the limited shade offerings?  Fenty still has all 50 shades on their website! * Ive been using this powder in shade 150 since it came out. All of a sudden theres no lighter shades? Not even one around the color ive been using. I've probably went through 10 of these compacts, and am beyond disappointed. Def gives me the ick for the brand!! * Perfect match for my skin tone. * I did the color match online and they matched me with a Shane that is not even available anymore. At the store I matched with 210 and the consultant said they are not going to carry that shade anymore. why would this supposedly inclusive brand cut all these different shades from their lineup? Now I guess I have to find another brand to buy powder from."
109,covergirl,simply ageless skin perfector essence foundation,pimprod2042952,2618803," * I had high hopes based on feedback from friends, but the product arrived very runny - it was like water and the beige liquid separated and would not blend well together even after I pumped the product onto my hand. I wish I had brought the product into the store for a refund. * If you're a fan of the Chanel Water Fresh Tint $70, then you should definitely try this. Coverage is identical but price difference makes it oh so much better. * i kinda want to gate keep and keep this gem to myself but omg this is amazing on the skin. I have the Chanel les beige tint and this is so comparable. I love it!!!!!!! Please dont ever discontinue * I bought this because I heard it was a dupe for a high end brand.  At first i didnt really care for this foundation but im almost done with the bottle and now I really like it.  I like that its lightweight, hydrating, leaves skin plump and healthy. It also evens out skintone and stays in through the day.  You do have to work it into the skin a little bit to get a even application because of foundation droplets. I like to use a flat (round)foundation brush. Its a very light foundation .. maybe even a skin tint.  Works wells with creams and powders.  I like mixing in some bronzing drops while applying. * I would have given this a higher rating, but this foundation irritated my skin. It made it dry, and small bumps started to appear, as well as making my pores appear larger.  Which is too bad; I would have liked this otherwise.  The first time I applied it, it evened out my blotchiness without having a thick layer of makeup on my skin, but my skin texture got progressively worse every day I wore this makeup.  So, it's not for me. * I love this stuff! Helps even out my skin tone, and for acne I spot conceal. Lasts all day for me (with setting powder and spray) and it feels so lightweight. I like this better then any high end product. * nothing ive used gives the same best-skin finish without looking like im wearing makeup. It also pairs well with all types of concealers, cheek and powder products. 

I know it's a bit expensive for cover girl but this formula is really excellent, and I like it better than what its duping bc it has zero scent. Also a bottle last 8-10months if used everyday. Just need small little dots for a naturally perfect skin look.

Keep this one around Cover Girl!"
