,Brand,Name,ID,sku,comments
45,laura mercier,real flawless weightless perfecting waterproof foundation,pimprod2038437,2608627," * I went in to buy a darker color in Estée Lauder double wear. The sales lady talked me into buying this instead and I'm disappointed. It's not as long wearing and much easier to wipe off. It doesn't settle into wrinkles as bad. * I finally found a foundation that doesn't accentuate the wrinkles on my face. It's light and smooth, and still covers my face naturally. I have been using this product for years. Very happy with my results. * Since i love laura setting power i thought i was going to love this foundation but it squirts more than a cat !!it will spray on you , your clothes like huh ?? Unbelievable and even thigj my skin is dry this feels like cooking grease and spreads all over your face in like 2 hours and you emd up looking a hot funky mess . * Yes, foundation is so light and goes on so smoothly and evenly. I love it and we'll definitely buy it again. * I have purchased this product  twice. I love it. The coverage is good without being heavy and it doesn't  contain harmful ingredients. * When you press the pump the product shoots out. So, if you want to get a little product  out to place on your fingertip, this is not for you. Also, it squirts out with too much force so it goes all over the place if you're not extremely careful.  I prefer a foundation that you are able to extract a small amount.  Additionally, while the product is light weight, when it dries you can see it if you have any lines. I like foundations that do not show in creases and this does after drying. * When I put this on my face in the morning, I thought it looked really nice.  But about 6 hours later, it needed to be reapplied and was dry and setting in wrinkles.  I tried it alone, with primer and it just didn't work for my dry skin.  I returned it."
46,it cosmetics,mini cc+ cream with spf 50+,pimprod2013015,2278481," * Trying out something new. So far i am loving it. * After trying so many foundations finally I found the perfect one for my skin. Exact match for my skin tone. I am loving this foundation. * I usually don't write reviews but for the price it's absolutely not worth it. I separates almost automatically and settles into pores immediately as well. There are so many better foundations especially for this price DO NOT GET. * Was recommended this product for acne prone skin. i was so excited bc ive heard many good things about this product, but it didn't work for me. it clings to every dry/textured spot and broke me out with how heavy it is. only pro is it goes on well * Very nice * 62 yrs old and absolutely love this foundation. * [I received this product in exchange for my honest review] [I received this product in exchange for my honest review] I love this creamy, light weight concealer that actually covers my blemishes.  With the correct skin prep, this lasts all day long. Definitely my go to for concealer"
47,laura mercier,tinted moisturizer natural skin perfector broad spectrum spf 30,pimprod2012417,2560092," * Light coverage and great for daily use .  Not for problematic skin coverage. * This is my favorite ""foundation"" but I do struggle with it. It can be patchy on dry skin and it does not mesh well with most of my moisturizers. However, even on bad application days, a couple hours later I'm always amazed by how amazing my skin looks. * This goes on light and smooth. Gives nice coverage when you want to look natural. Has SPF 30. * I needed a replacement for my favorite Les Beiges tinted SPF moisturizer by Chanel, which was discontinued :(. An ULTA assistant pointed me in the direction of Laura Mercier's tinted moisturizer with SPF, which has been great (I'm on my third tube—each has lasted me about 9 months with daily use). I like how this product lightly balances out redness, gives a subtle glow, doesn't bother my skin, and is breathable. * I'm very picky when it comes to base makeup. I have dry/normal skin, a light-medium olive skintone, and I deal with dullness/discoloration. Shade 2N1 is a good shade match for me. I've enjoyed using this with a dense foundation brush. It's easy to sheer out or build up. I would describe it as light/medium coverage. It evens out my skin tone, but doesn't cover blemishes. Its very comfortable on the skin, it feels like a moisturizer, the consistency is thick at first, but it doesn't feel like anything when blended out. I can wear it without powder and it stays on all day for me. Definitely repurchasing. * I've been using this product for years!  I don't like thick heavy coverage so this is very light buildable coverage.  I have pretty good skin, 38 years old, cheeks are pink from dryness with few blemishes and this provides me full coverage.  I do add a thin layer of moisturizer (especially now that I'm older and less oily) and concealer for under my eyes, nose and any glaring blemishes.  It's a very natural finish that does pull warm.  I use 2N1 for my winter everyday color and 2W1 for summer when I'm tanned (it's very yellow/gold). * The Laura Mercier Tinted Moisturizer goes on nicely,  bur doesnt cover ANY imperfections. Some pilling.  I was hoping to love it, but will be returning it."
48,maybelline,fit me matte + poreless liquid foundation,xlsimpprod11861007,2282913,
49,mac,studio radiance serum powered foundation,pimprod2040797,2613961," * The product is great, but it was really Miguel, the Ulta consultant, who made the experience memorable and assured I would come back and purchase again. Even though it wasn't his primary product area, he spent the time to find just the right foundation color , talk about the benefits of other MAC products and how they work together and was very informative, but not high pressure. He is the reason I will return! * I love this foundation. It has just the right coverage, covers flaws without looking cakey. Gives me an all day glow that looks totally natural. * Love love love this foundation! It's light weight, not a true mat but doesnt make me look shiny. It's buildable, lasts all day and the perfect match. * I swear its been YEARS to find a good base. 

YES the colors aren't solid and theres mot much variation BUT with concealer you add dimension and you're good go! 

I work in a kitchen over steaming soup pots and SWEAR on this!

Its hard ti find something that will stay all day in steam and sweat . ALSO glsses! A life saviour! Cant believe it took me this long to get into MAC. * As an older woman. My skin has changed. This product gives a smooth,  clean result. Great color match. * I sat with the MAC rep and we re-did ALL the foundations and powders for the winter! * Love this foundation …especially in the fall & winter. When skin tends to be drier!!"
50,clinique,almost powder makeup broad spectrum spf 18 foundation,xlsimpprod10791895,2160688,
51,chanel,ultra le teint ultrawear all-day comfort flawless finish foundation,pimprod2030114,2585239," * I really wanted to like this foundation, when I tried it on in the store, it felt so smooth and light, never settled in my laugh lines and it also covered my blemishes well. However, I have now tried a few of them in store and at home, and none of these shade fit my skin tone! It also oxidizes within an hour of wearing it. Ugh this foundation was exactly what I have been searching for but if I can't color match it and it changes colors throughout the day then it's just not a good fit. I feel terrible for returning it. * Blessed with wonderful skin… at 80! This foundation is like velvet and the best I've found today! * I absolutely love this foundation paired with the Chanel Enhancer - no primer needed and your makeup looks flawless all day. The foundation is matte and I am an older woman ( 45-50 years) that's why I prefer to pair with the enhancer. * Beautiful finish and buildable coverage. Would have liked a cooler fair shade but the lightest shade i was able to blend into my neck and make it work * I have nothing bad to say about this foundation! It offers a stunning lightweight finish that is never cakey, even long after it has set in on your skin. One thing I really love about this product is that its lightweight qualities allow either a medium or full coverage look that is perfectly & easily buildable to your liking. It spreads on the skin easily as well and does not dry or set in too quickly. It is my favorite of all foundations by far!!!!! * I purchased this foundation with low hopes because I was not liking any of the Chanel products in the last decade and boy was I wrong! I have combo skin, used two pumps to get full coverage and was shocked by the results. Gave a soft matte finish with amazing plump, glowing looking skin. Worth the money but I will say prep your skin greatly so you can get your money's worth! * Good coverage, i got the perfect shade match, looks really great on the skin and it is lightweight. I will recommend buying this and use a good primer."
52,clinique,superbalanced makeup foundation,xlsimpprod10791911,2153598,
53,bobbi brown,skin long-wear weightless foundation spf 15,pimprod2024898,2583683," * Good * For the price it was terrible after 1 use I had terrible bumps on my forehead and it took a long time to get rid of it worst experience ever! Do not buy! * I was expecting a little more coverage but does feel like skin. It looks beautiful but on acne days not even with a few layers it doesn't add to much coverage. * I'm so impressed by this foundation and have told all my friends about it. My skin looks incredible with it on and it applies so nicely, very light but great coverage! I dont even wear concealer with it! I put on a light moisturizer (I use Caudalie vinoperfect) and then apply the foundation with a brush. 5 stars!!! * This may be the worst foundation I've ever tried; I could not get this to apply correctly-i tried a brush, sponge and my fingers-there was just no applying this stuff. It was somewhat watery but I could not get it to spread on my face-i don't think I've ever had that happen with a foundation.  I wish I could give it 0 stars. * Looks very nice on * The best!"
54,lancÃ´me,teint idÃ´le ultra wear foundation stick,pimprod2023126,2577700," * I struggle with acne and skin picking always have possibly always will lol.. this little thing is amazing to keep in your bag for touchups. I love the concealer from this line and this foundation stick rocks. Full coverage- i just applied to a blemish (red, patchy, noticeable) and then davbed lightly with the brush on the other end and it blended perfectly, hid it conpletely. The brush is meant to blot not swipe. Just light pats on top of the makeup. I love it. * This product is AMAZING for covering blemishes!! I've struggled with acne for forever and could never find something that had coverage AND was lightweight. THIS IS IT!!!! A little goes a long way, which is great since this is so expensive :( BUT IT'S WORTH IT!! I have pretty fair skin so redness shows up really well. Its extremely lightweight which I love! Just spritz some setting spray and it should stay on for a good long while. I have relatively oily skin too and I find that this will still stick. LOVE IT!!! * I  had tried this before but it didn't last long. I gave it a second try, the brush makes it easier to apply. * Easy to apply with fingers or a brush. Flawless, matte coverage. Perfect for combination or oily skin types. Stays on all day and perfect for travel. The best. * The finish on this is so smooth and gorgeous. Perfect amount of coverage and lasts super long even on the more oily parts of my face. Doesn't break me out. 10/10 * Goes on smooth and does not feel heavy. * Perfection, beautiful color blended well light or full coverage can do all. 
Does not break me out with every penny. My confidence has been boosted since wearing this and can't pull myself to even try anything else. I'm IN love"
55,lancÃ´me,teint idole ultra wear care and glow foundation,pimprod2033657,2598637," * This foundation is the perfect color and formula for me.  I used to use the renergie, but the color I was using that was matched up incorrectly to me a year ago and it came off. 
The representative for Lancôme at the store helped me out.  She matched it perfectly!  I have been using g this for over a week now and it doesn't dry my skin out, gives great coverage and stays on. 
Her name is Crystal.  She got me all taken care of with numerous products that do everything I asked for!  You don't find people like this very often, * Color matches skin perfectly. It is lite to touch and use very little to apply. Will purchase again. * Great coverage. * So ive always tried to wear lancome teinte idole in matte. Alot of others can still wesr with thier dry skin; i however, cannot. When this first came out, i bought right away. I was certain it would not work because shade was a dark orangey neutral for the lightest neutral. 

I am a pale mature and dry skin woman. It did oxidize a bit BUT, it stayed the neutral amd then seemed to work with my skin and like, color corrected or something. I have no idea.  I just know that i love this, looks beautiful, stays on all day, tad bit of a glow, but not really. Its a perfect hint of something. * I sought help from the clerk for a color match.  She matched me with the wrong color and I can't use it.I use Lancome so it wasn't the product's problem. * This foundation feels very good on my skin and covers very well! * I ordered this march 2025 and have been using it and frankly i always loved this foundation. One time it was in front of me and i noticed 2024, took me a minute to realize ive been using an expired foundation since march. I got one for my mom the same day and it expires in december 2025. Ulta should not ship products that expired or have less than a year. Really upset about it, but the foundation itself is fantastic"
56,about-face,the performer skin-focused foundation,pimprod2043010,2618950," * Not a fan of the applicator as an acne prone girl. This foundation also transfers very easily, even when set with powder and setting spray. They have a great shade range and my skin looked evened out and glowy but returned due to the transferring issues. * A lot of 'cool' shades end up warm on me, which is especially difficult being a 'barely there' makeup user. The way thid blends to blur out blemishes is amazing, and its gentle on my eczema prone skin. Its also a lot of product for the price. Just give it a good shake if its been sitting for a while before using. * U e never repurchased a foundation so much!! I love this formula in any season! I also love that they have olive tones!! * I've been using this foundation for the past year and I am obsessed with it. It is lightweight but it does have some coverage. It somehow looks better overtime,  its sits beautifully on the skin. It is not going to be full coverage, more light to medium. So underrated. * This is the first foundation ive ever had to return. The neutral was bright yellow, im not even exaggerating normally i could make it work by mixing with something else but it was so bad i had to return it * Definitely not a full coverage foundation, but it can be light to medium and look stunning. This is my second bottle. A great tone for neutral light skin tones. * literally one of the BEST foundations i've ever used, second to only my $72 georgio armani one. its literally skin in a bottle, but better, and my skin looks great even after i take jt off because the formula is filled with skincare! i took off my makeup and immediately began writing this revview because j need everyone to know how amazing this foundation is. high recommend!"
57,charlotte tilbury,charlotte's beautiful skin foundation,pimprod2043365,2619495," * If u dont use it everyday it separates in the bottle its no coverage snells nasty super oily doesnt work with other products seperates on face as well * Natural finish, hydrating, great for color correcting, buildable coverage & long lasting. Perfect if not a fan of foundation but a step up from tinted moisturizer. More similar to CC cream. Light/ neutral undertone skin & wear neutral 3 fall/winter * I just overall didnt like it product.. it wad thick, unlike the stick foundation. It was just as glowy but yet had bad coverage. * May work for others yet didn't for me. It didn't stay on long. It did look natural as it stated. Even just chillin around doing nothing it faded away. * This foundation is worth every penny. I love the way it goes onto the skin and it leaves your face feeling soft with a subtle glow. It's so easy to color match with numbers in each skin tone category, light, neutral, etc. I love this foundation. * So pleased with this purchase! First time buying this foundation and kind of tried it on a whim! Goes on nicely and has good buildable coverage. Very happy so far! * I was veru hopeful for this product and i have combination skin on my t zone, but somehow with this product i was very oily to the touch on my whole face and felt my skin very slick after using, goes on very well and can be buildable but unfortunately was a bad experience on my end."
58,dior,dior forever foundation fluid matte,pimprod2036825,2604875," * I've tried many foundations and this one is by far the best. 
You get coverage but it looks so natural on and stays all day. * might try to mix with another foundation * Beautiful coverage and the first foundation I've found that actually conceals large pores. 
Don't be fooled by the name matte, it's actually a very hydrating formula.  Great for mature skin. * Nice coverage would prefer no scent due to the added ingredients. * My favorite foundation. I've repurchased many times because I like the light weight formula and full coverage. It also has a pleasant smell thats not overpowering. I have oily skin and this keeps me nice and matte. * Did something change with the formula or did my skin change? It used to look beautiful on me the past 2 years, now it separates and just sits on my skin towards the end of the day; very noticeable where it is and where it isnt. Ive never had a foundation do that. Regardless if it is my skin that has has changed or the formula, the bottle continues to be terrible, squirts out everywhere, on my walls and clothes and therefore gets only 1 star for that. * Wish it worked on my skin but it doesn't! Oily/combo, used Dior velvet primer"
59,clinique,stay-matte oil-free makeup foundation,xlsimpprod10791929,2247037,
60,clinique,acne solutions liquid makeup foundation,pimprod2043524,2619813," * Clinique recommended this when they discontinued their Stay Matte foundation, but it's been a terrible substitute. Despite the product name, it makes my skin breakout way more than it did with Stay Matte, and there's no oil or shine control. * I absolutely love this foundation. Blends super super well with any other product, or is perfect by itself. ONLY complaint is that it will (sometimes) cling to dry patches if your primer wasnt dense enough there. Other then that, its perfect. * It does not break me out. My dermatologist said it was good for me to use. Offers moderate coverage without a heavy feel. I had the consultant at the clinque counter help me match my skin tone with was very helful. * I have been using this  for 25 yrs. Same color just ordered and upon application, it is a completely different shade- much darker and turns orange.
PLEASE bring back old formula or figure out same shade. I even tried to match with a new color and none of them match. * The other day I tried alabaster (""matched"" at the store) and it oxidized. Went back and tried linen and it was the perfect match! I tried other cheaper foundations but sticking with this again because it's the best for my face! * I used to use Ivory (02) for years. I stopped wearing foundation for a couple years (not enough time with kids) and switched to a tinted sunscreen. I wanted more coverage so went and got alabaster but it oxidized so quickly! Will be returning! * This is my go to foundation. Having some acne issues, this foundation controls the acne."
61,fenty beauty by rihanna,eaze drop blur + smooth foundation stick,pimprod2041564,2614177," * I really like this, i was looking for a face tint but realized i need more coverage and better color match and i decided to try this. It was perfect for travel mess free. Find my shade was easy since i use the foundation same brand so i was able to look for a match. Feels good on skin not heavy at all and last long. * This is the first makeup product I have ever used and it turned out so beautiful! For a beginner like me, it was really easy to use and I could almost not tell a difference except that it make my skin tone more even. It is not heavy, it is very lightweight and super complementary. I purchased the Color 20 and used it along with the Juvia's place bronzer in the color Tan. It definitely elevates my make up look and the color match is crazy! Thank you Riri, you're truly a bad gyal for this one!! * I was looking for a skin tint that wouldnt leave me looking greasy, was recommended this, and it didnt go as planned. This left me very oily, i would have to put on a lot of setting powder throughout the day which was the whole point that i didnt want to have to do that. It also was a bit patchy under my eyes and by my nose and cheeks but that could have been something with my skin. If youre looking for something more less-coverage and not glowy, this isnt for you * This foundation stick is truly the best! It goes on smoothly and can be used just a little for a light makeup natural look or for a full-on glam look. It blends perfectly and doesn't crease. I'm on the older side and some makeup seems to fill my wrinkles and highlight them and this does not do that. It really is one of the best foundation choices I've used so far, and you can build on it if you want more coverage. I even use it to even out my skin when I don't want to wear any other makeup. It is my newest favorite as are most of the Fenty products. * The color match is perfect and the ease in applying and the coverage are excellent. * MAC messed up when they changed their colors, because this is what I replaced it with and I like it better! No irritation on my sensitive skin. I can't feel it, and actually forgot to wash it off one night.. no acne or irritation the next morning.  No dryness * Does not wear well regardless of the type of primer or setting powder I used. It didn't last more than 2 hours. This is genuinely the worst product I've used in a while. I wanted to like it so much but it just wore terribly. Product was silky and smooth"
62,fenty beauty by rihanna,soft'lit naturally luminous hydrating longwear foundation,pimprod2045514,2624152," * I'm sure this is a good product for younger skin, but I wouldn't recommend for mature skin.  I tried everything to get this to work before returning.  It settles in fine lines even with primer, and doesn't last long. * I love this foundation * Great coverage.  Great match. * Love * Love this foundation! * Good coverage. Moisturizing * Impressed! Glides on and blends like a dream, not heavy, silky, looks like skin. Doesn't accentuate lines, wrinkles or pores. I just love my new foundation. For reference, I'm 63, moderate aging, lines and wrinkles, hyperpigmentation. I used NARS sheer glow foundation previously and  loved it also but for some reason the color is just too orange on me now since winter is coming, I think NARS had a little more coverage, only dislike is I think it accentuates pores a little more. NARS color line has no other match for my skin color, seems like  most of their colors run quite yellow/orange that's why I decided to try another foundation brand.  I did try using the LA girl white pigment and added a teeny speck to the NARS foundation which made the shade better and not so yellow/orange as a side note, loved that product also for being so cheap. I think the Fenty foundation looks just a little more natural on me since I'm getting older. I also tried Natasha Denonas new foundation and liked that also but was a little heavier than the Fenty Luminous Silk."
63,hourglass,veil hydrating skin tint,pimprod2040571,2611435," * I've always had a problem feeling trapped under foundation so I stick to tinted moisturizers. Even with tinted moisturizers, some feel sticky or not breathable. This gives me enough sheer coverage to even me out but doesn't make me feel trapped. It feels like I'm applying moisturizer. I'm naturally oily so I do set it with powder. I recently switched to this brand by chance and I'm glad I did. A little goes a long way for me so it's worth the price tag. I also apply with my fingers vs a brush but only because I don't like the feeling of something sitting on my face vs melted in to my skin. I'm very sensitive and this doesn't clog my pores. Definitely worth a try! * I love light coverage and a Dewey even greasy finish. I have dry skin and work in a very dry environment. But this has zero coverage amplified every pore and every time I wore it, I developed a new pimple. I'm in my 50s and don't break out from any of my other foundations. * I love this product, my daughter bought it and suggested I try it, it's not too heavy and that's what I wanted * I got all these little red bumps and acne breakouts, so bad. * Just enough coverage to hide imperfections. Texture light enough that wrinkles don't stand out. A bit concealer and blush…and ready for the day. * Lucky for me there is a color match. Texture, also, is right for me. Not too heavy looking, but just enough coverage. * This product is really great.  I don't wear foundation or a lot of makeup but wanted a hydrating pick me up for my daily wear.  This tint is lightweight, hydrating, and I love that it doesn't feel heavy nor greasy.  It lasts all day."
