,Brand,Name,ID,sku,comments
136,smashbox,mini halo healthy glow tinted moisturizer broad spectrum spf 25,pimprod2033372,2596512," * I keep coming back to this because my dry skin LOVES it. I have yet to find another base product that sits as well as this does on my skin. It's a shame that the shade just isn't quite right. I am very fair with a pink undertone, and the lightest shade is a little too orange. It also oxidizes a bit so if I don't blend my jawline well, the contrast is noticeable. This gives me such a healthy glow and doesn't exaggerate my dry patches like other foundations/tinted base products do. It's the perfect coverage I'm looking for too. I don't think I'm the only person wishing for more cool/olive options! * Makes me feel greasy every time :'( * I have been searching for years for a light coverage product that will just even out my skin tone without feeling heavy at all. I am really particular about my facial products and any kind of makeup- if it feels heavy at all, I won't continue to use it. this product is perfect for me! I have again, dry 40 year old skin. I do my skin care and apply this right after my moisturizer and it evens me out beautifully while allowing my skin to breathe! I wear light neutral shade and there's zero orange undertone. I can't feel the product on my face, it just feels like part of my skin care routine. it also contains SPF which is a huge plus as well. wears perfectly all day long without making me greasy at all, which tends to happen with all foundations I've tried. this covers all my redness which is exactly what I need. no breakouts and no scent. please never stop making this! * It was on clearance and I see why. If you have acne prone skin run the other direction from this product. I tried twice before realizing this was the root of my end of day flare ups!!! It did not take long for it to form cysts. * now that I'm in my 40s, my skin is changing. it's more dry and my pores are bigger, in addition to having discoloration from previous years of tanning and no SPF. I was looking for something very lightweight that I can't feel, that contains SPF and also evens out my skin tone while adding some glow. a tall order, but this product full the bill in full! I tried it without putting on moisturizer first, and I wouldnt recommend that. it wasn't quite moisturizing enough to stand on its own for me. so if you are drier, definitely moisturize first then apply right away. the glow is beautiful but not at all greasy. it blended right in with no tool needed, and my cream blush went on over it perfectly. didn't feel heavy at all either. in fact I forgot id put it on at all after a half hour or so. it evened out my skin tone beautifully while allowing my freckles to show through a little too. love it! * Goes on great! Even skin tone without looking like you are wearing too much makeup. * I love this product. It's light weight. It has a natural glow. You can wear it alone. I top it with a pressed powder foundation. I like that it has SPF coverage in it. It works good for my oily/combo skin. You just need to set it well with a good pressed powder."
137,covergirl,olay simply ageless 3-in-1 liquid foundation,xlsimpprod13501013,2296380,
138,wet n wild,photofocus liquid foundation,xlsimpprod16731069,2518267,
139,revolution beauty,irl filter longwear foundation,pimprod2033090,2597565," * I love this product but I feel the appearance of the bottle is very misleading. You think you are getting a full bottle, but it is really only half full and when you are done, so much is wasted on the sides of the bottle that does not come out.. I do not feel I am getting my money's worth or this would have been a 5 star review. My service at Ulta was amazing, very pleased. I have called the make-up company and expressed my feelings on their packaging and presentation. * i have combo oily skin and i wear fair shades with neutral undertones. this foundation was great for mattifying my face and has great coverage with just shy of a full pump. however, there's a bizarre scent that seems to linger for awhile. normally, scent doesnt bother me too much, but something about this smelled really bad. the fair neutral shade unfortunately just looked very grey and unflattering on me, and bronzing drops didnt seem to help much. if they fixed the undertones & the scent of this product, this would be an easy five stars * im in love with this! i have super oily skin and it went on so smooth and super matte! only bad thing about it is its pink toned even on the ""golden"" shades but its a quick fix with the LA girl pro color foundation pigment in yellow just add a tad bit to your foundation shade and bingo!!! you have your perfect shade! * undertone does not maych.. its PINK.. its thick, SUPER pink, literally nothing can help it not be pink, has a scent and while it does cover, and i can get over the scent, i just cant get over the undertone, PASS * My favorite full coverage foundation. * So I was told by one of the old workers that this company is under the umbrella of Tarte, and with the outstanding quality of this, I can definitely tell. I am an extremely discerning consumer. And I have combination, oily skin, acne prone, so I am a great barometer for quality. This foundation has been my #1 for the past few years. If you're looking for something that blurs pores, is full coverage, mattifies beautifully, and you do look like a real life filter— this is your foundation! Absolutely amazing. 20 out of 10 stars. Have re-purchased a few times.
A little was a long way, so one bottle lasts a while. * So I was told by one of the old workers that this company is under the umbrella of Tarte, and with the outstanding quality of this, I can definitely tell. I am an extremely discerning consumer. And I have combination, oily skin, acne prone, so I am a great barometer for quality. This foundation has been my #1 for the past few years. If you're looking for something that blurs pores, is full coverage, mattifies beautifully, and you do look like a real life filter— this is your foundation! Absolutely amazing. 20 out of 10 stars. Have re-purchased a few times.
A little was a long way, so one bottle lasts a while."
140,juvia's place,i am magic glow radiance booster,pimprod2044250,2620803," * My Shade: 0.5
I can wear this alone or with foundation and it looks VERY SKIN LIKE. It makes your skin looks very even and hydrated. * Easy to apply and control coverage amount. Very nice natural finish. Great for everyday (no makeup makeup days), but not as long lasting as other radiance foundations. * It does not give you pimples. Yes it gives you a Dewey look glowing. I was using Mac before and did not realize how much harsh chemicals that were in it that messes with your hormones and can give you issues down the road I have red pigmentation.takes it away * This is great if you want something light but looking to have a beautiful, smooth glow. Makes your skin look healthy and balanced.  If you are oily I suggest setting with a powder and use a matte setting spray.  When i want a makeup look i use their powder foundation to set.  Great for the summer or just a natural look. * Great product! * Loved it * I've been trying to find something like this forever! I have pretty good skin and got away from using foundation. I just use tarte shape tape under my eyes and around my nose/chin for redness. But I wanted a little something just to enhance my skin. Everything either has sunscreen in it which I do not want or looks like like I put highlighter all over my face. This does not have any shimmer or glitter like the CT Hollywood filter. This provides minimal coverage but gives your skin a glow. You can always spot conceal if you have a blemish and this goes nicely on top. I can also see using this under or on top of higher coverage foundation for a dewy look. If you have extremely oily skin I do not think it would work but for normal to dry its beautiful. The thing I can compare it to most is milk makeups skin tint, but that clings to dry patches and separates. This does not, its perfect!"
141,jane iredale,beyond matte liquid foundation,pimprod2008017,2552811," * This makeup did not sit well on my skin. It showed every pore and imperfection. Including any dry skin and did not cover well at all. I wanted to really like it but it didn't work for me * I love this foundation, its like your own skin but better. * At this price I'm pretty disappointed. Color match was great and does not oxidize, but that's where the pros ended for me. Definitely not full coverage, didn't blend well and shifts/splotchy. If you're an oilslick like me… this is a total waste. Maybe good for dryer skin? Going back to Dior at this price point and won't be purchasing this one again. * This foundation brought out texture and wrinkles I have never seen before. It is not very blend-able, as it takes a lot of manipulation to look somewhat acceptable. This product is very drying and I have oily skin. Not to mention it does not adhere to the skin, it slips and sides off your face throughout the day leaving you patchy. * I finally found my holy grail foundation, I didn't even buy it at Ulta but that's how much I loved it to write a review. It feels like I'm wearing nothing, it matches my skin perfectly which has been a nightmare for years trying to find a good match. * This coverage is a lot more sheer and dewy than I had anticipated. This would be a beautiful foundation for someone with dry, mature skin since it does not crease. The colors are not accurate either. I suggest ordering one to two shades darker. * I need to keep looking. I have a full bottle that I hope to find someone that it works for."
142,burt's bees,mattifying powder foundation,xlsimpprod16781002,2518238,
143,maybelline,instant age rewind eraser treatment foundation,pimprod2043641,2620458," * everybody hating on it really does not comprehend what the product is advertised as. it's a natural finish tinted spf sort of think, labeling it as a foundation is kind of misleading. but oh my gosh this product is so amazing and doesnt crease for me (i use maybelline powder to set),love itt * I used to use this foundation when i first started wearing makeup in middle school. I bought it again recently for my natural ""no makeup days"" for a quick sheer cover up for my acne marks. It is a nice foundation for people who want a light to medium coverage. Definitely not full coverage. Although its good, i think there are much better options out there. This foundation can be very greasy, so if you have oily skin, be sure to set it and touch it up throughout the day. It also applies very streaky. The applicator makes putting it on very quick and easy, but since it can be very streaky, blotchy, and greasy, youll have to spend extra time blending it and setting it. 

This product was great when i was younger but i wouldn't repurchase now. * I'm 50 and have used foundations at every price point from drugstore to luxury. This is my favorite (I'm buying my second bottle) because it doesn't feel like I'm wearing anything on my skin. It covers well without being heavy or cakey. I use it as my concealer as well. I would prefer pump packaging because with the twist-up you can't gauge how much you're dispensing, but I can get past that. Great, unsung foundation! * Great job on covering the blemishes. * I am picky about color shades and there is Many colors to choose from * It worked like a greasy highlighter on my face, highlighted flaws I didn't know i had. Although I like the sheer and shimmery tint I didn't find it useful enough to keep it. * I love how it goes on. Looks great on my skin."
144,l'orÃ©al,age perfect 4-in-1 tinted face balm foundation,pimprod2034423,2601959," * I am 61 and was so shocked when I began to apply this foundation/balm. It feels so nourishing and applies so evenly. It's light yet gives a good medium coverage. A great summertime weight. Not heavy but yet just enough color. Love it. Buy it. Give it a try. I think you'll like it. * This foundation is so perfect for me. It blends perfectly into my skin. It's so easy to apply. I just dab it on with a beauty sponge and I'm done in minutes! 
I love it ❤️ * I'm not sure why my skin reacts to foundation so terribly, but even the luxury brands make me look a little off. I know my undertone and have been able to pinpoint my exact color profile, so it's not that. Foundation usually sits on top of my face, amplifies my fine lines, and makes me look like a hot mess. Age Perfect Tinted Balm is the only foundation that makes me look better, and I wish I knew about it sooner. It's my favorite! * I have what the skincare industry refers to as ""mature ""skin. I am a make junkie and I had many foundations from drugstores and major department stores but as I got older they all made me look cake and settled into lines. I stumbled on this product and I love it. It's my skin only better. It lasts almost all day on my  combination oily dry skin. It is a wonderful product with light medium coverage for mature skin. Will definitely buy again * I've used 3 pots of this now and I'm still somehow surprised by how nice it is. The formula feels like it won't cover much, but it softens the appearance of/seems to fill and even out pores, scars, wrinkles, or any textures--I often get compliments on how smooth my skin looks when I use this. I've gone back and forth between two colors because, as other reviewers have mentioned, the color match is a little difficult. All in all, I keep trying new foundations just to come back to this one and be impressed by it. * I'm a light-medium skin tone that leans towards cool. I got started on this because an influencer raved about it a few yrs. ago. I decided to try it and couldn't had been more thrilled. I use shade fair 20 for reference. In the pot it looks more like a peach shade. It glides on effortlessly and melts into my skin. My dry/mature skin looks healthy. I'm sure I will get tired of this foundation, but for the last 3 yrs. I've been pleased. Only time will tell. * I was very skeptical to try this and was shocked. It is so good. 47 year old combo skin, apply with real techniques dense brush and its better than high end. How is this not more popular?"
145,hourglass,illusion hyaluronic skin tint,pimprod2020463,2575960," * I expected to love this based on reviews I'd seen, but for me, it applied very thick, sat noticeably in pores (an issue I've never had with any other product) and fine lines and didn't do anything it claims to do. I actually found it quite drying. I love HG products and am so glad Ulta is carrying them. I hope they'll carry the newer HG skin tint so I can try that one. * Im 55 and my skin is very dry, this product is moisturizing and never settles in my pores , an excellent alternative to foundation which just sat on my skin, this tinted moisturizer does not do that. I would highly recommend this product- * I have never had so many compliments about my skin since using this tinted moisturizer! It may not be for anyone needing full coverage makeup but someone looking for a glow and slight coverage! * It was very hard to find something for my aging skin that is full coverage, but doesn't settle into lines and look caked on. this was recommended in store and I absolutely love it! I apply with a beauty blender and use shape tape concealer with a tiny bit of setting powder. Really makes a difference being hyaluronic and any pictures while wearing come out great. A must in my drawer. * I wanted to like this. I have dry skin and some creepiness at 52. This made all of that worse.

It's very thick and kinda hard to blend out even with moisturizer and primer. 
I had to return this and buy the Too Faced brand hydrating liquid foundation. * Several comments said this was medium to full coverage which made me want to try it and it is not. There is absolutely no coverage at all. If anything it's just a glorified moisturizer so I'm thinking those other comments were for a different product. * Absolutely one of my favorite foundation. I love how it leaves my skin glowing and hydrated!"
146,jane iredale,refillable compact,pimprod2031651,2595249," * Tried to purchase this compact in the 21 Days of Beauty promotional, but couldn't add it to my cart, was it sold out?  Imagine my surprise the following day when it was available again at full price. Bait and switch advertising...not cool. * The discontinued gold compact was perfectly thin and light weight, making it easy to carry everyday. Also great for touch-ups when mineral foundation SPF is needed out in the sun! The closing latch wasn't super secure but I never had a problem with it opening in my purse. The new design is thick and super heavy. It's beautiful to sit on a counter, but useless weight for travel or carried in a shoulder bag. So sad I never odered backs up of the slim gold-tone compact! * I was surprised how expensive this compact is. But I have had so many contacts break and then I get crumbled pressed powder. This one looks like it will hold up well. I will let you know the first time I drop it-Yikes! * Very happy with this new compact. My JI mineral foundation stores securely,  the compact opens easily and now has a mirror. Yay! * I am a loyal Jane Iredale brand user. In fact, I have been using their products for over 20 years. The Jane Iredale line was recommended to me by the surgeon who did facial reconstruction after skin cancer surgery. 

Although I love their products, I have always been ""ehh"" about their packaging....until now! Thanks for finally giving up the gaudy gold (sorry, Jane Iredale) and going with this new, modern and aesthetically pleasing line of packaging. Since I have several of the old gold compacts, including the gold metals ones, I ordered one of the new compacts to see how I would like it. After receiving the new compact, I cannot wait to replace ALL my older versions! 

One more suggestion... in your future development, please consider making your eye shadows available in refills. I love the idea of being kinder to our planet and saving on the excess packaging. I do not mind paying separately for the cases if I know if is making a smaller, greener impact for future generations. =)

One final note of thanks to Ulta...I have been begging my local store to start carrying Jane Iredale. I am glad to see that you are at least finally carrying this amazing, clean line of makeup online! * I bought this on sale and I'm glad I did. It just makes it nice to put your foundation in. For the price of the foundation, it's a shame you have to purchase compact separately. * This packaging is overpriced and by default should be included with the powder. Waste of money."
147,nudestix,tinted cover foundation,pimprod2008837,2552723," * Overall I really like this product. I have sensitive skin and eczema, but this does not irritate my skin. The only thing I dislike is the initial smell when first applied - it has a strange medicinal smell. The smell goes away 15-20 minutes after application but it's strong when first applied. If this product was truly fragrance free I would give it 5 stars. * I have been upping my skin care regiment to combat hormonal acne and hyperpigmentation so my skin has been looking very nice. Thats where this product shines! It's very hydrating and lightweight so it looks like radiant skin! * I actually love this foundation bc i have blemish free skin and us it to even out hyperpigmentation. The issue is the pump… it does not pull product well after tube is no longer full and it doesn't come off. So its just wasted product. * Of course it doesn't fully cover blemishes, its not full coverage. I buy this again & again & pair it with concealer for under eyes / blemishes , & blush. Its so smooth, never breaks out my acne prone skin. I love it so much!! * Honestly I hate foundation, I have super sensitive skin and anything can break me out easily. This foundation is SO NICE!! It is more like a skin tint than a foundation, which I prefer if I do ever wear it, the smell is relaxing (if you're not an essential oil person I wouldn't recommend, the lavender is pretty strong), and it doesn't feel like anything is on. For my Florida girls this stuff is a great quick fix for the hot and humid days!! * I have super sensitive, rosacea-prone skin & my eyes are really easily irritated by makeup (ocular rosace) that started a few years ago - suddenly I couldn't wear my favorite makeup without breaking out, & my eyes burning, bright red. I searched & finally found a brand specifically for rosacea-prone skin! So happy to be able to wear makeup again! Over the last year or so the formula clearly changed - I couldn't find a color match & then my eyes started to  burn again. Back to the search - finally found this - I love this foundation & the whole product line! It's light & looks great - as others have said, I look like myself, only better! It doesn't settle in my lines or pores, doesn't irritate my skin or eyes. It does feel a bit oily / has a bit of shine. Also, Nude 3 is a perfect color match for me when it goes on, but it does darken a bit across the day so I'm going to try 2.5 & save 3 for the summer. Otherwise, highly recommend!! * I bought this foundation and love it.  I'm 47 years old with dry and pigmented skin from aging and I like light coverage products due to aging skin look more natural than full coverage foundation.  Very moisturizing.  I still set with loose powder and yes would buy this as long as nudestix still made this."
148,ulta beauty collection,adjustable coverage foundation,xlsimpprod5721072,2260079,
149,uoma beauty,say what?! foundation,pimprod2033346,2593663," * Wanted to like it but even with shaking it is so watery. * I purchased TN3W and TN3N, choosing the color from the website can be difficult.  My thought was to return one of them.  However, the finish for both is beautiful, applied with a beauty sponge it gives a soft matte glow to my 61 year old complexion.  It gives health and vitality.  I tend to use the warm finish more often, however the neutral is just as beautiful on the skin.  After an 8 hour day of wearing the foundation, it looks great!  Definitely recommended especially at the sale price worth every penny. * SAVE YOUR MONEY! * I bought this foundation because I heard that UOMA was going away and now I wish it wasn't because this is liquid GOLD. It looks like SKIN and the shade is perfect for my pale olive toned skin. I love this so much!!! * I was so impressed with the color matching. This matched perfectly. Unfortunately, it was pretty watery. After a lot of shaking, it seemed to dispense properly, but the formula is pretty thick. It dries almost instantly and makes blending difficult. I also felt that it emphasized fine lines and wrinkles on my very dry skin. * overall the wear of the foundation wasn't bad, but my skin was red and inflamed when I took it off and I don't typically have sensitive skin and this was the only thing different in my routine * I like this brand and what little of this foundation I put on my face went on smooth and dried well. but it smelled so awful I couldn't use it! I didn't see reviews that mentioned the smell so I'm wondering if I got an old/bad batch…which would also be concerning. Disappointed but returning this"
150,j.cat beauty,aquasurance compact foundation,pimprod2000221,2550026," * This is the BEST powder foundation. When i need my make up to be quick but look like i spent way more time on it this is the answer. It blends into the skin so naturally and gives me nice coverage without feeling powdery or cakey. I have probably gone through 4-5 of these compacts! It does shatter easily so be careful with that. * I don't understand all the rave reviews about this product. It is patchy and doesnt cover anything! * amazing foundation for when I'm in a rush. I have oily skin but am on retinol so a light layer of this foundation works better than my other foundations. it can cake up if you use to many layers and don't prep correctly. I did wish they had a better shade range. * I have gone through 4 or 5 of this foundation! So easy to apply and sets beautifully with a setting spray * This is my favorite powder foundation formula and has been for years - goes on so smoothly and is buildable. The last few compacts I've bought have cracked from barely any use. I had to dump the powder into a different container and use it that way. * so I do a full face every day. every once in a while I'll ""cheat"" and use this product to save time. it works sooo well. I use a light shade which I chose by pretty much matching my neck/highlight areas and use it mainly in my T zone. highlighting under eyes, forehead between brows chin and then I also add it along my jawline. then I go about my routine as normal but without the need for foundation highlight and baking. saves so much time! it builds well and has amazing coverage. it lasts all day. I have mature skin and hate when things settle into fine lines and wrinkles and I do not have that problem with this. it actually makes my skin appear younger compared to my full face routine with baking etc. I know I hav to find a new foundation to help avoid it but who has the time lol anyway... YES. this product is one I want to hoard in case it ever goes away. it's amazing. I use it with a compact dense brush. 

only downside is that I broke 2... but it's because I throw it in my purse and I know that's not ideal and on me for being careless. but if it's getting tossed around, be aware the powder may break. * This is a must have in my kit! I use it to lightly set my foundation and it transforms my face! I have also used it as a powder foundation for summer days and it is flawless!"
