,Brand,Name,ID,sku,comments
149,avÃ¨ne,hydrance aqua gel,pimprod2020807,2577168," * I got this in a travel size in a gift set and was excited to use it on a long weekend trip. As soon as I opened the packaging, I was hit with the aggressive smell of this product and was transported back to my grandmother applying her heavily scented products in my youth. Since I had no other moisturizer with me, I used it and my combo acne prone skin informed me that I had offended it with the noxiously scented product. My skin was irritated and my husband, who has the worst sense of smell ever, could smell this product through a couple layers of product.

So needless to say, I do not recommend this product. * I had a bad experience with this cream. I have used this brand for many years because its products are made with high-quality ingredients, and it always tries to take care of the skin. But this cream, besides having a horrible and extremely strong smell, filled my face with pimples, made me look like a teenager, and dried out some areas of my face. It was a total disappointment. * loved the way it made my skin feel
but can't get past the strong fragrance * The texture of the cream is very light. I like how it applies smoothly on the skin. But it has a strong baby powder smell and it makes my skin look so greasy after a while. * Love this lightweight moisturizing gel cream. Also my husband always gives me compliments when he kisses my cheek because he loves the clean fresh scent of this cream. * I use several Avene products. I sometimes can't wait for this step in my skincare routine. I just love how good it feels going on.  It locks in moisture without feeling oily, too thick or too heavy. * This gel moisturizer seeps into the skin nicely, a little goes a long way. I have eczema, when it was super raw this did sting a little. The baby powder smell is OK, didn't bother me and I didn't love it either. This gentle yet effective for dry skin days. I love that it's non-comodogenic, for reference I have oily/dry combo skin that is acne prone."
150,beautycounter,countertime mineral boost hydrating essence,pimprod2038167,2606564, * Really enjoying the product.  The most enjoyable experience I've ever had at ULTA.  Jeremy Adam is a valuable asset to your team. * The mineral boost hydration feels amazing on your skin. It smells so good. It makes your skin feel so soft and supple. This is apart of my daily regimen. I am SO excited Beauty Counter has come to Ulta!
151,avÃ¨ne,retrinal 0.05 cream,pimprod2042754,2618818," * This stuff is just *chefs kiss* with daily application at night it has significantly reduced the apperance of my forehead fine lines. I feel so much more confident as a 24 yo in my aging skin. Gentle and effective. Love avene products! Just the best * Let me start off saying I really DO like this! I have 36yo DRY skin and I was getting a little peeling and dry patches from my Rx Tret. once a week, but had zero irritation using this every night! It's a pretty thick cream consistency so not the easiest to spread on its own IMO. I like to use a serum before this Retrinal .5% to help it glide on the skin easier. One pump usually does it, but sometimes I add just a tiny bit more if I feel like I didn't get even coverage. It's definitely a long term product so don't expect immediate results. I DO wish Ulta carried the 1.0 version of this instead of just the .5%. * I just bought this product and I am loving it. I can't speak on results yet but as someone with oily/acne prone  skin, I feel like I finally found an anti-aging product that absorbs well and doesn't break me out. It may feel slightly ""heavy"" at first but it absorbs. Great for sensitive skin, as well! So happy I found this brand * I tried a couple of retinal creams, and had breakouts and/or burning. Having used many Avene products with great results, I took their skin quiz online, and this product was recommended. It is a great alternative to retinol, at a very low dosage so you can start to build use. I've had great success with it, and it is helping with fine lines around my eyes. I can use it every night with absolutely no irritation."
152,clinique,moisture surge hydrating supercharged concentrate,xlsimpprod16101069,2508513,
153,mac,strobe cream,xlsimpprod15921232,2510715,
154,supergoop!,superscreen rich hydrating cream spf 40 moisturizer,pimprod2042770,2617635," * I'm new to the Supergoop product line and  I really needed this Superscreen to work for me. And voila! It did! I have sensitive skin, both oily and dry if that makes sense. This product goes on smoothly, blends in vs. typical sunscreens that never seem to soak into the skin. I will say I noticed a pretty strong scent of sunscreen when I first opened it. Now, just a few days later, I don't notice it at all. I love how this makes my skin feel hydrated but not oily. And it lasts all day. I apply once in the morning after washing my face and same routine at night. * Absorbs easily and great balance of moisture and sun protection for casual outside time. I'd still put another sunscreen on if I was spending concentrated time in the sun. * I originally received a free sample and fell in love. I ordered the moisturizer and it is not the same at all. My face started stinging and itching after the second use and it doesnt go on as smooth. * i loved this product for so long, but didnt realize that it what was breaking me out. i tried a different cleanser, added an exfoliater etc. NOTHING would get rid of the harsh bumps all over my face. not until i researched and found out it had safflower it in which (can) support fungal acne. i have dry, sensitive acneic skin so this may work for others but definitely not for me. very disappointed and wish i found out sooner. not even 3 days after stopping this product, my skin is clearing up. * I used to be a big fan of the Superscreen Daily Moisturizer, and although they kept the packaging the same, they changed the formula and the name to Superscreen Hydrating Daily Cream. I think brands should be more transparent about informing their customers that they're actually buying a different product than what they're used to. The consistency of the new cream is thicker and harder to spread, but what stands out the most to me is the smell: somewhere in between Play-Doh and generic baby sunscreen. My partner has sensitive skin around his eyes, and the old formula didn't cause him any burning, but the new one does. I wouldn't buy this again. * I bought this because it had avobenzone but no octocrylene (at the time). Great texture but I reacted badly to something in it. Guessing it was the algae because I've used the other ingredients before without issue. * DO NOT BUY new formula is horrible. Not the same product whatsoever. Why ruin a great product everyone loved?? Makes no sense. Ive gone through at least 10 of these moisturizers and now i will no longer purchase. And the new scent is a crime against humanity."
155,neutrogena,hydro boost hyaluronic acid water cream - fragrance free,pimprod2041040,2615560," * I have a super dry skin as well as eczema and this is the first moisturizer that is so mild without causing any issue as well as keeping my skin fresh and vibrant throughout the day! Thanks for a great product. * The water cream made me break out. The gel works much better for me. I will go back to that formulation. * I like this cream it goes on smoothly. * The results I've noticed after 3 weeks of using this are truly amazing. My skin has never been this soft or smooth. I've also noticed the darkness under my eyes has drastically changed, which I was not expecting. This should be a staple in everyone's skin care routine especially in the winter months! * Tried this product because it was half the price of the one I usually use ( Peter Thomas Roth) This left a very greasy film on my face. * I had used what I now can call the old formula, and did like how my skin felt. I was recommended by my esti to try another brand, but it was just too expensive to continue so I decided to go back to the Neutrogena. Sadly, the formula has been changed, and it is not at all what I experienced previously. I am not experiencing the redness and irritation that others are reporting, but my skin is not moisturized and looks dry and lifeless. My search for a new product begins. * Horrible. This new formula is simply horrible. It dries out my skin, makes it irritated, and leaves a weird greasy film. It pills like crazy and makes my skin horrible. I miss the old formula! It was perfect and always made my skin feel plump and soft. I swtiched to a higher end brand which is working now how this old neutrogena formula used to. Im incredibly disappointed in neutrogena and this product."
156,estÃ©e lauder,resilience multi-effect tri-peptide face and neck creme spf 15,pimprod2002477,2540080," * I would never have bought this on my own since it seems to be marketed to a bit older than me (I am 39), but it came with something else I bought so I tried it out. I LOVE IT!!! It blends GREAT (especially for a product with SPF), isn't greasy, doesn't make my skin oily or shiny, has not caused a breakout, and I can see a clear difference in the moisture level of my skin in just a few days. Anti-aging creams normally make my skin totally freak out, but this one is all good, no bad. Really glad I happened upon it! * This contains Avobenzone, Octisalate, and Octocrylene....FYI * I joke that this is my old lady face cream because it smells like a bouquet of roses. However, it really does give the skin a lifted appearance and tightened feel. The daytime version has some SPF and wears nice under makeup. I wouldn't recommend for sensitive skin because of the fragrance. Also, I noticed on very dry winter days the product does not have enough moisture for my skin * I received this as a sample size from Estee Lauder and I can't wait to buy a full size. This is why I love samples, It lets me fiind out what I love without spending a fortune first.  It has the faintest fragrance that is subtle but lovely. It goes on so smooth and is just pleasant to use. My only complaint is the price. Some of us would buy this brand more often if we weren't priced out of the market. This is why I gave it a four. Otherwise, a five all the way. * This smells like febreeze and it doesn't go away when you rub it in :( save your monies * I use this product daily.  It keeps my skin hydrated and smooth. It did not irritate my skin, which can sometimes be an issue for me.  Makeup base glides on smoothly over this moisturizer.  It is my absolute favorite. * I wish I could use this product as it seems to work well. However the fragrance is too strong and irritating."
157,dior,capture totale cell energy - firming & wrinkle-correcting cream,pimprod2036822,2604977," * I was really hoping this would be my ""go to"" wrinkle cream however it is not. I just finished up the container and have seen absolutely no difference in my skin. For this price there must be something better out there! * I use this morning and night along with the face and eye serum (same brand) followed by sunscreen (only in the morning). I can truly say that this stuff along with the face and eye serum works. I used to have very dry skin, but not anymore. Also, the hormonal acne I get occasionally is under control. Lastly, the wrinkles are diminishing. Totally worth every penny. * I see smoother skin , brighter skin , less fine lines and an overall younger look * I do love this product, it's true to all things advertised - A little bit goes a long way as I purchased this a few months ago and still have more than half of it left. I did not want to write a review until I was certain I was satisfied based off of the huge expense... 

that said, I wish the product was a bit less expensive because I have tried other product lines that do the same job without the extra $$... but then again, you are paying for the name"
158,bareminerals,smoothness bare haven soft moisturizer,pimprod2015694,2564097," * I love how soothing and light this moisturizer is. It helps with my eczema and doesn't leave a greasy residue or shine. The smell, for me, is another plus since I think it smells pretty good. * I have used Bare minerals for years but dont know how i missed this soft moisturizer! I have tried so many. This is the one! * I have very dry and easily irritated skin. This is the only moisturizer that hasn't caused irritation and keeps my skin from getting very dry. * I've been using this for 3 months now and it has left my skin so soft and even. This is by far the best moisturiser I have ever used. * very soft and moisturizing. clean scent. * I love the feel of this product and my face misses it when I don't have it. * This product has always been in stock whenever I'm ready to purchase it."
159,vichy,mineral 89 hydration boosting kit,pimprod2043517,2620409," * I've tried a few dozen moisturizers over the course of my life and I liked some and other I haven't but I've never LOVED anyone of them until now. My skin feels so hydrated, supple and refreshed. It's always budget friendly compared to others I've paid for. * I've been using this product for almost a year. Love it! Very moisturizing without a greasy feel. I've noticed much improvement for fine lines. Does not irritate my skin at all. * Been using this product for over two weeks and following the directions implicitly, yet I have seen no signs of improvement. * Really liked the way it went in my face so smooth & moisturerising, definitely but it again * I bought this on sale, wow I use medical grade skin care expensive 🙃 
nothing compares with this.
I mature 54 yes dry rosacea and this was is luxury on my skin
highly recommend 👌 * It's perfect for all skin types * I absolutely love this combo both are so hydrating & I have very sensitive skin but it doesn't cause any irritation 5 out of 5 for sure"
160,murad,hydro-dynamic ultimate moisture,xlsimpprod2390225,2544836,
161,dermalogica,super rich repair moisturizer cream,pimprod2024953,2580597," * I recently moved from somewhere that is constantly hot and humid to a place with real winter. This moisturizer is a game changer! I was starting to get cracked dry skin all over my face and within 4 weeks of regular nightly use my skin looks and feels fantastic. It's the perfecr winter moisturizer. * I do love the product however the design needs to be changed too much waste in a pump design * This is the best facial moisturizer ever!  I ha e been using it for years and there's nothing like it!  My skin feels so hydrated when I use it! * Dermalogica's Stabilizing Repair Cream -that was gifted by Dermatologica- is a game-changer for sensitive skin. Its balmy texture melts into the skin, providing instant relief from redness and irritation while strengthening the skin barrier over time. Key ingredients like Ceramide-Building Complex and Centella Asiatica help the skin build resilience, lock in moisture, and improve firmness. Free from artificial fragrances, this formula is perfect for sensitive types. Clinical results promise visible improvements in just one week, making it a must-have for soothing and repairing your skin. * I love this whole line of products.  This product goes on smooth but not heavy. * I used to work for this brand and im just in love with this. I missed it so much. It feels so good for my skin. I love using this in the winter time at night, i never have dry skin with this. * I love Dermalogica products and this Super Rich Repair is top of the line. Great for anti aging; thick and creamy but absorbs easily enough. The perfect nighttime cream for me!"
162,cocokind,resurrection polypeptide cream,pimprod2037614,2605570," * When I first opened it, I was disappointed by the glue like texture and smell. This literally smells like the elmers liquid glue used for crafts in elementary schools. However, I tried it as a night cream for a couple nights and got great results. It didn't irritate my sensitive skin and even helped calm the reddness I get on my cheeks. It meets the balanced of being a thick winter moisturizer without quite being heavy enough to clog pores—least this is my experience as someone with dry skin. It worth trying if you have try skin and need an affordable moisturizer. There are still better option on the market if you are willing to spend more money but this is a great value. * Amazing for my dry skin. With all the products out there it can be rare to find something that has such an immediate effect. The consistency is WEIRD but it truly absorbs super fast. My skin is hydrated and just seems to have a subtle glow. I do recommend having a somewhat consistent cleansing and exfoliation routine w this to help the product really sink in and not trap dead skin. Right now I only use it as an overnight moisturizer but it has been okay under make up if you give it real time to settle in and ""dry down"" 

I will be repurchasing! * I originally got this as a night cream because it's marketed as a heavier moisturizer, but it just didn't cut it overnight for me living in the desert with dry skin. It'll probably be great for people with oily or normal skin overnight. I made this my day moisturizer and it's lovely! Moisturizing without being greasy and my skin tolerates it well. This will be my winter day time moisturizer moving forward. * Because this is advertised as a heavier, winter cream I really thought it would be greasy on my skin. I was so wrong! It does feel a little thick but it rubs in well and absorbs better than any cream I have ever used. I have oily skin and that has even improved a bit. This is my new favorite face cream for daytime use. I will absolutely buy it again. * I was looking for a new night moisturizer- something with a thick consistency. This is definitely thick but kinda…waxy? Not sure how to explain. So i dont love the way it feels on my skin and i didnt find it to be deeply moisturizing. I tried patting it, fully blending, and also just setting it on top of the skin. Didnt do much for me. Just very basic moisture, yet also would be too much to just put on in the morning. Good packaging, smelled nice, and didnt break out my dry, sensitive skin * It reminds me of a mask you would put on and then wash off. Its very rich and thick but its great for these winter months with the cold dry air. I would purchase again for a winter time night time moisturizer. * Very thick cream; trying to use as a nighttime moisturizer but determining the amount to apply isnt easy.  Even a thin layer tends to peel.  Just sort of sits on the skin"
163,cerave,travel size daily moisturizing lotion for balanced to dry skin,pimprod2017446,2559602," * It is a good size for traveling. * I have been using this facial cleanser for quite a few years and have no intention of stopping. It never dries my skin out and lathers enough to leave my face feeling clean and refreshed. I just turned my husband on to this, too, because he ran out of his facial cleanser and told me that bar soap was making his face feel too tight and dry. * soo good,its my holy grail and i use this everyday * I always use this face wash. It's tried and true. A staple that I use all year round! * This product cleans your skin without drying out your skin. * It's not as gentle on my eyes as Cetaphil. It cleanses makeup just as well, but I do like a one-step cleanser (rather than having to use an eye makeup remover) and this does sting the eyes, just a tad. I'll stick with Cetaphil until I find a better alternative. * Truly an awesome facial cleanser. Someone I know has rosacea on his face and this product is one that helped calm down redness and irritation. Very non-stripping and gentle. The only con I can think of is that it doesn't foam (I prefer foaming cleansers). Very affordable, especially the value size because you get double the amount of product that the regular size contains for only a few bucks more. Great cleanser!"
164,fresh,black tea anti-aging ceramide moisturizer,pimprod2036988,2603047," * At first i liked it, but this product is extremely overpriced. I didnt notice a difference in my skin and it started to smell awful after a month * Hands up the best moisturizer for dry, aging skin. Incredible all-around. * I did a ton of research snd was super excited to try this eye cream. I have very dark circles around my eyes and I was thinking this product would help with that. Unfortunately when i put it on, it makes the skin around my eyes buuuurrrrn. My eyes also arent that much more moisturized for such a thick cream. If you have sensetive skin, dont buy, its burns and is too expensive to try. 

Also, the deeper i dug, the more reviews i found that were written by people who were traded the product for free in return for a product review. Should have done more research…. * I did a ton of research snd was super excited to try this eye cream. I have very dark circles around my eyes and I was thinking this product would help with that. Unfortunately when i put it on, it makes the skin around my eyes buuuurrrrn. My eyes also arent that much more moisturized for such a thick cream. If you have sensetive skin, dont buy, its burns and is too expensive to try. 

Also, the deeper i dug, the more reviews i found that were written by people who were traded the product for free in return for a product review. Should have done more research…. * It makes my skin feel so soft, without being greasy at all, and makeup easily goes on over it. Only a small amount goes a long way * I am in love with this line, specifically this face cream and the eye cream. I have gone through two jars so far. I also use it on my neck and have noticed more of a difference there than on my face regarding tightening of skin. The cream is fairly light on the skin and is deeply hydrating. I ran out for a week and noticed an immediate difference! It can be a little shiny when combined with sunscreen and makeup however at night it just makes my skin glow. I am 48 and starting to battle some hormonal acne around my chin and mouth area so I have to avoid putting the cream around those areas. If I cant help myself (because it feels so good) I just get a few microscopic whiteheads that go away by the next day. * I love this cream. It feels so smooth. Going on. Has a beautiful texture. I noticed my skin is very vibrant after I use it."
165,kiehl's since 1851,super multi-corrective anti-aging face and neck cream,pimprod2018365,2589390," * Made my nose and cheeks have a burning sensation. * Made my nose and cheeks have a burning sensation. * This is my must have product.  Have used it a couple years now.  Non-reactive on my sensitive skin and feels wonderful on.  I believe it has made a difference in the texture of my skin and improved my neck wrinkles. * Finding the right skin care routine is never linear since it varies person per person. I have sensitive combination skin and I always struggled to find a product that didnt give me that greasy glow. 

This product is light yet hydrating enough that it doesnt require a lot of product. While the price tad is high, the big container last me 2-3 months depending on the weather. 

I would recommend you get a sampler size and try it out for 3 months because you wont see any instant results. After 6 months of using this product, it cleared my blackhead and slowly seeing results in other areas. * I have been using this multi corrective face cream since its arrived on the market, Im 52, it has been a game changer since i traded up from their daily moisturizer( in which i stared at 30. It doing what it needs to do, im not getting wrinkles or dry skin and i use it alone & under make up. I'm often asked if im 35 so i have to give some credit to kehls for it. I love the line, its fine quality and i will never waver! * I bought this after many great reviews. I used it around 10 times and thought it was sunburn because I was red and sore. I switched to e45 then another brand and I was fine. I then tried it again after a couple of weeks and it stung my face again! I usually don't have sensitive skin and I'm gutted I spent so much and now can't use it * Every single thing on my face 'balls up' when I use this moisturizer, including when I use it alone.  It does not absorb into my skin, but just sits on top. I've tried it in so many combinations and it's just incompatible with other skin care and foundations (I've tried several foundations -high end & low end- with same results).  I've also tried using it with serums, different primers, different sunscreens and alone with the same result. This is a hard pass for me."
166,mad hippie,face cream,xlsimpprod18731231,2530013,
167,clinique,dramatically different hydrating jelly moisturizer,xlsimpprod18711071,2531785,
