,Brand,Name,ID,sku,comments
238,dune suncare,the mug guard broad spectrum spf 30,pimprod2039109,2608975," * I like it! It's a small bottle, but, I like it! I think it lives up to it's claim: my face appears to be smoother, feels softer. * Bummer that this is now 5 mL smaller than before but costs exactly the same. * Not great for sensitive skin. I love a milky SPF for layering other products but even with a heavy moisturizer underneath it dried my skin and caused peeling and flaking * I go through sunscreen like its nothing because I tend to burn easily. This one is lightweight and comfortable. I wear it under makeup without any problems like some cause. The only downside is the price for the size youre getting, but otherwise I love this product and will be buying it again. * I love the texture and feel of this sunscreen and it doesn't cause acne for my very sensitive skin. Downside is it goes quickly and the price point is too high. * I have sensitive, dry skin. I'm newer to using sunscreen daily. I researched many brands and this had great reviews, so I bought it hoping for the best. Using it over my serums has helped them work their magic. My dark spots have eased up and my expression lines are less prominent. My skin is more hydrated and plump. I plan to keep using this because ""if it ain't broke, don't fix it"" and it works perfectly for me! Also, sometimes when I introduce a new product, my skin has a bad reaction (redness, irritation, breakout) and this sunscreen has not caused any negative reactions. * It is not as good as people are saying in the reviews. Yes, it blends out well but it just stays on top of your skin and leaves you with a greasy feeling. Also, for the price… definitely not worth it. I couldnt even finish the whole bottle because it was breaking me out so bad. Some people are saying its good for people with acne prone skin but as someone with acne prone skin, yeah it is not it. I gave it to a relative because i didnt want to be wasteful and even they didnt like it and theyre honestly not that picky with their skincare. Korean sunscreens are the way to go especially if youre acne prone and the prices are a lot more cheaper!"
239,strivectin,advanced retinol nightly renewal moisturizer,pimprod2026692,2582803," * Tried them all…  This is the Best Choice  Lifts, hydrates, softens, brightens and reduces pores! * I can't say enough great things about this wonderful night cream I adore Strivectin and this moisturizer is my night cream of choice I know that when I use it I'll wake up to glowing , firm & overall better skin * Good! Love it * My skin feels smooth and moistureized. * This is my night cream ever night.  It works, It does not irritate my skin. What's not to love about that? * I received a sample of this and did wear sunscreen during the day. The first night it went on everything seemed fine. It went on with no problem. The second day I felt a little tight itching? By the third day I started seeing peeling around my nose and my face felt itchy and burny. Not an overwhelming itch but enough to recognize I'm having a bad reaction. Peeling, itching and a slight burning sensation. I didn't use makeup the first two days but when I put makeup on the third day, it went on blotchy and I could see the irritation on my cheeks, mostly below my eye area. I'm Pacific Islander, NC30 and in my 40's, sadly this product is not for me. * Product is usually good. But got a bad batch and felt bad so I didn't bring it back.  Cream is old and had been sitting on the shelf for a while."
240,clinique,repairwear laser focus wrinkle correcting eye cream,xlsimpprod12991075,2291706,
241,first aid beauty,hello fab coconut water cream,pimprod2029973,2589261," * I am repurchasing because i love how this makes my skin feel when i wake up in the morning. I do two layers before going to bed, its so good! I also enjoy the smell as well and its not too overpowering. The price is ok and I enjoyed it more than the Tatcha water cream I tried and its a lot more expensive! * I recommend this product to EVERYBODY. This stuff right here has completely changed my life. I get compliments on my skin all the time since ive started using this in 2022. I will never stop using it!!! * I have used this product every day, twice a day since 2017. I absolutely love it! It is lightweight, dries down smooth, and helps hydrate my oily sensitive skin. I would cry if FAB ever discontinued this product. 1000% would recommend. * This is a great moisturizer super lightweight better for like oily or skin types. But I like it as a quick little water cream to add to whatever else I'm using for the day. Smells delicious and love coconut so for me, this is a must have! * This product is amazing, it's so light weight and smells amazing. Would definitely recommend * i really loved the product and how it made my skin feel but i went thru the whole thing in one month!!! i can't be buying this every month for that price :/ * If you have acne or just skin in general you NEED this is in your life!"
242,clarins,super restorative day moisturizer,pimprod2033883,2598903," * The price tag is a whopper but this moisturizer is the best I have ever had. * don't buy if your skin is sensitive! it burns every time i use it, and i've been using it for a little over a month. just be cautious. it does make my skin look and feel beautiful AFTER the stinging. * My skin looks and feels so much better!"
243,good light,order of the eclipse hyaluronic cream,pimprod2033460,2597528," * my fav night moisturizer. i have sensitive/dehydrated skin and it is perfect for it, not perfume scented and has really made a difference in my skin. i've purchased twice and recieved as a gift from the bf :) will continue to rebuy for sure. * I was attracted to the packaging and the name of this cream, so I decided to try it. It's nongreasy, unscented formula glides onto the skin smoothly. It's lightweight and is great for morning and night use. I like it so much that I went back to buy more ""good light"" products! * My new go to moisturizer! I have sensitive combo skin and my skin just loves the hydration this leaves all day. My skin feels so soft and healthy after using it. Nice enough in the summer alone but even better for the fall/winter in the midwest over their abc oil. Fragrance free too. * I really like this face cream for the winter. I live in a high desert climate and have combination skin; this isn't great for all year long but in the winter it's perfect especially after a day outside in harsh conditions. Definitely not lightweight and would be too heavy/ oily for someone with oily skin or in a humid climate but it's great when I need it! As a bonus, I love the packaging. It's not my holy grail and it's more expensive for the size than some other creams that do essentially the same thing but it does it's job well! * Im very picky on what i use on my skin, and this is my holy grail!! I just purchased my 4th bottle today. Its thick and will last all night keeping you moisturized. Its light scented as well! The bottle isnt super huge and its a bit pricey but definitely worth it! * This moisturizer is nothing short of amazing! Perfect! I've tried them all. This is rich, thick, and best of all..no scent! This pairs so nicely with the milky toner and my retinol and vitamin C regiment. * This stuff is by far the top budget-friendly cream I have purchased! It rivals the ones that are over $100."
244,bliss,drench & quench cream-to-water hydrator,xlsimpprod17921136,2524145,
245,clinique,travel size dramatically different moisturizing face lotion+,xlsimpprod12481037,2289601,
246,peter thomas roth,peptide skinjection moisture infusion cream,pimprod2043797,2620555," * I like it and I'm very picky! Texture not as creamy as I like, but it is a very good moisturizer! * Love this cream best moisturizer light and hydrating. * Wonderful moisture infusion cream! Peter Thomas Roth is the best! * I was skeptical at first, but have noticed less wrinkles under my eyes and my makeup applies smoother * Amazing peptide complex and anti aging results * I splurged on this product as I felt my skin needed just a good moisturizer that locked everything in and protected it. The product is heavier than most but I feel it does a great job of hydrating my skin. The biggest con I have is the blue painted lid on the jar peels and leaves blue fragments of paint in the product, thus it going on my face. My fingertips are physically blue after simply unscrewing the cap. It actually concerns me because you never know what companies are using to manufacture their products. Disappointed with such a high price point. * Ive been using PTR products for 10+ years and my skin shows amazing results from the use of these products over the years. I'm a satisfied customer for life."
247,cetaphil,"moisturizing lotion, hydrating body moisturizer",pimprod2028656,2605916," * Broke me out * I haven't used it on my face, however I did on my body. It is thick but glides into skin. I agree with others it's a little tacky feeling but subsides fairly quick. That being said I give it 4 stars. My skin after a few days is more hydrated and healthier looking. * As someone who is always looking for the absolute most lightweight possible lotion, this is a great option for keeping winterttime dryness away without feeling weighted down. Otherwise, it would be a little bit too heavy for my personal taste during warmer months. * As someone who is always looking for the absolute most lightweight possible lotion, this is a great option for keeping winterttime dryness away without feeling weighted down. Otherwise, it would be a little bit too heavy for my personal taste during warmer months. * My son uses this products and has great results! * I was excited to try this out but fortunately it didn't work out for me. It's not for oily skin it feels greasy and it clogged pores * The best moisturizer I've tried for my dry, acne-prone skin. It leaves a beautiful glow and feels good on my skin. A little goes a long way so I don't have to waste all the product trying to not feel dehydrated. It's perfection in a bottle I'd recommend it to anyone."
248,hero cosmetics,clear collective clarifying prebiotic moisturizer,pimprod2030350,2591989," * I've tried many moisturizers (high end & affordable) for sensitive/acne prone skin and this is by far the best moisturizer, especially for the price! I use this with hyaluronic acid, niacinamide or salicylic acid and it pairs well with all my serums and sunscreen. This is also great under makeup since it's not oily and helps makeup last longer. I've repurchased this moisturizer at least 4 times and I always have a backup! * I love that this moisturizer is buildable. You xan relaly control how much you need. It feels great on my skin and my skin is noticeably more plump. I love it! * I am acne-prone but need a moisturizer for skin dryness, especially during the winter when the cold wind easily dries out your skin. After using this moisturizer, I have had several instances of bad luck with getting a new pimple the next morning. The texture and application (no burning) of this product are fine. It does its job to moisturize the skin. However, not without suffering more blemishes sadly. I picked this while trying to find noncomedogenic moisturizers with clean ingredients according to Yuka, but my mom helped point out to me later this has vegetable oil in it… Cool! 🙃 * its just perfect and a little goes a long way * I dont really know what people are saying about this product, most people are saying its lightweight and non greasy but it feels so heavy, sticky, and greasy on my face, maybe just not for me but I won't be buying this again * I have sensitive skin and this works well for me. Love that it isnt too heavy on my combo/acne prone skin * I was hoping this product would work well on my acne-prone skin, but it doesn't seem to do much for me. It doesn't absorb very well into the skin so the more you use the more ends up sitting on your face. The claims about this moisturizer being pre-biotic don't seem to mean much. Hero specializes in products for acne and acne-prone skin, so I assumed this moisturizer would work well in my routine and be hydrating but I was disappointed."
249,roc,retinol correxion deep wrinkle targeted patches,pimprod2037326,2605694," * I love love love this product. I have deep forehead wrinkles and this has helped soo much. * I wore these overnight like instructed and when I took them off in the morning I had much more pronounced and deep wrinkles. I look 15 years older. Literally does the opposite of what it's suppose to. Now I'm just praying these new wrinkles fade. * It's just temporary, so keep that in mind. * These are not very strong and theyre small. If you havent tried ""frownies"" i suggest trying those. Theyre cheaper for a larger quantity and better results. * I tried these on a few spots on my face, under eyes, smile lines, and 11 lines on forehead. I honestly wouldnt bother using these under your eyes because the adhesive is so strong it pulls at your skin even with wetting them. They did work well on my smile lines and 11 lines but they just soften the wrinkles, my results only lasted about 1 week. Personally I'd invest in a good quality eye cream over using these patches. * I love this idea and if it worked it would be cool but they don't stay on - followed directions to a ""t"" and still fell off within the hour. Returned them to the store as defective * comes off if I move my face :-("
250,estÃ©e lauder,daywear matte oil-control anti-oxidant moisturizer gel cream,xlsimpprod15401049,2502687,
251,cosrx,oil-free ultra-moisturizing lotion with birch sap,pimprod2035883,2603881," * I'm 46 with combo/dry aging skin. I've used $100.00 K-Beauty moisturizers, Estée Lauder, Lancome, Tatcha, Glow Recipe, etc... I bought the COSRX Oil Free Moisturizer in a pinch and actually like it! I use the Kate Sommerville Eradikate daily cleanser with my PTR Soniclear Elite followed by Mamonde Rose Toner during the day, (Ordinary Glycolic Acid 7% Exfoliating Toner at night), Hanskin Essence, Peach and Lily Good Acids Copper Peptides Serum, Kiehl's 🥑 Eye Cream, and the COSRX Moisturizer  as my final skincare step. I like how light it is, the price point, the volume of product, the consistency, & how long the bottle lasts. Its travel - friendly and good for all skin types. * This moisturizer is great for the summer or daytime, but personally its too lightweight for my combo skin. Its more hydrating than moisturizing and has a gel like texture. I gave it to my roommate who has oily skin and she loves it * It has helped me a lot with managing my breakouts along with clarifying toner. They really are a great combo to use. All the ingredients are clean and i havent had any type of allergic reaction. Ive scanned it the bottle for acnegenic and condemenic ingredients and it had none and then i also scanned it for toxins and it had none. Overall i would recommend to anyone unless they're specifically looking for a matteifying moisturizer. This oil free moisturizer gives you a slight sheen and glow. * New favorite! This has been amazing for my combo skin. My skin stays hydrated all day long but doesn't get oily. Great as a base layer under make-up, doesn't pill. * lightweight moisturizer , made skin smooth  , I Don't Think this moisturizer won't break you out !!! * i love this moisturizer, its perfect for layering! especially for skincare routines & when applying spf and makeup * I initally didnt like this mosituriser as the birch smell is a little odd…like a tree. But i reallt liked the lightness and the way it absorbs. So ive gotten use to the scent. This is the perfect day moisturizer as its light and absorbs well. I have dry somewhat sensitive skin. This product hasnt bothered me. I will definitely keep it in my routine"
252,juice beauty,green apple age defy moisturizer,xlsimpprod3670099,2236871,
253,kinship,supermello hyaluronic gel cream,pimprod2017767,2569973," * I wanted to love this product! The smell/texture is lovely.

Unfortunately, while sporting a ""clean ingredients"" tag and a tag from the national eczema association, I found the product to be highly irritating when I had a flare up. I only used it once during that time, and then after taking a second look at the ingredients, I found out that ""phenoxyethanol"" is a known potential allergen, irritant, potential endocrine disruptor, and the manufacturing process is highly polluting. In other countries the ""safe"" threshold for this ingredient is 1%, but it's hard to determine how much one is exposed to if applying daily/multiple times a day. Of course, there is no such regulation in US, so who knows how much is in this cream. 

At the same time I bought this, I tried products from cocokind which I highly recommend! They have a great price point and really are ""clean"" from what I have used so far, although one should always do their own research. While I was still having an eczema episode, I found using a homemade oatmeal paste + cocokind's chia seed oil was very helpful to get me through the dry itchiness. 

TLDR: not a clean product, could be irritating, check out cocokind. * I've been being treated for cancer for about a year and a half, now. Almost 6 months of that has been chemotherapy. Most products cause acne and rashes on my skin, since being on treatment. 
Pros: Did not irritate my overly sensitive skin. Smells good. I don't understand all the complaints about the smell. It is light and nice. It is kind of like marshmallows, but better. 

Cons: it moisturizes, but not enough while going through chemo. It feels great when I first put it on. But, after a few hours my skin feels tight again. Kind of like how vaseline can trick you into thinking your skin is moisturized at first. Hours later the surface of your skin feels tight and dry like a sunburn ready to peel. 

For the price, thete are much better options. Philosophy moisturizers are a lottle cheaper and give better longer lasting results for me in terms of moisture. * This is my 3rd time repurchasing this moisturizer. Unreal/ must try! * I do not want my face smelling like vanilla frosting but it did the whole time I used this. My fault but I'd literally have to hold my breath * Earlier this year my dermatologist informed me I have seborrheic dermatitis. I've been using ketoconazole shampoo which definitely helps but I still found myself needing to use cortisone cream on my face (gross!!). So I was researching moisturizers good for dermatitis and while Supermello isn't specifically marketed for dermatitis (it does list eczema) I thought it sounded like it may help. I am SO GLAD I gave it a chance!!!!! its been about 2 weeks now and my face is looking the best it's looked in several years. Patches that I thought were stubborn acne have been clearing up and are almost totally gone. the hydration level us just right so I feel moisturizes but don't get greasy as the day goes on. It does smell REALLY lovely with the light vanilla/Marshmallow aroma. Definitely worth trying if you have skin conditions that make you red/itchy! * I got this as a sample and wowww the smell is so good! It's very creamy so a little goes along way! Im so happy I got it as a sample because now Im definately buying more. I love this brand and it also makes my skin glowy and so soft. I love how my skin feels I usually use their Vitamin C then put on this cream and it leaves my skin poreless and soft. * My skin burns from water, I swear. I am incredibly sensitive to everything. My skin chaps, get red and raw, itches and burns. I have tried most of the major 'sensitive' skin moisturizers high to low end, and this is the absolute winner. Keeps my skin moisturized and smells great. I have found it does not do well under makeup so I only use at night and for the first time, thats enough moisture for me."
254,osea,seabiotic water cream,pimprod2027013,2587124," * This cream feels nice on the skin at first and has no discernable fragrance. Over time it started to sting my skin, caused the worst break out I've ever had and made my skin red and puffy. I have no allergies. * It's a gear product, I just wish it came in a 2.0 Ounce pump bottle like the atmosphere protection cream! * This is a lovely cream, it feels light on my skin. I use it at night. My skin feel soft and hydrated in the morning. I especially love that it is cruelty free. * This is my go to day moisturizer. Keeps my skin hydrated all day without being greasy! * I've used this moisturizer multiple times. It's a great Summer moisturizer, light and refreshing. Lasts about 2 months. * I cant get over the smell! But overall great hydration!! * Love this one! I use it as a day cream.It hydrates wonderfully abd it does not have a bad smell"
255,exuviance,daily corrector spf 35 face moisturizer,pimprod2010411,2554760," * I have sensitive combination skin with an oily Tzone and everything else staying pretty dry. This moisturizer is the first perfect combo of moisturizer and SPF I have found without it making my T zone worse or my chin flaky! Def buying another tube! * I have and oily T section and my skin becomes especially red or dry around my cheeks and chin right before my period. I've tried a lot of SPF and finally found one that doesn't leave me ultra shiny and oily.  I really like this product and will keep using it! Only downside is that I think some of the oils in the product settled and the last couple of uses did leave my skin somewhat shiny but other than that, my skin was left soft and even toned! * Contains harmful chemicals that damage our coral reefs. Please make smart consumer choices, this sunscreen is not environmentally safe and my face broke out when using it :( * this sunscreen gave me such a healthy glove, and my skin did not feel oily or greasy at!!!! I used to have the Laroche poosay (I hope i spelled it right) sunscreen, and it would make my skin shiny, but it all oily. I have normal skin and I really love this product. * I'm in my 30's and have always had acne prone, oily skin. A few years ago, I was able to clear up my skin with a strict morning and night routine that includes prescription creams, but every time I would try using SPF, I would immediately break out. I've tried dozens of prestige and drugstore brands! This moisturizer with SPF is the first that hasnt caused a single breakout. I've been using it for over a month now and I will continue to as long as its on shelves. * This product is okay as a moisturizer and sunscreen but leaves you shiny looking. It also does not work well under makeup at all. I learned the hard way after I was almost completely done with my makeup and it began lifting and leaving ugly peeling patches when i used a powder brush. For the price, theres way better sunscreens out there. The murad sunscreen in a blue bottle is about the same size and the same price but works amazing. * I switched to this sunscreen and my pores and oily skin were controlled also my skin felt amazing! I could t rebuy it because I was pregnant but whenever I get my hands on this again I would gladly stick to this only. The only con is the size and price"
