,Brand,Name,ID,sku,comments
0,clinique,moisture surge 100h auto-replenishing hydrator moisturizer,pimprod2021615,2576544," * Love the gel like feeling lightweight but moisturizing, great under makeup too . * Very light feeling but super hydrating * I have dull dehydrated skin. This moisturizer works wonders. Ik it's a bit pricy but it's worth it. My makeup was not patchy or pilled after applying this. Absolutely loved this! * Very cool and hydrating all day long. * I have been hooked on this product for years! Found it theough a free birthday sample and fell in love instantly. I have always struggled with dry skin and im on accutaine and this was my first step into a better moisturizer 
- pricey: for those who only buy during huge deals its worth buying in december get the biggest tub and it should last you until next december at least you shouldnt need a crazy amount
- moisturizer: genuinely my first ever ""makeup"" product and its great I havent needed to find anything else its amazing
- dryness: got rid of my dryness within a week and im a die hard fan * Best moisturizer that I have ever used—very light weight, cooling, refreshing, a little goes a long way,and just feels so great!  I often find myself saying ""aaahhh"" after I apply—my face feels that good!!! * Reducing some of my dry patches."
1,bubble,over night hydrating sleep mask,pimprod2035928,2600876," * When applied this felt like more of a skin tightening mask. I did ""feel"" it on my face but after a few minutes it went away. I do like the way it feels on my neck though. 
I like the packaging and the amount of product for the price. * I am very sensitive and dry. This product helps my face feel plump in the morning and gives it hydration. I am on my third bottle and I have not had any irritation. * Amazing pls buy * I love this sleep mask! It is so hydrating, and makes my skin super soft the next day! I love how you don't have to wash it off too! I would definitely recommend this product! * My daughter loves her skin care routine!! * I just love it moisturizer * No problems here! This feels fantastic. Deeply moisturizes without being too heavy or thick."
2,la roche-posay,toleriane double repair face moisturizer with niacinamide,xlsimpprod16011007,2509730,
3,philosophy,hope in a jar smooth-glow multi-tasking moisturizer spf 30,pimprod2037931,2605578," * My go to facial cleanser for many years. Definitely recommend. * I use the cleanser every day and I still have some left after two years. I love the cleanser. It leaves my skin smooth. * Not as good as Lancome facewash but almost. * Ive been using this cleanser for years and am in love with it. My moth bought it fir ke as a teenager when i struggled with acne and it was one kf the only skjncare products that actually helped. I just love how my skin feels arter using it. I like that it doesnt really foam. Its like a oil cleanser snd water based cleanser in one as far as skin feel. My skin alwasy feels nice after using * I always have to have this cleanser on hand for removing eye make-up. It takes off mascara, eyeliner, lipstick, eye brow pencil and any other waxy type make-up applications, without leaving a greasy film like eye make-up remover. Leaves my face feeling clean and not over striped. It has a light scent that does not linger. It doesn't foam much and is more of a light cream texture. I can wash around my eyes and eyelids then rinse without, eye irritation. I have sensitive eyes. 
I use a separate foaming cleanser (Tatcha Rice Wash) in the shower with a silicone scrubber for skin exfoliation and a deeper clean. * I'm 71 yrs old and my face has been breaking out. This cleanser has solved my problem. I've been using Philosophy in the shower and body lotion for years. * My skin loves this stuff! Plump, glowy, happy, hydrated skin. I have sensitive, acne prone, combo skin and during the winter time this is my go to PM moisturizer. In the AM I thin it out with a gel moisturizer."
4,drunk elephant,protini polypeptide firming moisturizer,pimprod2028061,2588434," * This is one of the creams that I like to use the most to have good hydration and care of my skin because it has peptides that help maintain natural moisture and protect my skin barrier, it does not contain aroma and the softness is irresistible, also the presentation is very practical to be able to mix with another serum or dye that I want to add, they mix well . Complimentary from drunkelephant * This is such a good staple moisturizer. Eaves my skin feeling really plump and hydrated. I've used it before and it will always be a favorite of mine. Also love the packaging and that it doesn't have an overwhelming fragrance. Gifted by drunk elephant * This lotion is good! I think it's cool how it is to get the lotion out by pressing down on the container to get it out and easily applying it to the face overall I really like this lotion and will continue to use! Gifted by drunk elephant * This protini peptide moisturizer by drunk elephant is amazing! It feels great on my skin and the packaging is really nice! I love how the container is in a pump and the moisturizer itself didn't irritate my skin. Gifted by drunkelephant * Gifted by drunkelephant this amazing moisturizer is good for all skin types. It instantly felt hydrating and plump to my skin. The cream feels so lightweight and does not feel greasy at all. Highly recommend. * I was gifted by Drunk Elephant their Protini Cream and it's a game-changer! It's lightweight yet super hydrating, leaving my skin feeling soft, smooth, and refreshed. The formula absorbs quickly without feeling greasy, and I've noticed a real difference in my skin's texture and elasticity. Perfect for daily use! * This drunk elephant moisturizer is great. I've been using it for awhile now and it's never caused any form of breakouts. It makes my skin feel soft and hydrated. I love the ingredients in this product. Would recommend! Complimentary from drunkelephant"
5,kiehl's since 1851,ultra facial cream with squalane,pimprod2002804,2540233," * I use it as a night cream and my skin soaks it up better than other night creams. It might be too moist for daytime use, so I'd recommend buying the travel size first to see if it's for you, but I highly recommend it. * I have combination skin that is both dry, oily and sensitive in certain areas on my face. i'm so glad I made the purchase and tried it out. I use this product religiously and have seen so much improvement! * My dry skin loves this moisturizer, it also has great humectant ingredients. This moisturizer is amazing, it is my new forever purchase. * Although its a bit pricey, this is my holy grail moisturizer. Does the job and doesn't break me out whatsoever! * I was excited to try this despite the high price. I have combination skin- dry in the winter, but my forehead and cheeks can get oily. This product felt good going on, but my skin, especially my cheeks, turned super red after use and stayed that way all day. I decided to stick with it for a couple days to see if my skin adjusted. Within a couple days of once daily use I had bad breakouts, as well. I'm 41 and typically have clear skin. This also made my forehead extremely greasy feeling, even if I only used a small amount there. I'm going to return it, even though I like the eye cream that came with it as a free gift. * Feels nice & hydrates my mature skin. Works well under makeup. * I have the most sensitive skin and have tried brands from, the outset, first aide beauty, tatcha , inn beauty , sunday riley, etc etc. they all break me out but not this stuff . I glow and my skin is so soft and i never ever break out. Love it so much! Cant go wrong with this stuff!"
6,la roche-posay,toleriane double repair face moisturizer uv spf 30,xlsimpprod15681007,2503390,
7,tula,24-7 weightless moisture day & night gel cream,pimprod2045112,2624255," * I bought this by accident when I was trying to buy the 24-7 day and night moistue. First thing  I noticed was the color, which made me realize I had bought the gel cream. The weightless texure is nice but the smell is absolutely awful. I will not be using this product due to the smell. * I bought this when my previous moisturizer was about to run out. This was on sale and the reviews seemed overall positive. I've used it twice and it's going in the trash. It has a nice, lightweight feel on my skin but the smell is awful. I can't tell if it's supposed to be scented or if it's the smell of just the ingredients but it smells like it's gone bad. There are so many other moisturizers out there that work well, are half the price, and don't leave you smelling like something expired. * Absolutely love this! I never put lotion on my face and just started using this product and I get so many compliments now how nice I look and young. I am almost 45 but I don't look it. * My beauty consultant, Beautifull (yes! that is her name) is the best in the business! I had so many questions when I was looking for a skin routine. I must say my skin is WHAT I WAS LOOKING FOR. She is located in North Texas! * I stopped buying moisture surge (and clinique in general) earlier this year, and searched for a comparable moisturizer all of 2024. Out of the 15 products I tried this year, this has been the best option by far. I honestly think this gel moisturizer is even better than Clinique's because it's fragrance free and 100% cruelty free. So many moisturizers are also too heavy for my sensitive and acne prone skin, but this is so lightweight and absorbs quickly. It's definitely worth the price, and a little goes a long way. * This is so light and so hydrating, it does not leave any sticky residue on the skin and no harsh smell. It cools the face and gives it a nice glow * I'm in my mid 40s, with sensitive combination skin, and this gel cream has been absolutely fantastic!  My previous moisturizer was a bit too heavy, and this one is just right for day and night use!!!"
8,it cosmetics,confidence in a cream anti-aging hydrating moisturizer,pimprod2033684,2598796," * Purchased this for my 23 year old daughter and this is the first moisturizer that doesn't irritate her highly sensitive skin. She approves. I haven't tried it myself though. It is a bit pricey though. * IT used to have a moisturizer I loved.  I didn't see it on the shelf so I bought this one instead based on the previous experience.  It's awful.  It doesn't hydrate all day and when I put it on in the morning and try to put foundation on, it's like...weird and sticky and I have a hard time blending in my foundation.  I tried 3 different foundations, so that is not the problem.  Never buying their products again. * I have been using this moisturizer for years and absolutely Love it!! 
I use to use the nighttime one as well but switched to using this morning & night because it works so well and feels so good on my skin.. * Feels heavy on skin, almost sticky and immediately broke out after using extremely unfortunate because I was really hoping this was going to be great! * Didn't really see a difference, just using it on my chest now * I have been using this moisturizer for a while and it consistently makes my skin feel fantastic and helps any signs of aging. * This leaves my face moist without that oily feeling."
9,tula,24-7 moisture hydrating day & night cream,xlsimpprod18731039,2577530,
10,the ordinary,natural moisturizing factors + ha daily moisturizer,pimprod2007113,2551163," * This is my favorite moisturizer. My skin stays hydrated all day long without my makeup looking dried out or cracked. This moisturizer leaves my skin looking smooth and has the perfect amount of glow to it with or without makeup. I would recommend this product to all my friends and continue to buy again and again. * I have sensitive skin and have been using this moisturizer for a while now. It calms and soothes irritated skin within just a few uses. I pair it with Cold Pressed Rose Hip Oil at night and with Alpha Arbutin in the morning and my skin is radiant. * My every day moisturizer. I'm a fan of pretty much everything The Ordinary and love how my skin has looked and felt. * My favorite moisterizer is the CeraVe one but i wanted to try a new one! This moisterizer is sooo good and works for me! This product is nice and lightweight which means that you can add as much product that you want! It doesn't break me out and has a lightweight feeling! * Had a breakout from this * I thought it was the intention of keeping my skin moisturized, but it does not feel moisturizing at all. It feels drying. And makes me feel like my face is crying for some water, I bought the big one so I'm gonna use it out, but I have to acompany it with a lot of face oil to get that moisture I'm looking for. * I thought it was the intention of keeping my skin moisturized, but it does not feel moisturizing at all. It feels drying. And makes me feel like my face is crying for some water, I bought the big one so I'm gonna use it out, but I have to acompany it with a lot of face oil to get that moisture I'm looking for."
11,bobbi brown,vitamin enriched face base moisturizer & primer with vitamin c + hyaluronic acid,pimprod2025028,2583728," * I tested 3 different times to see if it was really breaking me out and it is! Dont use unless you want acne! * Love it!! * Skin looks smooth glide on smooth. The smell is amazing. This is a must have for any make up routine. * Smells amazing too * amazing primer and moisturizer base! it evens out the texture of my skin! * amazing primer and moisturizer base! it evens out the texture of my skin! * I finally decided to try this product, and I can definitely tell it makes a difference for my make up"
12,clinique,dramatically different moisturizing face lotion+,xlsimpprod10791743,2261902,
13,la roche-posay,cicaplast balm b5 soothing therapeutic multi purpose cream,pimprod2018263,2570171," * im confused cause it felt like i was rubbing thsi product into my skin for foreverrrrrrrr. i didnt really notice any difference in my skin so it wasnt for me * im confused cause it felt like i was rubbing thsi product into my skin for foreverrrrrrrr. i didnt really notice any difference in my skin so it wasnt for me * This product reduced the size of my sebecous filaments that are so stubborn. I only applied to my nose and chin as some reviews mentioned it broke them out. I noticed a few clogged pores but nothing that would detract from this product. You only need to use a tiny amount and this product is so moisturizing! I recommend to anyone witn stubborn blackheads! * I apply this at night before I go to sleep and my hands have never felt softer. While it is a thick product, it absorbs nicely and doesn't leave behind a greasy feeling. Love love love this product and highly recommend! * It broke my face out, but it's really nice for hands when you live in a cold place where it gets in the negatives * Vermont takes a toll on face, arms, hands each winter. Getting in the wood, shoveling the snow, usually during wind and cold, your face and hands takes a beating. I got a chemical peel and the dermatologist recommended this product. It was soothing, absorbed quickly into the skin, and brought relief from itching and irritated skin. I now use it on my arms and hands to help with that pesky thinning skin. * I'm a bit confused as some of the reviews talk about this breaking them out. I've not used it on my face. Only on my hands and absolutely LOVE it. It is pricey but I snatched some when it was on sale. So worth it during the really cold and dry winter months."
14,dermalogica,dynamic skin recovery spf 50 moisturizer,pimprod2029957,2588996," * Does what it says, non-irritating, genuinely moisturizing, but far too expensive for the amount of product. * A smooth and hydrating sunscreen that does not burn my eyes! My absolute favorite! * This moisturizer is unmatched. I love that it comes in a travel size because I can't live without it. My skin feels so smooth and hydrated I love the creamy consistency. The ingredients leave my skin healthy and it creates the perfect foundation for makeup. gifted by dermalogica * This has great benefits, I love that it has SPF50 and it gives me a wonderful glow after. However, this breaks me out every time I use it. I've had this product for months and I didn't know for sure if it was from this product since I noticed I didn't have any the beginning of me using it. I decided to stop using it and my face was getting better. 
I'm so sad because this is not a cheap brand and this was definitely on the pricer side. I love their stabilizing repair cream super great. But I'll have to give this to a family member to see if it works better for them. * this is by far the best spf cream I've found. im 39 and i have dry skin. this product helps me get nice smooth skin. I've gotten rid of so many  wrinkles in my face by using this product religiously. * Not oily * I think there is something better for me."
15,philosophy,hope in a jar smooth-glow multi-tasking moisturizer,pimprod2029779,2589221," * My go to facial cleanser for many years. Definitely recommend. * I use the cleanser every day and I still have some left after two years. I love the cleanser. It leaves my skin smooth. * Not as good as Lancome facewash but almost. * Ive been using this cleanser for years and am in love with it. My moth bought it fir ke as a teenager when i struggled with acne and it was one kf the only skjncare products that actually helped. I just love how my skin feels arter using it. I like that it doesnt really foam. Its like a oil cleanser snd water based cleanser in one as far as skin feel. My skin alwasy feels nice after using * I always have to have this cleanser on hand for removing eye make-up. It takes off mascara, eyeliner, lipstick, eye brow pencil and any other waxy type make-up applications, without leaving a greasy film like eye make-up remover. Leaves my face feeling clean and not over striped. It has a light scent that does not linger. It doesn't foam much and is more of a light cream texture. I can wash around my eyes and eyelids then rinse without, eye irritation. I have sensitive eyes. 
I use a separate foaming cleanser (Tatcha Rice Wash) in the shower with a silicone scrubber for skin exfoliation and a deeper clean. * I'm 71 yrs old and my face has been breaking out. This cleanser has solved my problem. I've been using Philosophy in the shower and body lotion for years. * My skin loves this stuff! Plump, glowy, happy, hydrated skin. I have sensitive, acne prone, combo skin and during the winter time this is my go to PM moisturizer. In the AM I thin it out with a gel moisturizer."
16,beautycounter,mighty plump ceramide water cream,pimprod2043880,2621243,
17,dermalogica,clear start soothing hydrating lotion,xlsimpprod12881033,2291792,
18,cerave,moisturizing cream with hyaluronic acid for balanced to dry skin,xlsimpprod3530069,2234849,
19,bubble,slam dunk hydrating moisturizer,pimprod2035460,2600868," * This product I have bought two times and I AM OBSESSED!! I bought both sizes, I would recommend to start the smaller size and if you find it amazing like I do but the bigger size! * This product is so good and it hydrates my skin so well! It's really good for my dry skin and it's never made me break out before which other moisturizers have! I would really recommend this product to any young kids that are trying to use skin care. And it is a very gentle moisturizer. You should definitely buy it! * I tried this based in both the price point and the thousand of good reviews. I dispise this. It made my skin very red and patchy. I noticed it does not absorb into my skin AT ALL. So if i touch my face at all it just pills up and falls off. * I give this product a ten out of ten as a person with young skin and is still learning this an amazing and hydrating product * heavy cream but very moisturizing. smells awful. unfortunately causes redness. i have tried 5 different products from this brand and every single one causes skin irritation, and my skin is not even sensitive so …beware. * One of the best moisturizers ive ever used! Super clean wnd leaves face feelimf hydrated. * My 10 year old daughter and I love this moisturizer! It's super moisturizing, clean and affordable! This is our second purchase!"
20,peach & lily,matcha pudding antioxidant cream,xlsimpprod18971027,2532651,
21,neutrogena,hydro boost hyaluronic acid water gel moisturizer,xlsimpprod12041835,2284291,
22,peach & lily,peptide pro firming moisturizer,pimprod2034057,2597530," * This is a great moisturizer! * I have used a sample jar and a full size jsr and on my 2nd full size jar. I have not noticed any difference in lines at all, if anything they seem more pronounced. I waited to write a reviee until i gave the product ample time to work. Had such high hopes. Will not re-purchase again. * I'm
Loving this product, my skin feels velvety soft and plump. * This moisturizer left my face worse than initally, it left it feeling tight and I had seen visible dry flakes, while trying to apply it I had a white cast. Also this product gave me small little bumps around my face * This moisturizer left my face worse than initally, it left it feeling tight and I had seen visible dry flakes, while trying to apply it I had a white cast. Also this product gave me small little bumps around my face * I LOVE this moisturizer!! I hope they never ever stop selling this!! * love this stuff. my face drinks it up.   I literally feel it moisturizing my face the second I put it on. love it can't go without it"
23,philosophy,purity made simple oil free mattifying moisturizer,pimprod2017775,2565516," * I do like this moisturizer there isn't a age limit for this moisturizer. It can be for young skin too, and it's hydrating & light on skin , but the only thing I personally dont like is that it only lasts a few minutes on the skin its a good-affordable moisturizer tho ! * I love this product it make my skin feel smooth and fresh  l also got this product for a friend waiting to hear back from my friend Excellent product also love the price and size I would recommend this product to more friends and family also easy to order at ulta where I get points on rewards membership * This is the only moisturizer that has really worked for me. I had stopped using it because I thought it was breaking me out (turns out it was another product) but went back to it when I did have a really bad breakout and it completely cleared it! * i feel like i barely need a primer, it's so good! hydrated and softened my skin so well * this is my favorite face moisturizer. it's decent price for a face moisturizer, and i've never noticed any issues after using it. it does it's job, and I love how lightweight it feels on my face. plus, it lasts so long for a small bottle. * I started using this product as my face tends to be oily and at the very beginning, it was working perfectly - not oily residues for sure. Issue is, after a while of daily use, my skin would feel dry; even patchy. Wouldn't wear underneath make-up, for sure. * I was using the glow watermelon and it was alright but my skin now is so soft and looks so healthy and it really glows without feeling greasy or making me look super oily"
24,cerave,"am lotion face moisturizer with spf 30, daily face sunscreen for balanced to oily skin",xlsimpprod4190253,2241990,
25,bobbi brown,mini vitamin enriched face base moisturizer & primer with vitamin c + hyaluronic acid,pimprod2025025,2583729," * I tested 3 different times to see if it was really breaking me out and it is! Dont use unless you want acne! * Love it!! * Skin looks smooth glide on smooth. The smell is amazing. This is a must have for any make up routine. * Smells amazing too * amazing primer and moisturizer base! it evens out the texture of my skin! * amazing primer and moisturizer base! it evens out the texture of my skin! * I finally decided to try this product, and I can definitely tell it makes a difference for my make up"
