,Brand,Name,ID,sku,comments
149,avÃ¨ne,hydrance aqua gel,pimprod2020807,2577168," * Amazing! * Love this for the summer! Light and moisturizing but not heavy. * This lightweight moisturizer was good enough but the smell/fragrance is SO strong. It's surprising for an Avene product. I will not repurchase. * I love MOISTURE! I wish I could put this all over my body. I little goes a long way and  it completely covers my face with delightfuly dewy hydration. * This product is HEAVILY scented snd burned my sensitive skin. Its a no for me. * This moisturizer does hydrate but there's some pretty big cons. 
-Not for oily skin. Leaves the skin very oily a few hours after application.
- Not non comedogenic. Caused a lot of new breakouts.
- Fragrance is strong * I got this in a travel size in a gift set and was excited to use it on a long weekend trip. As soon as I opened the packaging, I was hit with the aggressive smell of this product and was transported back to my grandmother applying her heavily scented products in my youth. Since I had no other moisturizer with me, I used it and my combo acne prone skin informed me that I had offended it with the noxiously scented product. My skin was irritated and my husband, who has the worst sense of smell ever, could smell this product through a couple layers of product.

So needless to say, I do not recommend this product."
150,beautycounter,countertime mineral boost hydrating essence,pimprod2038167,2606564, * Really enjoying the product.  The most enjoyable experience I've ever had at ULTA.  Jeremy Adam is a valuable asset to your team. * The mineral boost hydration feels amazing on your skin. It smells so good. It makes your skin feel so soft and supple. This is apart of my daily regimen. I am SO excited Beauty Counter has come to Ulta!
151,avÃ¨ne,retrinal 0.05 cream,pimprod2042754,2618818," * The smell was terrible, unfortunately! Kind of chemical and sour and it lingered. It's only the second retinol-family product I've used, so I'm not sure if this is typical or not, but I couldn't get over it. I love Avene and I'm sure it's effective, but if you are sensitive to smells, too, maybe not for you. * [I received this product in exchange for my honest review] I enjoyed this product and I'll post a deeper review once I've finished my other product and can really focus on this one. I didn't notice any redness or peeling. I think that as far as Retrinal, this is a good starting product. No overwhelming scent. Very happy with this product. * After a week of use, I noticed a difference in my skin. I have dry skin, and I feel like it moisturizes enough without being greasy. I'll continue using it. * Recibí este producto a cambio de mi revisión honesta. I got this cream and my husband has been using it and it has worked very well on his face he is very happy I recommend it too much the packaging is very good and just like the product the texture the aroma is very good quality * I received this product in exchange for my honest review. It gently smooths the appearance of wrinkles and gives my skin a firmer look without causing any irritation or discomfort. The formula feels high quality. My complexion looks brighter, more even, and plumper. I love that it's fragrance free. I apply it each evening to my face, neck, and decollete. * This ends up changing color to dark pink and then I have to throw it out.  What a waste of money * [I received this product in exchange for my honest review] This product is light and goes on very nicely. I've been also using on my elbows and chest to get some added benefits. Would definitely recommend this brand!"
152,clinique,moisture surge hydrating supercharged concentrate,xlsimpprod16101069,2508513,
153,mac,strobe cream,xlsimpprod15921232,2510715,
154,supergoop!,superscreen rich hydrating cream spf 40 moisturizer,pimprod2042770,2617635," * This cream is selling that it is a sunscreen but it is not, at least that's what ChatGpt responded. I copied the list of it's ingredients and asked if they were safe/clean and if the sunscreen was mineral based. The response was that the ingredients are safe but that it is not a sunscreen because it does not contain any Sun protection ingredient, mineral or not. * This is the only sunscreen I will ever use. As a Hispanic woman, it's hard to find a sunscreen that won't leave a white cast. This. IS. IT. It melts right into my skin no problem & I can layer makeup on top of it with no pilling. 100/10. * I live in Arizona and this product has been so wonderful! I don't need a lot and sometimes I apply a second time in the middle of the day and my skin feels great. * Leaves your skin glowy and hydrated * I like the texture of it & it is SPF 40 in it. But I don't like the that is make my face oily and my make-up does not last. * this used to be my favorite moisturizer of all time. it was thick, glowy and completely smoothed the texture of my skin like no other. i restocked in march 2025 after not purchasing since 2024 and the product i received can only be summarized as garbage. it smells different, its a much lighter consistency (which i want to note is a BAD thing in this case) and the glow on this lasts about only 10 minutes before seeping in and my skin goes back to dull. i have super (SUPER) dry skin and this product used to be the only moisturizer that actually worked. i'm sad to say that what they're selling now is not the same moisturizer it used to be. if you're reading this in 2025 hoping you've found your new favorite moisturizer, KEEP LOOKING. THE NEW FORMULA OF THIS IS NOT IT! * I'm new to the Supergoop product line and  I really needed this Superscreen to work for me. And voila! It did! I have sensitive skin, both oily and dry if that makes sense. This product goes on smoothly, blends in vs. typical sunscreens that never seem to soak into the skin. I will say I noticed a pretty strong scent of sunscreen when I first opened it. Now, just a few days later, I don't notice it at all. I love how this makes my skin feel hydrated but not oily. And it lasts all day. I apply once in the morning after washing my face and same routine at night."
155,neutrogena,hydro boost hyaluronic acid water cream - fragrance free,pimprod2041040,2615560," * Beware of paid reviews. The new formula is terrible. It has cheap comegenic ingredients. I had to switch to the Aveeno gel moisturizer which is similar to the old formula * My skin broke out in a rash, it was so disappointing. Maybe some will like it, not me. Thankfully got my money back. * I really loved it. It's very smooth on the skin, and my skin absorbs it well, keeping my face hydrated and looking healthy. I love that! The only downside is that the bottle is a bit small, so if they offered a larger size, I would definitely consider buying that. Other than that, I absolutely love it, and it's really affordable! * This is a good product for lightweight hydration. I love the gel-cream texture, how it absorbs into the skin, and how it isn't greasy. Most of the time, this was an effective product, however I felt that on very cold days when my skin was incredibly dry, I needed something else as well. I would purchase the full-size, however it is a little expensive. * This made me break out! I'm glad I figured out it's this! Had to throw mine away. * This was a good moisturizer and felt lightweight on the skin. Felt very similar to the Tula Dew Your Thing moisturizer. I never woke up with any breakouts when I used this at night. However, I don't know if this would be suitable for somone with acne as I feel like it does just sit on the skin. * So many people like this product but i dont know why. I put it on and it feels nice at first but then within the hour I'm dry again and its like i didnt put any moisturizer on at all. I tested this out for 2 weeks and my face feels rough, its like this ruined the texture. So weird."
156,estÃ©e lauder,resilience multi-effect tri-peptide face and neck creme spf 15,pimprod2002477,2540080," * I would never have bought this on my own since it seems to be marketed to a bit older than me (I am 39), but it came with something else I bought so I tried it out. I LOVE IT!!! It blends GREAT (especially for a product with SPF), isn't greasy, doesn't make my skin oily or shiny, has not caused a breakout, and I can see a clear difference in the moisture level of my skin in just a few days. Anti-aging creams normally make my skin totally freak out, but this one is all good, no bad. Really glad I happened upon it! * This contains Avobenzone, Octisalate, and Octocrylene....FYI * I joke that this is my old lady face cream because it smells like a bouquet of roses. However, it really does give the skin a lifted appearance and tightened feel. The daytime version has some SPF and wears nice under makeup. I wouldn't recommend for sensitive skin because of the fragrance. Also, I noticed on very dry winter days the product does not have enough moisture for my skin * I received this as a sample size from Estee Lauder and I can't wait to buy a full size. This is why I love samples, It lets me fiind out what I love without spending a fortune first.  It has the faintest fragrance that is subtle but lovely. It goes on so smooth and is just pleasant to use. My only complaint is the price. Some of us would buy this brand more often if we weren't priced out of the market. This is why I gave it a four. Otherwise, a five all the way. * This smells like febreeze and it doesn't go away when you rub it in :( save your monies * I use this product daily.  It keeps my skin hydrated and smooth. It did not irritate my skin, which can sometimes be an issue for me.  Makeup base glides on smoothly over this moisturizer.  It is my absolute favorite. * I wish I could use this product as it seems to work well. However the fragrance is too strong and irritating."
157,dior,capture totale cell energy - firming & wrinkle-correcting cream,pimprod2036822,2604977," * I was really hoping this would be my ""go to"" wrinkle cream however it is not. I just finished up the container and have seen absolutely no difference in my skin. For this price there must be something better out there! * I use this morning and night along with the face and eye serum (same brand) followed by sunscreen (only in the morning). I can truly say that this stuff along with the face and eye serum works. I used to have very dry skin, but not anymore. Also, the hormonal acne I get occasionally is under control. Lastly, the wrinkles are diminishing. Totally worth every penny. * I see smoother skin , brighter skin , less fine lines and an overall younger look * I do love this product, it's true to all things advertised - A little bit goes a long way as I purchased this a few months ago and still have more than half of it left. I did not want to write a review until I was certain I was satisfied based off of the huge expense... 

that said, I wish the product was a bit less expensive because I have tried other product lines that do the same job without the extra $$... but then again, you are paying for the name"
158,bareminerals,smoothness bare haven soft moisturizer,pimprod2015694,2564097," * I love how soothing and light this moisturizer is. It helps with my eczema and doesn't leave a greasy residue or shine. The smell, for me, is another plus since I think it smells pretty good. * I have used Bare minerals for years but dont know how i missed this soft moisturizer! I have tried so many. This is the one! * I have very dry and easily irritated skin. This is the only moisturizer that hasn't caused irritation and keeps my skin from getting very dry. * I've been using this for 3 months now and it has left my skin so soft and even. This is by far the best moisturiser I have ever used. * very soft and moisturizing. clean scent. * I love the feel of this product and my face misses it when I don't have it. * This product has always been in stock whenever I'm ready to purchase it."
159,vichy,mineral 89 hydration boosting kit,pimprod2043517,2620409," * I've tried a few dozen moisturizers over the course of my life and I liked some and other I haven't but I've never LOVED anyone of them until now. My skin feels so hydrated, supple and refreshed. It's always budget friendly compared to others I've paid for. * I've been using this product for almost a year. Love it! Very moisturizing without a greasy feel. I've noticed much improvement for fine lines. Does not irritate my skin at all. * Been using this product for over two weeks and following the directions implicitly, yet I have seen no signs of improvement. * Really liked the way it went in my face so smooth & moisturerising, definitely but it again * I bought this on sale, wow I use medical grade skin care expensive 🙃 
nothing compares with this.
I mature 54 yes dry rosacea and this was is luxury on my skin
highly recommend 👌 * It's perfect for all skin types * I absolutely love this combo both are so hydrating & I have very sensitive skin but it doesn't cause any irritation 5 out of 5 for sure"
160,murad,hydro-dynamic ultimate moisture,xlsimpprod2390225,2544836,
161,dermalogica,super rich repair moisturizer cream,pimprod2024953,2580597," * ive purchased other products from dermalogica,  i went back to this moisturizer ive purchased before because its the best ive ever used , im 59 and it is good for dry wrinkled skin * This product is a game changer for my mature skin.  I'm never without it! * I bought the travel size when it was BOGO because it is very expensive.  I did not want to spend money on the full size not knowing if I'd like it.  So far, so good.  I've only used it one week.  My skin looks a bit better after one week's use.  I just might pop for the larger size.  I would suggest people buy the mini size when a product is BOGO.  If you try one container and don't like it, you can give the other to a friend.  You have not spent a small fortune to just try something. * During the winter my face became dry and flaky with more pronounced wrinkles. This reversed that! It also absorbs easily. This will be my go to year round. * I recently moved from somewhere that is constantly hot and humid to a place with real winter. This moisturizer is a game changer! I was starting to get cracked dry skin all over my face and within 4 weeks of regular nightly use my skin looks and feels fantastic. It's the perfecr winter moisturizer. * I do love the product however the design needs to be changed too much waste in a pump design * This is the best facial moisturizer ever!  I ha e been using it for years and there's nothing like it!  My skin feels so hydrated when I use it!"
162,cocokind,resurrection polypeptide cream,pimprod2037614,2605570," * Feels luxurious and soo hydrating. The texture at first threw me off a bit, but it helps if you use it right after a more watering serum or toner. I have very sensitive skin and this has never broken me out or caused any issues. Im very picky about moisturizers and I don't think I'll ever stop repurchasing this one! * The texture takes some getting use to but this product is so hydrating. My skins is glowing and supple when I use this moisturizer. I use it at night in the summer. Great for day and night in the winter months! * Thick, moisturizing but not heavy, plays well with other products and never breaks me out. I come back to this over and over * My skin gets extremely dry in the winter and a lot of products tend to clog my pores and make me break out in certain spots, but not this one. Its so moisturizing, velvety, and has helped my skin so much in the winter months. Will definitely be buying again! * If my face is going haywire in terms of  acne, this cream fits my skin as it doesn't lead to **additional** breakouts. The cream is thicker consistency, so all I do is take spatula of the amount I need for face & neck, then I do dots of the cream all around my face and finally pat it in. Similar method to tret where you use smaller amount and apply dots across the face. * My biggest complaint is that I found it to be a little too thick to the point I felt like i was tugging on my skin to get it to rub in all the way. Didnt notice a difference in skin texture or appearance after using almost the entire jar. * This product pills no matter how i apply it! I dont think skincare should be so tedious to apply."
163,cerave,travel size daily moisturizing lotion for balanced to dry skin,pimprod2017446,2559602," * My husband uses the lotion making a difference in moisture. * I remember using this product, and it never made my skin burn till I tried it again this winter. my skin is really bad during the winter due to meds, but this made my skin burn and sensitive. * very gentle- good price-hydrating * best face cleanser i've ever used in my entire existence * I love it when I initially started using it bc it didn't feel like it was stripping my skin's moisture. Until it did. It eventually left my face irritated and reactive to my favorite toner and emphasized the texture on my face. I wouldn't recommend! * At first when I got this I thought it would be great cleanser the only reason this gets 2 stars is because it foams but for the price and ingredients I dont recommend it has parabems and costs more then its worth and I broke out and I dont normally break out. * Light, no scent. Mositurizes well."
164,fresh,black tea anti-aging ceramide moisturizer,pimprod2036988,2603047," * Make sure you patch test this for a week before using on your face. This gave me a horrible eczema flare up on my face that took a week to treat and resolve, which has never happened to me with any other skincare product. I'm likely allergic to one of the botanicals. * This product us extremely overpriced and youre not getting a facelift ftom it. I got to try this for free and after attempting to make if work with cream, powder and liquid foundations, threw it away. It's not make up friendly. Why people buy this expensive product is beyond me. * I was excited to try this based on the positive reviews. There was one that mentioned a hollow center air bubble. Well, I got an air bubble. The entire center of the jar was hollow, making the jar far less full than it should be.  Fresh has to work on this. It's a disappointment. The cream is nice though. * My husband and i are 35, i take care of myself but he never uses anything on his face! He started getting bad wrinkles on his forehead and made him use this for a few days. Just in 4 days i saw a huge difference!!! * My skin is glowing ever since I added this cream into my regimen. * Best face location I have come across. A bit pricey, but well worth it. It's not thick, and doesn't leave a residue. My face feels silky smooth and glowing. * I loved this when I was 25, it was lightweight and made my drylines disappear after a long night or studying/going out. 
Using it at the age of 30, it is lacking the strength needed for my skin personally."
165,kiehl's since 1851,super multi-corrective anti-aging face and neck cream,pimprod2018365,2589390," * I received a sample size of this product and my dry skin loveeessssss it. It immediately soaks it up and leaves it feeling so smooth and moisturized. If it wasnt so expensive I'd probably buy a full-size jar. Maybe some day! * Made my nose and cheeks have a burning sensation. * Made my nose and cheeks have a burning sensation. * This is my must have product.  Have used it a couple years now.  Non-reactive on my sensitive skin and feels wonderful on.  I believe it has made a difference in the texture of my skin and improved my neck wrinkles. * Finding the right skin care routine is never linear since it varies person per person. I have sensitive combination skin and I always struggled to find a product that didnt give me that greasy glow. 

This product is light yet hydrating enough that it doesnt require a lot of product. While the price tad is high, the big container last me 2-3 months depending on the weather. 

I would recommend you get a sampler size and try it out for 3 months because you wont see any instant results. After 6 months of using this product, it cleared my blackhead and slowly seeing results in other areas. * I have been using this multi corrective face cream since its arrived on the market, Im 52, it has been a game changer since i traded up from their daily moisturizer( in which i stared at 30. It doing what it needs to do, im not getting wrinkles or dry skin and i use it alone & under make up. I'm often asked if im 35 so i have to give some credit to kehls for it. I love the line, its fine quality and i will never waver! * I bought this after many great reviews. I used it around 10 times and thought it was sunburn because I was red and sore. I switched to e45 then another brand and I was fine. I then tried it again after a couple of weeks and it stung my face again! I usually don't have sensitive skin and I'm gutted I spent so much and now can't use it"
166,mad hippie,face cream,xlsimpprod18731231,2530013,
167,clinique,dramatically different hydrating jelly moisturizer,xlsimpprod18711071,2531785,
168,tula,breakout star acne moisturizer,pimprod2014625,2561091," * I love this it is the only moisturizer that has truly helped my skin . I get terrible hormonal acne around my chin and jaw and this clears it right up. my only complaint is the price for the amount you get . * For the price I think this should be a better formula. I used it with the Tula breakout gel after washing my face with a Tula cleanser and it still pilled up. This and the gel do help with my dark marks and acne thats not hormonal but the pilling bothers me so bad. * I've used this for over a year and its a holy grail for acne prone skin. I usually have oily/combo skin and use this moisturizer under Matte Super Goop sunscreen. I haven't had any acne in soo long! I live in a high humidity area and it works great! * After applying other serums or makeup this product began to peel off my skin. * I have cystic and acne and everytning makes me break out but this didn't. I wouldn't say it helped my acne any, but i didn't break out bad and that's what i'm looking for :) the pump is awful though, barely works, wish it came in a different container. * i love this product but most of the bottle is air and only filled around halfway with the product. it is a wonderful product to help ease your acne but you definitely need to be willing to pay a lot for it and the select amount that you will get from the bottle * After two or three uses my entire face became red where I had applied it. Cannot figure out which ingredient i would be allergic to. Put Cortizone and neosporin all over my face to calm it down."
169,la roche-posay,anthelios mineral spf 30 face moisturizer with hyaluronic acid,pimprod2021600,2575538," * I have fair skin but the white cast was too much for me. It's a thicker formula and left me with pilling * I have a light to medium skin tone and the white cast was quite visible until it's absorbed into my skin. however, if I was sweating or my face got wet, then the white cast would be visible again, which I hated since I sweat a lot at my job. * Leaves a white sheen no matter how much you rub it in * It says it's hypoallergenic but my face is full of hives every time I use it * This product has an awful white cast, and I am white. It makes me look so pale. I am so surprised given the price and the fact it is supposed to be a ""daily moisturizer."" Would not waste your money. * I loved the fact that it had hyaluronic acid and SPF in one, but after putting it on, I realize it's definitely not for me. I hoped the reviews were wrong, but it definitely leaves a white cast over your skin, and made me look super pale, despite the fact that I have a fair, medium skin tone. * I have tried almost every mineral sunscreen under the sun. I'm fair skin, freckles, burn easily, break out easily and this sunscreen moisturizer has been amazing. There is a white cast initially but I rub the product between my fingers before applying and it blends within 5 minutes! I never get sunburn on my face while wearing this. I also apply a ceramide barrier serum beforehand and do not experience any dryness while using this product. Would absolutely purchase a cool toned tinted version of this."
