,Brand,Name,ID,sku,comments
237,beautybio,the zenbubble oil-free calming gel cream,pimprod2019384,2572411," * This gel cream from BeautyBio is my go-to whenever my skin is irritated, breaking out, or red. The lightweight, cooling texture feels so soothing and gives my skin the perfect amount of hydration without feeling greasy. It calms irritation, keeps my skin balanced, and even helps prevent breakouts — a must-have for my acne-prone skin. Complimentary from Beautybio. * Ive been buying it for a couple of years now and it always leaves my face so soft. When i wear makeup it also works as a good base leaving makeup flawless with no need of primer it definitely is worth it * Someone at ulta recommended me this one, really pricey to me, I usually dont spend over 30 on moisturizers, but this is one of my favorites (not enough for me to consistently buy it though). Goes on light, a little goes a long way I'd say, I have combination skin that used to be really oily but now is rather dry, I'd say it's fine for all skin types personally. Also it comes out by pressing down on it, whenever it runs low you can twist to get the rest of it. I was stressing out trying to get it out before realizing it opens. Again, would buy this all the time if not for the pricing, but pretty worth it * I've purchased this two times now and am loving how light it feels on the skin while being super hydrating for my dry skin. The container pump makes it so easy to apply. * I got this and the eye cream, both burned my eyes and skin. I am sensitive but don't usually break out in a few hours from a product. Also were very sticky long after applying just them and no other products for self testing. * Far from a moisturizer but in fact left my skin super oily. * Hands down the best makeup primer EVER. Its too good. My makeup looks freshly applied all day long. I csnt say enough about it."
238,dune suncare,the mug guard broad spectrum spf 30,pimprod2039109,2608975," * This is hands down the best sunscreen I've used as someone with a darker complexion and acne prone skin. It's moisturizing without the greasy, heavy feeling usual sunscreens leave behind, and it doesnt leave any white cast. * I have sensitive skin, reactive skin, combination skin, and acne prone skin. This sunscreen is the only sunscreen I keep coming back to!! 

It hasn't caused break outs, doesn't clog my pores, and hasn't caused excess oil production. I also love that the green helps soothe red skin. 

Also, even with it only being a SPF 30 it does a great job at keeping my face from getting sunburnt even with being out in the sun all day! * I really don't understand all the 4-5 star reviews. This suscreen has to be one of the worst sunscreens I've tried. It's sort of giving fake reviews but who knows 🤷‍♀️ because I have acne prone skin and this made it so much worse while I was using it. I see some people with fungal acne saying it's safe for they're skin type—yes, I understand fungal & acne prone are not the same! HOWEVER, they are very similar!! All this to say, PLEASEEE SAVE YOUR PRECIOUS MONEY ESPECIALLY IN THIS ECONOMY AND LOOK FOR ANOTHER OPTION! This sunscreen is ssa. Sorry not sorry. I just feel so gaslit by these reviews. I know that not everything is meant to work for me but ive tried other suncreens I maybe wasnt a fan of but they still did their job. This sunscreen on the other hand, did the opposite and actually cause me to breakout. * I am very prone to sunscreen moisturizers burning my eyes and have tried so many and im glad i finally tried this one. Does not burn my eyes, i wear it before long runs and when i go in the ocean. No burning. Also doesnt have a scent or a gross lingering smell like some other sunscreens which im also sensitive to. Love the texture too. Buying my second bottle now. * This is a great sunscreen. It does have that sunscreen smell but I quickly go nose blind to it. The claims are true! It does not pill, it's quick drying, and there is no white cast. I will say it does give me that dewy glow so if you're looking for a matte look- look elsewhere. * As I sit here with one eye open waiting for my bf to get back from the car with Micellar wipes, my eyes have been burning so badly for the past 2 hours (prob put it on an hour before that and it took time to ""travel"" to my eyes""), and I no longer can take it. I liked the feel of the formula and it rubbed in well. It's a larger size than many other bottles of face sunscreen. Thats the 2nd star. And I bougnt 2 of these. Nope. Never again. * As someone who breaks out to a lot of different skincare products, this is one of the few sunscreens that doesn't. I found no irritation around my eyes when I applied it, and it left no white cast on my medium skin! I love to buy it when its on sale."
239,strivectin,advanced retinol nightly renewal moisturizer,pimprod2026692,2582803," * this separates very badly. the product works well, but is frustrating. I have to store it upside down so it doesnt leak the oil everywhere. you have to shake the product exceptionally well to get it kind of mixed together. I like it a lot, it is just too expensive to be having so many issues with the messiness. * When I received it and opened it up, immediately oil came out and I shook it to mix up but it leaked in my drawer because of the separation. It's too expensive for this to happen. * This is one of my new go-to's for night treatment!! Feel like I wake up looking younger and more refreshed! I'm in my 50's but love great skincare! Very gentle for the results I've seen! Will be sure to purchase again! Highly recommend! * Tried them all…  This is the Best Choice  Lifts, hydrates, softens, brightens and reduces pores! * I can't say enough great things about this wonderful night cream I adore Strivectin and this moisturizer is my night cream of choice I know that when I use it I'll wake up to glowing , firm & overall better skin * Good! Love it * My skin feels smooth and moistureized."
240,clinique,repairwear laser focus wrinkle correcting eye cream,xlsimpprod12991075,2291706,
241,first aid beauty,hello fab coconut water cream,pimprod2029973,2589261," * I am repurchasing because i love how this makes my skin feel when i wake up in the morning. I do two layers before going to bed, its so good! I also enjoy the smell as well and its not too overpowering. The price is ok and I enjoyed it more than the Tatcha water cream I tried and its a lot more expensive! * I recommend this product to EVERYBODY. This stuff right here has completely changed my life. I get compliments on my skin all the time since ive started using this in 2022. I will never stop using it!!! * I have used this product every day, twice a day since 2017. I absolutely love it! It is lightweight, dries down smooth, and helps hydrate my oily sensitive skin. I would cry if FAB ever discontinued this product. 1000% would recommend. * This is a great moisturizer super lightweight better for like oily or skin types. But I like it as a quick little water cream to add to whatever else I'm using for the day. Smells delicious and love coconut so for me, this is a must have! * This product is amazing, it's so light weight and smells amazing. Would definitely recommend * i really loved the product and how it made my skin feel but i went thru the whole thing in one month!!! i can't be buying this every month for that price :/ * If you have acne or just skin in general you NEED this is in your life!"
242,clarins,super restorative day moisturizer,pimprod2033883,2598903," * The price tag is a whopper but this moisturizer is the best I have ever had. * don't buy if your skin is sensitive! it burns every time i use it, and i've been using it for a little over a month. just be cautious. it does make my skin look and feel beautiful AFTER the stinging. * My skin looks and feels so much better!"
243,good light,order of the eclipse hyaluronic cream,pimprod2033460,2597528," * I am in grad school and was looking for a moisturizer that is both moisturizing and cost-effective. Originally I switched to the Sarah😙 V moisturizer that I used in undergrad, but I feel like the product was not moisturizing enough. I also previously used the Peter Thomas Roth moisturizer, but didn't wanna spend that much money while I'm not working. I bought two of these moisturizers while it was on sale for Black Friday and I love them. Super moisturizeruzing, and my skin feel so refreshed when I wake up in the morning. It also does not clog your skin as some moisturizer do. A little goes a long way with how thick the product is. The containers are a little small, so I would only recommend buying them on sale. * I really do love this moisturizer it dos everything and more. i have super dry skin in the winter time and this does wonders!! The only issue i have is that i atruggle to open the lid and i dont struggle opening anything. I have to have my bf opennit for me every time or i wont be able to get it myself. (im not tightening it super tight either!) other tha that its perfect! * My one and only con with this moisturizer is that it's more pricey, than id like. But yall do not understand I have acne-prone and sensitive skin, this genuinely seems to be the only moisturizer that my skin doesn't react to  and actually enjoys. if your skin can't handle anything complex or botanical and is on the drier side and needs hydration, YES, you will love this, promise 🥹💋 * My skin has been going downhill after hitting 40. This cream has brought it back a bit. It's very hydrating. My skin looks plumper. I have very sensitive skin and this cream is not irritating at all. * For reference I am 46 years old and have just begun a real skin care regime in the last 6 months. I have started using this cream nightly for the last month. I apply after I cleanse my face with an oil cleanser in the evening. My face usually feels rather tight after cleansing and this product is my go to for bedtime moisturizer. This leaves my skin feeling supple and moisturized without feeling super greasy for bed. This seems to have helped with fine lines and has not had any adverse reaction on my skin. I will definitely repurchase and keep using. * My skin is so soft, and it has helped with fine lines. I've only been using this product for 2 weeks, but I love it. I would definitely recommend this product to other ladies who want to improve the look and feel of their skin especially in a short amount of time. * their milky toning lotion has already changed my skin entirely the last few months. like seriously. this cream just made my skin so plump and soft and overnight took away some texture and redness, just like the toner"
244,bliss,drench & quench cream-to-water hydrator,xlsimpprod17921136,2524145,
245,clinique,travel size dramatically different moisturizing face lotion+,xlsimpprod12481037,2289601,
246,peter thomas roth,peptide skinjection moisture infusion cream,pimprod2043797,2620555," * I like it and I'm very picky! Texture not as creamy as I like, but it is a very good moisturizer! * Love this cream best moisturizer light and hydrating. * Wonderful moisture infusion cream! Peter Thomas Roth is the best! * I was skeptical at first, but have noticed less wrinkles under my eyes and my makeup applies smoother * Amazing peptide complex and anti aging results * I splurged on this product as I felt my skin needed just a good moisturizer that locked everything in and protected it. The product is heavier than most but I feel it does a great job of hydrating my skin. The biggest con I have is the blue painted lid on the jar peels and leaves blue fragments of paint in the product, thus it going on my face. My fingertips are physically blue after simply unscrewing the cap. It actually concerns me because you never know what companies are using to manufacture their products. Disappointed with such a high price point. * Ive been using PTR products for 10+ years and my skin shows amazing results from the use of these products over the years. I'm a satisfied customer for life."
247,cetaphil,"moisturizing lotion, hydrating body moisturizer",pimprod2028656,2605916," * Ranks very well on the EWG for not being toxic. Hydrating without being greasy, been using for years! * I love wearing it after a shower and before bed, keeps my skin hydrated and soft * Keeps me feeling hydrated and the lotion absorbs quickly. I am able to sleep in it without feeling sticky or ""wet"" feeling. I have sensitive skin so this is a great product for me. * My daughter (a dermatologist) recommended this moisturizing lotion several years ago.  I have tried others, but always go back to this product.  Now I highly recommend this lotion for aging skin! * This moisturizer has been my go-to for years. I have sensitive skin and I have been using it on my face since 2019. My skin stays hydrated, glowy, and clear of any blemishes when I use this moisturizer compared to any other moisturizer I've used. This is really shocking but great considering the price of this product compared to other skincare. I take this with me and use it all year! It also has worked great on keeping me moisturized on my legs, where I'm prone to eczema. Everyone's skin is different, but mine really loves this moisturizer! 🩷 * i have acne prone combination skin, it seems to be clogging my pores and giving me closed comedones * I absolutely love the Cetaphil Moisturizing Lotion, Hydrating Body Moisturizer! It provides amazing hydration without feeling heavy or sticky, which is a big plus for me. My skin feels soft and nourished all day long, and I don't have to worry about it feeling greasy or tacky. I also appreciate that it has no fragrance, so it's perfect for sensitive skin or anyone who prefers unscented products. It's become a staple in my skincare routine, and I highly recommend it for anyone looking for a simple, effective moisturizer."
248,hero cosmetics,clear collective clarifying prebiotic moisturizer,pimprod2030350,2591989," * I've tried many moisturizers (high end & affordable) for sensitive/acne prone skin and this is by far the best moisturizer, especially for the price! I use this with hyaluronic acid, niacinamide or salicylic acid and it pairs well with all my serums and sunscreen. This is also great under makeup since it's not oily and helps makeup last longer. I've repurchased this moisturizer at least 4 times and I always have a backup! * I love that this moisturizer is buildable. You xan relaly control how much you need. It feels great on my skin and my skin is noticeably more plump. I love it! * I am acne-prone but need a moisturizer for skin dryness, especially during the winter when the cold wind easily dries out your skin. After using this moisturizer, I have had several instances of bad luck with getting a new pimple the next morning. The texture and application (no burning) of this product are fine. It does its job to moisturize the skin. However, not without suffering more blemishes sadly. I picked this while trying to find noncomedogenic moisturizers with clean ingredients according to Yuka, but my mom helped point out to me later this has vegetable oil in it… Cool! 🙃 * its just perfect and a little goes a long way * I dont really know what people are saying about this product, most people are saying its lightweight and non greasy but it feels so heavy, sticky, and greasy on my face, maybe just not for me but I won't be buying this again * I have sensitive skin and this works well for me. Love that it isnt too heavy on my combo/acne prone skin * I was hoping this product would work well on my acne-prone skin, but it doesn't seem to do much for me. It doesn't absorb very well into the skin so the more you use the more ends up sitting on your face. The claims about this moisturizer being pre-biotic don't seem to mean much. Hero specializes in products for acne and acne-prone skin, so I assumed this moisturizer would work well in my routine and be hydrating but I was disappointed."
249,roc,retinol correxion deep wrinkle targeted patches,pimprod2037326,2605694," * used all 6 patches on my face (forehead, mouth, crows feet), before going to bed. woke up the next morning, nothing! * I got these when I noticed crows feet developing. B0tox is so hard to afford these days! I put them on at night and woke up with visibly plumper skin and less wrinkles. I can see myself using these every two weeks or so as part of my skin routine! * I had high hopes for these especially for the price. I liked how tight they felt when i put them on my under eye line. I slept with them on and was so excited to see the results when when i woke up. However, there was no change. If anything i feel like one line looks deeper. * I love love love this product. I have deep forehead wrinkles and this has helped soo much. * I wore these overnight like instructed and when I took them off in the morning I had much more pronounced and deep wrinkles. I look 15 years older. Literally does the opposite of what it's suppose to. Now I'm just praying these new wrinkles fade. * It's just temporary, so keep that in mind. * These are not very strong and theyre small. If you havent tried ""frownies"" i suggest trying those. Theyre cheaper for a larger quantity and better results."
250,estÃ©e lauder,daywear matte oil-control anti-oxidant moisturizer gel cream,xlsimpprod15401049,2502687,
251,cosrx,oil-free ultra-moisturizing lotion with birch sap,pimprod2035883,2603881," * I've tried many different moisturizers marketed for oily skin. I love the idea of a gel-cream moisturizer but most have not been moisturizing enough. This one is lightweight and moisturiziing without being too much or too little for my skin. This is my new holy grail! * I'm 46 with combo/dry aging skin. I've used $100.00 K-Beauty moisturizers, Estée Lauder, Lancome, Tatcha, Glow Recipe, etc... I bought the COSRX Oil Free Moisturizer in a pinch and actually like it! I use the Kate Sommerville Eradikate daily cleanser with my PTR Soniclear Elite followed by Mamonde Rose Toner during the day, (Ordinary Glycolic Acid 7% Exfoliating Toner at night), Hanskin Essence, Peach and Lily Good Acids Copper Peptides Serum, Kiehl's 🥑 Eye Cream, and the COSRX Moisturizer  as my final skincare step. I like how light it is, the price point, the volume of product, the consistency, & how long the bottle lasts. Its travel - friendly and good for all skin types. * This moisturizer is great for the summer or daytime, but personally its too lightweight for my combo skin. Its more hydrating than moisturizing and has a gel like texture. I gave it to my roommate who has oily skin and she loves it * It has helped me a lot with managing my breakouts along with clarifying toner. They really are a great combo to use. All the ingredients are clean and i havent had any type of allergic reaction. Ive scanned it the bottle for acnegenic and condemenic ingredients and it had none and then i also scanned it for toxins and it had none. Overall i would recommend to anyone unless they're specifically looking for a matteifying moisturizer. This oil free moisturizer gives you a slight sheen and glow. * New favorite! This has been amazing for my combo skin. My skin stays hydrated all day long but doesn't get oily. Great as a base layer under make-up, doesn't pill. * lightweight moisturizer , made skin smooth  , I Don't Think this moisturizer won't break you out !!! * i love this moisturizer, its perfect for layering! especially for skincare routines & when applying spf and makeup"
252,juice beauty,green apple age defy moisturizer,xlsimpprod3670099,2236871,
253,kinship,supermello hyaluronic gel cream,pimprod2017767,2569973," * Seriously, the greatest of all time. I have dry, sensitive skin that's prone to rosacea and this has been a life saver. It's gentle and leaves my skin feeling soft, smooth and soothed. It's an added bonus that it smells delicious. * This is a great product for my dry, sensitive, and maturing skin. I more than likely will not purchase again. Bought 3 times before yall went and raised the price by $14. Not worth the price IMO. I feel there are better products for that price point. * I got this to keep my face from getting dry this winter. It works very well so far. The only thing I question is the fragrance, which is delightful, but probably not so good for my skin. * I wanted to love this product! The smell/texture is lovely.

Unfortunately, while sporting a ""clean ingredients"" tag and a tag from the national eczema association, I found the product to be highly irritating when I had a flare up. I only used it once during that time, and then after taking a second look at the ingredients, I found out that ""phenoxyethanol"" is a known potential allergen, irritant, potential endocrine disruptor, and the manufacturing process is highly polluting. In other countries the ""safe"" threshold for this ingredient is 1%, but it's hard to determine how much one is exposed to if applying daily/multiple times a day. Of course, there is no such regulation in US, so who knows how much is in this cream. 

At the same time I bought this, I tried products from cocokind which I highly recommend! They have a great price point and really are ""clean"" from what I have used so far, although one should always do their own research. While I was still having an eczema episode, I found using a homemade oatmeal paste + cocokind's chia seed oil was very helpful to get me through the dry itchiness. 

TLDR: not a clean product, could be irritating, check out cocokind. * I've been being treated for cancer for about a year and a half, now. Almost 6 months of that has been chemotherapy. Most products cause acne and rashes on my skin, since being on treatment. 
Pros: Did not irritate my overly sensitive skin. Smells good. I don't understand all the complaints about the smell. It is light and nice. It is kind of like marshmallows, but better. 

Cons: it moisturizes, but not enough while going through chemo. It feels great when I first put it on. But, after a few hours my skin feels tight again. Kind of like how vaseline can trick you into thinking your skin is moisturized at first. Hours later the surface of your skin feels tight and dry like a sunburn ready to peel. 

For the price, thete are much better options. Philosophy moisturizers are a lottle cheaper and give better longer lasting results for me in terms of moisture. * This is my 3rd time repurchasing this moisturizer. Unreal/ must try! * I do not want my face smelling like vanilla frosting but it did the whole time I used this. My fault but I'd literally have to hold my breath"
254,osea,seabiotic water cream,pimprod2027013,2587124," * This is a very nice cream.  I wish the size was a little larger for the price.  My skin feels softer and moisturized, so may purchase again. * I did not find this helpful to my skin routine. The cream is too greasy feeling and has an off putting aroma. * I am now on my 3rd jar of this product and i love it so much! Id say i have combination skin that is a bit more dry in the winter, and this stuff really helps moisturize my skin without ever feeling oily. It is great under makeup and great on its own. You definitely can layer it if you want more hydration. This product is a must have for me. * I wanted to love this since I love so many of their other products. It isnt super hydrating and the smell is quite offputting. Its hard to describe, but kind of like sour play-dough. I'd return it but think its too late. * Best moisturizer ive used so far. it has and odd smell when jar is opened but the smell goes away once applied to skin * It leaves my face soooooo soft and light! After 24 hours, it still feel super soft. It doesn't make my face feel lumpy or greasy as other moisturizers. 

It does have a light smell, but it isn't a huge disgust. It's kinda like a earthy or clayish smell to me. * Osea's website markets this as being for all skin types, so I tried it. I always thought I was oily/combo skin and wanted a less greasy look so I went for this.

Turns out, either my skin may have been the dry type (this product dried it). Its hard to say. It wasnt very moisturizing and I'd say more dehydrating, as my forehead developed dehydration lines and skin overall looked dull/aged. 

Id been using a different product brand religiously for years before switching and never had any dullness, no dry skin, always bright and wrinkle free, hydrated and clear. Ultimately switched back."
