,Brand,Name,ID,sku,comments
80,e.l.f. cosmetics,fragrance free holy hydration! face cream,pimprod2013329,2563564," * I wanted to love this so much ... but it pills on the skin.  So disappointed 😞 * I live this product so much. I use it at night and it works so well * Not good it did not hydrate my skin * Gentle and fragrance free cream does well on my sensitive skin. Not greasy at all and absorbs well. You cannot beat the price. Would highly recommend. * During the winter I have ultra dry flaky skin. This stuff is a miracle! I even noticed after a few uses that my skin looks brighter and ""well rested "" I don't have to slather it on either. A little goes a long way. * This is one of my favorite moisturizes * This is one of my favorite moisturizes"
81,philosophy,purity made simple oil free mattifying moisturizer,pimprod2017775,2565516," * I do like this moisturizer there isn't a age limit for this moisturizer. It can be for young skin too, and it's hydrating & light on skin , but the only thing I personally dont like is that it only lasts a few minutes on the skin its a good-affordable moisturizer tho ! * I love this product it make my skin feel smooth and fresh  l also got this product for a friend waiting to hear back from my friend Excellent product also love the price and size I would recommend this product to more friends and family also easy to order at ulta where I get points on rewards membership * This is the only moisturizer that has really worked for me. I had stopped using it because I thought it was breaking me out (turns out it was another product) but went back to it when I did have a really bad breakout and it completely cleared it! * i feel like i barely need a primer, it's so good! hydrated and softened my skin so well * this is my favorite face moisturizer. it's decent price for a face moisturizer, and i've never noticed any issues after using it. it does it's job, and I love how lightweight it feels on my face. plus, it lasts so long for a small bottle. * I started using this product as my face tends to be oily and at the very beginning, it was working perfectly - not oily residues for sure. Issue is, after a while of daily use, my skin would feel dry; even patchy. Wouldn't wear underneath make-up, for sure. * I was using the glow watermelon and it was alright but my skin now is so soft and looks so healthy and it really glows without feeling greasy or making me look super oily"
82,lancÃ´me,rÃ©nergie h.p.n. 300-peptide cream,pimprod2040492,2612984," * The cream works well but it has a strong fragrance. I have used this cream for about a month and the fragrance is too much for me. I will continue to use it but wish there was a fragrance free version. * I have used this product for years, it clears my face leaves it smooth and young looking. I recommend this product * I bought the Lancome holiday gift pack with this included. Otherwise I don't think I would've ever bought it. Out of the entire set this is the one I use consistently because of the way it feels. Woke up today and forgot I used to have age spots. They're gone. * This has a strong perfume smell.  I bought it half off during days of beauty.  Reviews are good but that strong perfume smell.  might use it on chest instead of face to use up. * Ive tried a lot of face creams, this is definitely in my top 3. This cream is ideal for mornings where you want something moisturizing but not too oily. I can also see a difference in brighness and fine lines. I also feel like this cream works with most skin types. I have dry skin and it works well as a day cream. * About two months ago I received a super sample of this and I was SHOCKED at the difference in my skin within 48 hours. My fine lines were already fading and my skin was taught. At 46 years old I've tried every serum and moisturizer, including high end brands such as Sunday Riley and Drunk Elephant only to be left with little to no results and wasted money. This particular line of Lancome products is expensive and beyond my normal budget but it is worth every penny. I just started using the serum and these products have changed my life. I will always look for the best sales and discounts but if I would pay full price because this moisturizer is magic and now a permanent staple in my skincare routine and I HIGHLY recommend this for all women my age and up in need of help fighting fine lines and wrinkles and skin elasticity. * This product has improved the appearance of my skin without causing any breakouts. I love the texture and it has a pleasant smell to it"
83,juice beauty,stem cellular anti-wrinkle best sellers day & night moisturizers kit,pimprod2021203,2578070," * The beat moisturizer  I tried is super light weight but reach in peptides I absolute love this product * My skin feels so soft after using this one time!  I've tried a lot of different brands and this is awesome for texture and fine lines and wrinkles!  Let my friend try it last night and she loved it also! * I saw looking to try something new. The duo smells nice and feels jice going on. Howecer this juice was not worth the squeeze and the dispenser clogged easily and often. * I went to buy a product that was highly recommended. The store associate introduced me to the Juice line, and it is the first product line that I honestly felt almost instantaneous results. * I started with the samples and i was really hoping I would hate it since it is so expensive. Unfortunately I loved it, and now I'm forced to spend a fortune on skincare. Use with their vitamin c, primer, foundation and translucent powder and your aging face will thank you, but your bank account won't. * I love juice beauty's products so I couldn't wait to try this product! I used it night cream the first night I got it and woke up and washed my face and placed on the day cream. Moments afterward my face began to feel very itchy and uncomfortable. If I would itch it would leave scratch welts all over my face (what it looks like when a dog jumps up and scratches you is the best way to describe it), followed by an itchy sensation from my head to my toes. Once I would itch I would get little hive bumps and the scratch welts all over my body. Very sad this product did not work out for me, but wanted to warn others that have sensitive skin. * This moisturizer is very thick and seems to be a great product with the exception of the smell. It is a vibrant apple/lemon like a candy. 
Reminds me of a teenage type product, unfortunately it is to potent to use at night, to try to fall asleep it just keeps me up."
84,fresh,rose deep hydration face cream,pimprod2025112,2584148," * Love the day and night cream * Huge fan of fresh products. Received in a sample and then bought the full size. Within 6 weeks my skin got so dry, tight, and inflamed. Acne sprung up. The skin especially around my chin / jaw / cheeks started cracking and scabbing. It smells and feels so nice but the end result over time was not good. Switched my moisturizer and immediately the cracking, inflammation, and acne went back to normal. 

Love Fresh but not this product. * They dont give that much product to see if it does anything and it clog my pours more * It works great. Its not greasy. It absorbs well, and my skin is soft. My sensitive skin is not adversly affected in any way. It's a good moisturizer, and it's light scent smells great. * I wanted to love this moisturizer because I've loved other products from Fresh and I love the scent, but it was very disappointing. I used it at night after my full routine, and noticed within about 30 minutes that my skin felt tight (not moisturized). It was like the product had dried into a layer sitting on top of my skin. The next morning my skin didnt feel well-hydrated at all, in fact I had dry patches in areas that would typically be fine with previous moisturizers I've used. Unfortunate for the high price point, but maybe it's just not for me. * I really really wanted to love this moisturizer because of the texture, fragrance and overall feeling when putting it on but the peeling is crazy! For the price this product should not be peeling off pf my face within 5 minutes of me putting it on. Love the texture + fragrance but hate the peeling. * I havd been using this for a while now and it pills like drazy after it dries down - which translates on the makeup since it comes off when you apply. I know its not my skin since i exfoliate - so it shouldn't be doing this. I'm disappointed."
85,lancÃ´me,uv expert defense spf 50+ primer & moisturizer,pimprod2004242,2541521," * Moisturizing non greasy sunscreen product.
A little goes a long way. * I have oily skin and finding an everyday face sunscreen has been a nightmare. This is the best product I have found so far. Goes on easy, absorbs and doesn't leave a sunscreen residue. Leaves my face feeling soft and make up goes on easy after. Bonus for smelling good!!! Not a lot of product for the prices is the only downside. * My dermotologist  has not needed to treat as many pre-cancer spots on my face since using this product. * This product burned the skin under my eyes creating blisters.  I have never had this problem and I d not have sensitive skin. * I love this sunscreen because I have oily/sensitive/acne prone skin and this sunscreen works well with my skin. It is a small tube but I love it and the ingredients are excellent they are noncomedogenic! Lovely sunscreen :) Thank you so much Lancome ! * this is product is heavenly only downside is the price! * I wish for the money this cost that it wikld have more product."
86,clinique,superdefense city block broad spectrum spf 50 daily energy + face protector primer,pimprod2014019,2560146," * I have been using this product daily for over a year. I really like it and I feel it smooths the skin and helps prevent sun damage. * I absolutely love this stuff and cannot understand the negative reviews.  Great tint, high SPF, and easy to apply.  Best of all, it does not burn my eyes!!  I apply it alone to my neck after serums and moisturizer but do mix with my foundation when I apply to my face. * I was given the sunscreen by my mom try, but after a few weeks of using it I notices it made my skin extremely dry. It also caused my make up to separate even when allowing 15 minutes to dry before applying foundation. I've increased my moisturizer usage hoping that would help offset the dryness, but it has not helped at all. This sunscreen has an odd smell to it. * I've had such a hard time finding a face sunscreen that didnt mess with my skin or makeup and this is it! I'm obsessed with how easy it is to apply after my skincare and it was no issue at all with my makeup after application! It doesn't have a typical sunscreen smell. I will say, for someone like myself who had oily combo skin, this might be a hit or miss for you, but for myself personally I didn't mind it at all :) * My sister-in-law got this and I've always wanted to try it and have it my own and I love it 😊 * Smells terrible and goes on like flaky paste. Overall gross feeling. Very dissatisfied. * I've tried countless sunblocks, most of which caused me breakouts and I usually hate the way they feel on my skin or smell. This one is my GOAT. It layers well over my other skincare and makes a great primer for makeup. I always repurchase this."
87,amlactin,daily nourish lotion with 12% lactic acid aha,pimprod2043815,2623394," * AmLactin Daily Nourish Lotion with 12% Lactic Acid is revolutionary! It provides gentle exfoliation, intense hydration, and results in astonishingly soft and smooth skin. Its lightweight, non-greasy formula ensures lasting moisture throughout the day. Additionally, it is fragrance-free and soothing, making it perfect for sensitive skin. Absolutely adore it! * I love to use this lotion when my skin feels really dry, especially in the cold months. I also like to use it when my hands when they get super dry. It deeply hydrates my skin. * My daughter suffers from severe dry skin and this is the only product that works wonders for her! It's incredibly light weight and non greasy which is perfect for applying after a shower.  Will be repurchasing again! * AmLactin Daily Nourish Lotion with 12% Lactic Acid is a must I have in my bag now a day. It helps exfoliates, and deeply hydrates to uncover softer, smoother skin which as a 30ish woman is so needed. I love that it's fragrance free and works with your body. * I like to think of the AmLactin Daily Nourish Lotion with 12% Lactic Acid AHA as my go-to post-pool or beach essential. It's a lifesaver for my skin, especially after spending hours in the water. My skin tends to get super dry after swimming, and this lotion really comes in handy! * I can't believe it took me so long to find this amazing product. I will have it a part of my skin routine forever now! Such a great lotion for my whole body. Highly recommend purchasing if you have dry and sensitive skin. Game changing product so excited I found it! * As someone with dry and flaky skin, I've tried countless lotions over the years, but none have worked as effectively as this one.

The lotion has a rich, creamy texture that absorbs quickly without leaving a greasy residue. My skin feels immediately hydrated and smooth after applying it."
88,tula,24-7 moisture intense ultra hydrating day & night cream,pimprod2036708,2603052," * I chose this for a FFF box. I struggle with redness, tiny pimples, itching and burning on my cheeks and forehead from rosecea. I applied this after my HA serum and it kept my itching, burning and spots away every day I used it. My skin felt so plump and hydrated, with slightly reduced redness. I'm saving up to put this amazing cream again. The texture is thick, but absorbed well. Love it a lot!! * This product is very thick and little bit goes a long way.  I have been using it consistently for a week and my skin feels so soft. My skin has the tendency to be very dry and flaky especially with it being so cold and windy.  My skin is loving the extra moisture it is getting. * Perfect addition to my night time skin care routine. So buttery and moisturizing. It is too thick for me to use during the daytime under my makeup, but I just use the original tula for that :) * This is an excellent moisturizer for dry and irritated skin!I use it nightly after my prescription acne treatments and it really helps keep my skin hydrated and is very soothing. * I got this as a sampler and used it for about a week.  Everytime i put it on, it burned my face. I thought maybe it was one of the other serums i had on that was having a reaction to, but slowly began to realize it was this moisturizer. I am not experiencing a rash in my eye areas and cheeks. * I have combination, sensitive skin. I generally use a light weight moisturizer daily after showering and sometimes at night when I actually bother to wash my face. It's always worked great but I was experiencing a little bit of dryness so I decided to try this. It didn't irritate my skin at any point but it also didn't moisturize my skin. Trying to wear makeup only magnifies the dryness/flaking (and it's a hydrating CC cream). * I like to wear this at night. I put it on as the last step to my routine at night. It locks everything in beautifully and my skin feels nice and soft in the morning.

I've never tried it on under makeup as I light lighter creams under makeup."
89,sunday riley,c.e.o. afterglow brightening vitamin c cream,pimprod2032040,2596206," * Makes me burn and red * I bought this on an ulta 21 days of beauty sale just to try for funzies and turns out i actually love this!!! Ive used the entire jar and now i need a refill. I definitely felt my was super moisturized, bright without leaving a greasy residue. Truly a great step in my makeup routine 10/10 i would recommend * I use this with my daily moisturizer. I absolutely love it! My skin feels so refreshing. * And still teying to replenish the moisture in my face! I threw it in the trash. * Very nice product * I am not using it long enough to tell if it's doing g what it's supposed to do
How long should o e use this product before seeing results ?
Please let me know
It smells good and the consistency is nice
For those 2 reasons I will give it a 5 Star
I only rated 3 Stars because as I said I am not seeing any results * I love this moisturizer, it doesn't leave your face feeling greasy."
90,belif,the true cream - moisturizing bomb,pimprod2043261,2619877," * My a tome favorite mositurizer. Soaks right on and feels great on your skin. * Absolutely love this moisturizer! Definitely helps in the winter time when my skin feels dry and flaky. I have sensitive skin and it does not break me out. * Ive tried major and most popular moisturizers but this one right here is the best one! I love how moisturized it leaves my skin & i love how i can go out with out any makeup and my skin looks so GREAT. It's seriously worth it. * I bought this as I was searching for an affordable dupe of the Tatcha moisturing cream. This is really close to it as it is hydrating, leaves your skin feeling and looking supple, and decent price point. Korean are known for their products and this one does not disappoint even during the winter dey weather, it hydrates and sits well under makeup.

Only con to me is the packaging. I wish it came in a tube for easier travel. * Got this as a freebie and I absolutely love it! I purchesed a bigger size. Its soo cooling and hydrating. Doesnt pill like some moistureizers and isnt sticky. * I have used this product for several year and loved it, but the new formula is drastically different and makes my skin burn and leaves my skin feeling greasy. The scent used to be a natural herbal scent, but now smells like chemicals. So sad and disappointed, I would've stocked up on the original formula if I'd know they were going to ruin it! * I'm not sure why rhis doesn't habe more reviews this is the best moisturizer ever. I the cream on in the fall/winter and the aqua one in the summer."
91,philosophy,hope in a jar smooth-glow multi-tasking moisturizer,pimprod2029779,2589221," * My go to facial cleanser for many years. Definitely recommend. * I use the cleanser every day and I still have some left after two years. I love the cleanser. It leaves my skin smooth. * Not as good as Lancome facewash but almost. * Ive been using this cleanser for years and am in love with it. My moth bought it fir ke as a teenager when i struggled with acne and it was one kf the only skjncare products that actually helped. I just love how my skin feels arter using it. I like that it doesnt really foam. Its like a oil cleanser snd water based cleanser in one as far as skin feel. My skin alwasy feels nice after using * I always have to have this cleanser on hand for removing eye make-up. It takes off mascara, eyeliner, lipstick, eye brow pencil and any other waxy type make-up applications, without leaving a greasy film like eye make-up remover. Leaves my face feeling clean and not over striped. It has a light scent that does not linger. It doesn't foam much and is more of a light cream texture. I can wash around my eyes and eyelids then rinse without, eye irritation. I have sensitive eyes. 
I use a separate foaming cleanser (Tatcha Rice Wash) in the shower with a silicone scrubber for skin exfoliation and a deeper clean. * I'm 71 yrs old and my face has been breaking out. This cleanser has solved my problem. I've been using Philosophy in the shower and body lotion for years. * My skin loves this stuff! Plump, glowy, happy, hydrated skin. I have sensitive, acne prone, combo skin and during the winter time this is my go to PM moisturizer. In the AM I thin it out with a gel moisturizer."
92,clinique,smart clinical repair lifting face + neck cream,pimprod2040914,2610876," * This product is worth it. It is super moisturizing and melts in your skin. At first I thought the cream would be too thick but i was wrong. You dont need a lot and my face is so soft after using it a few nights. I have noticed some difference already in my neck and face. * I have mature skin at 59. I started using this cream about 3 months ago. I only use this cream and the serum from this line, but I've noticed a significant difference in the firmness of my skin. I have weird skin. I had cystic acne when i was younger and now I'm dry most of the time. I was using Perricone MD but had used Clinique years ago. I was looking for something with a wow factor that was less pricey. I definitely found it in this cream! It's super creamy, doesn't take much product, absorbs like a dream. And fragrance free! * I find I can only use this at night because it sloughs off so much if applying foundation on top in the morning. Wish I would have just gotten the new night mask. * I feel like I've tried hundreds of different moisturizers. Many sit on top of my skin or feel heavy especially once you add sunscreen on top. This product absorbs quickly and actually makes my skin feel and look plumped. It also feels cool which I like a lot and has a clean, non-offending scent. It's a thick cream that's soft & pillowy and improves my skin's overall appearance. * I started with the sample.  I loved it.  Very creamy.  A little goes a long way. * I was concerned about the switch to a new line of creams as I've been using the old smart night cream for years as a night cream, but overall have been satisified with the change. I'm 29 and was recommended by an Ulta employee in the store the lifting face + neck cream. The cream is a completely new product. It is thicker, much firmer texture than the old one. It is also bright white. It does not have a noticeable fragrance. (The jar says fragrance free). I use it as a night cream and can definitely see and feel the difference in 'firmness' and 'lifting' in my neck; although I didn't think I really needed it and that wasn't why I used the original night cream. I have noticed some white heads in my forehead/T-Zone, but I tend to get them occasionally anyway so I can't blame the cream on it. After reading about the other variations, I wish I had the SPF version so I can try wearing it twice a day with my makeup over it. I'll be giving this one to my mom and trying the SPF one next. :) * This is returnef the plumpness to my cheeks has lifted my laugh lines and I don't look as sallow under my eyes. This cream is amazing I thought I needed a facelift but after using this clinically proven product were 100% of women saw results I'm in love. I've never had more compliments on my skin and I'm 62."
93,philosophy,ultimate miracle worker multi-rejuvenating cream spf 30,xlsimpprod12661073,2288779,
94,it cosmetics,hello results wrinkle-reducing daily retinol serum-in-cream,pimprod2020623,2571942," * I really wish this was fragrance free. it smells like old ladies. I get it. I'm old. I don't need to smell like it though. otherwise it works great and I'll use it until it's gone, but I probably won't buy it again. * Makes your face smooth like a baby. * I love to try new products bit this is one I am committed to use! I've been using it for several years now and have probably used 6 jars of it. My skin continues to improve and my recent newcdrivers license picture clearly shows how much younger I look now than 4 years ago and I don't get any ""work"" done!  The dispenser is ingenious and doesn't waste product like so much packaging does. At first you must press several times to get it going; from thence on it dispenses the perfect amount.  Once it seems ""empty"", I pry it apart and find very little is left...maybe enough for one application, but clearly the packaging is designed so you get all the product with no effort and it cant be contaminated . I also use a Lancome serum every morning, and the two products seem to have made an amazing difference. * Within a few days I saw fine lines going away withour peeling or burning like a stronger retinol. Plus my skin still felt moistureized. Also, I really love the pump so it does not ruin the efficacy of the rest of the product. 10/10 * I have purchased this product before and especially like the way it controls the amount needed on the top. It also is a fantastic retinol seum in cream! Goes on smoothy and feels good on the skin. * I buy this It product when it is on sale,  as the product itself is OK.   HOWEVER, I wish they would change the pump lid....it works a few times and then stops.  You end up having to unscrew it just like a normal jar to get the moisturizer out.  It needs to stop wasting money on these lids and quit trying my patience.  A NORMAL Lid is preferred to one that quits working. * I love this serum!! It feels really good on my face and i see a small difference in my wrinkles"
95,chanel,le lift crÃ¨me smooths - firms - illuminates,pimprod2029952,2560172," * It penetrates into the skin quickly. I've used it for one week and can already see a difference.  I'm 65 and I was starting to really show it! * Treat yourself to this eye cream.  I have tried so many that leave your under eyes looking cakey or dry, or too hydrating where it becomes oily or sticky.  This perfectly absorbs into the skin and leaves the under eyes feeling hydrated and smooth.  I love prepping with this eye cream before I put my concealer on. * Day and night… Smooth, no greasy, feel fresh, Smells good…
Love it… * Got rid of my loose neck highly recommend.♥️♥️"
