,Brand,Name,ID,sku,comments
62,coola,piÃ±a colada classic body organic sunscreen spray spf 30,pimprod2012272,2561103," * Expected SPF 30 protection. This performed like an 8. After 30-minutes, I didn't burn but got white spots. This also smelled like alcohol and had a sticky texture. A gummy residue was left behind after showering. Not for me. * As a cosmetologist and barber, I've seen my fair share of sunscreens, but COOLA Piña Colada Classic Body Organic Sunscreen Spray SPF 30 is a game-changer!  It's like a tropical vacation in a bottle! The piña colada fragrance is so refreshing and fun, it makes applying sunscreen feel like a treat rather than a chore. Plus, it doesn't have that overpowering chemical smell like some other sunscreens. The spray bottle makes it super easy to apply evenly all over your body, even those hard-to-reach spots. No more awkward contortions trying to reach your back! And because it's organic, I feel good knowing I'm not slathering myself in a bunch of nasty chemicals. The protection. SPF 30 is perfect for everyday wear, whether you're running errands or lounging by the pool. Overall, COOLA Piña Colada Classic Body Organic Sunscreen Spray SPF 30 is a must-have. It smells amazing, applies like a dream, and provides top-notch sun protection. Trust me, once you try it, you'll never want to use another sunscreen again! This review was collected as part of a promotion. * I am loving COOLA right now. This SPF is perfect for this dreadful Texas humidity and heat. It's very lightweight, non-greasy, and has a pleasant scent. Reapplying is a breeze since the product doesn't build up on the skin or cause a film. It's very breathable and works well with general skin sensitivities. The size is quite large for travel, but still small enough to throw in your beach bag and still have space for other necessities. It has a click-locking spray top so it doesn't accidentally spray in your bag. I will say that if your skin is very dry, you may want to go for a cream SPF because this does not provide much moisture. This is definitely made for hot, sunny summers. I love it and I know for sure I am buying a full-sized bottle to keep on hand.

***This review was collected as part of a promotion.*** * As a professional in the beauty industry, I've learned firsthand the  importance of sun protection, making COOLA's  spray an indispensable asset. In an industry where skincare is very important, COOLA stands out with its dedication to not only protecting against harmful UV rays but also enhancing the overall experience of sun care.

COOLA's sunscreen spray doesn't just shield your skin from UVA and UVB rays; Its broad-spectrum protection ensures comprehensive coverage, safeguarding against both premature aging and potential skin damage. As someone deeply invested in skin health, I love COOLA's commitment to providing a product that protects and cares for my skin.

The scent of Piña Colada fragrance is delicious. Gone are the days of sunscreen smelling like, well, sunscreen. Instead, COOLA's tropical scent transports me to my last vacation. It's a big change from the clinical smell of traditional sunscreens, making the application process a sensory experience.

I did not have any issue in my delicate skin but I always recommend  a patch test.

In my personal opinion, COOLA's in spray isn't just a sun protection product; it's an  evolution of skincare. With its comprehensive protection, anti-aging benefits, and irresistible Piña Colada scent, COOLA has redefined what it means to stay safe in the sun. So, whether I am lounging by the pool or hitting the beach, I make COOLA my go-to companion for summer adventures. And a big pus smells delicious! * The COOLA Piña Colada Classic Body Organic Sunscreen Spray SPF 30 offers a delightful sun protection experience. Its tropical scent evokes visions of sunny beaches and relaxation, enhancing the application process with a touch of indulgence. The organic formula boasts SPF 30, providing reliable protection against both UVA and UVB rays, crucial for preventing sunburn and long-term skin damage. What sets this sunscreen apart is its lightweight texture, which absorbs quickly without leaving a greasy or sticky residue. This feature is particularly appealing for those who dislike the heavy feeling often associated with sunscreen application. The spray mechanism ensures effortless and even coverage, making it convenient for reapplication throughout the day, especially during outdoor activities. Furthermore, the use of organic ingredients adds to its appeal for those who prioritize natural  products. 

 In conclusion, the COOLA Piña Colada Classic Body Organic Sunscreen Spray SPF 30 offers a luxurious and effective sun protection solution for those who appreciate both quality and indulgence in their routine. * As a licensed Esthetician, we our taught early on how important using SPF to protect our skin. This aerosol is easy to use and smells amazing! If you have sensitive skin I would recommend spraying into your hands first then applying. I did have a slightly burning feel when I sprayed directly. But, overall I really love how cute and small and effective this spf is to use. My skin adapted the more I used this spf. * I love this sunscreen! Its perfect for travel and smells great. I used it almost all up on my recent vacation. It smells likea tropical holiday on a beach with a coconut. I would definetly recommend. I know the spf is quality and better packaged and easily portable."
63,neutrogena,ultra sheer lightweight sunscreen spray spf 45,pimprod2032286,2595099," * This is an all in one product. I use it during the day for the sun protection and the glow it gives. You want to spray generously and not skim out on it. The scent is also not too overpowering. * Just no * Beautiful not greasy I buy this over and over try it you won't be disappointed * This gets everywhere oily. You absolutely cannot use it inside or your floors will be slick. I still burn reapplying this too. * Wore this, let it set, and got in pool. 15 minutes later I was blue from the pools paint. This thinned it, removed it, and stuck it to my body while destroying the pools paint. * It was working okay but after 3 weeks of using it almost everday I started to develop rashes. They were circular (kinda likr cigarette burns) reddish, and flaky. They get itchy sometimes. I know it is this product because this is the only new one I've used. Now I don't know what to do with all these rashes and skin damage I've sustained. * Great hand spray type top instead of those one finger kind of press button things. The hand grippy spray allows for easier application in hard to reach areas."
64,coola,makeup setting spray organic sunscreen spf 30,xlsimpprod12131017,2287002,
65,tula,protect + glow daily sunscreen gel broad spectrum spf 30,pimprod2016249,2562776," * This was always my go to. I loved it until recently. Half way through my 3rd bottle and the sunscreen now has a different consistently and is pilling everytime. It's not expired and was not expecting this especially for the price. Won't be repurchasing and would not recommend. * Tula made a sunscreen serum that was fantastic! Best i ever used. They stopped making it this year so i switched over to this one. Its nothing like the serum! This is heavy, greasy and causes breakouts. It also has a strong smell. Please Bring the serum back! * Got this from FabFitFun! I love this sunscreen - for the brown girlies! This leaves no white cast, smells like bananas, very tropical and leaves your skin with a beautiful glow. * This is my favorite daily spf. I've received a lot of compliments about my skin when I use this product. My only wish for this item is that it would come in a stronger spf. An spf 50 would be ideal! * This is not gel!  This is oily and chunky and awful.  Do NOT buy and waste your money.  First time I've been disappointed by Tula. * This is a good lotion but it's very shiney! * This is such an amazing product! Its so glowy, moisyering amd it has SPF (which is your BFF) i hibetsly think it coulc work fir every skin type. It is worth EVERY CENT."
66,supergoop!,unseen sunscreen body spf 40 invisible sun protection,pimprod2038031,2606364," * I was so excited when I found this sunscreen. I received a sample size for my face and used the whole bottle. It was great! Then I bought the body sunscreen for my vacation and after the first use I realized what an expensive mistake it was. It didn't absorb well and left greasy, chunky residue all over my body. It looked like my entire body was peeling from a bad sunburn. This is a very expensive sunscreen for it to not be usable. I don't want to hang out in a public location looking like my skins peeling and I'm shading chunky skin cells all over a public pool. Gross!! * Goes on light.  Not greasy and doesn't leave white residue like some sunscreens do. * I do really like this sunscreen- it's like a clear gel with a velvety finish (think primer consistency). It's rather expensive though for what you get- considering it's a body sunscreen, this wouldn't even get you through a week at the beach. * No matter which supergoop I try they are heavy greasy they do block the sun but feel horrible * Me gusta mucho, no deja la piel grasosa, te da brillo y protege * Absolutely terrible! I broke out in a rash about an hour after using. Theew it away immediately! * I love the OG unseen sunscreen for my face and its the perfect texture and viscosity. I was hoping this would be too. I hate the lotion texture of others so i was really excited that SG came out witb this. The only problem is that its just oily… it absorbs well and makes my skin feel REALLY SOFT but since i do sweat pretty easily it can feel a bit slick at times. Maybe its the olive oil in it? Or its just too many oils."
67,la roche-posay,anthelios mineral tinted ultra light face sunscreen fluid spf 50,xlsimpprod4350455,2246041,
68,la roche-posay,anthelios body and face soft finish mineral sunscreen lotion spf 50,pimprod2003396,2620364," * Let me preface by saying I'm already very fair and I don't wear a lot of makeup. This was very white but rubbed in and absorbed well. Dries down quick to a soft powdery feel which is so beautiful to the touch.  No smell, did not irritate my eyes, did not make me break out which is amazing bc I'm sensitive and it's just so light feeling on my skin. My skin looks grade and I absolutely love this! * Loveit * I liked this when I would run because  it doesn't run into my eyes when I sweat but it has an awful white cast and I'm very pale. Does not rub in all the way no matter how long you massage it and is pretty greasy. * Pill , white cast and drying * In my personal experience, with this sunscreen i would say that all the pros that they stated above the reviews, are not true at all. They gave me bumps and a rash, that still have not gone away in over a week. I would not recomend this to anyone who has sensitive skin, because I don't have sensitive skin and it gave me an allergic reaction. * If you are remotely melanated, this is NOT the sunscreen for you (unless you don't care about white cast). Even after rubbing this in really well, the white cast doesn't go away. I do feel like this does a great job preventing sunburn, though. * I really wanted to like this product but it made me smell horrible for days somehow despite saying it was unscented and it left a white cast on me that was extremely hard to blend in. After sweating, you could see the white cast build up more and I was constantly having to rub the sunscreen in."
69,supergoop!,travel size play everyday lotion spf 50,pimprod2044740,2624564," * I absolutely love this product I just wish it was a little more budget friendly on the price. however, if you have the spare cash for this it is totally worth it! * The play everyday sunscreen face lotion gifted by supergoop feels hydrating and soothing when applied. I have dry sensitive skin and it works great. I like that it feels light weight and doesn't leave residue. It also works great under makeup and easy to pack size for travel. * I love this lotion from Supergoop! The PLAY Everyday Face Lotion with SPF 50 has become my favorite - it doesn't smell, it doesn't leave that white feeling on the skin and it moisturizes super well! It's perfect under makeup, it's light, doesn't weigh the skin down and doesn't leave it oily. What's more, it's water and sweat resistant, great for everyday use or even for park days here in Florida. Perfect for the whole family! * Gifted by Supergoop for my honest review. I've been using the Supergoop! PLAY Everyday Face Lotion SPF 50 and honestly, I'm impressed. It goes on super smooth, no white cast at all, and feels more like skincare than sunscreen. I love that it's fragrance-free and layers perfectly under makeup—plus my skin feels hydrated all day without getting greasy. * I have used many different supergoop products and received this product complimentary from supergoop but I continually to love everyone I try! This play sunscreen glides on easily and works well for my skin. I have medium skin (not fair but not dark) and it protects my skin from sun exposure and last longer than most sunscreens. * Absolutely obsessed with this! Not only is it a high spf but there's no white cast. This is great on its own for every day coverage but also applied well underneath makeup. Soopergoop never disappoints! Gifted by supergoop * I WOULD REPURCHASE THIS! Summer is here and SPF SPF SPF ALL THE WAY! This formula feels so rich as soon as it touches your skin and it leaves no white residue. The packaging is so cute too. 100/10 gifted by supergoop"
70,sun bum,sunscreen lotion spf 70,xlsimpprod11281077,2267349,
71,la roche-posay,anthelios uv correct spf 70 daily face sunscreen with niacinamide,pimprod2030180,2591831," * I like it for most part... but if you sweat, or rub your eyes, it burns for a really long time. * I purchased this product three times. The first time was great i fell in love instantly, it was greasy, it dried down beautifully and it was great under makeup. Not to mention 70SPF?? Heck ye! So i bought it a second time and i used it for the first few months no problem, and then my eyes started to water..not sting, just water. And i thought hm well thats weird cant be my sunscreen cause ive been using it with no issues, and i was running out so i think purchased my third and final bottle and oh my gods when i tell yall my eyes BURNED. Within the first month of purchasing my third bottle i had to constantly wash my face because i couldnt keep my eyes open. But again, it couldnt have been the sunscreen right?? So for the next weeks i isolated my skincare products and all were perfectly fine…except for this sunscreen. By this time it was too late to return it so in the trash it sadly went. Ive never been so heartbroken, if they changed their formula or if my skin just got allergic to it over time i dont know. Im on the search for a new perfect sunscreen, wish me luck. * I have oily to combination skin and this product is not sweat proof or water proof as stated in the description. I will say this product did correct my darkspots and protected my skin. The lotion does need to be rubbed in and does peel after the second hour but the protection is present. I can only wear inside my house due to it being hot and me being sweaty. * It burned my eyes. I didn't put around eye area. I really wanted to love this spf 70, but it was too hard to work with. left face drier than before I put it on. I had to return it. * I wish I could love this product more; unfortunately, every time I apply this product it would irritate my eyes. Of course, I tried to avoid eye area, but still a few minutes after the application, my eyes would be irritated. If you have sensitive eyes, I would not recommend it. * This sunscreen is sheer and I like it very much. Sadly, it's one that creeps up into my eyes and burns. * This is a hard review to write because in a lot of ways its exactly what I'm looking for: moisturizing, has spf, gentle. The big reason I wouldn't buy it again is it melts into my eyes and stings terribly. Ive actually had to pull off the road barely able to keep my eyes open another second with a waterful of tears (product induced— not weeping) making the whole situation worse. It must not happened to everyone, which is why I gave it for stars. It just doesn't work for me."
72,la roche-posay,anthelios kids gentle sunscreen face and body lotion spf 50,pimprod2037033,2608258," * It looks horrible on my skin. I have used it on different occasions and it always happens the same. Don't waste your money. * By far the best sunscreen out there! I used it daily for a 3 week trip throughout Italy during a heatwave and didn't get burnt despite me being fair as can be and outside the majority of the day. Will always buy again!!! * I purchased this product because the ingredients list showed that it did not include Avobenzone, Octisalate, and Octocrylene. However, when I received the product, this sunscreen does include these ingredients which are NOT reef safe and is banned from parts of Hawaii. Will be returning. Please update the ingredients to include everything."
73,neutrogena,purescreen+ tinted mineral sunscreen,pimprod2037357,2606100," * Over the summer I wanted a tinted sunscreen to wear in lieu of foundation. I love that this is affordable, comes in a variety of shades (I sometimes mix them) and evens out my skintone while giving me sun protection.  I am in my late 50's, and not into high fashion cosmetics at this point of my life. But i am into quick makeup that looks natural, and this does the trick (although i still use an under eye corrector).  Some people say its oily. I feel like it gives me a dewy glow. Younger people may not like it, but its good for my generation whose makeup can look cakey due to drier skin. You have to shake up the product before applying which can be messy.  I've found that if I take off the lid and put my index finger over the hole while shaking, there's no mess (a finger keeps the product in the bottle better than the lid does). Also, when traveling, I put a small piece of plastic wrap over the hole, then screw on the lid. Pain in the butt?  A bit. But i like the product so I'll deal with the packaging. * I bought this product to make my morning routine easier, but it applies so oily and runny  that I need to be careful when handling the packaging and applying on my face. It's unwearable without setting powder and the product leaks everywhere. I bought a Medium shade but I'm really a light Medium and it shows that it's not the right shade. * Love the shade range and doesn't break me out or dry me out. * I really wanted to like this.  I have fair skin (120 in Fenty) and the light shade worked well for me.  It might be a tiny bit too dark, but it's so sheer that the color blends away and doesn't leave a line.  This has essentially no coverage, even for a tinted moisturizer so don't expect even light coverage with this.  I could deal with that and just use this as a sunscreen if it were not SO OILY.  It remains tacky and shiny even after letting it sink in for half an hour.  I am in my 40s and have very dry skin.  My skin is so dry that I use face oil with my moisturizer at night so I never thought I would say that a product is too oily.  I thought that my summer daytime moisturizer might be too heavy to use with this tinted moisturizer so I tried it without my normal skin care on bare skin the second time I used it.  It's still a greasy mess on my dry as the Sahara skin and the oil never sinks in.  The tint rubs off and leaves a mess if anything touches your face.  I just don't understand the reasoning behind a greasy, tinted sunscreen with no coverage that leaves color on anything that touches your face. * The sunscreen itself I enjoy and is great for my sensitive skin. However, the tube it comes in, is a mess! The sunscreen is so thin, it really needs to come in a pump style not a squeeze style. I feel like I've lost half of the product already because it leaks out the sides. * 1. I only wear mineral spf - if you can do chemical - i wouldn't recommend this. There are so many elegant chemical formulas, especially in k-beauty! 
2. This stuff IS moisturizing and doesn't really dry down. great for dry skin or when set with powder- but i wouldn't recommend to oily girlies. 
3. Its  VERY runny- so make sure to shake it before applying. The packaging gets pretty messy for that reason - i think a dropper bottle would be perfect. 

I use this when my skin needs moisture, like after retinol or AHA. Im pretty pale and the tint is perfect. All universal tinted spfs are too orange for me. 

While i don't this daily, I really do like it and find it's been a staple for my dry or sensitive days. * this oily soup of a sunscreen should not be appearing in the ""CC cream"" or other searches for ulta. to say it's tinted is a farse, it is slightly in appearance to be non-white. it is also the oiliest, runniest cosmetic I have ever encountered. I have dry skin and couldn't even absorb it after many attempts at blending (which then eliminated any coverage it provided). the end feel was disgusting and greasy and it gave acne within 24 hours. also, the packaging doesn't seal well. in just one day it seeped out into my makeup bag. Just awful all around."
74,vacation,classic lotion spf 50 sunscreen,pimprod2037341,2606406," * I've tried using this sunscreen a few times because I like the smell, but I burned three different times with it, and I don't usually burn with sunscreens. I don't recommend this for safe sun care. * This sunblock is awful. It pills so bad whether I rub it in right away or let it soak in for a minute. So naturally it provides no real protection. I genuinely hate this SPF and now I'm stuck with it. * I was excited to try this based on all the good reviews, but it pilled terribly, even as the only product on my skin. It also felt super sticky, and rubbed off on everything I brushed against. It never actually absorbed into my skin. Would not buy again. * LOVE the fragrance. I personally have never had issues with pilling as some others have noted. I have been using this as my go-to for two years now. * I've purchased this product before, a few years ago--no issues with pilling at that time. This time, it pilled horribly on both my husband and myself. We applied a half hour before going to the beach, and then reapplied after spending 40 minutes in the ocean. Both times it never seemed to absorb, just sat on top of the skin and felt greasy and pill-y. It pilled bad enough that I left a residue on the seats of our car. I have red hair and fair skin, so I reapply frequently to prevent sunburn. Guess who got sunburnt with this sunscreen anyway? * I was so excited about this sunscreen but ended up being disappointed! Maybe it's not made for use after being in water, but when reapplying it pilled so badly and I got burnt. It also is extremely greasy. * So I have the smaller size and I have no issues with that one, but I bought the big pump one for my trip and every time I used it it pilled like crazy on my chest back and shoulders. The smaller one doesn't though so I very confused..."
