,Brand,Name,ID,sku,comments
131,cetaphil,daily oil free facial moisturizer spf 35,pimprod2028657,2586964," * I tried this product because I was looking for a good moisturizer/sunscreen combo for the face. Overall the product was great. It did not leave a white hue to my light skin-tone face or to my tan skin-tone friend's face like other sunscreens do. I was out in the sun a lot and my face remained sunburn-free. My only complaint is the pump that dispenses the product. The first time I bought this, the pump simply would not work and I had to unscrew the cap and squeeze out the product. I bought the product another time and occasionally had similar issues with the pump. * This would probably work for someone with normal skin but definitely not oily / combo skin. It suffocates my pores and instantly causes me to start sweating. It doesn't wear well under makeup up, at least for me, due to the sweating. * Needs a better bottle * This is my favorite moisturizer. It makes my skin feel soft and nourished without feeling like theres a layer on top of my skin, and it does not feel greasy at all. Plumps skin too. * As soon as i put it on i start sweating it all off immediately. My skin cant breathe because its very thick. Maybe better for those with tighter pores * It good but first of all, it is only 35 spf. Do not get anything thats not over 50 spf. * This is my favorite moisturizer. I use it after washing my face and before putting on my makeup. 
I do not like the bottle it comes in. Theres so much wasted lotion at the bottom thats hard to get to unless I cut upen the bottle— and its a think bottle, which is difficult and dangerous to cut… 
I hope someday this lotion will come in a better sqeeze tube bottle similar to the cereve 50spf facial moisturizer squeeze tube/pump container."
132,supergoop!,play everyday lotion spf 30 with sunflower extract pa++++,pimprod2030630,2589405," * It was great the first few days. I loved the texture and the way it felt on my skin, but unfortunately 3 days later I broke out in a rash on my neck and chest. It was the only new product I had introduced. Maybe some people can tolerate it on their skin but not mine. * *I was gifted by Supergoop to review* My skin is typically combination, however my biggest concern with sunscreens is 1. Being good with sensitive skin and 2. Having little to no white cast since I have tan skin. To my surprise, there was ZERO white cast, and the lotion is completely white so it went into my skin nicely and left it pretty soft. I would recommend! * I love it. I put it on everyday. It doesn't make my face look oily even if I apply makeup on top. It's a great product that last for hours. I highly recommend this product. I received this product complimentary from Supergoop. * My skin is super itchy now. * Leaves a white cast. I will use the rest of it since it wasnt cheap but if you have medium to dark skin this might not be the sunscreen for you * My daughter love the super goop SPF 30 lotion it doesn't give a white residue. The whole family use it to. * I occasionally use it as a base for my make up and usually the first thing in the morning. If you don't set it with powder, it can get kind of greasy but otherwise it doesn't clog pores or make me break out."
133,neutrogena,invisible daily defense lotion spf 60+,pimprod2019316,2573916," * I used to use another Neutrogena sheer sunscreen.  It was sheer on the face and body but it left white smears over leather car interiors and dark clothing.  This one does not.  I was hesitant to try the orange looking sunscreen, but it is invisible when applied. My only complaint is that it is too hard to find in stores.  A local grocery only has this in spray-on form which is much too messy to use anywhere but at the beach.  I use sunscreen every day.. * I used this for a few weeks and didn't realize it was getting more uncomfortable, i thought maybe I'd over exfoliated or it was my makeup or something. But one day I applied it and my body rejected it intensely and I needed to go to urgent care with my face in so much pain and red blotches. Patch test but also just be wary if it starts tingling * I was hoping to use this on the face but it's very oily and has a strong smell. Does dry down nicely. It will be good for neck, chest, and hands * Really good sunscreen, as someone that has tried other sunscreens, this is the only one with good consistency and doesn't leave that horrible whitecast!! * I used this for a few weeks before I had a reaction. Over time I noticed my face felt a little stingy after my morning routine, and I just thought perhaps I had over exfoliated at some point. Then one day my face and eyes kept burning, and I thought it was my makeup. I washed my face and did my morning routine again including spf and had to wash it off AGAIN and realized it was just getting worse so I decided no makeup, but the burning?? And finally I just couldn't stand ANYTHING on my face, and I had to call out and go to the urgent care. I had patch tested it and worn it just fine for a few weeks, but somehow just developed an intense reaction to it. And removing that one item from my routine set everything right. I was disappointed and out money for the urgent care and missing work, and had a goofy red and painful face. I don't think anyone can patch test for weeks reasonably, but please learn from me- if your face starts tingling after your morning routine and this is the only thing that's new, don't wait for it to get worse. Just toss it. * I've tried many drugstore sunscreens and this is one I definitely recommend! 
It does go on a bit oily but letting it go into your skin for a few minutes it leaves a clear no whitecast application. I can put my foundation on without thinking about how it can mess up my shade! If you wear maybelline fit me foundation, this sunscreen does not separate your makeup underneath. Highly recommend!! * I really didn't care for this - the smell for me was very strong and off-putting, the texture was very oily and I didn't like how intense the orange-yellow coloring was.  It does protect from the sun, so it does the job, but I would not buy again."
134,coola,travel size piÃ±a colada classic body organic sunscreen spray spf 30,pimprod2012271,2561104," * Expected SPF 30 protection. This performed like an 8. After 30-minutes, I didn't burn but got white spots. This also smelled like alcohol and had a sticky texture. A gummy residue was left behind after showering. Not for me. * As a cosmetologist and barber, I've seen my fair share of sunscreens, but COOLA Piña Colada Classic Body Organic Sunscreen Spray SPF 30 is a game-changer!  It's like a tropical vacation in a bottle! The piña colada fragrance is so refreshing and fun, it makes applying sunscreen feel like a treat rather than a chore. Plus, it doesn't have that overpowering chemical smell like some other sunscreens. The spray bottle makes it super easy to apply evenly all over your body, even those hard-to-reach spots. No more awkward contortions trying to reach your back! And because it's organic, I feel good knowing I'm not slathering myself in a bunch of nasty chemicals. The protection. SPF 30 is perfect for everyday wear, whether you're running errands or lounging by the pool. Overall, COOLA Piña Colada Classic Body Organic Sunscreen Spray SPF 30 is a must-have. It smells amazing, applies like a dream, and provides top-notch sun protection. Trust me, once you try it, you'll never want to use another sunscreen again! This review was collected as part of a promotion. * I am loving COOLA right now. This SPF is perfect for this dreadful Texas humidity and heat. It's very lightweight, non-greasy, and has a pleasant scent. Reapplying is a breeze since the product doesn't build up on the skin or cause a film. It's very breathable and works well with general skin sensitivities. The size is quite large for travel, but still small enough to throw in your beach bag and still have space for other necessities. It has a click-locking spray top so it doesn't accidentally spray in your bag. I will say that if your skin is very dry, you may want to go for a cream SPF because this does not provide much moisture. This is definitely made for hot, sunny summers. I love it and I know for sure I am buying a full-sized bottle to keep on hand.

***This review was collected as part of a promotion.*** * As a professional in the beauty industry, I've learned firsthand the  importance of sun protection, making COOLA's  spray an indispensable asset. In an industry where skincare is very important, COOLA stands out with its dedication to not only protecting against harmful UV rays but also enhancing the overall experience of sun care.

COOLA's sunscreen spray doesn't just shield your skin from UVA and UVB rays; Its broad-spectrum protection ensures comprehensive coverage, safeguarding against both premature aging and potential skin damage. As someone deeply invested in skin health, I love COOLA's commitment to providing a product that protects and cares for my skin.

The scent of Piña Colada fragrance is delicious. Gone are the days of sunscreen smelling like, well, sunscreen. Instead, COOLA's tropical scent transports me to my last vacation. It's a big change from the clinical smell of traditional sunscreens, making the application process a sensory experience.

I did not have any issue in my delicate skin but I always recommend  a patch test.

In my personal opinion, COOLA's in spray isn't just a sun protection product; it's an  evolution of skincare. With its comprehensive protection, anti-aging benefits, and irresistible Piña Colada scent, COOLA has redefined what it means to stay safe in the sun. So, whether I am lounging by the pool or hitting the beach, I make COOLA my go-to companion for summer adventures. And a big pus smells delicious! * The COOLA Piña Colada Classic Body Organic Sunscreen Spray SPF 30 offers a delightful sun protection experience. Its tropical scent evokes visions of sunny beaches and relaxation, enhancing the application process with a touch of indulgence. The organic formula boasts SPF 30, providing reliable protection against both UVA and UVB rays, crucial for preventing sunburn and long-term skin damage. What sets this sunscreen apart is its lightweight texture, which absorbs quickly without leaving a greasy or sticky residue. This feature is particularly appealing for those who dislike the heavy feeling often associated with sunscreen application. The spray mechanism ensures effortless and even coverage, making it convenient for reapplication throughout the day, especially during outdoor activities. Furthermore, the use of organic ingredients adds to its appeal for those who prioritize natural  products. 

 In conclusion, the COOLA Piña Colada Classic Body Organic Sunscreen Spray SPF 30 offers a luxurious and effective sun protection solution for those who appreciate both quality and indulgence in their routine. * As a licensed Esthetician, we our taught early on how important using SPF to protect our skin. This aerosol is easy to use and smells amazing! If you have sensitive skin I would recommend spraying into your hands first then applying. I did have a slightly burning feel when I sprayed directly. But, overall I really love how cute and small and effective this spf is to use. My skin adapted the more I used this spf. * I love this sunscreen! Its perfect for travel and smells great. I used it almost all up on my recent vacation. It smells likea tropical holiday on a beach with a coconut. I would definetly recommend. I know the spf is quality and better packaged and easily portable."
135,black girl sunscreen,kids moisturizing broad spectrum spf 50,pimprod2038237,2609781," * I got a chemical burn on my face an was desperately lookimg for a sunscreen that had ingredients gentle enough to not increase the constant burning feeling. I dead through sooo many sunscreens and this was an AMAZING choice. And even after im all healed, its still my favorite because it doesn't give me that sticky feeling other sunscreens do. * This one isnt greasy which I love and I dont feel any burning/itchy sensation after applying it. * I use this everyday. It feels amazing on my skin. It doesn't burn for me but can sting if it gets into my eyes (normal). It doesn't have to weighty feel that a lot of other mineral sunscreens do but still feels like a nice moosturizer. And ++++ that it works great under makeup. I tried so many sunscreens before and this one stands above all else. * I apply this sunscreen daily. I have been using this for a couple of years now. I've strayed a couple of times, but I always come back to this. I have sensitive skin and eyes, and this is the only one I have found that doesn't irritate my skin, or sting my eyes. (I slather this all over my face, including my eyelids) * I love my BGS Kid's because it feels amazing and moisturizing on my face! I was recommended this by a friend, and it leaves no white cast. I don't like gel-consistency sunscreens, so I was stoked to find a classic lotion consistency, this one works great for me! * most moisturizing sunscreen i've ever tried and it feels good on my skin. I'm a darkskinned and it leaves a nice glow
HUGE CON: makes my eyes burn and makes my eyes water throughout the day everytime i've worn it, you HAVE to make sure to not put it around your eyes. started using it on my body instead of my face. * Been using this for years and I absolutely love it. Goes on a bit oily but dries down after a few minutes. Leaves my skin moisturized and protected without a purple cast. Highly recommend and have put a my friends and family on to it too."
136,shiseido,urban environment vita-clear sunscreen spf 42,pimprod2039504,2612331," * Excellent choice for those with sensitive skin. Infused with vitamin C, it offers effective sun protection without causing breakouts. The lotion leaves a slightly shiny finish but doesn't make the skin oily, making it a great base for foundation. Highly recommended for its lightweight feel and skin-friendly formulation. * Goes in clear which is great fir those ""no makenup days"" 
Very hydrating and gives my skin a nice glow. I wear in the summer time and my face always feels protected. 
Id tou are jot into the glowy/dewey look, id recommend a diffrent product! * I really like this sunscreen! It absorbs very quickly, lightweight, and help controls my oil production throughout the day. I still have to blot my face in the afternoon, but it helps. I also like to use a water base moisturizer underneath :) 
PLEASE NOTE* a little goes A LONG WAY! 
Your face will be a grease pit if you put too much on, learned the hard way. * I dont get why some people love the ""dewey"" effect because at least on me, when I put this sunscreen on, it felt like I just spent the day frying stuff in the kitchen and all sweaty, right after my shower! It went straight to the trash can. * This sunscreen reminded me of a drugstore formula, not something I'd expect from Shiseido. It has an oily, sticky texture - not like your typical Shiseido sunscreen or a clear sunscreen like Supergoop. It's greasy, doesn't absorb well, and it stings the eyes terribly like a poorly-formulated budget buy. I really dislike it and will be returning it."
137,tula,mineral magic oil- free mineral sunscreen fluid broad spectrum spf 30,pimprod2025972,2584410," * I use under any makeup or alone. Doesnt make my face break out and provides SPF * I love this!  it's a mineral sunscreen for face that truly goes on clear.  It has a beige tint til applied.  It adds a natural glow and makes skin look beautiful.   Perfect for mature skin.The expiration date (on the box and tube) isn't always great - 5 months.  The tube leaks into the cap, so I store mine with the tip upward. 
it's spf30, so it's efficacy is 2 hours - so reapply.   I highly recommend this for a mineral sunscreen. * It's lightweight and easy to wear but I dont feel like it protects me enough from the sun. I feel like I need to apply so much for it to work. Plus it's very small for the price. * The first bottle i bought was perfect. The sunscreen is incredible and makes you look so glowy. Doesnt break me out. I didnt have an issue with the bottle leaking. I just bought a second bottle and it is just not travel friendly at all. Half of it spilled in my toiletry bag. Id love for the packaging to get fixed so its not leaky but the product itself is top notch. Only sunscreen id ever use on my face * I do like this. It has a slight tint that when applied it's hardly noticeable but sunscreen seems a little drying but not as much as some other tinted sunscreens that I""ve tried. Would buy this again. * I find this sunscreen perfect for sitting under makeup or wearing it alone. * This sunscreen has Butyloctyl Salicylate, a cousin to octisalate, and a chemical UV absorber. That's how they can get a higher SPF with such a low concentration of Zinc or TO. So it isn't purely mineral. I like it and use it, but I wish they wouldn't market it as 100% mineral when it has unregulated chemical UV absorbers in it."
138,blue lizard australian sunscreen,sheer mineral sunscreen lotion for face spf 50+,pimprod2043669,2621977," * Although it's a sheer mineral sunscreen, I found that it's still difficult to completely rub into the skin and leaves a white cast (like most mineral sunscreens). I really wanted to like this brand as I've also tried their other sunscreens but they're just not for me. * I agree with many other reviewers about the product's comfort on the skin, easy to rub in formula, and ease of washing off compared to other mineral sunscreens. I switched to this from the CeraVe facial moisturizing lotion with SPF for a higher coverage and mineral. After about a month, my entire face was broken out, from my forehead line, temples, cheeks, chin, and jaw, all red under the skin bumps that were super itchy. Even though it's an otherwise clean product, make sure to spot test this a few times before buying! * I really wanted to like this sunscreen, especially because of the protection from blue light. However, this product isn't for me. It takes quite a while to rub in, and a white cast is still inevitable. It also feels greasy after a few hours of wear. I wish Ulta would restock the Jack Black sunscreen I have come to love over the years! * I tried the blue lizzard Sheer Mineral Sunscreen Lotion for Face SPF 50+ and I was very impressed. It is very lightweight and goes on sheer. I have very dry skin and most mineral sunscreens leave my skin uncomfortably dry after 2 hours. This is not the case with the blue lizzard sunscreen. I am able to wear it and reaply without my skin feeling uncomfortable. This is a great product for the price. * When applying the proper amount, it does leave a white cast on brown skin. But feels great on skin * I was recommended by a dermalogist to use blue lizard. I have dark brown spots.I have been using this product for over 6 years. I have noticed a difference on my face. * I've heard nothing but good things about this brand and when I ran out of my current face sunscreen, I decided to try this one. I love that it's an SPF50. That's honestly the only positive thing I can say about this sunscreen. It comes out pretty runny, but it's the consistency of Elmer's Glue and I imagine that this is exactly what it would feel like if you tried to rub glue into your face. On top of being difficult to apply, it leaves a horrible white cast. This one was a miss for me."
139,sun bum,daily 50 face gel,pimprod2043277,2619923," * this sunscreen was peeling. i would wait ten minutes between my moisturizer and sunscreen and even then when i began application the sunscreen would immediately start to pill up. i had to wipe my hands between sections of my face and wipe off the flaky resedue. it does get you matte, but only for a bit. after one hour my t-zone would be so shiny and oily. this sunscreen is not good and too much of a hassle to keep up with. do nit waste your money on it * This sunscreen is a great texture. Only problem is if it seeps into your eyes, it burns really bad. Do not put this under your eyes or on your eyelids. If it didnt burn then this woild be a awesome sunscreen! * I bought this sunscreen before i realized it has 5 oils including coconut oil which makes me nervous due to the high chance to clog pores. But i decided to still try it and the texture is really nice. I love that it is at least SPF 50, clear and easy to blend yet feels very hydrating and light. I love that it's water resistant most likely from the oils which makes it very smooth. * I have been using this sunscreen for about a week now, and i am loving it! I have extremely oily skin, so it's important to me to find a sunscreen that doesnt feel heavy or greasy. It blends into my skin very easily and wears well under makeup. It hasn't broke my skin out either! A lot of people have commented on the smell of it, but i do not notice any smell while applying it to my face. I will definitely keep using this sunscreen!! * This sunscreen changed my life, im normally sensitive to sunscreen and this one is perfect * I hate dewy sunscreen. Ive tried all big popular brands (supergoop, shisedo, elta md, etc) and this is my got to. I reach for this spf over all the others beacuse it feels light on my skin and has a matte finish. I have acne prone skin and feel/ look gross with that dewy shiny finish. This sun bum fel is simliler to the super goop unseen but feels breathable on my skin. I give it a good shake and have no problem getting the recommended amount on. I see a few reviews say it smells bad- but i dont think it has any scent. I wear this everyday. * I really like this formula. Reminds me of Supergoop but less silicone-y and my skin felt like it breathed more. My issue was the scent. I am normally not sensitive to smells but this smelled like something spoiled and it didnt go away quickly. Like burning rubber and cat puke. Surprised more reviews havent commented on it."
140,sun bum,face lotion spf 50,xlsimpprod17761991,2523259,
141,beekman 1802,milk primer spf 35 3-in-1 daily defense sunscreen & makeup perfecter,pimprod2024957,2577634," * Let me start off by saying that it's not for everyone. 
Depending on whether you want: dewy, mattifying, silicone, etc. 
This is more matte, and depending on the foundation you use, you'll need primer too. But it's 100% worth a try! I'll be re-purchasing! * An Ulta employee so graciously put me on to this product when I came in looking for a primer with SPF coverage and wow, did they deliver! Goes on super smooth and has no issues with clinging to dry patches or pilling (though if you're having issues with pilling, check what products you're layering under this! Jojoba oil/rose hip seed oil have never given me issues). Helps to even out my makeup and leaves no noticeable white cast under medium coverage foundation. This is quite a dewy primer, which may not be suitable for super oily folks, but works great with my combo skin. Took me about 5 months of almost-daily use to fully use all of the product, so I feel like the price is more than fair given that is satisfies the purpose of both a primer and daily SPF. Just make sure to shake it well before use to combine the product and help the pump function better! * I love this stuff, the formula is thin and watery but it leaves the skin silky. It does not pill at all under makeup, and feels super loght weight. * did nothing for me * This profuct is AMAZING!! I absolutely love everything about it. The texture on my face, the scent, the blurring effect. Key is to let it dry at least 3-4 minutes before applying the next skin regimen step. * I'm south east Asian with neutral light to medium skin tone and this left a white cast. My makeup didn't settle well with the primer. don't want to throw it away so I use on the body for extra SPF. * I sooo wanted to love this product but the smell is so horrible. I think I got a bad batch because I haven't heard someone else complain of the smell. The texture and prime this product has is just so incredible though ;("
142,sun bum,mini original spf 45 sunscreen face mist,pimprod2044628,2625244," * I love this refresher spray. Plus, it has SPF. I mean, I don't count on that for the amount of SPF I need, but it's a bonus. If you don't like scent, this isn't for you, but I love it!  It doesn't stay strong, but every time I spray it, someone comments how great it smells. * I LOVE THE SPRAY. but not sure if its my fave daily sunscreen. I like a lotion sunscreen but this is convenient. Smells like all other sunbum products (banana/summer) and i layer diff spf products. * I use spf makeup but this is perfect to carry and apply when im oitside with out ruin my hair or makeup * Love this face SPF mist for a nice cooling effect. Recently went on a beach vacay.  I used this product throught the day. I could pull it out of my bag and quickly get my SPF protection with a clean clear light mist. It was cooling as well which was a great plus in the hot climate.  A light tropical scent that dissipates quickly. So glad i had this. Works great. I would definitely encourage others to purchase if just for the ease of use. I sprayed over makeup too. This is a great performance product. * Smells strongly of fake banana, burned the skin while applying, left me feeling sticky and greasy."
