,Brand,Name,ID,sku,comments
198,mad hippie,sheer tint sun serum,pimprod2030864,2592481," * I do NOT recommend, i got a chemical burn from the product. My face started to go numb and was extremely swollen and red. It was really scary seeing myself that way. I typically have really nice skin with minimal concerns. I had never had an experience like this with amy product * I love mad hippie products, but I feel I need to give this review to warn others with skin like me. My face broke out into a rash covering both cheeks, forehead, and right jaw line. Ive never had something like this happen. I typically use chemical sunscreen, and I'm wondering if I'm allergic to zinc. Either way, i have very sensitive skin and the trash didn't go away for 5 days. * This is just the best zinc sunscreen around, hands down.  As a natural girlie I feel like I've tried most zinc sunscreens as its all my family and I will use.  Most are soooo very pasty.  This one goes on like butter!  Hydrated and clear.  The ingredients are super clean and hydrating.  I can layer makeup over it easily. * I use this un-tinted spf serum and the tinted one that mad hippie does.  They are both really good.  I like this one because it is waterproof and super moisturizing.  Its the most moisturizing zinc sunscreen I've ever found.  Most zinc sunscreens feel very drying on my skin and accentuate my wrinkles but this one feels like a moisturizer. * I try to only use zinc sunscreen on myself and my kids.  A lot of them are super whitening and feel like you've got something on your skin - yuck!  Not this one.  It goes on super smooth and leaves my skin feeling great.  I wish they would make a bigger bottle that I could use on my whole body. * Bought this because i wanted a sheer tint & light coverage & i love using mad hippie products! 
This one just sadly isnt for me. It completely dried out my skin (and i alraady deal with dry skin!) especially around my forehead and my nose. Im just upset because i spent money on it jusy to use it 3 times before it started drying me out bad! * Never can tell how ones skin is going to react to even the most popular products, but holy moly am I glad I decided to give this a chance. Just started my third bottle. I used La Roche Posay tinyed sunscreen previously, but this is worlds different. Have to work fast to get good distribution, but after a few seconds tapping a tiny bit more on top of any spots needing helps conceal. I use a very light layer of Ulta powder foundation after to set and Rude Cosmetics plump setting spray and let me just say its all survived monsoon rains, summer sweat and does not dry me out in winter so long as I remember to moisturize first."
199,mad hippie,daily protective serum spf 30+,pimprod2025055,2581556," * I do NOT recommend, i got a chemical burn from the product. My face started to go numb and was extremely swollen and red. It was really scary seeing myself that way. I typically have really nice skin with minimal concerns. I had never had an experience like this with amy product * I love mad hippie products, but I feel I need to give this review to warn others with skin like me. My face broke out into a rash covering both cheeks, forehead, and right jaw line. Ive never had something like this happen. I typically use chemical sunscreen, and I'm wondering if I'm allergic to zinc. Either way, i have very sensitive skin and the trash didn't go away for 5 days. * This is just the best zinc sunscreen around, hands down.  As a natural girlie I feel like I've tried most zinc sunscreens as its all my family and I will use.  Most are soooo very pasty.  This one goes on like butter!  Hydrated and clear.  The ingredients are super clean and hydrating.  I can layer makeup over it easily. * I use this un-tinted spf serum and the tinted one that mad hippie does.  They are both really good.  I like this one because it is waterproof and super moisturizing.  Its the most moisturizing zinc sunscreen I've ever found.  Most zinc sunscreens feel very drying on my skin and accentuate my wrinkles but this one feels like a moisturizer. * I try to only use zinc sunscreen on myself and my kids.  A lot of them are super whitening and feel like you've got something on your skin - yuck!  Not this one.  It goes on super smooth and leaves my skin feeling great.  I wish they would make a bigger bottle that I could use on my whole body. * Bought this because i wanted a sheer tint & light coverage & i love using mad hippie products! 
This one just sadly isnt for me. It completely dried out my skin (and i alraady deal with dry skin!) especially around my forehead and my nose. Im just upset because i spent money on it jusy to use it 3 times before it started drying me out bad! * Never can tell how ones skin is going to react to even the most popular products, but holy moly am I glad I decided to give this a chance. Just started my third bottle. I used La Roche Posay tinyed sunscreen previously, but this is worlds different. Have to work fast to get good distribution, but after a few seconds tapping a tiny bit more on top of any spots needing helps conceal. I use a very light layer of Ulta powder foundation after to set and Rude Cosmetics plump setting spray and let me just say its all survived monsoon rains, summer sweat and does not dry me out in winter so long as I remember to moisturize first."
200,coola,clear skin oil-free moisturizer zinc oxide sunscreen spf 30,pimprod2043265,2620330," * The packaging is so pretty and minimal making it have this luxe feel, which I loved. I have dry skin, and this moisturizer felt very hydrating to me. It goes on super smooth, feels lightweight, and gives a nice, healthy glow without any greasy finish. My skin did feel soft and moisturized, which was nice. However, after a while, it started to pill and peel, making it difficult to wear under makeup or on its own. If it didn't do that, it would have been perfect!"" It might work better for someone else, but for me, it was just okay :)

""""Product was received as part of an educational promotion. * I am a licensed Esthetician and came across Coola when I started looking seriously for brands that were cruelty free and now farm to face. There are so many great ingredients in this product like hyaluronic acid, coconut water, Jasmine, basil just to name a few.
These great ingredients have helped my skin tremendously.
After using it for just one week,1 have been not using my regular make up but only this sunscreen moisturizer during the day. My skin looks great with no makeup.
It is great to have a SPF that works like skincare in my routine and is helping with the anti aging process to boot. I am definitely going to be using this all year because UV rays are always out and we need to be protected. Thanks for another great product I am a huge fan of this product too.
Product was received as part of an educational promotion. * This doesn't blend into the skin, but rather sits in top and leaves a white cast. If you touch it or try to put anything over it, get ready for major pillong. Youll have to wipe it all off and start over. I also tried mixing it with another sunscreen, bit it still pilled.  Maybe a bit of oil in this product would help?? * Ive got real sensitive and acne prone skin. So any new product I introduce to my face, my skin will let me know it doesn't like it by breaking me out instantly. Usually by the next morning. I could not find a sunscreen that didn't do this. This one didn't! * Did not like this at all. It was okay at first, although sticky, it seemed fine. The white cast wasnt too baf and it eventually went away. After about 6 hrs i had to wash it off bc my skin was getting extremely red, itchy, and dry. I have oily and acne prone skin that i dont consider sensitive. It took a week for my skin to go back to normal and im still recovering from ghe breakouts. * Love how matte my skin looks. It hasn't made me break out unlike other sunscreens. * Very disappointing for a claim won't cause breakouts. Immediately caused breakouts and congestion. Also very drying cracking skin around nose. I have combo skin"
201,strivectin,advanced retinol daily repair moisturizer broad spectrum spf 30,pimprod2030923,2591236,
202,peter thomas roth,max clear invisible priming sunscreen broad spectrum spf 45,pimprod2029956,2579753," * I love this product. It moisturizes my skin and i can lather it on when I'm not wearing makeup. It makes my skin look so healthy. I've turned on 4 of my family members and a handful of friends to this. * The texture is oily and my makeup does not sit well over it. But the worst part about this item is that it smells terrible! * I didn't like the texture and it was grossly oily * I've tried many primers with SPF, and this is my favorite as it actually blurs pores the most and has the highest SPF. It's my daily primer. * I liked this spf until it reached the end. The bottle was very hard to swueeze. I was about to throw it out and decided to cut the package. There was still anton of product left! * It works very well under my makeup and makes my skin look younger. I will definitely buy this product again. * Really nice ,smooth sunscreen. Blends well with my skin with no white cast."
203,l'orÃ©al,bright reveal broad spectrum spf 50 daily uv,pimprod2040389,2613666," * This sunscreen pills once it dries down. It was really disappointed that it didn't have a smooth dry finish. I will not be buying again. * I really wanted to love this sunscreen, but I unfortunately, had a bad reaction to it.  It spread very easily and absorbed quickly, but a few hours later, my cheeks would turn bright red.  I stopped using it and started again and it would start.  It does blend very easily, so I think it's a shame it didn't work out for me. I know that the ingredients don't list anything that would have a strong alcoholic smell, but I thought the sunscreen smelled pretty strongly. * It's glowy and I'll give it that but I did not enjoy this sunscreen at all besides that. It has a strong sunscreen smell. It pills so bad. It also leaves a greasy feeling on me even in the winter time and I have combo/dry skin in the winter. * As a dark skin black woman I have struggled to find sunscreen that works for my skin. So glad I came across this holy grail. No white cast amd gives my skin a cute glow when worn alone. Perfect under makeup as well. This is the only sunscreen I will wear * I really wanted to love this sunscreen as I've heard great things about it both alone and under makeup. Unfortunately it never absorbs and pills terribly, under makeup and on its own. Leaves a whitecast as well. I returned it. * I decided to buy this sunscreen after reading the reviews and decided to give it a try. But I have nothing else to say except bad things about it. I have normal to dry skin, so I thought this would be a good fit for me since it's hydrating. However, it peels off instantly and don't even think to wear it under makeup. Plus, it leaves a white cast every time I apply it. I'm pale white. This is a big regret for me. * If you have olive undertones or tan skin in general this is not for you. The white cast is horrible and this sunscreen does not blend well at all. Made me extremely greasy and peely."
204,live tinted,hyperpigmentation essentials glow up set,pimprod2039104,2609978," * Ive been hearing more and more about this brand particularly the color corrector. I'm glad I got the to sample because i like uneben skin stick, ive been using it for abkjt three weeks and my dar spots on my face and chest ate fading, the tinyed moisturizer worh Spf 20 is ok, but i cant get behind the color corrector. Maybe I'm not patient, or care to take the time to really blend it. Its red, and if you dont take the time for it to set, then build with conceiler then its not going to look good. Im gonna stick with my other fave on that one! I will however, continue to use the dark spot stick! * The orange lip color looks awful. * Happy trial sizes exist of this product. Hyperpigmentation stick was good, glides and blends easily. However no match for my perimenopause dry skin. On anyone else would probably be a moisturizing glow. The SPF was great, blends in and gives a cc type of glow finish. * The tinted sunscreen does leave a slight cast, the color stick is perfect, and the hyperpigmentation serum needs better packaging because you have to dig out the product at end. Overall good value, but wont be purchasing full size items."
205,mad hippie,hydrating facial spf 25+,pimprod2025059,2581557," * I got this in a sample size & absolutely loved it. I'm oil prone & put it on in the morning - it's kept my face matte all day. Definitely need to get this in a full size. * My skin is fair and acne prone. This sunscreen has been working great so far. I actually have not noticed any new breakouts during the past couple of weeks I've been using this product. I even put it on my arm tattoos. The scent is pleasant, which is great because I hate the smell of sunscreen. Overall I think it's a great daily sunscreen for your face. * to start, spf 25 isnt even enough for your face or body no matter how much you use. I personally have combo skin with dry cheeks and an oily t zone, and this product dries me out! it sits TERRIBLY under makeup, and sweats off too easily. will not be re purchasing. * I bought the sunscreen because I've been on the hunt for a daily mineral 'clean ingredient' face SPF. I previously purchased the Mad Hippie face serum with spf and liked it, but saw this and there was more product for a similar price so I figured I'd give it a go. It is very light and blends easily for a mineral sunscreen, leaving a minimal cast (if at all). It has a very light, negligible scent. I don't wear daily makeup so I can't speak to layering it with other products, but I really like this sunscreen so far. * I didnt fond myself reaching for it a lot. Ive been trying to experiment with mineral sunscreens and while I think this did the job fine, it was very had to warm up in my hanfs out for me, and seemed greasy. 

I feel like this would be the ideal sunscreen for winter with ifs moisturizing properties, but not for summer, at least for me. * Even the smallest amount has left a white cast and flakes. I got a huge zit almost immediately after applying. Will be returning! * I love Mad Hippie but this is not my favorite product so far. It runs in clear but leaves your fingers feeling sticky afterwards."
206,zitsticka,megashade breakout-proof spf 50 serum,pimprod2025207,2584617," * I use this daily for my neck and chest. I am extremely break out prone and this is the one product that I can use daily ans not aggrivate any body acne. Its lightweight, yes hydrating and I dont mind the packaging. 
Its a little pricey but to know it wont break me out its worth the peace of mind! * Let me start off saying I live in AZ so sunscreen is a must, and I hardly ever buy the same product twice. This sunscreen has been repurchased 4 times now. It's perfect, its light weight feeling, hydrating, and I love the new packaging (even with the old dropper packaging, I hated that but the product was so good I continued to buy it, but the new pump is the best). It never makes my skin break out, I love that it's spf 50 as I wont use anything less than 40. Makeup goes on over it nicely, never had any issues with separation (skin is usually dry but sometimes oily nose area).
For people saying it's overpriced, I don't think it is. It has alot of skincare benefits besides sun protection, and if you have crazy sensitive skin that breaks out from almost everything (like I do) and you're on a clear skin journey, this is worth it. I'm a firm believer that if the product actually works then I will pay the price. I will continue to purchase this for as long as it's around, hopefully forever! * Ive tried countless sunscreens and this is my absolute favorite ever im obsessed. I have sensitive skin and this is the only one that works for me * Overpriced. * For the price, i expected much better quality. * I love this spf so much! Its lightweight and perfect if you are acne prone. Its leaves a dewy finish that can be set with powder if thats not your vibe. No whitecast on my pale skin is visible. It feels nice to apply! Doesnt smell awful or all. Ive gone through 3 bottles of this about to purchase my 4th. Its so good, try it at least once in your spf journey, i dont think youll be disappointed. * This sunscreen has changed my life! It is the only one that i have wanted to put on my face every single day! It has never made me break out and it makes makeup go on so smooth! Especially under the eyes! Please never stop making this! It is my holy grail sunscreen!!!!"
207,vichy,liftactiv peptide-c face sunscreen spf 30,pimprod2013305,2559388," * I am like that this has vitamin C and sunscreen. The lotion goes on easily, but it smells so bad. I will be returning it. * Does not leave white cast, wears good under makeup, I have been using for years now! * Terrible strong perfume scent that caused a rash - will be returning * It is light and smooth, not greasy. It will run into your eyes if you sweat. It has a strong fragrance like men's cologne. I don't know if it is a signature Vichy scent or what, but it is not a fragrance that plays well with others. * My skin is somewhat sensitive. Not many products, including sunscreen, break me out, but the ones that do, REALLY mess me up. This sunscreen broke me out terribly. Not all over the face, but a few cystic blemishes, including one of my nose. I'm still dealing with the scarring from that :( The scent on this is VERY strong. I am not sensitive to scents at all. I don't care when products are scented, but there is no need for it be this strongly scented. What were they thinking? 

I bought this during the beauty days sale so I will keep it and use it on my neck and chest for the anti-aging benefits, but if you are breakout prone from sunscreens, be very careful with this one. * My first time trying out this face sunscreen and it feels nothing like all the others I've tried and used under makeup! This is veil like, smooth application…. BUT!!! The scent! The scent is STRONG and it does not go away even after you applying foundation or bb cream… I really wanted to love this product because of the peptides but im disappointed I will not be using it as I wanted due to the smell. Side note the description does indicate there is a floral scent to it (i missed reading that part) I agree it is a floral scent except it is strong! * I like how this goes on and the potential benefits, however, it irritates my rosacea and makes me redder."
208,kopari beauty,antioxidant face shield mineral spf 30,pimprod2031646,2594644," * This gave me no sun protection, skin rash and is not a true Mineral Sunscreen. It has butyloctyl salicylate  a UV filter Chemical. It burns my skin, eyes and neck. I do not recommend for sensitive or need a mineral sunscreen. what a waste of money. disappointed. * I use this sunscreen almost daily, I love that it's mineral based and has clean ingredients. It does have an odd light smell but I would rather deal with that than put something with a strong parfum/fragrance ingredient on my face. It makes my skin glowy and dewy which I love! * I really wanted to like this one, but it's not for me. It has an off putting smell and is greasy so your makeup slides off. Using sunscreen daily is the key to keeping skin young looking. To get the best protection I think the easiest and best is the mists or setting sprays like seriously fab zinc over. If sunscreen is greasy and smells bad, you're probably not gonna wanna do it every day. This one has a long list of chemicals no bueno. * I really wanted to like this but don't understand the hype. It smells terrible, like sand and playdough somehow at the same time. It's not glowy but greasy and doesn't ever dry down, making you feel sticky for hours. The greasiness means makeup also doesn't wear well on top. I tried it for a long time to give it a fair chance (about 1 month) and ended up throwing the rest away. Do not recommend. * This product has an odor that is so horrible, I had to wash my face after application. * I have purchased this product, three times sense trying it… it is a little expensive, but it doesn't break me out, smells good, and it looks beautiful on the skin. * I have very sensitive skin and am allergic to most sunscreens but I can sometimes pull off mineral. This was a winner. The only down side is the smell but worth the 5 seconds."
209,vichy,capital soleil tinted face mineral sunscreen spf 60,pimprod2013306,2559390," * Not my favorite sunscreen on the market but I like the fact that its SPF 60, bottle is small so travels well and consistency is fine. When I apply this with my hands, it leaves me with a like chalky/pale, no white, but pale skintone which you dont expect for a tinted product.  I prefer to apply with a makeup brush. The thing I dislike most is the smell, reminds me of sulfur, using a brush minimized that. Likely won't repurchase and will just use what I have left. * I really wanted to like this sunscreen. It dries down matte but it breaks me out everytime I use it. * I like to use mineral sunscreens because they don't sting my eyes, but this one stings my entire face. * It balls up, pills and comes off EVERY SINGLE TIME.
I shake it until the cows come home
I use just ONE moisturizer underneath it
I put it on NAKED skin

It PILLS, without fail * this is my new foundation. 2 in 1 for sure. I am going for a second bottle. * I've used heavy full coverage foundations for almost 20 years. I wanted to add sunscreen and skincare to my makeup. tried several tinted serums, sunscreens, moisturizers, but this one actually has some coverage and gives you a glow. I stopped wearing foundation completely now. this is my daily go to. if I need extra coverage I use a little concealer. I still do my smoky eye and it looks great * Product is definitely oily and even after shaking VERY well, it was still separating and had almost sandlike grains in it. Additionally it was not blendable at all and made my lightly tanned skin look ghostly. Am returning asap."
210,first aid beauty,mineral sunscreen zinc oxide broad spectrum spf 30,pimprod2032660,2593738," * I love this product so much! Ive been looking for a sunblock for years. I've tried blue lizard, cetaphil, la roche posay, it, elf, & supergoop. They've all irritated my skin. This is the first sunblock that has not irritated my face. I'm so glad i invested in it. The product is a little sticky, but i dont mind! * Sunscreen is something I've incorporated into my daily skin regimen since I was a tween. This sunscreen goes on sheer and has a subtle non bothering natural fragrance that makes application enjoyable. * I have very oily and acne prone skin, this product saved my skin. I have yet to break out. The bottle also lasts forever, I've had the same bottle for 6 months. Love this product, worth the price. * Recommend to those with sensitive skin as it's a mineral sunscreen. Zinc is good for acne and I didn't break out from this. I dont recommend this for those with darker skin as it may leave a white cast * Not sure how this has so many postive reviews. Its so sticky and tacky. I would not recomend this. * I just jeep coming back too it. I have combo sensative acne prone skin and its just unbeatable! * doesnt leave a white cast, didnt break me out, protexts my skin from the sun, sits well under makeup, feels like a moisturizer, dosesnt pill. this is the beat spf ive ever used and ive been looking for one for so long"
