,Brand,Name,ID,sku
307,roc,barrier renew pm moisturizer ceramides + antioxidant green tea,pimprod2040672,2614417
308,proactiv,green tea moisturizer with hyaluronic acid,xlsimpprod14651017,2500640
309,roc,retinol correxion line smoothing max hydration cream,pimprod2037330,2605755
310,clinique,clinique for men maximum hydrator activated water-gel concentrate,xlsimpprod15841061,2508523
311,no7,radiance+ vitamin c daily brightening moisturizer,pimprod2020107,2574176
312,fresh,rose & hyaluronic acid lightweight moisturizer,pimprod2038854,2608278
313,kiehl's since 1851,ultra facial moisturizer spf 30,pimprod2002927,2536697
314,cetaphil,hydrating moisturizing cream body moisturizer,pimprod2028655,2586929
315,la roche-posay,pure vitamin c anti-wrinkle firming moisturizing filler,pimprod2019700,2574392
316,dermalogica,clear start soothing hydrating lotion,xlsimpprod12881033,2291792
317,estée lauder,revitalizing supreme+ bright power soft crème moisturizer,pimprod2030767,2591239
318,belif,aqua bomb brightening vitamin c cream,pimprod2043263,2619878
319,panoxyl,am oil control moisturizer with broad spectrum spf 30 mineral sunscreen,pimprod2041857,2615401
