,Brand,Name,ID,sku
0,clinique,moisture surge 100h auto-replenishing hydrator moisturizer,pimprod2021615,2576544
1,bubble,over night hydrating sleep mask,pimprod2035928,2600876
2,la roche-posay,toleriane double repair face moisturizer with niacinamide,xlsimpprod16011007,2509730
3,philosophy,hope in a jar smooth-glow multi-tasking moisturizer spf 30,pimprod2037931,2605578
4,drunk elephant,protini polypeptide firming moisturizer,pimprod2028061,2588434
5,kiehl's since 1851,ultra facial cream with squalane,pimprod2002804,2540233
6,la roche-posay,toleriane double repair face moisturizer uv spf 30,xlsimpprod15681007,2503390
7,tula,24-7 weightless moisture day & night gel cream,pimprod2045112,2624255
8,it cosmetics,confidence in a cream anti-aging hydrating moisturizer,pimprod2033684,2598796
9,tula,24-7 moisture hydrating day & night cream,xlsimpprod18731039,2577530
10,the ordinary,natural moisturizing factors + ha daily moisturizer,pimprod2007113,2551163
11,bobbi brown,vitamin enriched face base moisturizer & primer with vitamin c + hyaluronic acid,pimprod2025028,2583728
12,clinique,dramatically different moisturizing face lotion+,xlsimpprod10791743,2261902
13,la roche-posay,cicaplast balm b5 soothing therapeutic multi purpose cream,pimprod2018263,2570171
14,dermalogica,dynamic skin recovery spf 50 moisturizer,pimprod2029957,2588996
15,philosophy,hope in a jar smooth-glow multi-tasking moisturizer,pimprod2029779,2589221
16,beautycounter,mighty plump ceramide water cream,pimprod2043880,2621243
17,dermalogica,clear start soothing hydrating lotion,xlsimpprod12881033,2291792
18,cerave,moisturizing cream with hyaluronic acid for balanced to dry skin,xlsimpprod3530069,2234849
19,bubble,slam dunk hydrating moisturizer,pimprod2035460,2600868
20,peach & lily,matcha pudding antioxidant cream,xlsimpprod18971027,2532651
21,neutrogena,hydro boost hyaluronic acid water gel moisturizer,xlsimpprod12041835,2284291
22,peach & lily,peptide pro firming moisturizer,pimprod2034057,2597530
23,philosophy,purity made simple oil free mattifying moisturizer,pimprod2017775,2565516
24,cerave,"am lotion face moisturizer with spf 30, daily face sunscreen for balanced to oily skin",xlsimpprod4190253,2241990
25,bobbi brown,mini vitamin enriched face base moisturizer & primer with vitamin c + hyaluronic acid,pimprod2025025,2583729
26,drunk elephant,lala retro whipped cream moisturizer with ceramides,pimprod2028065,2588438
27,philosophy,hope in a jar water cream hyaluronic glow moisturizer,pimprod2029778,2589219
28,cosrx,advanced snail 92 all in one cream,pimprod2038492,2610464
29,dermalogica,intensive moisture balance moisturizer,pimprod2003120,2535727
30,la roche-posay,toleriane double repair matte face moisturizer for oily skin,pimprod2030179,2591830
31,amlactin,daily nourish lotion with 12% lactic acid aha,pimprod2043815,2623394
32,dermalogica,skin smoothing cream moisturizer,pimprod2000019,2536765
33,charlotte tilbury,magic cream moisturizer with hyaluronic acid,pimprod2043375,2619315
34,estée lauder,revitalizing supreme+ youth power crème moisturizer,pimprod2030772,2591237
35,byoma,moisturizing gel cream,pimprod2034790,2613117
36,first aid beauty,ultra repair cream,xlsimpprod13491031,2295764
37,drunk elephant,bora barrier repair cream,pimprod2043543,2619870
38,avène,cicalfate+ restorative protective cream,pimprod2020798,2577161
39,philosophy,anti-wrinkle miracle worker+ line correcting moisturizer,pimprod2002773,2535870
40,first aid beauty,"firming cream with peptides, niacinamide + collagen",pimprod2022848,2577192
41,clinique,moisture surge broad spectrum spf 28 sheer hydrator moisturizer,pimprod2038272,2604860
42,clinique,redness solutions daily relief face cream with probiotic technology,xlsimpprod10791833,2157845
43,clinique,dramatically different face moisturizing gel,xlsimpprod10791745,2153924
44,first aid beauty,ultra repair oil-control moisturizer,pimprod2017306,2568399
45,beekman 1802,bloom cream daily moisturizer,pimprod2017582,2569244
46,dermalogica,active moist oil-free moisturizer,vp12690,2152609
47,clinique,clinique smart clinical repair wrinkle correcting face cream,pimprod2033123,2598026
48,beautycounter,countercontrol matte effect gel cream,pimprod2038172,2606559
49,good molecules,lightweight daily moisturizer,pimprod2023937,2582316
50,clinique,moisture surge intense 72h lipid-replenishing hydrator moisturizer,pimprod2018283,2568219
51,peach & lily,lazy day all-in-one moisture pads,xlsimpprod18971029,2532635
52,cerave,ultra-light moisturizing lotion with spf 30 for balanced to oily skin,xlsimpprod17162943,2520842
53,beautycounter,countertime tetrapeptide supreme cream,pimprod2038170,2606561
54,belif,the true cream - aqua bomb hydrating moisturizer,pimprod2043259,2619876
55,peter thomas roth,water drench hyaluronic cloud cream hydrating moisturizer,xlsimpprod15261059,2515463
56,supergoop!,triple prep weightless multitasking moisturizer spf 40 face sunscreen,pimprod2043911,2620576
57,tula,glow starts here bestselling skin essentials kit,pimprod2024933,2580288
58,beautycounter,countermatch adaptive moisture lotion,pimprod2038174,2606567
59,olehenriksen,strength trainer peptide boost moisturizer,pimprod2042287,2617224
60,bubble,cloud surf water cream moisturizer,pimprod2040785,2611778
61,peach & lily,glass skin water-gel moisturizer,pimprod2020749,2572404
62,estée lauder,daywear multi-protection anti-oxidant 24h cream moisturizer spf 15,xlsimpprod14641487,2309280
63,cerave,renewing salicylic acid body cream for rough & bumpy skin,xlsimpprod13762087,2298313
64,dermalogica,stabilizing repair cream,pimprod2039798,2612125
65,tula,24-7 weightless moisture day & night gel cream,pimprod2045112,2624255
66,murad,essential-c day moisture broad spectrum spf 30 / pa+++,xlsimpprod1650195,2210998
67,la roche-posay,toleriane double repair face moisturizer uv spf 30,xlsimpprod15681007,2503390
68,avène,tolerance control skin recovery cream,pimprod2026568,2586855
69,good molecules,gentle retinol cream,pimprod2027916,2589110
70,juice beauty,stem cellular anti-wrinkle moisturizer,xlsimpprod3670097,2236870
71,first aid beauty,ultra repair cream,xlsimpprod13491031,2295764
72,la roche-posay,effaclar mat daily face moisturizer for oily skin,xlsimpprod5280325,2259844
73,bubble,level up balancing moisturizer,pimprod2035461,2600869
74,dermalogica,super rich repair moisturizer,prod2152651,2152651
75,origins,ginzing spf 40 energy-boosting tinted moisturizer,xlsimpprod16231003,2510433
76,peach & lily,ultra plush rich cream,pimprod2043759,2620276
77,la roche-posay,travel size toleriane double repair face moisturizer with niacinamide,pimprod2039395,2606178
78,lancôme,hydra zen gel cream oil-free face moisturizer with salicylic acid,pimprod2016557,2562199
79,good molecules,lightweight daily moisturizer,pimprod2023937,2582316
80,e.l.f. cosmetics,fragrance free holy hydration! face cream,pimprod2013329,2563564
81,philosophy,purity made simple oil free mattifying moisturizer,pimprod2017775,2565516
82,lancôme,rénergie h.p.n. 300-peptide cream,pimprod2040492,2612984
83,juice beauty,stem cellular anti-wrinkle best sellers day & night moisturizers kit,pimprod2021203,2578070
84,fresh,rose deep hydration face cream,pimprod2025112,2584148
85,lancôme,uv expert defense spf 50+ primer & moisturizer,pimprod2004242,2541521
86,clinique,superdefense city block broad spectrum spf 50 daily energy + face protector primer,pimprod2014019,2560146
87,amlactin,daily nourish lotion with 12% lactic acid aha,pimprod2043815,2623394
88,tula,24-7 moisture intense ultra hydrating day & night cream,pimprod2036708,2603052
89,sunday riley,c.e.o. afterglow brightening vitamin c cream,pimprod2032040,2596206
90,belif,the true cream - moisturizing bomb,pimprod2043261,2619877
91,philosophy,hope in a jar smooth-glow multi-tasking moisturizer,pimprod2029779,2589221
92,clinique,smart clinical repair lifting face + neck cream,pimprod2040914,2610876
93,philosophy,ultimate miracle worker multi-rejuvenating cream spf 30,xlsimpprod12661073,2288779
94,it cosmetics,hello results wrinkle-reducing daily retinol serum-in-cream,pimprod2020623,2571942
95,chanel,le lift crème smooths - firms - illuminates,pimprod2029952,2560172
96,vanicream,moisturizing cream pump,pimprod2042406,2619667
97,first aid beauty,ultra repair face moisturizer,xlsimpprod13491041,2295769
98,no7,future renew damage reversal day cream spf 25,pimprod2043250,2620359
99,dermalogica,clear start soothing hydrating lotion,xlsimpprod12881033,2291792
100,cerave,ultra-light facial gel with hyaluronic acid for all skin types,pimprod2039910,2611323
101,beautycounter,countertime antioxidant soft cream,pimprod2038169,2606562
102,elemis,pro-collagen marine cream spf 30,pimprod2004522,2545254
103,tula,24-7 moisture hydrating day & night cream,xlsimpprod18731039,2577530
104,elemis,pro-collagen marine cream,xlsimpprod18731125,2533936
105,clinique,smart clinical repair spf 30 wrinkle correcting cream,pimprod2042886,2616984
106,perricone md,high potency face finishing & firming tinted moisturizer spf 30,xlsimpprod19011041,2532607
107,clinique,moisture surge 100h auto-replenishing hydrator moisturizer mini,pimprod2023293,2576602
108,e.l.f. cosmetics,holy hydration! face cream spf 30,pimprod2025445,2582406
109,cosrx,hyaluronic acid intensive cream,pimprod2004959,2542834
110,cerave,sa lotion with salicylic acid for rough & bumpy skin,pimprod2013144,2559621
111,murad,oil and pore control mattifier broad spectrum spf 45 pa++++,pimprod2007193,2547796
112,the ordinary,natural moisturizing factors + phytoceramides moisturizer,pimprod2037765,2606219
113,shiseido,benefiance wrinkle smoothing cream enriched,pimprod2008180,2549744
114,bubble,over night hydrating sleep mask,pimprod2035928,2600876
115,drunk elephant,a-passioni retinol cream,pimprod2028055,2588469
116,dermalogica,biolumin-c vitamin c gel moisturizer,pimprod2026418,2583209
117,la roche-posay,toleriane dermallergo soothing repair moisturizer for sensitive skin,pimprod2002095,2539629
118,supergoop!,daily spf starter set for face and body,pimprod2044980,2624465
119,byoma,moisturizing rich cream,pimprod2034791,2601333
120,dime,tbt clean retinol alternative cream,pimprod2035164,2603233
121,clarins,multi-active day moisturizer for lines and glow with niacinamide,pimprod2043929,2620943
122,supergoop!,play everyday lotion spf 50 with sunflower extract pa++++,pimprod2029934,2589381
123,neutrogena,rapid wrinkle repair regenerating cream,xlsimpprod15321221,2501816
124,aveeno,calm + restore oat gel moisturizer,pimprod2017659,2570004
125,peach slices,snail rescue all-in-one deep moisture cream,pimprod2033309,2597524
126,the ordinary,natural moisturizing factors + beta glucan,pimprod2039174,2609860
127,e.l.f. cosmetics,holy hydration! gel-yeah moisturizer,pimprod2043031,2619632
128,byoma,moisturizing gel cream spf30,pimprod2039807,2611682
129,exuviance,age reverse day repair spf 30 + retinol antiaging face moisturizer,xlsimpprod2420449,2554761
130,clinique,dramatically different moisturizing cream,xlsimpprod12711079,2290045
131,jack black,double duty face moisturizer spf 20,xlsimpprod3730165,2211500
132,lancôme,absolue revitalizing & brightening soft cream,pimprod2024436,2606320
133,fresh,lotus youth preserve radiance renewal night cream,pimprod2042752,2617057
134,dermalogica,phyto nature oxygen cream,pimprod2037847,2606355
135,peach slices,snail rescue all-in-one oil free moisturizer,pimprod2018393,2567117
136,bareminerals,butter drench restorative rich cream,xlsimpprod13481001,2296207
137,fresh,lotus youth preserve line & texture smoothing moisturizer,pimprod2042751,2617055
138,estée lauder,revitalizing supreme+ youth power creme spf 25 moisturizer,pimprod2044443,2618891
139,peter thomas roth,ultimate solution 5 multitasking moisturizer,pimprod2037890,2606103
140,clinique,even better brightening moisturizer spf 20,xlsimpprod10791803,2211496
141,l'oréal,revitalift triple power anti-aging moisturizer - fragrance free,pimprod2009091,2554031
142,first aid beauty,travel size ultra repair cream intense hydration,pimprod2013850,2559167
143,strivectin,sd advanced plus intensive moisturizer,pimprod2043672,2620437
144,strivectin,super-c spf 30 vitamin c moisturizer,pimprod2022788,2574715
145,dermalogica,powerbright moisturizer spf 50,xlsimpprod11271057,2281033
146,philosophy,hope in a jar water cream hyaluronic glow moisturizer,pimprod2029778,2589219
147,dime,dewy day cream: rosehip + tremella,pimprod2039423,2612541
148,beautystat cosmetics,universal c skin refiner 20% vitamin c brightening serum,pimprod2030149,2592489
149,avène,hydrance aqua gel,pimprod2020807,2577168
150,beautycounter,countertime mineral boost hydrating essence,pimprod2038167,2606564
151,avène,retrinal 0.05 cream,pimprod2042754,2618818
152,clinique,moisture surge hydrating supercharged concentrate,xlsimpprod16101069,2508513
153,mac,strobe cream,xlsimpprod15921232,2510715
154,supergoop!,superscreen rich hydrating cream spf 40 moisturizer,pimprod2042770,2617635
155,neutrogena,hydro boost hyaluronic acid water cream - fragrance free,pimprod2041040,2615560
156,estée lauder,resilience multi-effect tri-peptide face and neck creme spf 15,pimprod2002477,2540080
157,dior,capture totale cell energy - firming & wrinkle-correcting cream,pimprod2036822,2604977
158,bareminerals,smoothness bare haven soft moisturizer,pimprod2015694,2564097
159,vichy,mineral 89 hydration boosting kit,pimprod2043517,2620409
160,murad,hydro-dynamic ultimate moisture,xlsimpprod2390225,2544836
161,dermalogica,super rich repair moisturizer cream,pimprod2024953,2580597
162,cocokind,resurrection polypeptide cream,pimprod2037614,2605570
163,cerave,travel size daily moisturizing lotion for balanced to dry skin,pimprod2017446,2559602
164,fresh,black tea anti-aging ceramide moisturizer,pimprod2036988,2603047
165,kiehl's since 1851,super multi-corrective anti-aging face and neck cream,pimprod2018365,2589390
166,mad hippie,face cream,xlsimpprod18731231,2530013
167,clinique,dramatically different hydrating jelly moisturizer,xlsimpprod18711071,2531785
168,tula,breakout star acne moisturizer,pimprod2014625,2561091
169,la roche-posay,anthelios mineral spf 30 face moisturizer with hyaluronic acid,pimprod2021600,2575538
170,neutrogena,"hydro boost hyaluronic acid water gel moisturizer, fragrance free",pimprod2041883,2615397
171,clarins,multi-active day moisturizer with spf 20,xlsimpprod13611447,2298383
172,honest beauty,hydrogel cream,pimprod2015205,2566810
173,la roche-posay,toleriane rosaliac anti-redness face moisturizer for sensitive skin,pimprod2038740,2610275
174,tula,protect + plump firming & hydrating face moisturizer,pimprod2019788,2571139
175,philosophy,anti-wrinkle miracle worker+ line correcting moisturizer,pimprod2002773,2535870
176,coola,refreshing water cream spf 50,pimprod2021554,2575597
177,roc,retinol correxion max daily hydration creme,pimprod2002111,2534774
178,hero cosmetics,rescue balm +red correct post-blemish recovery cream,pimprod2034649,2599903
179,cosrx,full fit propolis light cream,pimprod2017573,2568303
180,kopari beauty,moisture whipped ceramide cream,pimprod2034179,2597743
181,mac,hyper real skincanvas balm moisturizing cream,pimprod2037107,2605398
182,origins,ginzing energizing gel cream with caffeine + niacinamide,pimprod2033869,2598935
183,peach & lily,rescue party barrier comfort cream,pimprod2042702,2617478
184,osea,atmosphere protection cream,pimprod2017698,2570072
185,clarins,hydra-essentiel silky moisturizer with double hyaluronic acid,pimprod2037565,2606367
186,peter thomas roth,firmx collagen moisturizer,pimprod2014564,2561084
187,perricone md,high potency classics: face finishing & firming moisturizer,xlsimpprod19011039,2532500
188,clinique,clinique for men broad spectrum spf 21 moisturizer,prod2140588,2140588
189,la roche-posay,travel size lipikar ap+m triple repair body moisturizer for dry skin,pimprod2039390,2606155
190,good molecules,bha clarify gel cream,pimprod2023936,2582314
191,clarins,"extra-firming & smoothing day moisturizer, spf 15",xlsimpprod17491009,2520383
192,clarins,"extra-firming & smoothing day moisturizer, spf 15",xlsimpprod17491009,2520383
193,la roche-posay,travel size lipikar ap+m triple repair body moisturizer for dry skin,pimprod2039390,2606155
194,origins,a perfect world spf 40 age-defense moisturizer with white tea,xlsimpprod15911105,2505527
195,peach slices,redness relief calming cream,pimprod2033305,2597521
196,vanicream,facial moisturizer broad spectrum spf 30,pimprod2042402,2619672
197,lancôme,hydra zen glow lightweight liquid moisturizer with hyaluronic acid,pimprod2016440,2562193
198,clinique,clinique smart clinical repair wrinkle correcting rich face cream,pimprod2033121,2598028
199,peach slices,redness relief color correcting moisturizer,pimprod2037238,2605747
200,first aid beauty,brighten + glow face moisturizer with vitamin c,pimprod2042089,2617637
201,neutrogena,hydro boost hyaluronic acid moisturizer spf 50,pimprod2028420,2587006
202,charlotte tilbury,travel size magic cream moisturizer with hyaluronic acid,pimprod2043572,2619312
203,clinique,clinique for men anti-age moisturizer,xlsimpprod6470041,2271618
204,pacifica,future youth daily turnaround hydrating moisturizer spf 50,pimprod2039828,2611406
205,avène,hydrance rich hydrating cream,pimprod2020810,2577173
206,shiseido,essential energy hydrating cream,pimprod2029345,2589232
207,avène,tolerance control skin recovery balm,pimprod2026570,2586856
208,pür,get a lift firming facial cream,pimprod2039303,2606348
209,no7,protect & perfect intense advanced day cream spf 30,xlsimpprod5140153,2257092
210,philosophy,purity made simple ultra-light moisturizer,xlsimpprod17561003,2521755
211,first aid beauty,hello fab coconut skin smoothie priming moisturizer,pimprod2030928,2589262
212,no7,restore & renew face & neck multi action fragrance free cream spf 30,pimprod2025410,2582678
213,shiseido,bio-performance advanced super revitalizing cream,xlsimpprod14351067,2305972
214,e.l.f. cosmetics,holy hydration! daily moisturizer,xlsimpprod14481069,2500311
215,tula,bright start vitamin c antioxidant brightening moisturizer,pimprod2030892,2593351
216,chanel,le lift crème smooths - firms - illuminates,pimprod2029952,2560172
217,la roche-posay,lipikar eczema soothing relief cream,pimprod2019354,2572921
218,exuviance,age reverse hydrafirm hyaluronic acid antiaging face moisturizer,xlsimpprod5120029,2554718
219,kiehl's since 1851,ultra facial oil-free gel cream,pimprod2024047,2579729
220,peter thomas roth,full-size water drench super hydrators 2-piece kit,pimprod2038041,2606104
221,first aid beauty,ultra repair face moisturizer with spf 30,pimprod2037708,2606963
222,peter thomas roth,potent c brightening vitamin c moisturizer,pimprod2039378,2609607
223,bobbi brown,hydrating face cream,pimprod2024886,2583622
224,no7,restore & renew face & neck multi action day cream spf 30,xlsimpprod18771035,2530149
225,dermalogica,prisma protect spf 30 moisturizer,pimprod2004270,2541755
226,la roche-posay,lipikar body lotion daily repair moisturizing lotion for dry skin,pimprod2037861,2609329
227,strivectin,contour restore tightening & sculpting face cream,pimprod2029311,2588253
228,origins,ginzing ultra-hydrating energy-boosting cream,pimprod2008580,2552852
229,la roche-posay,"mela b3 uv daily moisturizer sunscreen, spf 30",pimprod2043466,2620363
230,peter thomas roth,water drench hyaluronic cloud rich barrier moisturizer,pimprod2036804,2603438
231,olay,regenerist micro-sculpting cream,xlsimpprod5981450,2147262
232,origins,ginzing spf 30 daily moisturizer sunscreen,pimprod2045181,2623404
233,murad,anti-aging moisturizer broad spectrum spf 30 | pa+++,pimprod2017332,2566520
234,l'oréal,age perfect cell renewal midnight hydrating serum,pimprod2027969,2586726
235,tonymoly,wonder ceramide mochi water cream,pimprod2040801,2613434
236,charlotte tilbury,magic water cream gel moisturizer with niacinamide,pimprod2043839,2620075
237,beautybio,the zenbubble oil-free calming gel cream,pimprod2019384,2572411
238,dune suncare,the mug guard broad spectrum spf 30,pimprod2039109,2608975
239,strivectin,advanced retinol nightly renewal moisturizer,pimprod2026692,2582803
240,clinique,repairwear laser focus wrinkle correcting eye cream,xlsimpprod12991075,2291706
241,first aid beauty,hello fab coconut water cream,pimprod2029973,2589261
242,clarins,super restorative day moisturizer,pimprod2033883,2598903
243,good light,order of the eclipse hyaluronic cream,pimprod2033460,2597528
244,bliss,drench & quench cream-to-water hydrator,xlsimpprod17921136,2524145
245,clinique,travel size dramatically different moisturizing face lotion+,xlsimpprod12481037,2289601
246,peter thomas roth,peptide skinjection moisture infusion cream,pimprod2043797,2620555
247,cetaphil,"moisturizing lotion, hydrating body moisturizer",pimprod2028656,2605916
248,hero cosmetics,clear collective clarifying prebiotic moisturizer,pimprod2030350,2591989
249,roc,retinol correxion deep wrinkle targeted patches,pimprod2037326,2605694
250,estée lauder,daywear matte oil-control anti-oxidant moisturizer gel cream,xlsimpprod15401049,2502687
251,cosrx,oil-free ultra-moisturizing lotion with birch sap,pimprod2035883,2603881
252,juice beauty,green apple age defy moisturizer,xlsimpprod3670099,2236871
253,kinship,supermello hyaluronic gel cream,pimprod2017767,2569973
254,osea,seabiotic water cream,pimprod2027013,2587124
255,exuviance,daily corrector spf 35 face moisturizer,pimprod2010411,2554760
256,pür,cloud cream gel-to-water hydrating essence moisturizer,pimprod2039302,2606347
257,bareminerals,poreless oil-free moisturizer,pimprod2009780,2553324
258,lancôme,absolue revitalizing & brightening rich cream,pimprod2025856,2586923
259,no7,lift & luminate triple action day cream spf 30,xlsimpprod17162829,2521837
260,estée lauder,nutritious melting soft cream mask and moisturizer,pimprod2038328,2607433
261,amlactin,daily nourish lotion with 12% lactic acid aha,pimprod2043815,2623394
262,perricone md,vitamin c ester photo-brightening moisturizer broad spectrum spf 30,xlsimpprod19011035,2532499
263,bareminerals,ageless phyto-retinol face cream,pimprod2019600,2573360
264,neutrogena,rapid wrinkle repair moisturizer spf 30,xlsimpprod3190075,2225739
265,pacifica,future youth moisturizing super cream,pimprod2042626,2617977
266,dermalogica,clear start clearing defense moisturizer spf 30,pimprod2006536,2547226
267,kate somerville,on the glow kit,pimprod2044690,2625430
268,shiseido,vital perfection uplifting and firming advanced cream,pimprod2044271,2624758
269,good light,moon glow milky moisturizing toning lotion,pimprod2032522,2597589
270,aveeno,positively radiant daily face moisturizer with spf 30,pimprod2035362,2601075
271,tula,24-7 weightless moisture day & night gel cream,pimprod2045112,2624255
272,origins,plantscription spf 25 power anti-aging cream,xlsimpprod15071331,2307153
273,peter thomas roth,water drench broad spectrum spf 45 hyaluronic cloud moisturizer,pimprod2016323,2564751
274,chanel,hydra beauty micro crème fortifying replenishing hydration,pimprod2029965,2528711
275,proactiv,proactiv+ complexion perfecting hydrator,xlsimpprod14651015,2500639
276,dermalogica,clear start cooling aqua jelly moisturizer,pimprod2020863,2572027
277,pacifica,vegan collagen every day lotion spf 30,pimprod2017151,2566493
278,clarins,extra-firming & smoothing night moisturizer,pimprod2031267,2592833
279,cosrx,the retinol 0.1 cream with super vitamin e + pathenol,pimprod2038198,2607592
280,origins,dr. andrew weil mega-mushroom soothing treatment lotion,pimprod2031368,2593778
281,kiehl's since 1851,ultra facial advanced repair barrier cream,pimprod2036682,2603779
282,cetaphil,daily oil free hydrating lotion with hyaluronic acid,xlsimpprod15622971,2501613
283,beautybio,the quench rapid recovery face cream,pimprod2019383,2572410
284,no7,hydraluminous+ hydrating day gel,pimprod2043213,2620549
285,buttah skin,cocoshea revitalizing cream,pimprod2025807,2585286
286,cetaphil,uva/uvb defense spf50 daytime moisturizer,xlsimpprod2160013,2203289
287,vichy,minéral 89 rich cream with hyaluronic acid,pimprod2039917,2613656
288,nyx professional makeup,face freezie cooling hydration moisturizer + primer,pimprod2038044,2605421
289,olay,regenerist fragrance-free micro-sculpting cream,xlsimpprod4180665,2240496
290,olay,complete uv365 daily moisturizer spf 30,vp00009,2096508
291,juice beauty,"prebiotix spf 45 glow, daily multi-tasking moisturizer",pimprod2037710,2606644
292,chanel,n°1 de chanel revitalizing cream,pimprod2029886,2589593
293,perricone md,high potency classics hyaluronic intensive moisturizer,xlsimpprod19011037,2532497
294,elemis,superfood glow priming moisturiser,pimprod2022684,2577527
295,kate somerville,+retinol vitamin c moisturizer,pimprod2005754,2547441
296,dermalogica,travel size dynamic skin recovery spf 50 moisturizer,pimprod2045124,2624464
297,olehenriksen,c-rush brightening vitamin c gel crème,pimprod2042315,2617265
298,amlactin,daily vitamin c lotion with 7% lactic acid aha,pimprod2043811,2623399
299,clinique,clinique for men moisturizing lotion,xlsimpprod6470045,2271620
300,olay,regenerist vitamin c + peptide 24 hydrating moisturizer,pimprod2027778,2586031
301,chanel,hydra beauty camellia water cream illuminating hydrating fluid,pimprod2029968,2544825
302,vichy,minéral 89 fragrance free cream,pimprod2039914,2613655
303,cetaphil,healthy renew purified peptides broad spectrum spf 30 day cream,pimprod2041297,2611322
304,clinique,clinique for men oil free moisturizer,xlsimpprod6470043,2271619
305,peach & lily,travel size glass skin water-gel moisturizer,pimprod2022178,2575568
306,derma e,vitamin c radiance-boosting renewing moisturizer,xlsimpprod15623007,2501940
